,body,score,author,permalink,comment_id,created_loc,created_utc,post_title,post_score,post_id
730,Who are they paid by? ,31,Boom9001,/r/nba/comments/6mff9j/hopperhq_lebron_james_earns_120000_per_instagram/dk14cs6/,dk14cs6,1499731851.0,1499703051.0,"[HopperHQ] LeBron James earns $120,000 per Instagram post. On Instagram, he is the highest paid American athlete and 10th highest paid overall.",1695,6mff9j
731,"Dude looked tired in those games. Doesn't mean he didn't ball the fuck out, but he looked tired. ",41,BlackMathNerd,/r/nba/comments/6m9ruo/justin_termine_ty_lue_told_us_on_siriusxmnba_the/djzy0c0/,djzy0c0,1499661199.0,1499632399.0,[Justin Termine] Ty Lue told us on @SiriusXMNBA the media always claiming Lebron is tired in the Finals is insulting to Lebron...,26,6m9ruo
732,"Wasn't he #1 when he was a senior, and Lebron was a freshman?",51,Wentzamania,/r/nba/comments/6m5bz7/lenny_cooke_in_high_school_was_ranked_1_in_the/djz0ghl/,djz0ghl,1499599655.0,1499570855.0,Lenny Cooke in high school was ranked #1 in the nation ahead of Lebron and Melo. Yet he never played a minute in the NBA.,24,6m5bz7
733,"iirc, LeBron absolutely demolished Cooke in a camp game or something and he was never the same after it",29,Ricard_Rubio,/r/nba/comments/6m5bz7/lenny_cooke_in_high_school_was_ranked_1_in_the/djz0h1p/,djz0h1p,1499599680.0,1499570880.0,Lenny Cooke in high school was ranked #1 in the nation ahead of Lebron and Melo. Yet he never played a minute in the NBA.,24,6m5bz7
734,Ive been ignoring this shit in my youtube feed for a while now ,32,Whydidideletemyaccou,/r/nba/comments/6m5bz7/lenny_cooke_in_high_school_was_ranked_1_in_the/djz0tpp/,djz0tpp,1499600240.0,1499571440.0,Lenny Cooke in high school was ranked #1 in the nation ahead of Lebron and Melo. Yet he never played a minute in the NBA.,24,6m5bz7
735,"""I'm in his ass like a bike without a seat ... excuse my French.""

DEAD.",611,kFleish,/r/nba/comments/6m571h/lebron_james_proves_he_has_the_heart_of_a/djyz9af/,djyz9af,1499597775.0,1499568975.0,LeBron James proves he has the heart of a Redditor with his trash talk while playing Street Fighter,632,6m571h
736,Lebron for EVO let's goooooooooo,98,ximca,/r/nba/comments/6m571h/lebron_james_proves_he_has_the_heart_of_a/djyzb4b/,djyzb4b,1499597852.0,1499569052.0,LeBron James proves he has the heart of a Redditor with his trash talk while playing Street Fighter,632,6m571h
737,[deleted],185,,/r/nba/comments/6m571h/lebron_james_proves_he_has_the_heart_of_a/djyzap1/,djyzap1,1499597835.0,1499569035.0,LeBron James proves he has the heart of a Redditor with his trash talk while playing Street Fighter,632,6m571h
738,[deleted],150,,/r/nba/comments/6m571h/lebron_james_proves_he_has_the_heart_of_a/djyzbsl/,djyzbsl,1499597880.0,1499569080.0,LeBron James proves he has the heart of a Redditor with his trash talk while playing Street Fighter,632,6m571h
739,God I love LeBron,147,,/r/nba/comments/6m571h/lebron_james_proves_he_has_the_heart_of_a/djyza05/,djyza05,1499597806.0,1499569006.0,LeBron James proves he has the heart of a Redditor with his trash talk while playing Street Fighter,632,6m571h
740,Adam Silver??,27,riskbreaking101,/r/nba/comments/6m571h/lebron_james_proves_he_has_the_heart_of_a/djyzgcr/,djyzgcr,1499598077.0,1499569277.0,LeBron James proves he has the heart of a Redditor with his trash talk while playing Street Fighter,632,6m571h
741,Dhalsim? Nice choice.,25,StakDoe,/r/nba/comments/6m571h/lebron_james_proves_he_has_the_heart_of_a/djyzen7/,djyzen7,1499598002.0,1499569202.0,LeBron James proves he has the heart of a Redditor with his trash talk while playing Street Fighter,632,6m571h
742,I just don't think I'm confident enough to ever say I'm in his ass when trash talking,57,Leavingtheecstasy,/r/nba/comments/6m571h/lebron_james_proves_he_has_the_heart_of_a/djyzkin/,djyzkin,1499598259.0,1499569459.0,LeBron James proves he has the heart of a Redditor with his trash talk while playing Street Fighter,632,6m571h
743,Aren't redditors generally meek neckbeards though,59,CUNT__FUCKER,/r/nba/comments/6m571h/lebron_james_proves_he_has_the_heart_of_a/djyza5s/,djyza5s,1499597812.0,1499569012.0,LeBron James proves he has the heart of a Redditor with his trash talk while playing Street Fighter,632,6m571h
744,"""The Cavaliers quickly rebuffed the Lakers offer, but told Los Angeles they could have anyone else on the team in exchange for Bryant.""
LOL",152,Labikero,/r/nba/comments/6m46s5/lakers_tried_to_trade_kobe_for_lebron_in_2007/djyrdhs/,djyrdhs,1499585791.0,1499556991.0,Lakers tried to trade Kobe for Lebron in 2007,78,6m46s5
745,"Only team reportedly to ever even call the Cavs about LeBron. Even the most delusional of GMs know better than to try that. 

Btw this will always be a favorite line of mine:

""Los Angeles almost dealt Bryant to Chicago, but Bryant balked when Luol Deng was included in the trade, believing the Bulls roster would be too barren when he arrived.""",120,dropdatdurkadurk,/r/nba/comments/6m46s5/lakers_tried_to_trade_kobe_for_lebron_in_2007/djyqw21/,djyqw21,1499585059.0,1499556259.0,Lakers tried to trade Kobe for Lebron in 2007,78,6m46s5
746,[deleted],35,,/r/nba/comments/6m46s5/lakers_tried_to_trade_kobe_for_lebron_in_2007/djyqvrb/,djyqvrb,1499585046.0,1499556246.0,Lakers tried to trade Kobe for Lebron in 2007,78,6m46s5
747,Dread Bosh ,99,NaciremaBlack,/r/nba/comments/6m2kvz/lebron_other_allstars_go_nuts_over_iversons_new/djye943/,djye943,1499567405.0,1499538605.0,Lebron & other all-stars go nuts over Iverson's new hair style [2009],110,6m2kvz
748,Devin Harris and Jameer Nelson being allstars is so odd to look back on but it made so much sense back then. ,44,VictoryCigar95,/r/nba/comments/6m2kvz/lebron_other_allstars_go_nuts_over_iversons_new/djyel02/,djyel02,1499567844.0,1499539044.0,Lebron & other all-stars go nuts over Iverson's new hair style [2009],110,6m2kvz
749,0:52 satan laugh by wade wtf,55,dumbrich23,/r/nba/comments/6m2kvz/lebron_other_allstars_go_nuts_over_iversons_new/djyefdi/,djyefdi,1499567650.0,1499538850.0,Lebron & other all-stars go nuts over Iverson's new hair style [2009],110,6m2kvz
750,"Being a professional basketball player looks really fun. I knew i should have gone into that.

Well, i guess desktop support is fun too....",25,jcw4455,/r/nba/comments/6m2kvz/lebron_other_allstars_go_nuts_over_iversons_new/djyf21l/,djyf21l,1499568460.0,1499539660.0,Lebron & other all-stars go nuts over Iverson's new hair style [2009],110,6m2kvz
751,That whole group is so nostalgic ,25,pjm9,/r/nba/comments/6m2kvz/lebron_other_allstars_go_nuts_over_iversons_new/djyeopt/,djyeopt,1499567976.0,1499539176.0,Lebron & other all-stars go nuts over Iverson's new hair style [2009],110,6m2kvz
752,"Damn, 7 years?? I haven't taken my talents anywhere in that time.",1828,lend_me_a_tenor,/r/nba/comments/6m1msu/sports_illustrated_seven_years_ago_today_lebron/djy6v0h/,djy6v0h,1499557609.0,1499528809.0,"[Sports Illustrated] Seven years ago today, LeBron James told the world he was taking his talents to South Beach",2165,6m1msu
753,"not one, not two, not three, not four, not five, not six, but seven years ago",1287,iamrade4ever,/r/nba/comments/6m1msu/sports_illustrated_seven_years_ago_today_lebron/djy7t3c/,djy7t3c,1499558899.0,1499530099.0,"[Sports Illustrated] Seven years ago today, LeBron James told the world he was taking his talents to South Beach",2165,6m1msu
754,lol I still remember that damn pink checked shirt,214,eeeeeeethan,/r/nba/comments/6m1msu/sports_illustrated_seven_years_ago_today_lebron/djy7748/,djy7748,1499558073.0,1499529273.0,"[Sports Illustrated] Seven years ago today, LeBron James told the world he was taking his talents to South Beach",2165,6m1msu
755,RIP villain LeBron,524,kinglawrenceIV,/r/nba/comments/6m1msu/sports_illustrated_seven_years_ago_today_lebron/djy6sc2/,djy6sc2,1499557504.0,1499528704.0,"[Sports Illustrated] Seven years ago today, LeBron James told the world he was taking his talents to South Beach",2165,6m1msu
756,"Goodness...it doesn't seem that long ago, has it? So much has changed since then.",75,Dsarg_92,/r/nba/comments/6m1msu/sports_illustrated_seven_years_ago_today_lebron/djy8wdx/,djy8wdx,1499560363.0,1499531563.0,"[Sports Illustrated] Seven years ago today, LeBron James told the world he was taking his talents to South Beach",2165,6m1msu
757,"Damn I've been using ""taking my talents to South Beach"" as a euphemism for taking a shit for seven years? Time flies. ",142,NJJeffK,/r/nba/comments/6m1msu/sports_illustrated_seven_years_ago_today_lebron/djycuji/,djycuji,1499565501.0,1499536701.0,"[Sports Illustrated] Seven years ago today, LeBron James told the world he was taking his talents to South Beach",2165,6m1msu
758,Who would have thought at that time that in seven years there would be a superteam that would make that superteam look like nothing ,467,IAmADopelyLitSavage,/r/nba/comments/6m1msu/sports_illustrated_seven_years_ago_today_lebron/djy7epr/,djy7epr,1499558359.0,1499529559.0,"[Sports Illustrated] Seven years ago today, LeBron James told the world he was taking his talents to South Beach",2165,6m1msu
759,Man I remember when ESPN had a whole column dedicated to them. The Heatles! ,65,johnny_84,/r/nba/comments/6m1msu/sports_illustrated_seven_years_ago_today_lebron/djy8w20/,djy8w20,1499560351.0,1499531551.0,"[Sports Illustrated] Seven years ago today, LeBron James told the world he was taking his talents to South Beach",2165,6m1msu
760,"Not 1, not 2, oh wait... yeah just 2",161,WillYouMaryJaneMe,/r/nba/comments/6m1msu/sports_illustrated_seven_years_ago_today_lebron/djyabs5/,djyabs5,1499562203.0,1499533403.0,"[Sports Illustrated] Seven years ago today, LeBron James told the world he was taking his talents to South Beach",2165,6m1msu
761,Really can't believe it's that been that long,25,,/r/nba/comments/6m1msu/sports_illustrated_seven_years_ago_today_lebron/djy7wi5/,djy7wi5,1499559030.0,1499530230.0,"[Sports Illustrated] Seven years ago today, LeBron James told the world he was taking his talents to South Beach",2165,6m1msu
762,"""Hey, I'm fucking calling you on vacation from Cabo you better sign you crusty old loser""


""Okay""",210,legodmanjames,/r/nba/comments/6lxu9f/windhorst_lebron_james_had_active_conversations/djxerh0/,djxerh0,1499502246.0,1499473446.0,"[Windhorst] LeBron James had active conversations with Jeff Green before decision to sign with Cavs, sources said.",173,6lxu9f
763,"""Trust me LeBron, I rested all of last season so I'll be 100% ready to go by June""

\- Jeff Green, probably",97,dooleysucks,/r/nba/comments/6lxu9f/windhorst_lebron_james_had_active_conversations/djxerud/,djxerud,1499502259.0,1499473459.0,"[Windhorst] LeBron James had active conversations with Jeff Green before decision to sign with Cavs, sources said.",173,6lxu9f
764,LeInterimGm,70,simocm11,/r/nba/comments/6lxu9f/windhorst_lebron_james_had_active_conversations/djxerar/,djxerar,1499502239.0,1499473439.0,"[Windhorst] LeBron James had active conversations with Jeff Green before decision to sign with Cavs, sources said.",173,6lxu9f
765,"Imagine trading Tobias Harris for nothing just to free cap space to sign Jeff Green to a 15 mil contract, aka Orlando",39,maxwell81798,/r/nba/comments/6lxu9f/windhorst_lebron_james_had_active_conversations/djxeuix/,djxeuix,1499502361.0,1499473561.0,"[Windhorst] LeBron James had active conversations with Jeff Green before decision to sign with Cavs, sources said.",173,6lxu9f
766,LeGM,36,kajarann,/r/nba/comments/6lxu9f/windhorst_lebron_james_had_active_conversations/djxepwl/,djxepwl,1499502186.0,1499473386.0,"[Windhorst] LeBron James had active conversations with Jeff Green before decision to sign with Cavs, sources said.",173,6lxu9f
767,"Mannix: With Woj gone, I write the hit pieces now!",95,IamOlderthanMe,/r/nba/comments/6lv2h1/mannix_cavs_owner_dan_gilbert_is_failing_to_prove/djwrqkj/,djwrqkj,1499476150.0,1499447350.0,[Mannix] Cavs owner Dan Gilbert is failing to prove his worth to LeBron,75,6lv2h1
768,Lol cmon,41,constantvariables,/r/nba/comments/6lv2h1/mannix_cavs_owner_dan_gilbert_is_failing_to_prove/djwrqde/,djwrqde,1499476145.0,1499447345.0,[Mannix] Cavs owner Dan Gilbert is failing to prove his worth to LeBron,75,6lv2h1
769,Gilbert is anything but cheap. ,26,Bromine21,/r/nba/comments/6lv2h1/mannix_cavs_owner_dan_gilbert_is_failing_to_prove/djwru06/,djwru06,1499476244.0,1499447444.0,[Mannix] Cavs owner Dan Gilbert is failing to prove his worth to LeBron,75,6lv2h1
770,So I guess paying 50 million in luxury tax or whatever it was is failing to prove worth now,21,BeastlyIguana,/r/nba/comments/6lv2h1/mannix_cavs_owner_dan_gilbert_is_failing_to_prove/djwrucf/,djwrucf,1499476254.0,1499447454.0,[Mannix] Cavs owner Dan Gilbert is failing to prove his worth to LeBron,75,6lv2h1
771,We would have to salary dump Corey Brewer for that,70,jtn1123,/r/nba/comments/6luw6j/simmons_good_litmus_test_for_lebron_going_to/djwq882/,djwq882,1499474601.0,1499445801.0,[Simmons] Good litmus test for LeBron going to Lakers in a year - if LA throws KCP a lifeboat 1 year 20-22m deal so Klutch can save face with KCP.,77,6luw6j
772,They both have the same agent so I think that's what he's getting at.,76,king_k_7,/r/nba/comments/6luw6j/simmons_good_litmus_test_for_lebron_going_to/djwq8du/,djwq8du,1499474605.0,1499445805.0,[Simmons] Good litmus test for LeBron going to Lakers in a year - if LA throws KCP a lifeboat 1 year 20-22m deal so Klutch can save face with KCP.,77,6luw6j
773,Lebron will take next season off 2 film Space Jam 2 Co-Starring Skip Bayless+Lavar,34,,/r/nba/comments/6luw6j/simmons_good_litmus_test_for_lebron_going_to/djwqbs6/,djwqbs6,1499474702.0,1499445902.0,[Simmons] Good litmus test for LeBron going to Lakers in a year - if LA throws KCP a lifeboat 1 year 20-22m deal so Klutch can save face with KCP.,77,6luw6j
774,lebasic bitch,211,Liquidgoldvelveeta,/r/nba/comments/6luhco/medforth_lebron_is_out_here_captioning_his/djwmtkh/,djwmtkh,1499471085.0,1499442285.0,"[Medforth] LeBron is out here captioning his vacation photos with Live, Laugh, Love ",125,6luhco
775,confirmed Kevin Love is staying,53,funtaspen,/r/nba/comments/6luhco/medforth_lebron_is_out_here_captioning_his/djwn19a/,djwn19a,1499471309.0,1499442509.0,"[Medforth] LeBron is out here captioning his vacation photos with Live, Laugh, Love ",125,6luhco
776,He thicc as shit,106,chakalls,/r/nba/comments/6luhco/medforth_lebron_is_out_here_captioning_his/djwmrij/,djwmrij,1499471024.0,1499442224.0,"[Medforth] LeBron is out here captioning his vacation photos with Live, Laugh, Love ",125,6luhco
777,ESPN: Sources say Cavs looking to keep Love but Lebron fleeing to Rockets ,23,jathy2800,/r/nba/comments/6luhco/medforth_lebron_is_out_here_captioning_his/djwnn45/,djwnn45,1499471943.0,1499443143.0,"[Medforth] LeBron is out here captioning his vacation photos with Live, Laugh, Love ",125,6luhco
778,Lebron putting on the pounds ,26,BismackMyBiyombo,/r/nba/comments/6luhco/medforth_lebron_is_out_here_captioning_his/djwmv9u/,djwmv9u,1499471135.0,1499442335.0,"[Medforth] LeBron is out here captioning his vacation photos with Live, Laugh, Love ",125,6luhco
779,rocket emoji !!!!!!,29,Bentekkers22,/r/nba/comments/6luhco/medforth_lebron_is_out_here_captioning_his/djwncw3/,djwncw3,1499471651.0,1499442851.0,"[Medforth] LeBron is out here captioning his vacation photos with Live, Laugh, Love ",125,6luhco
780,"Dude should take things easy the rest of his career. His peak from 2011-2016 was fun as fuck, but he should really just slow down and enjoy the game of basketball. Tune things down, and let other teams make it out of the East^please^LeBron",39,AnCo17,/r/nba/comments/6luhco/medforth_lebron_is_out_here_captioning_his/djwmrul/,djwmrul,1499471034.0,1499442234.0,"[Medforth] LeBron is out here captioning his vacation photos with Live, Laugh, Love ",125,6luhco
781,I think Dirk fell off just this year ,30,,/r/nba/comments/6lrv03/espn_only_6_players_have_averaged_at_least_17_ppg/djw49of/,djw49of,1499437446.0,1499408646.0,"[ESPN] Only 6 players have averaged at least 17 PPG in each of the last 10 seasons: LeBron, Durant, Wade, Carmelo, Aldridge and Gay.",149,6lrv03
782,"Sad to see Dirk just missed it this year, it would have been 18 straight years (all but his rookie season).",61,Juniper41,/r/nba/comments/6lrv03/espn_only_6_players_have_averaged_at_least_17_ppg/djw4a0b/,djw4a0b,1499437466.0,1499408666.0,"[ESPN] Only 6 players have averaged at least 17 PPG in each of the last 10 seasons: LeBron, Durant, Wade, Carmelo, Aldridge and Gay.",149,6lrv03
783,[deleted],84,,/r/nba/comments/6lrv03/espn_only_6_players_have_averaged_at_least_17_ppg/djw49qk/,djw49qk,1499437449.0,1499408649.0,"[ESPN] Only 6 players have averaged at least 17 PPG in each of the last 10 seasons: LeBron, Durant, Wade, Carmelo, Aldridge and Gay.",149,6lrv03
784,Gay confirmed MVP on 30.PPG off the bench whilst also winning six man of the year.,90,Flux320,/r/nba/comments/6lrv03/espn_only_6_players_have_averaged_at_least_17_ppg/djw4a2f/,djw4a2f,1499437469.0,1499408669.0,"[ESPN] Only 6 players have averaged at least 17 PPG in each of the last 10 seasons: LeBron, Durant, Wade, Carmelo, Aldridge and Gay.",149,6lrv03
785,Good times,50,y0ungw0lf,/r/nba/comments/6lqb1q/lebron_james_epic_performance_2012_ecf_game_6_at/djvrbey/,djvrbey,1499418639.0,1499389839.0,"LeBron James Epic Performance 2012 ECF Game 6 at Celtics - 45 Pts, 15 Rebs, 5 Assists",72,6lqb1q
786,"This wasn't 45 in 2017, this was 45 against a slow paced defensive juggernaut. ",53,suphater,/r/nba/comments/6lqb1q/lebron_james_epic_performance_2012_ecf_game_6_at/djvrjn7/,djvrjn7,1499418935.0,1499390135.0,"LeBron James Epic Performance 2012 ECF Game 6 at Celtics - 45 Pts, 15 Rebs, 5 Assists",72,6lqb1q
787,GOAT performance,36,DeKobe-DeBryant,/r/nba/comments/6lqb1q/lebron_james_epic_performance_2012_ecf_game_6_at/djvrfqf/,djvrfqf,1499418796.0,1499389996.0,"LeBron James Epic Performance 2012 ECF Game 6 at Celtics - 45 Pts, 15 Rebs, 5 Assists",72,6lqb1q
788,Favorite game. Dude was a machine. ,27,soeasyakamancandoit,/r/nba/comments/6lqb1q/lebron_james_epic_performance_2012_ecf_game_6_at/djvrb07/,djvrb07,1499418624.0,1499389824.0,"LeBron James Epic Performance 2012 ECF Game 6 at Celtics - 45 Pts, 15 Rebs, 5 Assists",72,6lqb1q
789,"Ahhh yes. 

#UPVOTE !!! UPVOTE !!! UPVOTE !!!",30,Slimshady305,/r/nba/comments/6lqb1q/lebron_james_epic_performance_2012_ecf_game_6_at/djvrbu3/,djvrbu3,1499418655.0,1499389855.0,"LeBron James Epic Performance 2012 ECF Game 6 at Celtics - 45 Pts, 15 Rebs, 5 Assists",72,6lqb1q
790,Pls no. I've managed to avoid ever watching any highlights of this game even 5 years later. ,25,WKWA,/r/nba/comments/6lqb1q/lebron_james_epic_performance_2012_ecf_game_6_at/djvrb7u/,djvrb7u,1499418632.0,1499389832.0,"LeBron James Epic Performance 2012 ECF Game 6 at Celtics - 45 Pts, 15 Rebs, 5 Assists",72,6lqb1q
791,The new cap ladies and gentlemen. ,156,IncaseAce,/r/nba/comments/6lq361/beerin_201011_miami_paid_lebron_bosh_wade_145/djvpi3v/,djvpi3v,1499416244.0,1499387444.0,"[Beer]In 2010-11, Miami paid Lebron, Bosh & Wade $14.5 million apiece Next season they'll pay Dion Waiters & Kelly Olynyk approx $13 million each",260,6lq361
792,"We need to start using % of the cap instead of numbers. In 1985, the Lakers paid Magic $1M. Now the minimum salary is over $1M. ?!!?!?!",70,brandoi,/r/nba/comments/6lq361/beerin_201011_miami_paid_lebron_bosh_wade_145/djvpm1u/,djvpm1u,1499416388.0,1499387588.0,"[Beer]In 2010-11, Miami paid Lebron, Bosh & Wade $14.5 million apiece Next season they'll pay Dion Waiters & Kelly Olynyk approx $13 million each",260,6lq361
793,I don't see anything wrong with that? They will go down as heat legends ,45,goofygoober2,/r/nba/comments/6lq361/beerin_201011_miami_paid_lebron_bosh_wade_145/djvpiqd/,djvpiqd,1499416267.0,1499387467.0,"[Beer]In 2010-11, Miami paid Lebron, Bosh & Wade $14.5 million apiece Next season they'll pay Dion Waiters & Kelly Olynyk approx $13 million each",260,6lq361
794,LeBron signed a 6-year/110M deal in 2010 and Otto Porter signed a 4-year/106M deal this year.,35,Number333,/r/nba/comments/6lq361/beerin_201011_miami_paid_lebron_bosh_wade_145/djvpj9g/,djvpj9g,1499416286.0,1499387486.0,"[Beer]In 2010-11, Miami paid Lebron, Bosh & Wade $14.5 million apiece Next season they'll pay Dion Waiters & Kelly Olynyk approx $13 million each",260,6lq361
795,Jamal Crawford and Jose Calderon? Maybe the Cavs should look at the Big 3 league for their next signings. ,374,so-cal_kid,/r/nba/comments/6lp7xt/vardon_jamal_crawford_spoke_with_lebron_and_is/djvijlt/,djvijlt,1499407499.0,1499378699.0,[Vardon] Jamal Crawford spoke with LeBron and is 'very interested' in joining Cavs once he's a free agent,314,6lp7xt
796,I wonder if Lebron's plan for beating Golden State is to take his team and time travel to 2008,120,Josh-Norman,/r/nba/comments/6lp7xt/vardon_jamal_crawford_spoke_with_lebron_and_is/djvilek/,djvilek,1499407557.0,1499378757.0,[Vardon] Jamal Crawford spoke with LeBron and is 'very interested' in joining Cavs once he's a free agent,314,6lp7xt
797,"Old and washed up and doesn't play defense, perfect for the Cavs bench",233,J_KMOS,/r/nba/comments/6lp7xt/vardon_jamal_crawford_spoke_with_lebron_and_is/djvij5u/,djvij5u,1499407484.0,1499378684.0,[Vardon] Jamal Crawford spoke with LeBron and is 'very interested' in joining Cavs once he's a free agent,314,6lp7xt
798,Is this even a good thing for them??,40,habanatrain,/r/nba/comments/6lp7xt/vardon_jamal_crawford_spoke_with_lebron_and_is/djvijt3/,djvijt3,1499407505.0,1499378705.0,[Vardon] Jamal Crawford spoke with LeBron and is 'very interested' in joining Cavs once he's a free agent,314,6lp7xt
799,"Kobe is a fucking psycho lol, thank god he chose to play basketball",24,virtualed,/r/nba/comments/6lohki/kobe_explains_how_to_guard_lebron_and_other/djvcygf/,djvcygf,1499401412.0,1499372612.0,Kobe explains how to guard Lebron and other superstars,58,6lohki
800,I will use this next time I guard Lebron.,22,Haiko248,/r/nba/comments/6lohki/kobe_explains_how_to_guard_lebron_and_other/djvd6k2/,djvd6k2,1499401645.0,1499372845.0,Kobe explains how to guard Lebron and other superstars,58,6lohki
801,"""lost out"" on wade seems like the wrong word.",117,omokok1049,/r/nba/comments/6lnycz/windhorst_since_lebron_left_the_heat_are_on_a/djv82ev/,djv82ev,1499396385.0,1499367585.0,"[Windhorst] Since LeBron left, the Heat are on a free-agency losing streak. They lost out on LeBron James in 2014, Kevin Durant and Wade in 2016 and now Gordon Hayward in 2017.",53,6lnycz
802,Hot take: It's really really hard to get top free agents. Nobody bats a super high percentage. Why when you get them it's such a huge deal. ,42,dropdatdurkadurk,/r/nba/comments/6lnycz/windhorst_since_lebron_left_the_heat_are_on_a/djv82qa/,djv82qa,1499396394.0,1499367594.0,"[Windhorst] Since LeBron left, the Heat are on a free-agency losing streak. They lost out on LeBron James in 2014, Kevin Durant and Wade in 2016 and now Gordon Hayward in 2017.",53,6lnycz
803,Only wade leaving was really that shocking ,76,kash96,/r/nba/comments/6lnycz/windhorst_since_lebron_left_the_heat_are_on_a/djv81qh/,djv81qh,1499396365.0,1499367565.0,"[Windhorst] Since LeBron left, the Heat are on a free-agency losing streak. They lost out on LeBron James in 2014, Kevin Durant and Wade in 2016 and now Gordon Hayward in 2017.",53,6lnycz
804,"You can't say ""Since LeBron Left"" and then count LeBron leaving as an example, Brian.

Also, I'm pretty sure Pat Riley wasn't exactly putting on a full court press to re-sign Wade.",29,ACTUAL_TIME_TRAVELER,/r/nba/comments/6lnycz/windhorst_since_lebron_left_the_heat_are_on_a/djv82yu/,djv82yu,1499396400.0,1499367600.0,"[Windhorst] Since LeBron left, the Heat are on a free-agency losing streak. They lost out on LeBron James in 2014, Kevin Durant and Wade in 2016 and now Gordon Hayward in 2017.",53,6lnycz
805,"Lol it's still a good organization, good location, no state income tax, a good PG, a good big, a SG with balls. FAs will come. LeBron just wanted to come home, KD wanted an automatic ring and Miami wasn't automatic, and Hayward liked Brad Stevens a lot. Just a bad mix of a lot of SFs having very strong personal/emotional reasons they couldn't satisfy in Miami.",44,mathandcoffee,/r/nba/comments/6lnycz/windhorst_since_lebron_left_the_heat_are_on_a/djv82pq/,djv82pq,1499396393.0,1499367593.0,"[Windhorst] Since LeBron left, the Heat are on a free-agency losing streak. They lost out on LeBron James in 2014, Kevin Durant and Wade in 2016 and now Gordon Hayward in 2017.",53,6lnycz
806,"8ft would be a monster you'd have to double, which would get open spot up shots for Smurfbron.

I'm taking them",430,shazam_7,/r/nba/comments/6lnnq6/2_on_2_who_wins_8ft_lebron_and_4ft_lebron_vs_two/djv5ldj/,djv5ldj,1499393854.0,1499365054.0,2 on 2 who wins: 8ft Lebron and 4ft Lebron vs two regular size Lebrons.,218,6lnnq6
807,8ft team,90,360Angel90,/r/nba/comments/6lnnq6/2_on_2_who_wins_8ft_lebron_and_4ft_lebron_vs_two/djv5k3m/,djv5k3m,1499393820.0,1499365020.0,2 on 2 who wins: 8ft Lebron and 4ft Lebron vs two regular size Lebrons.,218,6lnnq6
808,sandals ,49,,/r/nba/comments/6lnnq6/2_on_2_who_wins_8ft_lebron_and_4ft_lebron_vs_two/djv5l63/,djv5l63,1499393848.0,1499365048.0,2 on 2 who wins: 8ft Lebron and 4ft Lebron vs two regular size Lebrons.,218,6lnnq6
809,Can you shit post better with fingers twice their current size or fingers half their current size?,37,1moreban,/r/nba/comments/6lnnq6/2_on_2_who_wins_8ft_lebron_and_4ft_lebron_vs_two/djv62mk/,djv62mk,1499394335.0,1499365535.0,2 on 2 who wins: 8ft Lebron and 4ft Lebron vs two regular size Lebrons.,218,6lnnq6
810,8ft LeBron would beat any 2 players in NBA history.,63,erldn123,/r/nba/comments/6lnnq6/2_on_2_who_wins_8ft_lebron_and_4ft_lebron_vs_two/djv5yqf/,djv5yqf,1499394227.0,1499365427.0,2 on 2 who wins: 8ft Lebron and 4ft Lebron vs two regular size Lebrons.,218,6lnnq6
