,body,score,author,permalink,comment_id,created_loc,created_utc,post_title,post_score,post_id
0,"Stop feeding the trolls LeBron.  
  
or is it stop trolling, LeBron? ",22,BariNizami,/r/nba/comments/32qqm8/haynes_lebron_james_was_asked_who_he_would_vote/cqdqt9b/,cqdqt9b,1429170722.0,1429141922.0,"[Haynes] ""LeBron James was asked who he would vote on for MVP and he said Kevin Love, with a smile.""",1113,32qqm8
1,League better watch out Lelbron is back ,23,CapturedSoul,/r/nba/comments/32qqm8/haynes_lebron_james_was_asked_who_he_would_vote/cqdr9mb/,cqdr9mb,1429171510.0,1429142710.0,"[Haynes] ""LeBron James was asked who he would vote on for MVP and he said Kevin Love, with a smile.""",1113,32qqm8
2,They were .500 before they got you JR. You da real MVP,1574,sENTual,/r/nba/comments/32lkga/jr_smith_on_why_lebron_is_the_real_mvp_you_see/cqcb7lz/,cqcb7lz,1429069081.0,1429040281.0,"J.R. Smith on why LeBron is the real MVP: ""You see one year removed from a team like Miami -- and they probably won't even make the playoffs -- to a team that hasn't made the playoffs since he left and then, all of the sudden, we're a 52-win team.""",1577,32lkga
3,"LeBron James was the only thing that prevented blood clots from forming in Chris Bosh's lungs.  Top that, MJ.",387,siphillis,/r/nba/comments/32lkga/jr_smith_on_why_lebron_is_the_real_mvp_you_see/cqchkr9/,cqchkr9,1429078955.0,1429050155.0,"J.R. Smith on why LeBron is the real MVP: ""You see one year removed from a team like Miami -- and they probably won't even make the playoffs -- to a team that hasn't made the playoffs since he left and then, all of the sudden, we're a 52-win team.""",1577,32lkga
4,[deleted],92,,/r/nba/comments/32lkga/jr_smith_on_why_lebron_is_the_real_mvp_you_see/cqccple/,cqccple,1429071293.0,1429042493.0,"J.R. Smith on why LeBron is the real MVP: ""You see one year removed from a team like Miami -- and they probably won't even make the playoffs -- to a team that hasn't made the playoffs since he left and then, all of the sudden, we're a 52-win team.""",1577,32lkga
5,"Yea, this is pretty stupid, Miami got hit hard with injuries and the Cavs are a completely different team, they have only 4 players from last year (Verajao, Thompson, Irving, Delladova)",700,ojzoh,/r/nba/comments/32lkga/jr_smith_on_why_lebron_is_the_real_mvp_you_see/cqcbb9a/,cqcbb9a,1429069232.0,1429040432.0,"J.R. Smith on why LeBron is the real MVP: ""You see one year removed from a team like Miami -- and they probably won't even make the playoffs -- to a team that hasn't made the playoffs since he left and then, all of the sudden, we're a 52-win team.""",1577,32lkga
6,Well technically its not even CLOSE to the same team it was before LeBron got there and neither was Miami.  ,25,,/r/nba/comments/32lkga/jr_smith_on_why_lebron_is_the_real_mvp_you_see/cqcduwc/,cqcduwc,1429072990.0,1429044190.0,"J.R. Smith on why LeBron is the real MVP: ""You see one year removed from a team like Miami -- and they probably won't even make the playoffs -- to a team that hasn't made the playoffs since he left and then, all of the sudden, we're a 52-win team.""",1577,32lkga
7,"Fun fact:  Wade (who everyone dogs for missing a bunch of games every season) has played the [3rd most games of any player on the Heat team this season, at 62](https://twitter.com/PBPjasonlieser/status/588026826972356609)

Now, does that mean Wade played in more games than you expected or that Miami was just that ridiculously plagued by injuries?  Depends on your expectations, but I'm leaning towards the latter.",22,yrogreg,/r/nba/comments/32lkga/jr_smith_on_why_lebron_is_the_real_mvp_you_see/cqcfyhm/,cqcfyhm,1429076260.0,1429047460.0,"J.R. Smith on why LeBron is the real MVP: ""You see one year removed from a team like Miami -- and they probably won't even make the playoffs -- to a team that hasn't made the playoffs since he left and then, all of the sudden, we're a 52-win team.""",1577,32lkga
8,"Actually, the Cavs really struggled until they picked up Mozgov. I'm being serious here, his size and presence in the paint was something they sorely needed. If you ask me, he da real MVP",28,,/r/nba/comments/32lkga/jr_smith_on_why_lebron_is_the_real_mvp_you_see/cqchvea/,cqchvea,1429079456.0,1429050656.0,"J.R. Smith on why LeBron is the real MVP: ""You see one year removed from a team like Miami -- and they probably won't even make the playoffs -- to a team that hasn't made the playoffs since he left and then, all of the sudden, we're a 52-win team.""",1577,32lkga
9,"This year's Cavs are a complete different team than last year's Cavs. So just a thought: The award is called MVP - Most Valuable Player. A lot of the players on this years Cavs joined or agreed to trades just because of LeBron. Isn't that what makes a player valuable? Besides still being the best player in the league he's the main reason that other important pieces joined the team.

I know that this is not how the MVP award works and Curry or Harden really deserved it, I just thought this was interesting.",79,koerbchen,/r/nba/comments/32lkga/jr_smith_on_why_lebron_is_the_real_mvp_you_see/cqcd5vt/,cqcd5vt,1429071962.0,1429043162.0,"J.R. Smith on why LeBron is the real MVP: ""You see one year removed from a team like Miami -- and they probably won't even make the playoffs -- to a team that hasn't made the playoffs since he left and then, all of the sudden, we're a 52-win team.""",1577,32lkga
10,"Damn what a useless comment by a typical irrational hater. 

""DUNCAN HAS YET TO PROVE HE CAN WIN A CHAMPIONSHIP WITHOUT POP"" ",1082,blast0ise,/r/nba/comments/32kuff/kobe_defending_lebron_going_off_on_media_on/cqc48xk/,cqc48xk,1429058377.0,1429029577.0,"Kobe defending LeBron, going off on media on Twitter",3956,32kuff
11,Kobe probably bored out of his mind,1207,urfaselol,/r/nba/comments/32kuff/kobe_defending_lebron_going_off_on_media_on/cqc4bfg/,cqc4bfg,1429058486.0,1429029686.0,"Kobe defending LeBron, going off on media on Twitter",3956,32kuff
12,"It's a stupid narrative to begin with.  Basketball is a team game.  Anyone who actually understands the game appreciates that.

To me, the relevant question is: would the team have won the championship without you?  If the answer is 'no', then you earned your championship(s).  Most championship teams have at least three guys they can say that about.",259,SourerDiesel,/r/nba/comments/32kuff/kobe_defending_lebron_going_off_on_media_on/cqc4t63/,cqc4t63,1429059263.0,1429030463.0,"Kobe defending LeBron, going off on media on Twitter",3956,32kuff
13,It's funny how Kobe and LBJ fans hate each other but Kobe and Lebron are friends and stick for each other,1615,mrmoves20,/r/nba/comments/32kuff/kobe_defending_lebron_going_off_on_media_on/cqc463j/,cqc463j,1429058253.0,1429029453.0,"Kobe defending LeBron, going off on media on Twitter",3956,32kuff
14,"In a lot of other sports, great players and their superb teams are CELEBRATED, not scoffed at. Nobody downplays Pele or Johan Cruyff for playing on two of the most legendary international sides of all time. Wayne Gretzky played on a super-stacked Oilers team in the 1980s, and we love the fact that he played on a team that enabled him to reach his max potential.

But for some reason, in basketball, we seem to want to isolate the game's greatest talents on a D-League team and watch them grind out some horrible hero-ball championship.",61,,/r/nba/comments/32kuff/kobe_defending_lebron_going_off_on_media_on/cqc6j2z/,cqc6j2z,1429061944.0,1429033144.0,"Kobe defending LeBron, going off on media on Twitter",3956,32kuff
15,This is awesome. Great seeing a player of his caliber sticking it to some stupid fan. ,220,Kashmir33,/r/nba/comments/32kuff/kobe_defending_lebron_going_off_on_media_on/cqc415h/,cqc415h,1429058032.0,1429029232.0,"Kobe defending LeBron, going off on media on Twitter",3956,32kuff
16,">going off

We've really diluted the meaning of this word haven't we?",289,Zeppelanoid,/r/nba/comments/32kuff/kobe_defending_lebron_going_off_on_media_on/cqc590h/,cqc590h,1429059942.0,1429031142.0,"Kobe defending LeBron, going off on media on Twitter",3956,32kuff
17,"It's really not that complicated of a concept to understand that NO ONE DOES IT ALONE. No one has ever, and no one will ever. LeBron is a great player, one of the greatest of all time. He is not a shoot-first player, he is basically a PG, therefore, he will rely on teammates, and needs competent teammates to win. Kobe and Jordan were different type players, but STILL HAD A DOMINANT TEAM AROUND THEM. ",53,cooze08,/r/nba/comments/32kuff/kobe_defending_lebron_going_off_on_media_on/cqc4pc0/,cqc4pc0,1429059097.0,1429030297.0,"Kobe defending LeBron, going off on media on Twitter",3956,32kuff
18," Man I love Kobe.


He is a true competitor. 

He is well spoken.

One of the all time best

A real players person. He will defend himself and another NBA player from bullshit media until the day he dies.




",420,saintscanucks,/r/nba/comments/32kuff/kobe_defending_lebron_going_off_on_media_on/cqc4719/,cqc4719,1429058294.0,1429029494.0,"Kobe defending LeBron, going off on media on Twitter",3956,32kuff
19,"[**@kobebryant**](https://twitter.com/kobebryant):
>[2015-04-14 15:19:29 UTC](https://twitter.com/kobebryant/status/587998618935660544)

>Media critique\- Mj was a gunner Magic was a coach killer Shaq wasn't serious Lbj couldn't handle pressure Spurs r too old [#BeforeRings](https://twitter.com/search?q=%23BeforeRings)

[**@PaulBrahan**](https://twitter.com/PaulBrahan):
>[2015-04-14 16:02:28 UTC](https://twitter.com/PaulBrahan/status/588009433139179520)

>[@kobebryant](https://twitter.com/kobebryant) lbj has yet to prove he can win a championship without 2 other superstars

[**@kobebryant**](https://twitter.com/kobebryant):
>[2015-04-14 16:28:09 UTC](https://twitter.com/kobebryant/status/588015896658063362)

>Lbj doesn't need to prove that [@PaulBrahan](https://twitter.com/PaulBrahan) I had Shaq \+ Pau Mj had Pip Magic had Worthy \+ Kareem etc AND we all had great teammates

----

[^[Mistake?]](http://www.reddit.com/message/compose/?to=TweetPoster&subject=Error%20Report&message=http://reddit.com/32kuff%0A%0APlease leave above link unaltered.)
[^[Suggestion]](http://www.reddit.com/message/compose/?to=TweetPoster&subject=Suggestion)
[^[FAQ]](http://np.reddit.com/r/TweetPoster/comments/13relk/)
[^[Code]](https://github.com/buttscicles/TweetPoster)
[^[Issues]](https://github.com/buttscicles/TweetPoster/issues)
",65,TweetPoster,/r/nba/comments/32kuff/kobe_defending_lebron_going_off_on_media_on/cqc3yfw/,cqc3yfw,1429057908.0,1429029108.0,"Kobe defending LeBron, going off on media on Twitter",3956,32kuff
20,you would think everyone who would want a kobe jersey would have one by now ,463,DirtyJerseyjumpshot,/r/nba/comments/32kmrb/most_popular_nba_jerseys_1_lebron_2_curry_3_kobe/cqc2lrk/,cqc2lrk,1429055765.0,1429026965.0,Most Popular NBA Jerseys: 1. Lebron 2. Curry 3. Kobe 4. Durant 5. Rose,431,32kmrb
21,"James Harden's name is nowhere to be found. That's surprising, isn't it?",200,noyoublow,/r/nba/comments/32kmrb/most_popular_nba_jerseys_1_lebron_2_curry_3_kobe/cqc2bof/,cqc2bof,1429055317.0,1429026517.0,Most Popular NBA Jerseys: 1. Lebron 2. Curry 3. Kobe 4. Durant 5. Rose,431,32kmrb
22,Looks like everyone who burned their Lebron jersey 4 years ago bought new ones.,99,chaofun,/r/nba/comments/32kmrb/most_popular_nba_jerseys_1_lebron_2_curry_3_kobe/cqc8hmh/,cqc8hmh,1429064926.0,1429036126.0,Most Popular NBA Jerseys: 1. Lebron 2. Curry 3. Kobe 4. Durant 5. Rose,431,32kmrb
23,"Damn it's crazy Kobe is still third, I thought everyone had at least a couple Kobe jerseys by now lol",52,MyUsername0_0,/r/nba/comments/32kmrb/most_popular_nba_jerseys_1_lebron_2_curry_3_kobe/cqc2tdy/,cqc2tdy,1429056105.0,1429027305.0,Most Popular NBA Jerseys: 1. Lebron 2. Curry 3. Kobe 4. Durant 5. Rose,431,32kmrb
24,Suprised Rose is still up there.,116,Truly_Bliss,/r/nba/comments/32kmrb/most_popular_nba_jerseys_1_lebron_2_curry_3_kobe/cqc1vpr/,cqc1vpr,1429054606.0,1429025806.0,Most Popular NBA Jerseys: 1. Lebron 2. Curry 3. Kobe 4. Durant 5. Rose,431,32kmrb
25,"Would've been third, were it not for those meddling redditors!",133,jeffgreenfan,/r/nba/comments/32ic2u/lebron_james_records_his_second_triple_double_of/cqbgy4d/,cqbgy4d,1429001705.0,1428972905.0,Lebron James records his second triple double of the season.,194,32ic2u
26,So happy Lebron kicked ass after coming back from injury. So many idiots were talking like all of his skill had suddenly Space Jam-ed out of his body.,123,IanicRR,/r/nba/comments/32ic2u/lebron_james_records_his_second_triple_double_of/cqbh2yy/,cqbh2yy,1429001937.0,1428973137.0,Lebron James records his second triple double of the season.,194,32ic2u
27,Playoff Lebron *and* playoff Spurs? Welp ,39,XiTauri,/r/nba/comments/32ic2u/lebron_james_records_his_second_triple_double_of/cqbk2eu/,cqbk2eu,1429006980.0,1428978180.0,Lebron James records his second triple double of the season.,194,32ic2u
28,"He really wanted that 10th rebound...didn't come out when he usually comes out, sagged off his man to stick close to the lane to grab the board...gotta love the last week of the season.",22,BrennanHuffDoback,/r/nba/comments/32ic2u/lebron_james_records_his_second_triple_double_of/cqbh4yl/,cqbh4yl,1429002030.0,1428973230.0,Lebron James records his second triple double of the season.,194,32ic2u
29,voter fatigue is some dumb shit,42,chrimewave,/r/nba/comments/32ic2u/lebron_james_records_his_second_triple_double_of/cqbh1kn/,cqbh1kn,1429001870.0,1428973070.0,Lebron James records his second triple double of the season.,194,32ic2u
30,Jesus that is ridiculous,266,noyoublow,/r/nba/comments/32i70q/lebron_james_steal_and_behindtheback_pass/cqbfjs1/,cqbfjs1,1428999269.0,1428970469.0,LeBron James Steal and Behind-The-Back Pass,769,32i70q
31,I swear this Cleveland team is becoming an external hemisphere of his brain. ,84,illdreams,/r/nba/comments/32i70q/lebron_james_steal_and_behindtheback_pass/cqbijq4/,cqbijq4,1429004434.0,1428975634.0,LeBron James Steal and Behind-The-Back Pass,769,32i70q
32,wow i was not expecting that to be so sick,37,champagnencampaign,/r/nba/comments/32i70q/lebron_james_steal_and_behindtheback_pass/cqbhker/,cqbhker,1429002759.0,1428973959.0,LeBron James Steal and Behind-The-Back Pass,769,32i70q
33,[Mirror](https://www.youtube.com/watch?v=jCikdbUVRP0),27,tekNYK,/r/nba/comments/32i70q/lebron_james_steal_and_behindtheback_pass/cqc3o3t/,cqc3o3t,1429057462.0,1429028662.0,LeBron James Steal and Behind-The-Back Pass,769,32i70q
34,"If you watch the clip and follow LeBron from when he's near the 3-point line, it's simply mind-blowing. It's hard to even see when he grabs the pass but he's anticipating it a good 3 or 4 seconds before it happens. I don't care what anyone says, King James is the most complete player in NBA history. ",25,HighGuy92,/r/nba/comments/32i70q/lebron_james_steal_and_behindtheback_pass/cqbqc8v/,cqbqc8v,1429020511.0,1428991711.0,LeBron James Steal and Behind-The-Back Pass,769,32i70q
35,Does lebron have the highest basketball iq of any player ever? These plays with his steals are absolutely insane,51,Mrgreenfield,/r/nba/comments/32i70q/lebron_james_steal_and_behindtheback_pass/cqbnah8/,cqbnah8,1429012962.0,1428984162.0,LeBron James Steal and Behind-The-Back Pass,769,32i70q
36,That was some Magic Johnson type stuff.. man,44,ireddit270,/r/nba/comments/32i70q/lebron_james_steal_and_behindtheback_pass/cqbfthc/,cqbfthc,1428999733.0,1428970933.0,LeBron James Steal and Behind-The-Back Pass,769,32i70q
37,"I've never seen such a high basketball IQ, just crazy the way he anticipates plays like that.",31,OmertaFPS,/r/nba/comments/32i70q/lebron_james_steal_and_behindtheback_pass/cqbmaas/,cqbmaas,1429010953.0,1428982153.0,LeBron James Steal and Behind-The-Back Pass,769,32i70q
38,"Well, that got pretty... juvenile. (☞ﾟヮﾟ)☞

Editted 'cause it was a joke.",183,JesusSama,/r/nba/comments/32hdqs/evan_turner_andre_iguodalas_son_is_better_baller/cqb7m1e/,cqb7m1e,1428986215.0,1428957415.0,Evan Turner: Andre Iguodala’s Son Is Better Baller Than LeBron James’ Son,277,32hdqs
39,Both of them are better than Doc's son. ,79,,/r/nba/comments/32hdqs/evan_turner_andre_iguodalas_son_is_better_baller/cqblikr/,cqblikr,1429009512.0,1428980712.0,Evan Turner: Andre Iguodala’s Son Is Better Baller Than LeBron James’ Son,277,32hdqs
40,"ET is so weird, it's awesome. He's like a less violent Artest (personality wise)

People should read the article by the way it was a joke they laughed about.",95,vforprez2,/r/nba/comments/32hdqs/evan_turner_andre_iguodalas_son_is_better_baller/cqb7kya/,cqb7kya,1428986171.0,1428957371.0,Evan Turner: Andre Iguodala’s Son Is Better Baller Than LeBron James’ Son,277,32hdqs
41,LaaaaBrooon Jameessss,23,StoopidFlexin,/r/nba/comments/32hdqs/evan_turner_andre_iguodalas_son_is_better_baller/cqb7l24/,cqb7l24,1428986174.0,1428957374.0,Evan Turner: Andre Iguodala’s Son Is Better Baller Than LeBron James’ Son,277,32hdqs
42,I feel like Evan Turner is one of my favorite players just because of the crazy shit he says.,36,lakerswiz,/r/nba/comments/32hdqs/evan_turner_andre_iguodalas_son_is_better_baller/cqb86x0/,cqb86x0,1428987074.0,1428958274.0,Evan Turner: Andre Iguodala’s Son Is Better Baller Than LeBron James’ Son,277,32hdqs
43,"""Evan Turner calls out LeBron James?! If Cleveland faces Boston in the play-offs, how will Evan Turner's completely out-of-line comment affect LeBron James during the series?"" - ESPN

Edit: Is it ""playoffs"" or ""play-offs""? I don't even know anymore haha",56,,/r/nba/comments/32hdqs/evan_turner_andre_iguodalas_son_is_better_baller/cqb7jru/,cqb7jru,1428986123.0,1428957323.0,Evan Turner: Andre Iguodala’s Son Is Better Baller Than LeBron James’ Son,277,32hdqs
44,Cavs rolling with their playoff lineup,151,yellowcarpet,/r/nba/comments/32cla2/basketball_monster_lebron_james_kyrie_irving/cq9xyr5/,cq9xyr5,1428889022.0,1428860222.0,"[Basketball Monster] LeBron James, Kyrie Irving, Kevin Love, JR Smith will be rested Sunday.",219,32cla2
45,Embrace the tank,48,shuab15,/r/nba/comments/32cla2/basketball_monster_lebron_james_kyrie_irving/cq9ymhv/,cq9ymhv,1428890222.0,1428861422.0,"[Basketball Monster] LeBron James, Kyrie Irving, Kevin Love, JR Smith will be rested Sunday.",219,32cla2
46,Big Perk's time to shine baby!!!,27,mad_regal,/r/nba/comments/32cla2/basketball_monster_lebron_james_kyrie_irving/cq9xrlu/,cq9xrlu,1428888667.0,1428859867.0,"[Basketball Monster] LeBron James, Kyrie Irving, Kevin Love, JR Smith will be rested Sunday.",219,32cla2
47,I'm taking down my lebron poster,23,Red_it_dawg,/r/nba/comments/32cla2/basketball_monster_lebron_james_kyrie_irving/cq9zltv/,cq9zltv,1428891975.0,1428863175.0,"[Basketball Monster] LeBron James, Kyrie Irving, Kevin Love, JR Smith will be rested Sunday.",219,32cla2
48,Let's goooooo Cleveland Delledovas! Also known as Mosgov and the minions. ,84,ProbablyMyLastLogin,/r/nba/comments/32cla2/basketball_monster_lebron_james_kyrie_irving/cq9xpko/,cq9xpko,1428888564.0,1428859764.0,"[Basketball Monster] LeBron James, Kyrie Irving, Kevin Love, JR Smith will be rested Sunday.",219,32cla2
49,Conspiracy Theory: Lebron wants to give the Celtics a leg up to make totally sure the Heat get booted out of the playoffs. That way nobody forgets that HE makes the difference between a second seed and a lottery bound team.,52,RobertDowneyDildos,/r/nba/comments/32cla2/basketball_monster_lebron_james_kyrie_irving/cq9zmkw/,cq9zmkw,1428892013.0,1428863213.0,"[Basketball Monster] LeBron James, Kyrie Irving, Kevin Love, JR Smith will be rested Sunday.",219,32cla2
50,"Isn't he shooting a lot of threes now? I'm not sure, but watching certainly feels like it. ",83,Smash_Brothers,/r/nba/comments/32c07k/why_has_lebron_james_shooting_percentage_gone/cq9s2a0/,cq9s2a0,1428877041.0,1428848241.0,Why has LeBron James' shooting percentage gone down so much this season?,93,32c07k
51,He doesnt play out of the post as much as he did with the Heat.,56,Thurstian,/r/nba/comments/32c07k/why_has_lebron_james_shooting_percentage_gone/cq9sn7x/,cq9sn7x,1428878455.0,1428849655.0,Why has LeBron James' shooting percentage gone down so much this season?,93,32c07k
52,People seem to forget how good Spo's system was,237,ActuarialGrape,/r/nba/comments/32c07k/why_has_lebron_james_shooting_percentage_gone/cq9s6ua/,cq9s6ua,1428877362.0,1428848562.0,Why has LeBron James' shooting percentage gone down so much this season?,93,32c07k
53,shot selection mostly. Coupled that with more isolation plays than in recent years because of the new system he had to get accustomed to leads to less high percentage shots for him. Kyrie on the other hand benefits greatly from LeBron..,47,Kashmir33,/r/nba/comments/32c07k/why_has_lebron_james_shooting_percentage_gone/cq9s5lx/,cq9s5lx,1428877275.0,1428848475.0,Why has LeBron James' shooting percentage gone down so much this season?,93,32c07k
54,No headband.,46,,/r/nba/comments/32c07k/why_has_lebron_james_shooting_percentage_gone/cq9sxeh/,cq9sxeh,1428879114.0,1428850314.0,Why has LeBron James' shooting percentage gone down so much this season?,93,32c07k
55,You don't remember? He's a potato now.,84,yeshua1986,/r/nba/comments/32c07k/why_has_lebron_james_shooting_percentage_gone/cq9s88d/,cq9s88d,1428877460.0,1428848660.0,Why has LeBron James' shooting percentage gone down so much this season?,93,32c07k
56,The biggest part of it is that he's finishing at the worst rate at the rim this year since his rookie year. He's never been significantly below 70% before; now he's at 63%. ,33,,/r/nba/comments/32c07k/why_has_lebron_james_shooting_percentage_gone/cq9ux0y/,cq9ux0y,1428883341.0,1428854541.0,Why has LeBron James' shooting percentage gone down so much this season?,93,32c07k
57,"I'm sure the Cavs would love that aswell, as opposed to say Indiana.

LeBron would probably be thrilled, seeing as with the zero rim protection the Celtics provide, he could pretty much walk to the rim.",29,boogieDMC,/r/nba/comments/32bobl/celtics_owner_says_he_respects_lebron_going_back/cq9pmm0/,cq9pmm0,1428869095.0,1428840295.0,"Celtics owner says he respects LeBron going back but ""would love to play Cavs in playoffs"" [24:25]",36,32bobl
58,yeah good luck *walking* by Evan Turner!,27,,/r/nba/comments/32bobl/celtics_owner_says_he_respects_lebron_going_back/cq9pxfx/,cq9pxfx,1428870348.0,1428841548.0,"Celtics owner says he respects LeBron going back but ""would love to play Cavs in playoffs"" [24:25]",36,32bobl
59,"Lmao why does Evan always say the weirdest shit in post game conferences

The Jesus stuff, now this ",316,Yanns,/r/nba/comments/326yx6/evan_turner_i_threw_away_my_lebron_poster_in_high/cq8i97r/,cq8i97r,1428751922.0,1428723122.0,"Evan Turner: ""I threw away my LeBron poster in high school, so I don’t care how much he played tonight.""",332,326yx6
60,"LeBron: ""I threw away my 'Jesus is my Homeboy' t-shirt in middle school, so I don't care how much he played tonight.""",152,Blacramento,/r/nba/comments/326yx6/evan_turner_i_threw_away_my_lebron_poster_in_high/cq8h6xc/,cq8h6xc,1428749727.0,1428720927.0,"Evan Turner: ""I threw away my LeBron poster in high school, so I don’t care how much he played tonight.""",332,326yx6
61,"Evan Turner is weird, but I love him. ",48,PunkPenguin,/r/nba/comments/326yx6/evan_turner_i_threw_away_my_lebron_poster_in_high/cq8io29/,cq8io29,1428752838.0,1428724038.0,"Evan Turner: ""I threw away my LeBron poster in high school, so I don’t care how much he played tonight.""",332,326yx6
62,[deleted],82,,/r/nba/comments/326yx6/evan_turner_i_threw_away_my_lebron_poster_in_high/cq8hd89/,cq8hd89,1428750081.0,1428721281.0,"Evan Turner: ""I threw away my LeBron poster in high school, so I don’t care how much he played tonight.""",332,326yx6
63,Hahaha I don't get why the fans of Turners previous teams hate this guy so much. He seems to be Brad Stevens favorite player and has been nothing but funny and a positive guy to have in The locker room.,45,crustman34,/r/nba/comments/326yx6/evan_turner_i_threw_away_my_lebron_poster_in_high/cq8iz7j/,cq8iz7j,1428753533.0,1428724733.0,"Evan Turner: ""I threw away my LeBron poster in high school, so I don’t care how much he played tonight.""",332,326yx6
64,Edgy,82,jcosma,/r/nba/comments/326yx6/evan_turner_i_threw_away_my_lebron_poster_in_high/cq8h89k/,cq8h89k,1428749804.0,1428721004.0,"Evan Turner: ""I threw away my LeBron poster in high school, so I don’t care how much he played tonight.""",332,326yx6
65,Savage,28,,/r/nba/comments/326yx6/evan_turner_i_threw_away_my_lebron_poster_in_high/cq8ha9h/,cq8ha9h,1428749917.0,1428721117.0,"Evan Turner: ""I threw away my LeBron poster in high school, so I don’t care how much he played tonight.""",332,326yx6
66,Hairline looks fly though. Looks 5 years younger.,80,vforprez2,/r/nba/comments/326ntd/lebron_misses_a_monster_dunk/cq8e7cu/,cq8e7cu,1428743759.0,1428714959.0,Lebron misses a MONSTER dunk,254,326ntd
67,Anyone else catch the Cavs player holding Zeller under the basket to get dunked on?,74,thecurrydealer,/r/nba/comments/326ntd/lebron_misses_a_monster_dunk/cq8ev7s/,cq8ev7s,1428745056.0,1428716256.0,Lebron misses a MONSTER dunk,254,326ntd
68,[deleted],28,,/r/nba/comments/326ntd/lebron_misses_a_monster_dunk/cq8fogg/,cq8fogg,1428746684.0,1428717884.0,Lebron misses a MONSTER dunk,254,326ntd
69,"""ball finds love"" Sounds like the premise to a Rob Schneider movie.",24,LongJohnErd,/r/nba/comments/326ntd/lebron_misses_a_monster_dunk/cq8gala/,cq8gala,1428747889.0,1428719089.0,Lebron misses a MONSTER dunk,254,326ntd
70,"No Melo, Rose or Bosh.

Edit: PG-13.",106,Clive-Owen,/r/nba/comments/32519m/finnan_cavs_now_have_the_top_two_scorers_in_the/cq7xemj/,cq7xemj,1428715163.0,1428686363.0,[Finnan] Cavs now have the top two scorers in the Eastern Conference in LeBron James (third overall at 25.5 ppg) and Kyrie Irving (ninth at 22 ppg),178,32519m
