,body,score,author,permalink,comment_id,created_loc,created_utc,post_title,post_score,post_id
473,"""If they like it with no seams or with the seams. I know that might not make sense -- some guys like it different ways. I get the ball right in my hand before I throw it. I know the guys on my team like seams or guys who like the ball high when they catch it. I know guys who like it low or midsection. I know where everyone wants the ball, and I just try to put it there on time and on target. All they have to do is catch and fire. It's those guys working on their craft that allows me to do that.""",639,suphater,/r/nba/comments/5fit9k/windhorst_lebron_breaks_all_the_passing_rules_and/dakiz9c/,dakiz9c,1480459175.0,1480430375.0,"[Windhorst] LeBron 'breaks all the passing rules,' and he's loving it: James is averaging the fewest shots (17.2) and the most assists (9.7) per game in his career.",1290,5fit9k
474,"Makes sense to see if they can win with as little scoring from him as possible. He enables his teammates, which should pay off in the long run, but can turn it on if needed to take over a game.",74,Iamnotthefirst,/r/nba/comments/5fit9k/windhorst_lebron_breaks_all_the_passing_rules_and/dakkdvl/,dakkdvl,1480461223.0,1480432423.0,"[Windhorst] LeBron 'breaks all the passing rules,' and he's loving it: James is averaging the fewest shots (17.2) and the most assists (9.7) per game in his career.",1290,5fit9k
475,LeCoast is only second to LeBeast. Scary,124,snek26,/r/nba/comments/5fit9k/windhorst_lebron_breaks_all_the_passing_rules_and/daklbdl/,daklbdl,1480462486.0,1480433686.0,"[Windhorst] LeBron 'breaks all the passing rules,' and he's loving it: James is averaging the fewest shots (17.2) and the most assists (9.7) per game in his career.",1290,5fit9k
476,This year he looks like LeMagic James,60,ehmaruko,/r/nba/comments/5fit9k/windhorst_lebron_breaks_all_the_passing_rules_and/dakmic0/,dakmic0,1480464011.0,1480435211.0,"[Windhorst] LeBron 'breaks all the passing rules,' and he's loving it: James is averaging the fewest shots (17.2) and the most assists (9.7) per game in his career.",1290,5fit9k
477,LePass,126,existential7,/r/nba/comments/5fit9k/windhorst_lebron_breaks_all_the_passing_rules_and/dakjpra/,dakjpra,1480460271.0,1480431471.0,"[Windhorst] LeBron 'breaks all the passing rules,' and he's loving it: James is averaging the fewest shots (17.2) and the most assists (9.7) per game in his career.",1290,5fit9k
478,He's the greatest player I've ever seen. There's no question about it.,312,jeewantha,/r/nba/comments/5fit9k/windhorst_lebron_breaks_all_the_passing_rules_and/dakif2u/,dakif2u,1480458291.0,1480429491.0,"[Windhorst] LeBron 'breaks all the passing rules,' and he's loving it: James is averaging the fewest shots (17.2) and the most assists (9.7) per game in his career.",1290,5fit9k
479,I'm praying for a Cleveland repeat,510,Tito_Our_Saviour,/r/nba/comments/5fit9k/windhorst_lebron_breaks_all_the_passing_rules_and/daki80j/,daki80j,1480457979.0,1480429179.0,"[Windhorst] LeBron 'breaks all the passing rules,' and he's loving it: James is averaging the fewest shots (17.2) and the most assists (9.7) per game in his career.",1290,5fit9k
480,"Can he give Melo a call and maybe give him some pointers?


Thanks",80,DrStabwounds,/r/nba/comments/5fit9k/windhorst_lebron_breaks_all_the_passing_rules_and/dakkwk6/,dakkwk6,1480461937.0,1480433137.0,"[Windhorst] LeBron 'breaks all the passing rules,' and he's loving it: James is averaging the fewest shots (17.2) and the most assists (9.7) per game in his career.",1290,5fit9k
481,"""If they like it with no seams or with the seams. I know that might not make sense -- some guys like it different ways. I get the ball right in my hand before I throw it.""

I played HS and ran scrims with some guys from college and I didn't think this was physically possible. Amazing",37,Dirtybirdz04,/r/nba/comments/5fit9k/windhorst_lebron_breaks_all_the_passing_rules_and/dakkqfh/,dakkqfh,1480461707.0,1480432907.0,"[Windhorst] LeBron 'breaks all the passing rules,' and he's loving it: James is averaging the fewest shots (17.2) and the most assists (9.7) per game in his career.",1290,5fit9k
482,"I don't know how to define perfect. But Lebron in that season was the most versatile player I've ever seen. Shot 40%+ from the 3 and a good volume so that just enhanced his offensive threat. He also reached DPOY levels for the last time in his career. He could defend any elite wing player, and could guard anyone below 7' with ease.  
Who can forget that 27 game winning streak the Heat had during that season? Lebron was the man. He destroyed us in the Finals.  
In terms of versatility the only player who came close to Lebron was KG in 2003-2004.",205,jeewantha,/r/nba/comments/5fbtvn/was_prime_lebron_the_perfect_nba_player/daizm4w/,daizm4w,1480371287.0,1480342487.0,Was prime LeBron the perfect NBA player?,71,5fbtvn
483,myPlayer was better,38,bldbld,/r/nba/comments/5fbtvn/was_prime_lebron_the_perfect_nba_player/daj1fil/,daj1fil,1480374289.0,1480345489.0,Was prime LeBron the perfect NBA player?,71,5fbtvn
484,"I'd argue 88 Jordan. 33, 8,8. Defensive player of the year, MVP, 54% shooting. 3 steals a game. Only ""lacking"" part was 3 point shooting, but I don't necessarily think that's a valid criticism based on the offense he was running.",85,cgar28,/r/nba/comments/5fbtvn/was_prime_lebron_the_perfect_nba_player/daj097t/,daj097t,1480372386.0,1480343586.0,Was prime LeBron the perfect NBA player?,71,5fbtvn
485,"we will never see a perfect player, but LeBron was pretty close to perfection in 2012-2014 ",31,Dont_argue_me,/r/nba/comments/5fbtvn/was_prime_lebron_the_perfect_nba_player/daizjhf/,daizjhf,1480371156.0,1480342356.0,Was prime LeBron the perfect NBA player?,71,5fbtvn
486,"Yes. Specifically 2012/2013 Lebron.

His only crux has been his jump shooting and 3 point shot. But in 2012/2013, he was fucking super saiyan.",28,padowan,/r/nba/comments/5fbtvn/was_prime_lebron_the_perfect_nba_player/daiznqp/,daiznqp,1480371364.0,1480342564.0,Was prime LeBron the perfect NBA player?,71,5fbtvn
487,So far this season the best players seem to be playing at an unusually high level. Seriously. A core of great players seem to be really hot.,88,Not_A_Doctor__,/r/nba/comments/5f7exk/young_lebron_responds_to_westbrook_tying_him_in/dai3vpz/,dai3vpz,1480312906.0,1480284106.0,[Young] LeBron responds to Westbrook tying him in triple-doubles to take back sixth all-time for himself with the 45th of his career.,156,5f7exk
488,my two favorite players in a dick measuring contest <3 this is a good season,46,ABNew,/r/nba/comments/5f7exk/young_lebron_responds_to_westbrook_tying_him_in/dai67rd/,dai67rd,1480315956.0,1480287156.0,[Young] LeBron responds to Westbrook tying him in triple-doubles to take back sixth all-time for himself with the 45th of his career.,156,5f7exk
489,I hope LeBron gets MVP this season,112,Ifuckinglovebball,/r/nba/comments/5f7exk/young_lebron_responds_to_westbrook_tying_him_in/dai1dg2/,dai1dg2,1480309703.0,1480280903.0,[Young] LeBron responds to Westbrook tying him in triple-doubles to take back sixth all-time for himself with the 45th of his career.,156,5f7exk
490,Box out people. Box out.,127,,/r/nba/comments/5f7cg2/lebron_slams_missed_free_throw/dahzpt1/,dahzpt1,1480307635.0,1480278835.0,LeBron slams missed free throw,934,5f7cg2
491,Its amazing how lebron makes grown ass nba players look like highschoolers on some kids mixtape,226,Swift_taco_mechanic,/r/nba/comments/5f7cg2/lebron_slams_missed_free_throw/dai0mt1/,dai0mt1,1480308778.0,1480279978.0,LeBron slams missed free throw,934,5f7cg2
492,a man vs boys,71,zepg,/r/nba/comments/5f7cg2/lebron_slams_missed_free_throw/dahzxuz/,dahzxuz,1480307909.0,1480279109.0,LeBron slams missed free throw,934,5f7cg2
493,"reminds me of that time he slammed his own free throw miss when the timberwolves didnt realize it was only 1 foul shot

https://www.youtube.com/watch?v=isU8-o5SCHk#t=7s",70,chandler55,/r/nba/comments/5f7cg2/lebron_slams_missed_free_throw/dai34fr/,dai34fr,1480311926.0,1480283126.0,LeBron slams missed free throw,934,5f7cg2
494,"That was really impressive.

Especially because it looks like (although you can't see for sure from this angle) he didn't commit a lane violation... and the two Sixers players next to him both did.",248,zzMojaveExpress,/r/nba/comments/5f7cg2/lebron_slams_missed_free_throw/dahzrqe/,dahzrqe,1480307703.0,1480278903.0,LeBron slams missed free throw,934,5f7cg2
495,So many lane violations by everyone. They deserved to get dunked on. ,47,WarmTequila,/r/nba/comments/5f7cg2/lebron_slams_missed_free_throw/dai10yx/,dai10yx,1480309276.0,1480280476.0,LeBron slams missed free throw,934,5f7cg2
496,"Damn, where was the box out? This game was simply a showcase for why experience matters.",38,,/r/nba/comments/5f7cg2/lebron_slams_missed_free_throw/dahzuz5/,dahzuz5,1480307812.0,1480279012.0,LeBron slams missed free throw,934,5f7cg2
497,Relevant Michael Jordan: https://www.youtube.com/watch?v=E6ziQNSETe4,27,canipaybycheck,/r/nba/comments/5f7cg2/lebron_slams_missed_free_throw/dai6nio/,dai6nio,1480316541.0,1480287741.0,LeBron slams missed free throw,934,5f7cg2
498,So ready for a Westbrook-James triple double competition this season. ,497,throwtherock13,/r/nba/comments/5f7b2q/lebron_has_his_3rd_triple_double_of_the_year/dahzfrm/,dahzfrm,1480307294.0,1480278494.0,LeBron has his 3rd triple double of the year,599,5f7b2q
499,Lebron was like  fuck that can't let Westbrook be there with me,136,deadla104,/r/nba/comments/5f7b2q/lebron_has_his_3rd_triple_double_of_the_year/dahzqoi/,dahzqoi,1480307666.0,1480278866.0,LeBron has his 3rd triple double of the year,599,5f7b2q
500,"LeBron is ~~62~~ 49 assists away from a LeBron Career: 27K/7K/7K

edit: included today's game",151,heat_forever,/r/nba/comments/5f7b2q/lebron_has_his_3rd_triple_double_of_the_year/dai1uc3/,dai1uc3,1480310287.0,1480281487.0,LeBron has his 3rd triple double of the year,599,5f7b2q
501,Man so happy my basketball experience is tethered to when Lebron entered the league. I get to enjoy watching his whole career live,122,RastaJafar,/r/nba/comments/5f7b2q/lebron_has_his_3rd_triple_double_of_the_year/dahzzrg/,dahzzrg,1480307974.0,1480279174.0,LeBron has his 3rd triple double of the year,599,5f7b2q
502,It's crazy watching this kid emerge this season.,94,Lord_Von,/r/nba/comments/5f7b2q/lebron_has_his_3rd_triple_double_of_the_year/dai1jpn/,dai1jpn,1480309913.0,1480281113.0,LeBron has his 3rd triple double of the year,599,5f7b2q
503,Kyrie has 39 now,60,,/r/nba/comments/5f7b2q/lebron_has_his_3rd_triple_double_of_the_year/dahzns3/,dahzns3,1480307567.0,1480278767.0,LeBron has his 3rd triple double of the year,599,5f7b2q
504,"CORRECTION: Kyrie had 39

Cavs Big 3: 90pnts (29-59 FG (49%) | 10-21 3P (48%) | 22-24 FT (92%)) 25rebs 16assts 1stl 0blks

Rest of the Cavs: 22pnts (9-33 FG (27%) | 2-17 3P (12%) | 2-4 FT (50%)) 8rebs 3assts 4stls 3blks 

Lucky for the Cavs they were playing Philly.",39,Mind_Fcuk,/r/nba/comments/5f7b2q/lebron_has_his_3rd_triple_double_of_the_year/dai0756/,dai0756,1480308236.0,1480279436.0,LeBron has his 3rd triple double of the year,599,5f7b2q
505,"If he get's 11 rbs next game he will officially be averaging a triple double. Right now he's averaging 31.2pts,11.2ast,9.9rbs ",605,,/r/nba/comments/5f3e4n/espn_russell_westbrook_is_now_tied_with_lebron/dah60na/,dah60na,1480247243.0,1480218443.0,[ESPN] Russell Westbrook is now tied with LeBron for 6th all time in triple-doubles. He's played in 395 fewer games.,1347,5f3e4n
506,"this is honestly not something to be looked over.

that's amazing shit right there.

Russell Westbrook is truly a monster.",729,JMD__,/r/nba/comments/5f3e4n/espn_russell_westbrook_is_now_tied_with_lebron/dah5sey/,dah5sey,1480246884.0,1480218084.0,[ESPN] Russell Westbrook is now tied with LeBron for 6th all time in triple-doubles. He's played in 395 fewer games.,1347,5f3e4n
507,[deleted],55,,/r/nba/comments/5f3e4n/espn_russell_westbrook_is_now_tied_with_lebron/dah5she/,dah5she,1480246887.0,1480218087.0,[ESPN] Russell Westbrook is now tied with LeBron for 6th all time in triple-doubles. He's played in 395 fewer games.,1347,5f3e4n
508,"Lo the time of the False Prophet has ended. May the young goat lead us to summer pastures. 

-Scryers of Wilt 9,38-40",121,rabidbot,/r/nba/comments/5f3e4n/espn_russell_westbrook_is_now_tied_with_lebron/dah72er/,dah72er,1480248938.0,1480220138.0,[ESPN] Russell Westbrook is now tied with LeBron for 6th all time in triple-doubles. He's played in 395 fewer games.,1347,5f3e4n
509,Westbrook is like a fucking machine,179,StopfortheKlopp,/r/nba/comments/5f3e4n/espn_russell_westbrook_is_now_tied_with_lebron/dah5qk9/,dah5qk9,1480246805.0,1480218005.0,[ESPN] Russell Westbrook is now tied with LeBron for 6th all time in triple-doubles. He's played in 395 fewer games.,1347,5f3e4n
510,Going to start calling him the Little O,71,ronxpopeil,/r/nba/comments/5f3e4n/espn_russell_westbrook_is_now_tied_with_lebron/dah5s58/,dah5s58,1480246871.0,1480218071.0,[ESPN] Russell Westbrook is now tied with LeBron for 6th all time in triple-doubles. He's played in 395 fewer games.,1347,5f3e4n
511,He needs 11 boards the next game to average a triple double for the season,45,OrangeKookie,/r/nba/comments/5f3e4n/espn_russell_westbrook_is_now_tied_with_lebron/dah66jx/,dah66jx,1480247502.0,1480218702.0,[ESPN] Russell Westbrook is now tied with LeBron for 6th all time in triple-doubles. He's played in 395 fewer games.,1347,5f3e4n
512,How many LeBrons does he have tho?,56,johncenatbh,/r/nba/comments/5f3e4n/espn_russell_westbrook_is_now_tied_with_lebron/dah5osb/,dah5osb,1480246727.0,1480217927.0,[ESPN] Russell Westbrook is now tied with LeBron for 6th all time in triple-doubles. He's played in 395 fewer games.,1347,5f3e4n
513,How many Brodies does LeBron have?,68,,/r/nba/comments/5f3e4n/espn_russell_westbrook_is_now_tied_with_lebron/dah61ha/,dah61ha,1480247282.0,1480218482.0,[ESPN] Russell Westbrook is now tied with LeBron for 6th all time in triple-doubles. He's played in 395 fewer games.,1347,5f3e4n
514,Triple Doubrook,112,Oh_no_bros,/r/nba/comments/5f3e4n/espn_russell_westbrook_is_now_tied_with_lebron/dah5sv3/,dah5sv3,1480246902.0,1480218102.0,[ESPN] Russell Westbrook is now tied with LeBron for 6th all time in triple-doubles. He's played in 395 fewer games.,1347,5f3e4n
515,"Averaging a triple double for the season!! 
[Edit: 31/9.9/11] I goofd        ",26,Find_Your_MegaMan,/r/nba/comments/5f3azk/westbrook_finishes_with_17pts15ast13reb_to_record/dah4wj7/,dah4wj7,1480245443.0,1480216643.0,"Westbrook finishes with 17pts,15ast,13reb to record 7th TripleDouble of Season and ties Lebron with 44 All-Time",59,5f3azk
516,But he stole those assists from his team mates. ,21,KillSleigh,/r/nba/comments/5f35t7/westbrook_gets_7th_triple_double_of_season_and/dah3npt/,dah3npt,1480243390.0,1480214590.0,"Westbrook get's 7th Triple Double of Season and ties LeBron with 44 all time [11pts, 11rbs, 10asts] with 3:35 still left in 3rd vs Detroit",44,5f35t7
517,god I wish my team had as much chemistry as the cavs do. ,177,russellp1212,/r/nba/comments/5f0wn3/lebron_james_and_the_cavs_dance_it_off_after_ohio/dagm82y/,dagm82y,1480217611.0,1480188811.0,Lebron James and the Cavs dance it off after Ohio State pick-six,483,5f0wn3
518,Looks like an aggressive urban posse initiation ,298,ireddit270,/r/nba/comments/5f0wn3/lebron_james_and_the_cavs_dance_it_off_after_ohio/dagl476/,dagl476,1480216108.0,1480187308.0,Lebron James and the Cavs dance it off after Ohio State pick-six,483,5f0wn3
519,[deleted],377,,/r/nba/comments/5f0wn3/lebron_james_and_the_cavs_dance_it_off_after_ohio/dagkmxk/,dagkmxk,1480215451.0,1480186651.0,Lebron James and the Cavs dance it off after Ohio State pick-six,483,5f0wn3
520,"The Cavs have great chemistry, maybe it does take more than a year to gain chemistry ?",39,najib78,/r/nba/comments/5f0wn3/lebron_james_and_the_cavs_dance_it_off_after_ohio/dagnoj1/,dagnoj1,1480219616.0,1480190816.0,Lebron James and the Cavs dance it off after Ohio State pick-six,483,5f0wn3
521,Lmao is Kyrie wearing a snuggie or something???,64,,/r/nba/comments/5f0wn3/lebron_james_and_the_cavs_dance_it_off_after_ohio/dagn9iq/,dagn9iq,1480219025.0,1480190225.0,Lebron James and the Cavs dance it off after Ohio State pick-six,483,5f0wn3
522,Obligatory I wish I was an NBA player comment.,33,Shogun_Ro,/r/nba/comments/5f0wn3/lebron_james_and_the_cavs_dance_it_off_after_ohio/dagmdj4/,dagmdj4,1480217819.0,1480189019.0,Lebron James and the Cavs dance it off after Ohio State pick-six,483,5f0wn3
523,Lebron single-handedly made all of Ohio cool. ,59,Incognitohero11,/r/nba/comments/5f0wn3/lebron_james_and_the_cavs_dance_it_off_after_ohio/dagmnpr/,dagmnpr,1480218207.0,1480189407.0,Lebron James and the Cavs dance it off after Ohio State pick-six,483,5f0wn3
524,O.H.,21,HungDownLo,/r/nba/comments/5f0wn3/lebron_james_and_the_cavs_dance_it_off_after_ohio/dagkurk/,dagkurk,1480215750.0,1480186950.0,Lebron James and the Cavs dance it off after Ohio State pick-six,483,5f0wn3
525,If Lebron was a kid rn he would be a Cubs/Warriors/Patriots fan,104,DSouT,/r/nba/comments/5f0wn3/lebron_james_and_the_cavs_dance_it_off_after_ohio/dagmerg/,dagmerg,1480217867.0,1480189067.0,Lebron James and the Cavs dance it off after Ohio State pick-six,483,5f0wn3
526,"Ah yes, the MJ point guard experiment.",739,Tundraaa,/r/nba/comments/5f0ui3/earlyseason_lebron_check_russell_westbrook_leads/dagk7uz/,dagk7uz,1480214863.0,1480186063.0,"Early-season LeBron check: Russell Westbrook leads the league with 13 LeBrons, while LeBron James has 3.",1727,5f0ui3
527,I fucking love these posts.,327,threekingmodest101,/r/nba/comments/5f0ui3/earlyseason_lebron_check_russell_westbrook_leads/dagl7fx/,dagl7fx,1480216233.0,1480187433.0,"Early-season LeBron check: Russell Westbrook leads the league with 13 LeBrons, while LeBron James has 3.",1727,5f0ui3
528,"I think we're about to see a back-half-of-his-carrer update on the ""LeBron.""  He's going to be all about the 21/9/9 (at least)",104,FalconLorenzo,/r/nba/comments/5f0ui3/earlyseason_lebron_check_russell_westbrook_leads/dagn8wf/,dagn8wf,1480219002.0,1480190202.0,"Early-season LeBron check: Russell Westbrook leads the league with 13 LeBrons, while LeBron James has 3.",1727,5f0ui3
529,Damn 10 straight games is wild. ,170,,/r/nba/comments/5f0ui3/earlyseason_lebron_check_russell_westbrook_leads/dagk1ci/,dagk1ci,1480214610.0,1480185810.0,"Early-season LeBron check: Russell Westbrook leads the league with 13 LeBrons, while LeBron James has 3.",1727,5f0ui3
530,What's the record for LeBron's in a season? Looks like Westbrook is gonna smash it.,116,,/r/nba/comments/5f0ui3/earlyseason_lebron_check_russell_westbrook_leads/dagkbzl/,dagkbzl,1480215021.0,1480186221.0,"Early-season LeBron check: Russell Westbrook leads the league with 13 LeBrons, while LeBron James has 3.",1727,5f0ui3
531,The new LeBron is like 24/9/9,106,Fake_Trades_XD,/r/nba/comments/5f0ui3/earlyseason_lebron_check_russell_westbrook_leads/dagl5nw/,dagl5nw,1480216166.0,1480187366.0,"Early-season LeBron check: Russell Westbrook leads the league with 13 LeBrons, while LeBron James has 3.",1727,5f0ui3
532,it seems Russell has a better chance at a lebron if his team is at risk of losing.,63,FreeGums,/r/nba/comments/5f0ui3/earlyseason_lebron_check_russell_westbrook_leads/dagka1t/,dagka1t,1480214948.0,1480186148.0,"Early-season LeBron check: Russell Westbrook leads the league with 13 LeBrons, while LeBron James has 3.",1727,5f0ui3
533,3-7 during that run. I'm surprised Harden had more Lebrons than WBrook last season.,49,prncpl_vgna_no_rlatn,/r/nba/comments/5f0ui3/earlyseason_lebron_check_russell_westbrook_leads/dagmj3t/,dagmj3t,1480218035.0,1480189235.0,"Early-season LeBron check: Russell Westbrook leads the league with 13 LeBrons, while LeBron James has 3.",1727,5f0ui3
534,So what's a Westbrook?,31,ARealKoala,/r/nba/comments/5f0ui3/earlyseason_lebron_check_russell_westbrook_leads/dagkio7/,dagkio7,1480215282.0,1480186482.0,"Early-season LeBron check: Russell Westbrook leads the league with 13 LeBrons, while LeBron James has 3.",1727,5f0ui3
535,Russ/OKC is 3-7 on this ten game streak. ,34,,/r/nba/comments/5f0ui3/earlyseason_lebron_check_russell_westbrook_leads/dagp9sq/,dagp9sq,1480221803.0,1480193003.0,"Early-season LeBron check: Russell Westbrook leads the league with 13 LeBrons, while LeBron James has 3.",1727,5f0ui3
536,He'll go 25/7/7,32,jiggajiggajoo,/r/nba/comments/5eyi86/question_on_lebron/dag3d7i/,dag3d7i,1480176211.0,1480147411.0,Question on Lebron,25,5eyi86
537,LBJ isn't even trying,34,,/r/nba/comments/5eyi86/question_on_lebron/dag3nso/,dag3nso,1480177091.0,1480148291.0,Question on Lebron,25,5eyi86
538,"Triple-doubles used to be so rare before, now it seems there is one every game night. Westbrook is probably going to finish top 3 in this category if he stays healthy.",547,AsPeHeat,/r/nba/comments/5exus1/espn_russell_westbrook_is_now_one_tripledouble_43/dafygqx/,dafygqx,1480164984.0,1480136184.0,[ESPN] Russell Westbrook is now one triple-double (43) behind LeBron James (44) for 6th all-time in the NBA.,1118,5exus1
539,"I know that they're two completely different players with different styles, but Russell's had almost as many triple doubles as lebron with 5 years less in the league. Crazy.",211,ArcanePudding,/r/nba/comments/5exus1/espn_russell_westbrook_is_now_one_tripledouble_43/dafyguf/,dafyguf,1480164989.0,1480136189.0,[ESPN] Russell Westbrook is now one triple-double (43) behind LeBron James (44) for 6th all-time in the NBA.,1118,5exus1
540,Didn't Lebron just pass Fat Lever a couple of days ago? And now Westbrook. Fat Lever out there thinking 2016 is the worst,130,YoungJebediah,/r/nba/comments/5exus1/espn_russell_westbrook_is_now_one_tripledouble_43/dag18qo/,dag18qo,1480170644.0,1480141844.0,[ESPN] Russell Westbrook is now one triple-double (43) behind LeBron James (44) for 6th all-time in the NBA.,1118,5exus1
541,"Fat Lever's out here thinking ""Man wtf this is all I got""",27,jumboponcho,/r/nba/comments/5exus1/espn_russell_westbrook_is_now_one_tripledouble_43/dag7b14/,dag7b14,1480190335.0,1480161535.0,[ESPN] Russell Westbrook is now one triple-double (43) behind LeBron James (44) for 6th all-time in the NBA.,1118,5exus1
542,Westbrook sux he only plays hard to pad his stats,300,,/r/nba/comments/5exus1/espn_russell_westbrook_is_now_one_tripledouble_43/dafyhri/,dafyhri,1480165037.0,1480136237.0,[ESPN] Russell Westbrook is now one triple-double (43) behind LeBron James (44) for 6th all-time in the NBA.,1118,5exus1
543,Imagine if James ever had a USG% of 41...,74,joeypeepy,/r/nba/comments/5exus1/espn_russell_westbrook_is_now_one_tripledouble_43/dafyv41/,dafyv41,1480165750.0,1480136950.0,[ESPN] Russell Westbrook is now one triple-double (43) behind LeBron James (44) for 6th all-time in the NBA.,1118,5exus1
544,"6th all time in Triple Doubles?


MAKE THAT OLD.",36,ChronoXfinity,/r/nba/comments/5exus1/espn_russell_westbrook_is_now_one_tripledouble_43/dafyh80/,dafyh80,1480165009.0,1480136209.0,[ESPN] Russell Westbrook is now one triple-double (43) behind LeBron James (44) for 6th all-time in the NBA.,1118,5exus1
545,"He's so unbelievably talented but his decision making, bad defense and low shooting percentages are holding him back. If he cleaned those things up he'd be the best point guard in the league. I'm rooting for him though ",32,,/r/nba/comments/5exus1/espn_russell_westbrook_is_now_one_tripledouble_43/dafyjm1/,dafyjm1,1480165135.0,1480136335.0,[ESPN] Russell Westbrook is now one triple-double (43) behind LeBron James (44) for 6th all-time in the NBA.,1118,5exus1
546,The best quarterback Cleveland has seen in decades,62,LaPenta5594,/r/nba/comments/5exkoz/kevin_loves_touchdown_pass_to_lebron/dafw7yj/,dafw7yj,1480160834.0,1480132034.0,Kevin Love's Touchdown Pass to LeBron,97,5exkoz
547,How the heck does he always get the pass to lebron so accurately. It's incredible.,31,CondescendingMan,/r/nba/comments/5exkoz/kevin_loves_touchdown_pass_to_lebron/dafwico/,dafwico,1480161366.0,1480132566.0,Kevin Love's Touchdown Pass to LeBron,97,5exkoz
548,K Love's outlet passes make me wet,21,SadBoy02,/r/nba/comments/5exkoz/kevin_loves_touchdown_pass_to_lebron/dafxpgh/,dafxpgh,1480163546.0,1480134746.0,Kevin Love's Touchdown Pass to LeBron,97,5exkoz
549,What the fuck is that score,169,SadBoy02,/r/nba/comments/5exdyn/lebron_with_a_beautiful_nolook_pass_to_tt/dafv6ud/,dafv6ud,1480158974.0,1480130174.0,LeBron with a beautiful no-look pass to TT,437,5exdyn
550,So graceful but very powerful. Wow lebron,67,,/r/nba/comments/5exdyn/lebron_with_a_beautiful_nolook_pass_to_tt/dafunrf/,dafunrf,1480158035.0,1480129235.0,LeBron with a beautiful no-look pass to TT,437,5exdyn
551,Shit was so damn smooth,79,huskyjabz,/r/nba/comments/5exdyn/lebron_with_a_beautiful_nolook_pass_to_tt/dafujpm/,dafujpm,1480157844.0,1480129044.0,LeBron with a beautiful no-look pass to TT,437,5exdyn
552,There's no prettier pass than a skip bounce pass through the defense.,31,Chitalian8,/r/nba/comments/5exdyn/lebron_with_a_beautiful_nolook_pass_to_tt/dafuli3/,dafuli3,1480157929.0,1480129129.0,LeBron with a beautiful no-look pass to TT,437,5exdyn
553,"LeCompletePackage.

LeBron had some amazing passes tonight. This one, the lefty pass to Kyrie, and the pass to Love where Love shot it from the hip. Beautiful.",23,jspeed04,/r/nba/comments/5exdyn/lebron_with_a_beautiful_nolook_pass_to_tt/dafvlh1/,dafvlh1,1480159702.0,1480130902.0,LeBron with a beautiful no-look pass to TT,437,5exdyn
554,That was pretty neat thing that he did right there. I love no look passes.,30,GOD_DAMNIT_BROWNS,/r/nba/comments/5exdyn/lebron_with_a_beautiful_nolook_pass_to_tt/daful48/,daful48,1480157911.0,1480129111.0,LeBron with a beautiful no-look pass to TT,437,5exdyn
