,body,score,author,permalink,comment_id,created_loc,created_utc,post_title,post_score,post_id
437,"Absolutely terrible reporting. They're **maintaining cap flexibility**, not for LeBron, but for whatever they can use it for. One of the ideas behind the Oklahoma City model is that there's **no reason to spend cap space if you're not competing for a playoff spot.** It's a waste that does nothing but hurt your chances of re-signing your players. The Cavs found this out when they hamstrung themselves by giving Larry Hughes a big deal early when LeBron was here.

They're not like the Knicks, clearing cap for LeBron. They're just not spending money on free agents when they know all that will do is hold up cap room which they can use to take on salary in trades or give their players new deals. You're going to hear the Cavs name in just about every trade for a big player because they have the cap space to help get teams under the luxury tax, and this allows them to take in more picks. The last two years, taking in salary in trades got them Kyrie Irving and Tyler Zeller. 

This is so speculative and unfounded. ""Executives and agents around the league."" Translation: 2 or 3 guys. Bullshit. They're committed to the rebuild and cap flexibility is a part of that.",113,ianbits,/r/nba/comments/16ijkz/cavs_are_saving_cap_space_for_potential_run_at/c7wfhbu/,c7wfhbu,1358154884.0,1358126084.0,Cavs Are Saving Cap Space For Potential Run at LeBron James in 2014,146,16ijkz
438,"Kyrie and Lebron on the same team....

No Me Gusta. ",37,,/r/nba/comments/16ijkz/cavs_are_saving_cap_space_for_potential_run_at/c7weo9y/,c7weo9y,1358152140.0,1358123340.0,Cavs Are Saving Cap Space For Potential Run at LeBron James in 2014,146,16ijkz
439,"I like it, he promised Cleveland a championship and I hope he gives them one. I won't even be mad.",78,KingJames006,/r/nba/comments/16ijkz/cavs_are_saving_cap_space_for_potential_run_at/c7wd028/,c7wd028,1358146674.0,1358117874.0,Cavs Are Saving Cap Space For Potential Run at LeBron James in 2014,146,16ijkz
440,"Dear Cleveland, 

It's time to move on. LeBron found someone else. The longer you hang on to it, the harder the pill is to swallow. Don't be that psycho ex. ",190,sick_transit,/r/nba/comments/16ijkz/cavs_are_saving_cap_space_for_potential_run_at/c7wd69m/,c7wd69m,1358147243.0,1358118443.0,Cavs Are Saving Cap Space For Potential Run at LeBron James in 2014,146,16ijkz
441,Lebron would not go back to that team as long as Gilbert still owns it. Gilbert shit all over Lebron and I'm sure he wont forget that.,94,The1andonlyZack,/r/nba/comments/16ijkz/cavs_are_saving_cap_space_for_potential_run_at/c7wd0j3/,c7wd0j3,1358146716.0,1358117916.0,Cavs Are Saving Cap Space For Potential Run at LeBron James in 2014,146,16ijkz
442,I really doubt Lebron does this especially with the Heat having potential for a dynasty.,45,DrFury,/r/nba/comments/16ijkz/cavs_are_saving_cap_space_for_potential_run_at/c7wd2y0/,c7wd2y0,1358146932.0,1358118132.0,Cavs Are Saving Cap Space For Potential Run at LeBron James in 2014,146,16ijkz
443,"Sick dunk, but I hate when they switch the camera angles for plays like these",33,mcev,/r/nba/comments/16h2nq/lebron_james_alleyoop_to_dwyane_wade/c7vybjn/,c7vybjn,1358078374.0,1358049574.0,LeBron James alley-oop to Dwyane Wade,56,16h2nq
444,I think you got this title backwards ,66,,/r/nba/comments/16h2nq/lebron_james_alleyoop_to_dwyane_wade/c7vyym7/,c7vyym7,1358080634.0,1358051834.0,LeBron James alley-oop to Dwyane Wade,56,16h2nq
445,"The first time I watched this, I was underwhelmed. Then, the second time through, I realized that I was underwhelmed only because Lebron throws down a reverse alley-oop so casually that it's like a layup. These two have been breaking out these sorts of plays every day in practice--what would be a highlight of the season for any other pair of players is just another day at the office for them.",24,,/r/nba/comments/16h2nq/lebron_james_alleyoop_to_dwyane_wade/c7vz5a8/,c7vz5a8,1358081308.0,1358052508.0,LeBron James alley-oop to Dwyane Wade,56,16h2nq
446,"Why did they have to switch the camera angle? I hate that. Seriously though, these guys are alley-oop masters.",23,elchupanibre5,/r/nba/comments/16h2nq/lebron_james_alleyoop_to_dwyane_wade/c7vyncn/,c7vyncn,1358079534.0,1358050734.0,LeBron James alley-oop to Dwyane Wade,56,16h2nq
447,[Called it](http://www.reddit.com/r/nba/comments/160mqv/kevin_johnson_foreshadows_special_announcement_in/c7rmq35),97,TheBaconator1990,/r/nba/comments/16gpwn/kevin_johnson_asks_lebron_to_buy_the_kings/c7vuy6j/,c7vuy6j,1358066658.0,1358037858.0,Kevin Johnson asks LeBron to buy the Kings,87,16gpwn
448,King James... So King of Kings? ,36,maxcaliburx,/r/nba/comments/16gpwn/kevin_johnson_asks_lebron_to_buy_the_kings/c7vyw6c/,c7vyw6c,1358080396.0,1358051596.0,Kevin Johnson asks LeBron to buy the Kings,87,16gpwn
449,Decision 2013: Taking his team to South Beach ,32,deadskin,/r/nba/comments/16gpwn/kevin_johnson_asks_lebron_to_buy_the_kings/c7vyvvy/,c7vyvvy,1358080369.0,1358051569.0,Kevin Johnson asks LeBron to buy the Kings,87,16gpwn
450,LeBron owns the kings everytime they play. ,21,Great-Band-Name,/r/nba/comments/16gpwn/kevin_johnson_asks_lebron_to_buy_the_kings/c7w27kk/,c7w27kk,1358095450.0,1358066650.0,Kevin Johnson asks LeBron to buy the Kings,87,16gpwn
451,"cuz they did.....

Lebron was the most hated person in sports. 

Shit he was so hated, fuckin CNN did a special on whether he was gonna get killed or not in his return to Cleveland.",208,Akhil13,/r/nba/comments/16fq21/lebron_james_and_dwyane_wade_say_the_heat_faced_a/c7vm05o/,c7vm05o,1358032418.0,1358003618.0,LeBron James and Dwyane Wade say the Heat faced a lot more pressure than the Lakers ,94,16fq21
452,"Well, they're right about that. The hate/coverage on the Lakers has been really intense but I don't know if we'll ever see anything like that Heat season for a long time.",60,bball0718,/r/nba/comments/16fq21/lebron_james_and_dwyane_wade_say_the_heat_faced_a/c7vm94z/,c7vm94z,1358033669.0,1358004869.0,LeBron James and Dwyane Wade say the Heat faced a lot more pressure than the Lakers ,94,16fq21
453,"The Heat faced more pressure but they created it themselves, especially with Lebron saying they were gonna win ""not six, not seven but eight championships"". It got worse after losing to Dallas in the finals.  

The Lakers however have historically always been a great team and at their worst average, they have only missed the playoffs 5 times in their history! I think Lakers fans should look forward to next season because their won't be as much pressure on them. The Lakers fans and LA media will ride them but IMO it's better than going to the finals, losing to Dallas and have the whole world riding your back, that's worse.",47,H3rBz,/r/nba/comments/16fq21/lebron_james_and_dwyane_wade_say_the_heat_faced_a/c7vmjht/,c7vmjht,1358035053.0,1358006253.0,LeBron James and Dwyane Wade say the Heat faced a lot more pressure than the Lakers ,94,16fq21
454,[deleted],72,,/r/nba/comments/16e2n8/lebron_james_approaching_20k_points_5k_rebounds/c7v6sj8/,c7v6sj8,1357961178.0,1357932378.0,"LeBron James Approaching 20k Points, 5k Rebounds, 5k Assists ",72,16e2n8
455,Oscar motherfucking Roberston. So far ahead of everyone else on the list. ,30,IndigoMoss,/r/nba/comments/16e2n8/lebron_james_approaching_20k_points_5k_rebounds/c7v8fe2/,c7v8fe2,1357965885.0,1357937085.0,"LeBron James Approaching 20k Points, 5k Rebounds, 5k Assists ",72,16e2n8
456,The man fills a box score. Just insane numbers. I root against the heat generally but I don't think there's any question who the MVP is right now.,23,blindedbybears,/r/nba/comments/16e2n8/lebron_james_approaching_20k_points_5k_rebounds/c7v6vi5/,c7v6vi5,1357961425.0,1357932625.0,"LeBron James Approaching 20k Points, 5k Rebounds, 5k Assists ",72,16e2n8
457,Who's not calling Lillard ROTY?,41,FuckYouGod,/r/nba/comments/16bwz1/lebron_calls_damian_lillard_rookie_of_the_year/c7ull3h/,c7ull3h,1357876176.0,1357847376.0,Lebron calls Damian Lillard Rookie of the Year,44,16bwz1
458,"Similarly, Damian Lillard calls LeBron: ""LeBron""",33,I_canrelate,/r/nba/comments/16bwz1/lebron_calls_damian_lillard_rookie_of_the_year/c7upftn/,c7upftn,1357886837.0,1357858037.0,Lebron calls Damian Lillard Rookie of the Year,44,16bwz1
459,"Imagine if the Pacers meet the Knicks and the Heat in the playoffs? The Knicks just for old times sake and the Heat for last year's playoffs. Oh man, I would be so excited. Even if we lost, I'd still be happy because those would be entertaining games.",25,lbsnake7,/r/nba/comments/167b6r/lebron_james_pacers_are_a_cocky_bunch/c7teil6/,c7teil6,1357707377.0,1357678577.0,LeBron James: Pacers are a cocky bunch,32,167b6r
460,"Inflammatory title by the Sun-Sentinel.  LeBron is too smart a spokesman to say a team is ""cocky"" even when he thinks it.  Don't bother clicking to give them hits.  Here are his quotes regarding the situation:

>""They took a 2-1 lead and were really excited about what was going on and they were talking a lot,"" he said. ""They felt like they were the better team, we took control of the series.""

>""But they've been talking a lot,"" he said. ""I read a lot of clips they had before the season, said they were better than us and they should have beat us, so we'll be ready.""

>""I'm not one to talk much, honestly,"" he said. ""I just do it on the court. I let my game do the talking, but it is amusing sometimes, you see guys, you see teams talking and they didn't beat you.""

>""I've always kind of been after the fact,"" he said. ""If I hear someone talking, then I will have a conversation with them, or say my peace out on the floor, but I will never start it up.

>""My Little League coaches wouldn't allow us to do that. They always told, 'Just let your game do the talking.' """,21,bubbachuck,/r/nba/comments/167b6r/lebron_james_pacers_are_a_cocky_bunch/c7thxn5/,c7thxn5,1357718102.0,1357689302.0,LeBron James: Pacers are a cocky bunch,32,167b6r
461,"Wow, these comments suck. That was a great video, it was awesome to see his genuine excitement, he seems like a great kid.",22,myst1227,/r/nba/comments/16390s/young_fan_amazed_by_dwyane_wades_amazing_alleyoop/c7seb4q/,c7seb4q,1357558866.0,1357530066.0,Young fan amazed by Dwyane Wade's amazing alley-oop to LeBron James (Wizards @ Heat),81,16390s
462,That's pretty cool how they bring in the make-a-wish kid to do commentary. ,45,DrFury,/r/nba/comments/16390s/young_fan_amazed_by_dwyane_wades_amazing_alleyoop/c7sbuib/,c7sbuib,1357550883.0,1357522083.0,Young fan amazed by Dwyane Wade's amazing alley-oop to LeBron James (Wizards @ Heat),81,16390s
463,"boozer's ""no defense"" defense is appalling. ",32,Panthertron,/r/nba/comments/162opm/bball_breakdown_lebron_and_wade_cant_stop_boozer/c7s7747/,c7s7747,1357536771.0,1357507971.0,B-Ball Breakdown: LeBron and Wade Can't Stop Boozer and Joakim 1/6/13,113,162opm
464,"I still remember that 76ers and Raptors series in 2001. Vince Carter and AI were playing out of their minds. One of the best playoff series I've seen.

Edit: [Link](https://www.youtube.com/watch?v=TnE-8HMkYFA) for those interested.",49,,/r/nba/comments/160q19/allen_iverson_accurately_predicts_lebron_james/c7rmg71/,c7rmg71,1357447354.0,1357418554.0,Allen Iverson accurately predicts Lebron James hate in 2006.,252,160q19
465,"A.I. was one of the most entertaining basketball players who ever lived, as well as very skillful. The knicks should sign him because that would be entertaining as fuck. 


",35,,/r/nba/comments/160q19/allen_iverson_accurately_predicts_lebron_james/c7rm6bp/,c7rm6bp,1357446353.0,1357417553.0,Allen Iverson accurately predicts Lebron James hate in 2006.,252,160q19
466,"""I'd rather not be in the NBA"" pretty much sums up why Iverson isn't in the league anymore.",119,vignesh35,/r/nba/comments/160q19/allen_iverson_accurately_predicts_lebron_james/c7rlgaz/,c7rlgaz,1357443682.0,1357414882.0,Allen Iverson accurately predicts Lebron James hate in 2006.,252,160q19
467,"""they waiting man""



yup, one of the guys waiting is the one in front of you too. lol",97,stOikaL,/r/nba/comments/160q19/allen_iverson_accurately_predicts_lebron_james/c7rmayh/,c7rmayh,1357446824.0,1357418024.0,Allen Iverson accurately predicts Lebron James hate in 2006.,252,160q19
468,"We love to build people up, to idolize them; it's human nature. Just as well, we love more, when given the chance, to knock those same people down. ",54,meltedlaundry,/r/nba/comments/160q19/allen_iverson_accurately_predicts_lebron_james/c7rm0gt/,c7rm0gt,1357445751.0,1357416951.0,Allen Iverson accurately predicts Lebron James hate in 2006.,252,160q19
469,"I think his ""if they like you, you're fake"" quote was pretty far off center. I was waiting for him to make it an issue of race, but I'm glad this clip didn't devolve into that. Not every NBA player is an aggressive ""thug"" and he needs to realize that if he had a modicum of self control and half a brain, he would not have been put in the position he is. AI had the potential to be remembered as a top 20 player but his ""me against the world"" attitude proves to me he's just not mentally in the right place to fulfill his potential. 

",22,knoblauch,/r/nba/comments/160q19/allen_iverson_accurately_predicts_lebron_james/c7rn4z7/,c7rn4z7,1357449893.0,1357421093.0,Allen Iverson accurately predicts Lebron James hate in 2006.,252,160q19
470,"**Lebron: What the f#!k is wrong with that guy**

Thats what the youtube uploader claims was said in the description",28,anhdeez,/r/nba/comments/15zy2f/lebron_tells_ray_allen_to_get_the_fk_off_me_after/c7rdwgp/,c7rdwgp,1357400337.0,1357371537.0,LeBron tells Ray Allen to 'Get the f**k off me' after arguing with refs.,32,15zy2f
471,"sounds like ""the fucks wrong with you""",40,SkinnyNiggaBigBalls,/r/nba/comments/15zy2f/lebron_tells_ray_allen_to_get_the_fk_off_me_after/c7rdn6e/,c7rdn6e,1357399068.0,1357370268.0,LeBron tells Ray Allen to 'Get the f**k off me' after arguing with refs.,32,15zy2f
472,"if he wasn't lebron james, he would've gotten a technical",87,clickfive4321,/r/nba/comments/15zy2f/lebron_tells_ray_allen_to_get_the_fk_off_me_after/c7rdoja/,c7rdoja,1357399246.0,1357370446.0,LeBron tells Ray Allen to 'Get the f**k off me' after arguing with refs.,32,15zy2f
473,I don't get it.  How does Durant get two techs in a matter of seconds and Lebron gets nothing.  That's messed up,23,,/r/nba/comments/15zy2f/lebron_tells_ray_allen_to_get_the_fk_off_me_after/c7re366/,c7re366,1357401309.0,1357372509.0,LeBron tells Ray Allen to 'Get the f**k off me' after arguing with refs.,32,15zy2f
474,"Wait so he flopped on him, then at 0:18 he touches his wiener.. not cool Lebron",29,CreamPeters,/r/nba/comments/15zk9f/tom_thibodeau_takes_charge_from_lebron_james/c7rbqe0/,c7rbqe0,1357391081.0,1357362281.0,Tom Thibodeau Takes Charge From LeBron James - Chicago Bulls @ Miami Heat ,31,15zk9f
475,"I really wish Lebron would stop doing this. Yeah, it gives you a competitive advantage but he's better than this.

He should get warned for this.",21,,/r/nba/comments/15zk9f/tom_thibodeau_takes_charge_from_lebron_james/c7rd2s6/,c7rd2s6,1357396445.0,1357367645.0,Tom Thibodeau Takes Charge From LeBron James - Chicago Bulls @ Miami Heat ,31,15zk9f
476,That's a flopping fine,41,FriendEater,/r/nba/comments/15zk9f/tom_thibodeau_takes_charge_from_lebron_james/c7r9q7f/,c7r9q7f,1357383839.0,1357355039.0,Tom Thibodeau Takes Charge From LeBron James - Chicago Bulls @ Miami Heat ,31,15zk9f
477,They both needed Eric Snow...,93,johniecid,/r/nba/comments/15vf0b/which_was_more_impressive_iverson_taking_the/c7q56kc/,c7q56kc,1357219232.0,1357190432.0,Which was more impressive? Iverson taking the 76ers to the finals in 2001 or LeBron taking the Cavs there in 2007?,22,15vf0b
478,"I'm more impressed by Iverson. 

Iverson made his run as pretty much the smallest player in the league. All of the series he went through were really close - I think all of them went to 7 (or 5) games. He completely put everything on the court. 

The thing that really puts Iverson's run on top is that he had a legendary game against Lakers, who were steamrolling the league. They were on a 19 game win streak, including going undefeated in the west playoffs against some of the best teams of the era - the Blazers, Kings, and Spurs. His 48 points in game 1 was one of the few times I've seen Kobe be handedly outplayed by another guard, and was the only loss for the nearly perfect Lakers playoff run in 2001.

Lebron's run to the Finals was amazing, especially the Detroit series. But, people forget that Ben Wallace left the Pistons the year before, and Larry Brown left 2 years before. This wasn't the same Pistons team of 2004-2006, this was a team that signed an aging Chris Webber as their starting center as a hope to save the season. Lebron also got swept in the Finals by the Spurs, who were awesome, but no match for the 2001 Lakers.",22,rjvir,/r/nba/comments/15vf0b/which_was_more_impressive_iverson_taking_the/c7q7ipe/,c7q7ipe,1357228939.0,1357200139.0,Which was more impressive? Iverson taking the 76ers to the finals in 2001 or LeBron taking the Cavs there in 2007?,22,15vf0b
479,[deleted],21,,/r/nba/comments/15u2z7/michael_jordan_kobe_bryant_lebron_james_rise_to/c7pt8d9/,c7pt8d9,1357179784.0,1357150984.0,Michael Jordan | Kobe Bryant | LeBron James Rise to the Throne [12:07],110,15u2z7
480,Was hoping for a yo-yo video. Disappointed.,124,greymalik,/r/nba/comments/15seuu/lebron_james_takes_walking_the_dog_to_another/c7pdnnn/,c7pdnnn,1357107490.0,1357078690.0,LeBron James takes walking the dog to another level,156,15seuu
481,I've seen Rondo do this a lot yet never take any flack. I see no problem here.,31,johnnymatrix,/r/nba/comments/15seuu/lebron_james_takes_walking_the_dog_to_another/c7pfzij/,c7pfzij,1357116062.0,1357087262.0,LeBron James takes walking the dog to another level,156,15seuu
482,It's part of the game. These announcers are idiots.,76,Stopitkels,/r/nba/comments/15seuu/lebron_james_takes_walking_the_dog_to_another/c7pfzau/,c7pfzau,1357116040.0,1357087240.0,LeBron James takes walking the dog to another level,156,15seuu
483,This has been done a million times but when Lebron does it everyone gets butt hurt smh...,57,veksone,/r/nba/comments/15seuu/lebron_james_takes_walking_the_dog_to_another/c7pevxj/,c7pevxj,1357112018.0,1357083218.0,LeBron James takes walking the dog to another level,156,15seuu
484,[deleted],44,,/r/nba/comments/15seuu/lebron_james_takes_walking_the_dog_to_another/c7pdtus/,c7pdtus,1357108119.0,1357079319.0,LeBron James takes walking the dog to another level,156,15seuu
485,"If I had the body Lebron has, I'd be the most insufferable asshole on Earth. ",63,knoblauch,/r/nba/comments/15ohwp/alot_of_talk_about_kd_and_lebron_working_out/c7ocz6j/,c7ocz6j,1356924850.0,1356896050.0,Alot of talk about KD and Lebron working out together in the offseason. heres a clip of some of it. Lebron is so impressive.,89,15ohwp
486,[deleted],53,,/r/nba/comments/15ohwp/alot_of_talk_about_kd_and_lebron_working_out/c7oeovg/,c7oeovg,1356931199.0,1356902399.0,Alot of talk about KD and Lebron working out together in the offseason. heres a clip of some of it. Lebron is so impressive.,89,15ohwp
487,"I like the idea of them working out together and pushing their limits.

They both have ALOT to learn from eachother.  Melo should be begging to be included.",27,tha_carter,/r/nba/comments/15ohwp/alot_of_talk_about_kd_and_lebron_working_out/c7oboq5/,c7oboq5,1356919936.0,1356891136.0,Alot of talk about KD and Lebron working out together in the offseason. heres a clip of some of it. Lebron is so impressive.,89,15ohwp
488,Footage of Lebron missing shots were confiscated by Nike. ,29,,/r/nba/comments/15ohwp/alot_of_talk_about_kd_and_lebron_working_out/c7oem8n/,c7oem8n,1356930932.0,1356902132.0,Alot of talk about KD and Lebron working out together in the offseason. heres a clip of some of it. Lebron is so impressive.,89,15ohwp
489,"I remember him messing up a relatively simple phrase and then hanging his head and going ""I didn't go to college"". Hahahahaha.",53,posthoc,/r/nba/comments/15j7n6/lebron_james_re_avery_johnson_firing/c7n05al/,c7n05al,1356678063.0,1356649263.0,Lebron James RE: Avery Johnson firing.,173,15j7n6
490,"Blatche tweeted ""he was a great coach"", but it seemed to have been scrubbed and he just thanked him.

Anyway, as far as I'm concerned, if you got Blatche to be useful after what he was on the Wizards, you're doing pretty well as a coach.",32,biscuitball,/r/nba/comments/15j7n6/lebron_james_re_avery_johnson_firing/c7n0z68/,c7n0z68,1356681259.0,1356652459.0,Lebron James RE: Avery Johnson firing.,173,15j7n6
491,No it's not. It's like a player gets Player of the Month and then gets cut from the team.,120,USP123,/r/nba/comments/15j7n6/lebron_james_re_avery_johnson_firing/c7mx7o7/,c7mx7o7,1356667589.0,1356638789.0,Lebron James RE: Avery Johnson firing.,173,15j7n6
492,"ITT: 20-30 year olds talking about how ""old"" they are/feel.

We're not old, you fucks. You realize that 20-30 is your physical prime?",41,,/r/nba/comments/15g428/as_i_was_hanging_around_the_aventura_mall_and/c7m9vc6/,c7m9vc6,1356543668.0,1356514868.0,"As I was hanging around the Aventura Mall, and boom, Lebron",100,15g428
493,"So, the 2000 in your username is the year you were born?",71,,/r/nba/comments/15g428/as_i_was_hanging_around_the_aventura_mall_and/c7m5jbk/,c7m5jbk,1356520520.0,1356491720.0,"As I was hanging around the Aventura Mall, and boom, Lebron",100,15g428
494,So this whole time I've been talking basketball with 12 year old boys? Great.,207,Smoosm,/r/nba/comments/15g428/as_i_was_hanging_around_the_aventura_mall_and/c7m5y9x/,c7m5y9x,1356522364.0,1356493564.0,"As I was hanging around the Aventura Mall, and boom, Lebron",100,15g428
495,"I know that it's not a random coincidence, but those shows really look like the players wearing them. 

Edit: I appreciate that even after 20 upvotes nobody pointed out that I wrote shows instead of shoes. ",23,30cities30shooters,/r/nba/comments/15g2dt/shoes_worn_tonight_by_lebron_kobe_and_durant/c7m4ndq/,c7m4ndq,1356516346.0,1356487546.0,"Shoes worn tonight by Lebron, Kobe, and Durant",101,15g2dt
496,am I the only one that gets irritated how lebron's swoosh goes the other way?,30,tomBARCIK,/r/nba/comments/15g2dt/shoes_worn_tonight_by_lebron_kobe_and_durant/c7m5jtb/,c7m5jtb,1356520584.0,1356491784.0,"Shoes worn tonight by Lebron, Kobe, and Durant",101,15g2dt
497,"It's not a real competition anyways, it's a popularity contest

Exhibit A: BG. Great dunker but not even the 2nd best dunker in his own KIA contest",45,heat_check_,/r/nba/comments/15cq83/lebron_james_says_he_will_never_compete_in_slam/c7lb05t/,c7lb05t,1356347169.0,1356318369.0,LeBron James says he will never compete in Slam Dunk contest,44,15cq83
498,Nate Robinson and Dwight Howard both had a hand in killing the dunk contest. Nate because he robbed other more deserving contestants and Dwight because he made the contest into a gimmick that seems more and more scripted every year,24,,/r/nba/comments/15cq83/lebron_james_says_he_will_never_compete_in_slam/c7ldz46/,c7ldz46,1356359965.0,1356331165.0,LeBron James says he will never compete in Slam Dunk contest,44,15cq83
499,"Dunk Contest has been garbage for years.  Like when Dwight did his superman dunk or when Griffin jumped over a car, both extremely lame IMO.  ",40,who-boppin,/r/nba/comments/15cq83/lebron_james_says_he_will_never_compete_in_slam/c7lbzwe/,c7lbzwe,1356351239.0,1356322439.0,LeBron James says he will never compete in Slam Dunk contest,44,15cq83
500,"Not surprising.

If you dont want to believe the ""I dont want to risk injury thing"", I almost cant blame him if he just doesnt want to deal with whatever media backlash there would be if he ended up performing poorly in the contest. 

Really the same reason I dont think many stars would want to participate in a 1on1 tourney. ",28,RavR,/r/nba/comments/15cq83/lebron_james_says_he_will_never_compete_in_slam/c7lamci/,c7lamci,1356345585.0,1356316785.0,LeBron James says he will never compete in Slam Dunk contest,44,15cq83
501,"To him its like fighting a girl. Best case scenario, you beat up a girl...
",60,,/r/nba/comments/15cq83/lebron_james_says_he_will_never_compete_in_slam/c7lbxws/,c7lbxws,1356351018.0,1356322218.0,LeBron James says he will never compete in Slam Dunk contest,44,15cq83
502,"This is just another epic opportunity for Lebron to troll Cleveland again. 


""After bringing a championship to South Beach...I want to bring a championship trophy to Cleveland...as the newest member of the New York Knickerboppers.""",37,SunQ,/r/nba/comments/15cff9/cavs_sticking_to_rebuilding_plan_but_looming/c7l9ksm/,c7l9ksm,1356341200.0,1356312400.0,"Cavs sticking to rebuilding plan, but looming LeBron decision could alter path of franchise.",31,15cff9
503,I really can't see Lebron leaving Miami to go back to Cleveland. Especially after the way the fans there treated him when he left. Sorry Cleveland you are no longer witnesses. ,85,FuckYouGod,/r/nba/comments/15cff9/cavs_sticking_to_rebuilding_plan_but_looming/c7l7ywa/,c7l7ywa,1356334207.0,1356305407.0,"Cavs sticking to rebuilding plan, but looming LeBron decision could alter path of franchise.",31,15cff9
504,"Plenty of Cavs fans are still pissed about what he did (which I can understand) but if he decided to come back, everyone would go back to adoring him.",21,mr_amaral,/r/nba/comments/15cff9/cavs_sticking_to_rebuilding_plan_but_looming/c7l8kvd/,c7l8kvd,1356336833.0,1356308033.0,"Cavs sticking to rebuilding plan, but looming LeBron decision could alter path of franchise.",31,15cff9
