,body,score,author,permalink,comment_id,created_loc,created_utc,post_title,post_score,post_id
215,"When an away crowd reacts like that, you know it's good.",56,Mojo17,/r/nba/comments/30kb89/lebron_james_throws_down_a_monster_alleyoop_dunk/cpt8up9/,cpt8up9,1427541607.0,1427512807.0,LeBron James throws down a monster alley-oop dunk,570,30kb89
216,I just tried this on a fisher price hoop...I am in the hospital now,55,asininequestion,/r/nba/comments/30kb89/lebron_james_throws_down_a_monster_alleyoop_dunk/cptbmvo/,cptbmvo,1427548507.0,1427519707.0,LeBron James throws down a monster alley-oop dunk,570,30kb89
217,Damn great play design. Dunk was great too.,25,LoveSosuh,/r/nba/comments/30kb89/lebron_james_throws_down_a_monster_alleyoop_dunk/cpt84lu/,cpt84lu,1427539990.0,1427511190.0,LeBron James throws down a monster alley-oop dunk,570,30kb89
218,[deleted],66,,/r/nba/comments/30k5wz/embiid_say_he_would_beat_lebron_oneonone/cpt6krg/,cpt6krg,1427536722.0,1427507922.0,Embiid say he would beat LeBron one-on-one,52,30k5wz
219,y'all have absolutely no sense of humor ,77,themariokarters,/r/nba/comments/30k5wz/embiid_say_he_would_beat_lebron_oneonone/cpt6n0m/,cpt6n0m,1427536853.0,1427508053.0,Embiid say he would beat LeBron one-on-one,52,30k5wz
220,"The nets are messed up for moving him.  So what if James doesn't like him.  he's the annoying guy on the home team.  everyone should have a guy like that.  thunder have that weird half naked belly dude, lakers have douche dude, nets have this guy.  sterilizing the game to the point where you can't even mock the away team ruins the fun. ",59,fullyobese,/r/nba/comments/30k2nu/mr_whammys_thoughts_on_lebron_james_after_his/cpt6ck7/,cpt6ck7,1427536242.0,1427507442.0,"Mr. Whammy's thoughts on LeBron James after his seats were moved by the King: ""I hate him. Crybaby.""",53,30k2nu
221,[deleted],30,,/r/nba/comments/30k2nu/mr_whammys_thoughts_on_lebron_james_after_his/cpt5q4k/,cpt5q4k,1427534951.0,1427506151.0,"Mr. Whammy's thoughts on LeBron James after his seats were moved by the King: ""I hate him. Crybaby.""",53,30k2nu
222,Damn straight. You don't fuckin' complain about Mr. Whammy. He's a national treasure.,24,FigureltOut,/r/nba/comments/30k2nu/mr_whammys_thoughts_on_lebron_james_after_his/cpt5mv5/,cpt5mv5,1427534761.0,1427505961.0,"Mr. Whammy's thoughts on LeBron James after his seats were moved by the King: ""I hate him. Crybaby.""",53,30k2nu
223,LeBron really makes it hard for me to like him sometimes. I look forward to your downvotes.,36,TheMissingMeatball,/r/nba/comments/30k2nu/mr_whammys_thoughts_on_lebron_james_after_his/cpt7mr7/,cpt7mr7,1427538939.0,1427510139.0,"Mr. Whammy's thoughts on LeBron James after his seats were moved by the King: ""I hate him. Crybaby.""",53,30k2nu
224,[deleted],79,,/r/nba/comments/30fqgg/bballbreakdown_has_kevin_love_finally_fit_into/cps67gk/,cps67gk,1427455213.0,1427426413.0,[bballbreakdown] Has Kevin Love Finally Fit Into The Cavs Offense With LeBron?,278,30fqgg
225,Oh god an offense with motion / sets is so beautiful to watch. Cavs are going to be fun in the playoffs.,55,Pasty-torso,/r/nba/comments/30fqgg/bballbreakdown_has_kevin_love_finally_fit_into/cps4gy8/,cps4gy8,1427451937.0,1427423137.0,[bballbreakdown] Has Kevin Love Finally Fit Into The Cavs Offense With LeBron?,278,30fqgg
226,That... was beautiful.,68,KINGOFWHIMS,/r/nba/comments/30fqgg/bballbreakdown_has_kevin_love_finally_fit_into/cps2iu1/,cps2iu1,1427448578.0,1427419778.0,[bballbreakdown] Has Kevin Love Finally Fit Into The Cavs Offense With LeBron?,278,30fqgg
227,I've been waiting for Coach Nick to make an analysis video about the reformed Cavs. ,79,nickmaster2007,/r/nba/comments/30fqgg/bballbreakdown_has_kevin_love_finally_fit_into/cps06da/,cps06da,1427444545.0,1427415745.0,[bballbreakdown] Has Kevin Love Finally Fit Into The Cavs Offense With LeBron?,278,30fqgg
228,"But guys, K Love isn't in any of Lebron's Instagram pictures. They must hate each other. ",22,Nogiback,/r/nba/comments/30fqgg/bballbreakdown_has_kevin_love_finally_fit_into/cps87gi/,cps87gi,1427459474.0,1427430674.0,[bballbreakdown] Has Kevin Love Finally Fit Into The Cavs Offense With LeBron?,278,30fqgg
229,*love to lakers* ,28,Sweatycocks,/r/nba/comments/30fqgg/bballbreakdown_has_kevin_love_finally_fit_into/cps03p4/,cps03p4,1427444421.0,1427415621.0,[bballbreakdown] Has Kevin Love Finally Fit Into The Cavs Offense With LeBron?,278,30fqgg
230,"i still can't get over the no headband thing, its like there is a new player in the nba. ",336,vayuu,/r/nba/comments/30bi1h/lebron_drops_the_spirit_bomb_on_the_rim/cpqw0d9/,cpqw0d9,1427360575.0,1427331775.0,LeBron drops the Spirit Bomb on the rim,803,30bi1h
231,"umm, the spirit bomb is held up in the air by energy for extended periods of time before being released. 

lebron is great and all. but he's no goku. ",398,ganduncthewhite,/r/nba/comments/30bi1h/lebron_drops_the_spirit_bomb_on_the_rim/cpqvaf9/,cpqvaf9,1427359337.0,1427330537.0,LeBron drops the Spirit Bomb on the rim,803,30bi1h
232,"And in true DBZ fashion, it took him 72 games to do that",96,Conkeldurr,/r/nba/comments/30bi1h/lebron_drops_the_spirit_bomb_on_the_rim/cpqz1dv/,cpqz1dv,1427365971.0,1427337171.0,LeBron drops the Spirit Bomb on the rim,803,30bi1h
233,Headbandless LeBron for Rookie of the Year,44,AstraeusPrhyme,/r/nba/comments/30bi1h/lebron_drops_the_spirit_bomb_on_the_rim/cpr0wvn/,cpr0wvn,1427369581.0,1427340781.0,LeBron drops the Spirit Bomb on the rim,803,30bi1h
234,Lebron Russ dunk contest pls,42,rumblegod,/r/nba/comments/30bi1h/lebron_drops_the_spirit_bomb_on_the_rim/cpqvduc/,cpqvduc,1427359497.0,1427330697.0,LeBron drops the Spirit Bomb on the rim,803,30bi1h
235,How was Moz not called for a foul on Gasol during the rebound?,56,QuadDeuces422,/r/nba/comments/30bi1h/lebron_drops_the_spirit_bomb_on_the_rim/cpqy8jj/,cpqy8jj,1427364523.0,1427335723.0,LeBron drops the Spirit Bomb on the rim,803,30bi1h
236,Lebrons is more impressive considering +/- is a team Stat and that cavs roster was fucking horrible.,70,,/r/nba/comments/309yzc/stephen_curry_leads_nba_with_a_824_plusminus_on/cpqh6ty/,cpqh6ty,1427336603.0,1427307803.0,"Stephen Curry leads NBA with a +824 plus-minus, on pace for best +/- since stat began being tracked in 1996-97 (LeBron James, 2008-09, +870)",100,309yzc
237,He reminds me of a less athletic rookie  KD,90,,/r/nba/comments/304xoi/epsn_most_ppg_in_the_4th_quarter_since_march_1st/cpp4ygz/,cpp4ygz,1427239008.0,1427210208.0,"[EPSN] Most PPG in the 4th quarter since march 1st, Mirotic-9.5, Lebron-8.5, Westbrook-8.3.",539,304xoi
238,MIRGOATIC,45,,/r/nba/comments/304xoi/epsn_most_ppg_in_the_4th_quarter_since_march_1st/cpp6oxr/,cpp6oxr,1427241818.0,1427213018.0,"[EPSN] Most PPG in the 4th quarter since march 1st, Mirotic-9.5, Lebron-8.5, Westbrook-8.3.",539,304xoi
239,"Not to understate the achievements of the learned and majestic Nikola, but I think it's important to note minutes here. Thibs has been bringing in Niko in the latter half of the 1st and 3rd quarters and leaving him in for all of the 2nd and 4th quarters. Just about every NBA team subs in starters somewhere in the 5 to 9 minute range of the 4th quarter so Niko has been playing anywhere from 33% to 140% more 4th quarter minutes than nearly every NBA starter.",42,,/r/nba/comments/304xoi/epsn_most_ppg_in_the_4th_quarter_since_march_1st/cppap5f/,cppap5f,1427248036.0,1427219236.0,"[EPSN] Most PPG in the 4th quarter since march 1st, Mirotic-9.5, Lebron-8.5, Westbrook-8.3.",539,304xoi
240,"Before anyone ineveitably posts trying to say that anyones saying Nikos better or near them. We all know hes not, everyone knows, you dont need to complain about it. Its just a cool stat.",153,Dougiethefresh2333,/r/nba/comments/304xoi/epsn_most_ppg_in_the_4th_quarter_since_march_1st/cpp49dm/,cpp49dm,1427237804.0,1427209004.0,"[EPSN] Most PPG in the 4th quarter since march 1st, Mirotic-9.5, Lebron-8.5, Westbrook-8.3.",539,304xoi
241,"Has anyone confirmed that Nikola Mirotic isn't actually a disguised Andrew Luck? Luck said he wouldn't mind playing in the NBA..

http://www.scoopnest.com/user/AdamSchefter/573799432094879746",43,flash2121,/r/nba/comments/304xoi/epsn_most_ppg_in_the_4th_quarter_since_march_1st/cpp5eub/,cpp5eub,1427239754.0,1427210954.0,"[EPSN] Most PPG in the 4th quarter since march 1st, Mirotic-9.5, Lebron-8.5, Westbrook-8.3.",539,304xoi
242,"Here are the [top 10 4th quarter scorers this season](http://stats.nba.com/league/player/#!/?Period=4&sort=PTS&dir=1):

|Player|REB|AST|PTS|
|:---|:---|:---|:---|
|LeBron James|1.6|1.5|7.3|
|Dwyane Wade|1|1.1|7|
|Isaiah Thomas|0.9|1.3|6.6|
|Russell Westbrook|1.8|1.6|6.6|
|Carmelo Anthony|1.8|0.5|6.5|
|Anthony Davis|2.7|0.3|6.4|
|Jamal Crawford|0.9|1.1|6.2|
|Damian Lillard|1.3|1.2|6.1|
|James Harden|1.3|1.3|6.1|
|Nick Young|0.8|0.4|6.1|

and the [top 10 4th quarter scorers since March 1st (no filters)](http://stats.nba.com/league/player/#!/?Period=4&sort=PTS&dir=1&DateFrom=03%2F01%2F2015):

|Player|GP|REB|AST|PTS|
|:---|:---|:---|:---|:---|
|Jamal Crawford|1|0|0|10|
|Isaiah Thomas|5|1.2|1.6|9.6|
|Nikola Mirotic|13|2.7|0.3|9.5|
|LeBron James|11|1.4|1.7|8.5|
|Russell Westbrook|10|2.1|2.1|8.3|
|Stephen Curry|9|0.8|1.2|7.8|
|Anthony Davis|7|2.9|0.6|7.3|
|Lou Williams|11|0.9|0.4|7.2|
|Dwyane Wade|10|1.1|0.9|6.9|
|Justin Hamilton|5|2.2|0.6|6.6|
",24,catmoon,/r/nba/comments/304xoi/epsn_most_ppg_in_the_4th_quarter_since_march_1st/cpp9mxa/,cpp9mxa,1427246430.0,1427217630.0,"[EPSN] Most PPG in the 4th quarter since march 1st, Mirotic-9.5, Lebron-8.5, Westbrook-8.3.",539,304xoi
243,This is what everyone was hoping would happen after Lebron left. I just wish Bosh was healthy to take part in it if it happens.,21,dragonz7,/r/nba/comments/303yx4/if_the_playoffs_were_to_start_today_cleveland_2/cpowil4/,cpowil4,1427213440.0,1427184640.0,"If the playoffs were to start today, Cleveland (2) would play Miami (7) for a Wade vs LeBron matchup that we haven't seen since 2010. Also, a collection of gamelogs between of Wade vs LeBron",23,303yx4
244,">for a Wade vs LeBron matchup that we haven't seen since 2010.

This doesn't make sense. Wade and Lebron have never played each other in a playoff series. And if you're talking regular season, we just saw that a week ago.",47,TwoTenths,/r/nba/comments/303yx4/if_the_playoffs_were_to_start_today_cleveland_2/cpozve0/,cpozve0,1427228129.0,1427199329.0,"If the playoffs were to start today, Cleveland (2) would play Miami (7) for a Wade vs LeBron matchup that we haven't seen since 2010. Also, a collection of gamelogs between of Wade vs LeBron",23,303yx4
245,"Harden and LeBron are also at highs in TOV%. Westbrook is actually below his career average in TOV%, he just has a ridiculous USG%",175,Good_NewsEveryone,/r/nba/comments/300w9m/lebron_harden_and_westbrook_are_all_giving_up_the/cpo1ptd/,cpo1ptd,1427156243.0,1427127443.0,"LeBron, Harden, and Westbrook are all giving up the most turnovers of their careers this season",308,300w9m
246,"Harden and Westbrook are handling the rock more than they ever have and King James is still acclimating with a new team so this doesn't really surprise me. 

",102,,/r/nba/comments/300w9m/lebron_harden_and_westbrook_are_all_giving_up_the/cpo1tjz/,cpo1tjz,1427156410.0,1427127610.0,"LeBron, Harden, and Westbrook are all giving up the most turnovers of their careers this season",308,300w9m
247,"J.R.'s transition this year has been as awesome a narrative as the ""Lebron coming home"" story imo.",69,iREDDITnaked,/r/nba/comments/2zxwvf/j_r_smith_on_the_break_lobs_it_up_to_lebron_james/cpnbm34/,cpnbm34,1427090116.0,1427061316.0,J. R. Smith on the break lobs it up to LeBron James who finishes with the dunk.,421,2zxwvf
248,LBJ was dunking hard all game.,62,DeTecTiV_MiTenZ,/r/nba/comments/2zxwvf/j_r_smith_on_the_break_lobs_it_up_to_lebron_james/cpnaai4/,cpnaai4,1427087773.0,1427058973.0,J. R. Smith on the break lobs it up to LeBron James who finishes with the dunk.,421,2zxwvf
249,"[Mosgov, bench](https://gfycat.com/PleasingDisfiguredFanworms)",55,-MarcusD-,/r/nba/comments/2zxwvf/j_r_smith_on_the_break_lobs_it_up_to_lebron_james/cpnawx4/,cpnawx4,1427088852.0,1427060052.0,J. R. Smith on the break lobs it up to LeBron James who finishes with the dunk.,421,2zxwvf
250,mozgods reaction to this was the best part,89,GSCStew,/r/nba/comments/2zxwvf/j_r_smith_on_the_break_lobs_it_up_to_lebron_james/cpna9rl/,cpna9rl,1427087738.0,1427058938.0,J. R. Smith on the break lobs it up to LeBron James who finishes with the dunk.,421,2zxwvf
251,"Has Bron Bron dropped the headband for good?
",23,neverruntwice,/r/nba/comments/2zxwvf/j_r_smith_on_the_break_lobs_it_up_to_lebron_james/cpnahgr/,cpnahgr,1427088109.0,1427059309.0,J. R. Smith on the break lobs it up to LeBron James who finishes with the dunk.,421,2zxwvf
252,This was nasty. That ball looked so far away. LeBron made it look easy.,31,terrordactoll,/r/nba/comments/2zxwvf/j_r_smith_on_the_break_lobs_it_up_to_lebron_james/cpnab94/,cpnab94,1427087809.0,1427059009.0,J. R. Smith on the break lobs it up to LeBron James who finishes with the dunk.,421,2zxwvf
253,"*LeBron whispers*

*""Kobe""*",3611,,/r/nba/comments/2zxvmz/lebron_casually_hits_a_40_footer_like_its_a_free/cpn9x5u/,cpn9x5u,1427087153.0,1427058353.0,Lebron casually hits a 40 footer like it's a free throw,7783,2zxvmz
254,[deleted],288,,/r/nba/comments/2zxvmz/lebron_casually_hits_a_40_footer_like_its_a_free/cpnb7by/,cpnb7by,1427089373.0,1427060573.0,Lebron casually hits a 40 footer like it's a free throw,7783,2zxvmz
255,I don't agree with this defensive scheme,170,thisishorsepoop,/r/nba/comments/2zxvmz/lebron_casually_hits_a_40_footer_like_its_a_free/cpnapga/,cpnapga,1427088491.0,1427059691.0,Lebron casually hits a 40 footer like it's a free throw,7783,2zxvmz
256,"Man fuck this and the Wade half court highlight too

I gotta put my whole god damn body behind a transition 3 from 3 behind the arc and these fools make that shit look like they playing on a playschool dunk set for kids

It's ridiculous",664,uNBAnned_,/r/nba/comments/2zxvmz/lebron_casually_hits_a_40_footer_like_its_a_free/cpnb9nq/,cpnb9nq,1427089491.0,1427060691.0,Lebron casually hits a 40 footer like it's a free throw,7783,2zxvmz
257,"The title reminded me of [this game](http://youtu.be/-2HU4zBFdHw), it was also against Milwaukee coincidentally",315,WhiteKidMAADCity,/r/nba/comments/2zxvmz/lebron_casually_hits_a_40_footer_like_its_a_free/cpn9zno/,cpn9zno,1427087282.0,1427058482.0,Lebron casually hits a 40 footer like it's a free throw,7783,2zxvmz
258,Aimbotting,213,,/r/nba/comments/2zxvmz/lebron_casually_hits_a_40_footer_like_its_a_free/cpnaqjj/,cpnaqjj,1427088543.0,1427059743.0,Lebron casually hits a 40 footer like it's a free throw,7783,2zxvmz
259,Mi..Midorima..,42,jphobia,/r/nba/comments/2zxvmz/lebron_casually_hits_a_40_footer_like_its_a_free/cpne5ib/,cpne5ib,1427094762.0,1427065962.0,Lebron casually hits a 40 footer like it's a free throw,7783,2zxvmz
260,"Can't be like a free throw, he actually made this shot",1484,Charlie2904,/r/nba/comments/2zxvmz/lebron_casually_hits_a_40_footer_like_its_a_free/cpn9wv5/,cpn9wv5,1427087136.0,1427058336.0,Lebron casually hits a 40 footer like it's a free throw,7783,2zxvmz
261,"Literally all arms, no leg power and he barely even throws his shoulders into it... Just another idea at how strong he is",179,ComeOnBreh,/r/nba/comments/2zxvmz/lebron_casually_hits_a_40_footer_like_its_a_free/cpnbzhh/,cpnbzhh,1427090800.0,1427062000.0,Lebron casually hits a 40 footer like it's a free throw,7783,2zxvmz
262,No one even flinches. ,300,ecntlr,/r/nba/comments/2zxvmz/lebron_casually_hits_a_40_footer_like_its_a_free/cpn9zik/,cpn9zik,1427087275.0,1427058475.0,Lebron casually hits a 40 footer like it's a free throw,7783,2zxvmz
263,I can't get used to this headbandlessness. It feels like I'm looking at a new gigantic unbelievably coordinated man. ,265,ank1613,/r/nba/comments/2zrlfg/lebron_james_floats_in_for_the_finger_roll_layup/cplndg3/,cplndg3,1426931434.0,1426902634.0,LeBron James floats in for the finger roll layup,458,2zrlfg
264,"These are so hard to do irl. When you're in the air and try to do the scoop its feel like you're wearing a 10,000 pound belt bringing you down. ",76,enjoithelrg,/r/nba/comments/2zrlfg/lebron_james_floats_in_for_the_finger_roll_layup/cplnuj6/,cplnuj6,1426932448.0,1426903648.0,LeBron James floats in for the finger roll layup,458,2zrlfg
265,"that's a disgustingly awesome shot.

^^i ^^miss ^^him",35,nixed9,/r/nba/comments/2zrlfg/lebron_james_floats_in_for_the_finger_roll_layup/cplpjon/,cplpjon,1426936165.0,1426907365.0,LeBron James floats in for the finger roll layup,458,2zrlfg
266,these are the kind of shots that the CPU makes when the clock is winding down to 0 in 2k,26,5hunned,/r/nba/comments/2zrlfg/lebron_james_floats_in_for_the_finger_roll_layup/cplpgt4/,cplpgt4,1426935988.0,1426907188.0,LeBron James floats in for the finger roll layup,458,2zrlfg
267,"He wasn't perfect, but LeBron had a phenomenal 4th quarter.  This move was just icing on the cake.",42,typs,/r/nba/comments/2zrlfg/lebron_james_floats_in_for_the_finger_roll_layup/cplne2z/,cplne2z,1426931471.0,1426902671.0,LeBron James floats in for the finger roll layup,458,2zrlfg
268,Every time I see him do something like this I need to remind myself that he's pretty much the same size as Dwight.,37,,/r/nba/comments/2zrlfg/lebron_james_floats_in_for_the_finger_roll_layup/cplp4lg/,cplp4lg,1426935225.0,1426906425.0,LeBron James floats in for the finger roll layup,458,2zrlfg
269,Contract year LeBron,192,,/r/nba/comments/2zqip3/tom_haberstroh_something_i_discovered_in_my_brow/cpld2br/,cpld2br,1426911329.0,1426882529.0,[Tom Haberstroh]: Something I discovered in my Brow research: LeBron had a 59.3 PER in clutch situations in 2009-10. Scored 208 points in 151 minutes.,279,2zqip3
270,LeChoke amirite,130,Smash_Brothers,/r/nba/comments/2zqip3/tom_haberstroh_something_i_discovered_in_my_brow/cplefxw/,cplefxw,1426913672.0,1426884872.0,[Tom Haberstroh]: Something I discovered in my Brow research: LeBron had a 59.3 PER in clutch situations in 2009-10. Scored 208 points in 151 minutes.,279,2zqip3
271,"""brow research""

",62,TOUCHDOWNJOEMONTANA,/r/nba/comments/2zqip3/tom_haberstroh_something_i_discovered_in_my_brow/cpld24g/,cpld24g,1426911319.0,1426882519.0,[Tom Haberstroh]: Something I discovered in my Brow research: LeBron had a 59.3 PER in clutch situations in 2009-10. Scored 208 points in 151 minutes.,279,2zqip3
272,"Well yea, Lebron is kinda good",30,SlappyBagg,/r/nba/comments/2zqip3/tom_haberstroh_something_i_discovered_in_my_brow/cpldca0/,cpldca0,1426911794.0,1426882994.0,[Tom Haberstroh]: Something I discovered in my Brow research: LeBron had a 59.3 PER in clutch situations in 2009-10. Scored 208 points in 151 minutes.,279,2zqip3
273,Doesn't get more clutch than the king. Especially in the playoffs ,35,WadeJordan,/r/nba/comments/2zqip3/tom_haberstroh_something_i_discovered_in_my_brow/cplf4ak/,cplf4ak,1426914874.0,1426886074.0,[Tom Haberstroh]: Something I discovered in my Brow research: LeBron had a 59.3 PER in clutch situations in 2009-10. Scored 208 points in 151 minutes.,279,2zqip3
274,Ugghhhh why does every Pacers game have to be a struggle,47,I_LIKE_BASKETBALL,/r/nba/comments/2zpgk8/lebron_james_illness_missed_cavs_shootaround_hes/cpl20zn/,cpl20zn,1426893495.0,1426864695.0,LeBron James (illness) missed Cavs shootaround. He's questionable for game against Pacers tonight.,91,2zpgk8
275,It's like we're allergic to the Pacers or something.,47,tealjaker94,/r/nba/comments/2zpgk8/lebron_james_illness_missed_cavs_shootaround_hes/cpl2577/,cpl2577,1426893691.0,1426864891.0,LeBron James (illness) missed Cavs shootaround. He's questionable for game against Pacers tonight.,91,2zpgk8
276,Stop trying to find a way to SIT-OUT and just SIT-IN. Be apart of something special! Just my thoughts,107,,/r/nba/comments/2zpgk8/lebron_james_illness_missed_cavs_shootaround_hes/cpl2j65/,cpl2j65,1426894341.0,1426865541.0,LeBron James (illness) missed Cavs shootaround. He's questionable for game against Pacers tonight.,91,2zpgk8
277,Noooo fuck this first game I've ever been to in my entire life and he's gonna sit out fuck ,25,chetmccool,/r/nba/comments/2zpgk8/lebron_james_illness_missed_cavs_shootaround_hes/cpl5in2/,cpl5in2,1426899184.0,1426870384.0,LeBron James (illness) missed Cavs shootaround. He's questionable for game against Pacers tonight.,91,2zpgk8
278,This play is almost exactly what we expected Cavs basketball to be,40,urhedsonfire,/r/nba/comments/2zjxor/a_klove_outlet_follows_a_jr_block_lebron_dunks_it/cpjm49j/,cpjm49j,1426770591.0,1426741791.0,A K-Love outlet follows a JR block; Lebron dunks it at the other end.,120,2zjxor
279,This title is poorly constructed.,38,Rswany,/r/nba/comments/2zjxor/a_klove_outlet_follows_a_jr_block_lebron_dunks_it/cpjlcxr/,cpjlcxr,1426768738.0,1426739938.0,A K-Love outlet follows a JR block; Lebron dunks it at the other end.,120,2zjxor
280,JR Smith was brought in to stop fast breaks. We all know it. ,29,tokyo_dave,/r/nba/comments/2zjxor/a_klove_outlet_follows_a_jr_block_lebron_dunks_it/cpjmk8k/,cpjmk8k,1426771805.0,1426743005.0,A K-Love outlet follows a JR block; Lebron dunks it at the other end.,120,2zjxor
281,Windhorst probably took those pics,542,sY20,/r/nba/comments/2zjheg/windhorst_lebron_hanging_around_cavs_locker_room/cpjgpyt/,cpjgpyt,1426759517.0,1426730717.0,[Windhorst] LeBron hanging around Cavs locker room to watch end of Heat-Blazers. Correctly predicted Wade stepback before it happened.,465,2zjheg
282,So technically Windhorst is watching LeBron watch tv. Just when I think he can't get any creepier.,370,,/r/nba/comments/2zjheg/windhorst_lebron_hanging_around_cavs_locker_room/cpjgxru/,cpjgxru,1426759915.0,1426731115.0,[Windhorst] LeBron hanging around Cavs locker room to watch end of Heat-Blazers. Correctly predicted Wade stepback before it happened.,465,2zjheg
283,Windhorst hanging around Cavs locker room to watch Lebron watch end of Heat-Blazers. Correctly predicted Lebron wouldn't acknowledge his existence. ,274,,/r/nba/comments/2zjheg/windhorst_lebron_hanging_around_cavs_locker_room/cpjgwp5/,cpjgwp5,1426759864.0,1426731064.0,[Windhorst] LeBron hanging around Cavs locker room to watch end of Heat-Blazers. Correctly predicted Wade stepback before it happened.,465,2zjheg
284,"""Hes gonna shoot it""",256,Apocalypticorn,/r/nba/comments/2zjheg/windhorst_lebron_hanging_around_cavs_locker_room/cpjgpme/,cpjgpme,1426759499.0,1426730699.0,[Windhorst] LeBron hanging around Cavs locker room to watch end of Heat-Blazers. Correctly predicted Wade stepback before it happened.,465,2zjheg
285,"After playing against Wade for years and playing with him for almost half a decade (including Olympic Games and deep playoff runs) Lebron is capable of making educated guesses on his teammates next move. Windhorst, not realizing this is common among any professional who takes their craft seriously, swoons. ",135,diabolical-sun,/r/nba/comments/2zjheg/windhorst_lebron_hanging_around_cavs_locker_room/cpjhn8i/,cpjhn8i,1426761213.0,1426732413.0,[Windhorst] LeBron hanging around Cavs locker room to watch end of Heat-Blazers. Correctly predicted Wade stepback before it happened.,465,2zjheg
286,"I imagine windhorst; eating out of a bag of leftover popcorn he found in the stands, watching Lebron watch the game. He quickly pulls out his phone to tweet this but he smears butter on his screen. He panics. Lebron lolz, ""Imma help you out Brian, wades going to hit a stepback."" Windhorst quickly cleans his hands and tweets this after stuffing one more handful of popcorn in his mouth. Lebron, now fully nude watching wade, says ""No pictures though.""",72,,/r/nba/comments/2zjheg/windhorst_lebron_hanging_around_cavs_locker_room/cpji3mr/,cpji3mr,1426762045.0,1426733245.0,[Windhorst] LeBron hanging around Cavs locker room to watch end of Heat-Blazers. Correctly predicted Wade stepback before it happened.,465,2zjheg
287,Windhorst hanging around Cavs locker room to watch Lebron watch end of Heat-Blazers. Correctly predicted Lebron taking his shirt off before it happened.,31,DrYakub,/r/nba/comments/2zjheg/windhorst_lebron_hanging_around_cavs_locker_room/cpjgx0z/,cpjgx0z,1426759880.0,1426731080.0,[Windhorst] LeBron hanging around Cavs locker room to watch end of Heat-Blazers. Correctly predicted Wade stepback before it happened.,465,2zjheg
288,He misses his boo,21,LeFlop_,/r/nba/comments/2zjheg/windhorst_lebron_hanging_around_cavs_locker_room/cpjgxu1/,cpjgxu1,1426759917.0,1426731117.0,[Windhorst] LeBron hanging around Cavs locker room to watch end of Heat-Blazers. Correctly predicted Wade stepback before it happened.,465,2zjheg
289,Yeah you like that Lebron don't you,98,Sock_Monster,/r/nba/comments/2zjheg/windhorst_lebron_hanging_around_cavs_locker_room/cpjgyrv/,cpjgyrv,1426759964.0,1426731164.0,[Windhorst] LeBron hanging around Cavs locker room to watch end of Heat-Blazers. Correctly predicted Wade stepback before it happened.,465,2zjheg
290,"I'm excited to see how the Kyrie's do going forward. A lot of players are wearing them in games, which will help promote them even more",25,rompskee,/r/nba/comments/2zheb7/lebron_james_is_nbas_top_shoe_salesman_with_340/cpj1vz2/,cpj1vz2,1426733987.0,1426705187.0,LeBron James Is NBA's Top Shoe Salesman With $340 Million For Nike,190,2zheb7
291,Dwight schrute is shaking his head somewhere telling himself he can sell more ,49,jschireson,/r/nba/comments/2zheb7/lebron_james_is_nbas_top_shoe_salesman_with_340/cpizfri/,cpizfri,1426730150.0,1426701350.0,LeBron James Is NBA's Top Shoe Salesman With $340 Million For Nike,190,2zheb7
