,body,score,author,permalink,comment_id,created_loc,created_utc,post_title,post_score,post_id
712,"MJ was dropping 30-6-4 in his age 32 season. Hard to compare 3pt percentage because they had the shortened line that year but Lebron is obviously much more efficient overall as a scorer. They are both unbelievable. 

",85,chapinator,/r/nba/comments/5xhofx/lebron_james_is_now_shooting_398_from_3_this/dei94ib/,dei94ib,1488680630.0,1488651830.0,LeBron James is now shooting 39.8% from 3 this season and making the most 3's per game of his career.,1354,5xhofx
713,"also worth mentioning: Steph is shooting the lowest percentage from 3 in his career this season (40.1%).  obviously he's taking 10-11 attempts a game, but it's just kinda funny how Bron is shooting his career best while Steph is shooting his lowest from 3. there's a 3-1 joke somewhere ",139,IndianBoyShameer,/r/nba/comments/5xhofx/lebron_james_is_now_shooting_398_from_3_this/dei4vac/,dei4vac,1488674572.0,1488645772.0,LeBron James is now shooting 39.8% from 3 this season and making the most 3's per game of his career.,1354,5xhofx
714,"Jordan's 2pt % and 3pt% start to drop after 32, LeBron's 2pt % and 3pt% actually improves after 32.",183,monstars12,/r/nba/comments/5xhofx/lebron_james_is_now_shooting_398_from_3_this/dei5z2z/,dei5z2z,1488676164.0,1488647364.0,LeBron James is now shooting 39.8% from 3 this season and making the most 3's per game of his career.,1354,5xhofx
715,"Skip Bayless: ""LeBron is coming off the worst 3 point shooting postseason of all time. This hot streak is just fool's gold. LeBron will go back to being mediocre, or worse, come April. Mark my words.""

Shannon: ""You done?! You know what, I'm not even going to respond to that.""

Skip: ""So you agree with me? It seems like you don't have anything to prove me wrong.""

Shannon gives the most ""I'm done with this shit"" face and you can hear Joy laugh in the background.",46,BradWonder,/r/nba/comments/5xhofx/lebron_james_is_now_shooting_398_from_3_this/dei9o59/,dei9o59,1488681410.0,1488652610.0,LeBron James is now shooting 39.8% from 3 this season and making the most 3's per game of his career.,1354,5xhofx
716,Just wait until he hits his prime boys ,1564,_ganjaman_,/r/nba/comments/5xhmw7/lebron_james_is_now_averaging_careerhigh_in_both/dei4wbf/,dei4wbf,1488674613.0,1488645813.0,LeBron James is now averaging career-high in both rebounds (8.1) and assists (8.9).,3889,5xhmw7
717,LeIncline,2374,Jjab430,/r/nba/comments/5xhmw7/lebron_james_is_now_averaging_careerhigh_in_both/dei45nd/,dei45nd,1488673539.0,1488644739.0,LeBron James is now averaging career-high in both rebounds (8.1) and assists (8.9).,3889,5xhmw7
718,Lebron's kids will never get to beat their dad 1v1. ,374,KRAUSE1,/r/nba/comments/5xhmw7/lebron_james_is_now_averaging_careerhigh_in_both/dei8yl8/,dei8yl8,1488680399.0,1488651599.0,LeBron James is now averaging career-high in both rebounds (8.1) and assists (8.9).,3889,5xhmw7
719,"Also 40% from three in 4.5 attempts, he's been hitting LeFuck you threes at an insane rate",1122,johncenatbh,/r/nba/comments/5xhmw7/lebron_james_is_now_averaging_careerhigh_in_both/dei448c/,dei448c,1488673478.0,1488644678.0,LeBron James is now averaging career-high in both rebounds (8.1) and assists (8.9).,3889,5xhmw7
720,"This is a crazy statistical season league wide 

I feel like more people are averaging more points than in most years  ",288,DaBear816,/r/nba/comments/5xhmw7/lebron_james_is_now_averaging_careerhigh_in_both/dei4e5s/,dei4e5s,1488673900.0,1488645100.0,LeBron James is now averaging career-high in both rebounds (8.1) and assists (8.9).,3889,5xhmw7
721,"On a first place team and also shooting about 40% from three. This MVP race is honestly a toss up in my mind between him, Westbrook, Harden, and Kawhi. ",582,sportsfan113,/r/nba/comments/5xhmw7/lebron_james_is_now_averaging_careerhigh_in_both/dei4a1d/,dei4a1d,1488673731.0,1488644931.0,LeBron James is now averaging career-high in both rebounds (8.1) and assists (8.9).,3889,5xhmw7
722,"If he finishes the season with these averages, it'll be his first time averaging 8+ APG and RPG in the same season.",171,YizWasHere,/r/nba/comments/5xhmw7/lebron_james_is_now_averaging_careerhigh_in_both/dei457u/,dei457u,1488673520.0,1488644720.0,LeBron James is now averaging career-high in both rebounds (8.1) and assists (8.9).,3889,5xhmw7
723,How does he keep getting better at this age,207,raptorsbucketnator,/r/nba/comments/5xhmw7/lebron_james_is_now_averaging_careerhigh_in_both/dei45j0/,dei45j0,1488673533.0,1488644733.0,LeBron James is now averaging career-high in both rebounds (8.1) and assists (8.9).,3889,5xhmw7
724,M,312,suphater,/r/nba/comments/5xhmw7/lebron_james_is_now_averaging_careerhigh_in_both/dei44uf/,dei44uf,1488673504.0,1488644704.0,LeBron James is now averaging career-high in both rebounds (8.1) and assists (8.9).,3889,5xhmw7
725,LolDecline,34,sonQUAALUDE,/r/nba/comments/5xhmw7/lebron_james_is_now_averaging_careerhigh_in_both/dei704q/,dei704q,1488677660.0,1488648860.0,LeBron James is now averaging career-high in both rebounds (8.1) and assists (8.9).,3889,5xhmw7
726,Is he even a top 31 starting PG in the east?,688,snickers_t_dog,/r/nba/comments/5xh2f7/nba_on_espn_lebron_and_kyrie_scored_or_assisted/dei01ap/,dei01ap,1488666656.0,1488637856.0,[NBA on ESPN] LeBron and Kyrie scored or assisted on 117 of the Cavs 135 points (86.7%).,1314,5xh2f7
727,Game 5 flashbacks.,146,greensplat_thingy,/r/nba/comments/5xh2f7/nba_on_espn_lebron_and_kyrie_scored_or_assisted/dehzt3o/,dehzt3o,1488666248.0,1488637448.0,[NBA on ESPN] LeBron and Kyrie scored or assisted on 117 of the Cavs 135 points (86.7%).,1314,5xh2f7
728,"I hate to say it but they're clearly a much better duo than LBJ and Wade stylistically. I was rewatching game 6 of the 2013 finals, and over a 7:30 stretch from the end of the 3rd quarter, while Wade was on the bench in favor of more outside shooting, Lebron scored or assisted on something like 13 of 14 possessions while also guarding Manu and TP. He got into the paint almost every time because any time they would sag in on him he'd hit a shooter for 3.

Then (and trust me I'm not disparaging him), Wade comes back in with 430 left and the spacing was just totally gone. Where Lebron had been playing instinctual basketball he started thinking and it shut the door on the momentum he built",260,writingandshit,/r/nba/comments/5xh2f7/nba_on_espn_lebron_and_kyrie_scored_or_assisted/dei39gn/,dei39gn,1488672139.0,1488643339.0,[NBA on ESPN] LeBron and Kyrie scored or assisted on 117 of the Cavs 135 points (86.7%).,1314,5xh2f7
729,That is fucking crazy.,89,Sane333,/r/nba/comments/5xh2f7/nba_on_espn_lebron_and_kyrie_scored_or_assisted/dehzwas/,dehzwas,1488666407.0,1488637607.0,[NBA on ESPN] LeBron and Kyrie scored or assisted on 117 of the Cavs 135 points (86.7%).,1314,5xh2f7
730,Don't need 4 all stars if you got 2 guys like this ,111,Tito_Our_Saviour,/r/nba/comments/5xh2f7/nba_on_espn_lebron_and_kyrie_scored_or_assisted/dehzxpk/,dehzxpk,1488666475.0,1488637675.0,[NBA on ESPN] LeBron and Kyrie scored or assisted on 117 of the Cavs 135 points (86.7%).,1314,5xh2f7
731,LePlaymaker,49,Darth-LeBron,/r/nba/comments/5xh2f7/nba_on_espn_lebron_and_kyrie_scored_or_assisted/dehzmxy/,dehzmxy,1488665914.0,1488637114.0,[NBA on ESPN] LeBron and Kyrie scored or assisted on 117 of the Cavs 135 points (86.7%).,1314,5xh2f7
732,Kyrie cant pass,199,youngtrece13,/r/nba/comments/5xh2f7/nba_on_espn_lebron_and_kyrie_scored_or_assisted/dehzmh6/,dehzmh6,1488665888.0,1488637088.0,[NBA on ESPN] LeBron and Kyrie scored or assisted on 117 of the Cavs 135 points (86.7%).,1314,5xh2f7
733,Tim Hardaway Jr. scored or assisted on 130 of the Hawks 130 points (100%). Facts.,38,,/r/nba/comments/5xh2f7/nba_on_espn_lebron_and_kyrie_scored_or_assisted/dei6o3u/,dei6o3u,1488677184.0,1488648384.0,[NBA on ESPN] LeBron and Kyrie scored or assisted on 117 of the Cavs 135 points (86.7%).,1314,5xh2f7
734,"wait. 38 pts from Lebron + 43 pts from Kyrie + 17 assists x 2 = 115. 

they only assisted on two 3 pointers?

EDIT: welp, i am wrong. it's a lot harder to figure out than i thought. looking at the play-by-play is probably simpler",43,norriscolesucks,/r/nba/comments/5xh2f7/nba_on_espn_lebron_and_kyrie_scored_or_assisted/dei0erw/,dei0erw,1488667349.0,1488638549.0,[NBA on ESPN] LeBron and Kyrie scored or assisted on 117 of the Cavs 135 points (86.7%).,1314,5xh2f7
735,What in 3 point participation....,76,,/r/nba/comments/5xf7mj/lebron_is_now_shooting_approximately_40_from/dehlwxj/,dehlwxj,1488630827.0,1488602027.0,LeBron is now shooting approximately 40% from three this season,69,5xf7mj
736,If he goes up to 75% at the line in the playoffs it's a wrap ,41,ilara31,/r/nba/comments/5xf7mj/lebron_is_now_shooting_approximately_40_from/dehlzai/,dehlzai,1488630937.0,1488602137.0,LeBron is now shooting approximately 40% from three this season,69,5xf7mj
737,LeAgue fucked,47,BizGilwalker,/r/nba/comments/5xf7mj/lebron_is_now_shooting_approximately_40_from/dehlvgd/,dehlvgd,1488630757.0,1488601957.0,LeBron is now shooting approximately 40% from three this season,69,5xf7mj
738,He has a post game. And now he has developed a 3 game. LeDecline that we love to joke about will happen at some point and he's equipping himself nicely. Appreciate greatness,27,happyhappy7,/r/nba/comments/5xf7mj/lebron_is_now_shooting_approximately_40_from/dehlwhu/,dehlwhu,1488630808.0,1488602008.0,LeBron is now shooting approximately 40% from three this season,69,5xf7mj
739,Lebron is simply just a better player than Kobe period. ,192,t_mac1,/r/nba/comments/5xf7lm/am_i_wrong_to_think_lebron_is_statistically/dehm3mv/,dehm3mv,1488631147.0,1488602347.0,Am I wrong to think LeBron is STATISTICALLY having a better season than Kobe ever did?,33,5xf7lm
740,"Not at all. The only argument for Kobe is ""muh PPG"". Not a knock on Kobe at all, he's a legend, but LeBron is on another level. ",32,MikhailGorbachef,/r/nba/comments/5xf7lm/am_i_wrong_to_think_lebron_is_statistically/dehml61/,dehml61,1488631982.0,1488603182.0,Am I wrong to think LeBron is STATISTICALLY having a better season than Kobe ever did?,33,5xf7lm
741,"Lol no point  comparing both. Different players, different mentality, different style of play. Just enjoy. And sure lebron is having statistically a better season, but it won't matter until he wins that chip and everyone knows it. Different season, same goal.",21,ahqawa,/r/nba/comments/5xf7lm/am_i_wrong_to_think_lebron_is_statistically/dehlx2c/,dehlx2c,1488630834.0,1488602034.0,Am I wrong to think LeBron is STATISTICALLY having a better season than Kobe ever did?,33,5xf7lm
742,Upvote for skipping the ad,47,DeKobe-DeBryant,/r/nba/comments/5xeyg0/lebron_james_vs_hawks_38_pts6_threes_13_reb_8_ast/dehjq5h/,dehjq5h,1488627084.0,1488598284.0,"LeBron James vs Hawks - 38 Pts(6 threes), 13 Reb, 8 Ast",113,5xeyg0
743,Hes just going to keep peaking isnt he?,37,,/r/nba/comments/5xeyg0/lebron_james_vs_hawks_38_pts6_threes_13_reb_8_ast/dehjxz7/,dehjxz7,1488627447.0,1488598647.0,"LeBron James vs Hawks - 38 Pts(6 threes), 13 Reb, 8 Ast",113,5xeyg0
744,"watching Lebron James play basketball really is a treat 

that behind the back bounce pass around ersan to derrick williams was on the money",30,Wu-Tang31,/r/nba/comments/5xeyg0/lebron_james_vs_hawks_38_pts6_threes_13_reb_8_ast/dehkiw4/,dehkiw4,1488628418.0,1488599618.0,"LeBron James vs Hawks - 38 Pts(6 threes), 13 Reb, 8 Ast",113,5xeyg0
745,"When Lebron has the 3 dialed in, he is unstoppable.  


New record for 3s in a game.  25",24,4448144484,/r/nba/comments/5xeyg0/lebron_james_vs_hawks_38_pts6_threes_13_reb_8_ast/dehjqil/,dehjqil,1488627100.0,1488598300.0,"LeBron James vs Hawks - 38 Pts(6 threes), 13 Reb, 8 Ast",113,5xeyg0
746,Lebron  goes 6 of 10 from 3 and 4 of 8 from the line. Lol how does that happen? ,617,drspg99,/r/nba/comments/5xepmv/post_game_thread_the_cleveland_cavaliers_4218/dehhouc/,dehhouc,1488623769.0,1488594969.0,[Post Game Thread] The Cleveland Cavaliers (42-18) defeat the Atlanta Hawks (34-27) 135-130. Kyrie Irving and LeBron James combine for 81 points. The Cavs also break the record for most 3 pointers made in a game with 25.,1493,5xepmv
747,Korver breaking the 3pt record against us after a 25 point comeback to ice the game was the perfect way to stab me in the heart. ,1198,WrongTetrisBlock,/r/nba/comments/5xepmv/post_game_thread_the_cleveland_cavaliers_4218/dehhmgg/,dehhmgg,1488623665.0,1488594865.0,[Post Game Thread] The Cleveland Cavaliers (42-18) defeat the Atlanta Hawks (34-27) 135-130. Kyrie Irving and LeBron James combine for 81 points. The Cavs also break the record for most 3 pointers made in a game with 25.,1493,5xepmv
748,when you score 130 points in regulation and lose,1431,ReesesFastbreak,/r/nba/comments/5xepmv/post_game_thread_the_cleveland_cavaliers_4218/dehhlki/,dehhlki,1488623628.0,1488594828.0,[Post Game Thread] The Cleveland Cavaliers (42-18) defeat the Atlanta Hawks (34-27) 135-130. Kyrie Irving and LeBron James combine for 81 points. The Cavs also break the record for most 3 pointers made in a game with 25.,1493,5xepmv
749,25 threes and we still barely win...,763,Collier1505,/r/nba/comments/5xepmv/post_game_thread_the_cleveland_cavaliers_4218/dehhlv4/,dehhlv4,1488623640.0,1488594840.0,[Post Game Thread] The Cleveland Cavaliers (42-18) defeat the Atlanta Hawks (34-27) 135-130. Kyrie Irving and LeBron James combine for 81 points. The Cavs also break the record for most 3 pointers made in a game with 25.,1493,5xepmv
750,"So that's what it feels like to have Korver hit a dagger 3 on you...

Once you go up 20 we got you right where we want you. ",261,Martinsek,/r/nba/comments/5xepmv/post_game_thread_the_cleveland_cavaliers_4218/dehhmt1/,dehhmt1,1488623681.0,1488594881.0,[Post Game Thread] The Cleveland Cavaliers (42-18) defeat the Atlanta Hawks (34-27) 135-130. Kyrie Irving and LeBron James combine for 81 points. The Cavs also break the record for most 3 pointers made in a game with 25.,1493,5xepmv
751,"What a collapse by us. We slowed way down in 2nd half. But respect to the Hawks for fighting back. They made it a good game.

When JR and Love come back, I think we could hit 30 threes in a game.",112,KansasKingdom,/r/nba/comments/5xepmv/post_game_thread_the_cleveland_cavaliers_4218/dehhs21/,dehhs21,1488623904.0,1488595104.0,[Post Game Thread] The Cleveland Cavaliers (42-18) defeat the Atlanta Hawks (34-27) 135-130. Kyrie Irving and LeBron James combine for 81 points. The Cavs also break the record for most 3 pointers made in a game with 25.,1493,5xepmv
752,"Had 2 Dinguses at the bar last night try to tell me that Lebron is not the best player in the NBA. This game was well-timed. Also, Milsap is fucking nasty.",334,,/r/nba/comments/5xepmv/post_game_thread_the_cleveland_cavaliers_4218/dehhlwr/,dehhlwr,1488623642.0,1488594842.0,[Post Game Thread] The Cleveland Cavaliers (42-18) defeat the Atlanta Hawks (34-27) 135-130. Kyrie Irving and LeBron James combine for 81 points. The Cavs also break the record for most 3 pointers made in a game with 25.,1493,5xepmv
753,Blowing leads and winning the game is an art ,85,ilara31,/r/nba/comments/5xepmv/post_game_thread_the_cleveland_cavaliers_4218/dehhm2x/,dehhm2x,1488623649.0,1488594849.0,[Post Game Thread] The Cleveland Cavaliers (42-18) defeat the Atlanta Hawks (34-27) 135-130. Kyrie Irving and LeBron James combine for 81 points. The Cavs also break the record for most 3 pointers made in a game with 25.,1493,5xepmv
754,That's some 80s Nuggets score,68,BlindManBaldwin,/r/nba/comments/5xepmv/post_game_thread_the_cleveland_cavaliers_4218/dehhmio/,dehhmio,1488623667.0,1488594867.0,[Post Game Thread] The Cleveland Cavaliers (42-18) defeat the Atlanta Hawks (34-27) 135-130. Kyrie Irving and LeBron James combine for 81 points. The Cavs also break the record for most 3 pointers made in a game with 25.,1493,5xepmv
755,The Cavs attempted almost twice as many 3 pointers as the Hawks and at a better efficiency... how was this game even close?,65,ireallydohatereddit,/r/nba/comments/5xepmv/post_game_thread_the_cleveland_cavaliers_4218/dehhp80/,dehhp80,1488623784.0,1488594984.0,[Post Game Thread] The Cleveland Cavaliers (42-18) defeat the Atlanta Hawks (34-27) 135-130. Kyrie Irving and LeBron James combine for 81 points. The Cavs also break the record for most 3 pointers made in a game with 25.,1493,5xepmv
756,LeLeBron,35,flintmichigantropics,/r/nba/comments/5xehvx/lebron_with_the_emphatic_rejection_on_sefolosha/dehft40/,dehft40,1488620851.0,1488592051.0,Lebron with the emphatic rejection on Sefolosha (credit /u/j0ydivisi0n),104,5xehvx
757,LeBron to NYPD confirmed ,29,scrivz827,/r/nba/comments/5xehvx/lebron_with_the_emphatic_rejection_on_sefolosha/dehft6x/,dehft6x,1488620854.0,1488592054.0,Lebron with the emphatic rejection on Sefolosha (credit /u/j0ydivisi0n),104,5xehvx
758,https://static.independent.co.uk/s3fs-public/indy100/bk5ELp7wwW/17300-1sy9sdn.gif,590,amramahi,/r/nba/comments/5xefvq/lebron_hits_the_crazy_three_fading_out_of_bounds/dehf9wy/,dehf9wy,1488620032.0,1488591232.0,Lebron hits the crazy three fading out of bounds,1729,5xefvq
759,Lebron is casually playing one of the most impressive games we'eve ever seen from him,405,Kenya151,/r/nba/comments/5xefvq/lebron_hits_the_crazy_three_fading_out_of_bounds/dehfamy/,dehfamy,1488620063.0,1488591263.0,Lebron hits the crazy three fading out of bounds,1729,5xefvq
760,"i wonder what the thought process is on this shot, "" I am going out of bounds, better shoot this shit off balance not facing the basket"" ",137,hotsrirachacha,/r/nba/comments/5xefvq/lebron_hits_the_crazy_three_fading_out_of_bounds/dehfbzm/,dehfbzm,1488620120.0,1488591320.0,Lebron hits the crazy three fading out of bounds,1729,5xefvq
761,Father has siphoned his sons abilities.,115,Stereodog,/r/nba/comments/5xefvq/lebron_hits_the_crazy_three_fading_out_of_bounds/dehfguu/,dehfguu,1488620332.0,1488591532.0,Lebron hits the crazy three fading out of bounds,1729,5xefvq
762,He literally dribbled into the corner and faded by choice.,99,EStotheGN,/r/nba/comments/5xefvq/lebron_hits_the_crazy_three_fading_out_of_bounds/dehi7bu/,dehi7bu,1488624571.0,1488595771.0,Lebron hits the crazy three fading out of bounds,1729,5xefvq
763,http://i.imgur.com/i5idIXL.jpg,186,MeesterAndrew,/r/nba/comments/5xefvq/lebron_hits_the_crazy_three_fading_out_of_bounds/dehfbbk/,dehfbbk,1488620092.0,1488591292.0,Lebron hits the crazy three fading out of bounds,1729,5xefvq
764,[Reminded me of this](https://www.youtube.com/watch?v=bTaMRoAWrzY),258,YaBoiWhit,/r/nba/comments/5xefvq/lebron_hits_the_crazy_three_fading_out_of_bounds/dehfbtn/,dehfbtn,1488620113.0,1488591313.0,Lebron hits the crazy three fading out of bounds,1729,5xefvq
765,The ultimate Lefuckyou 3,155,Tmac16,/r/nba/comments/5xefvq/lebron_hits_the_crazy_three_fading_out_of_bounds/dehfa3n/,dehfa3n,1488620040.0,1488591240.0,Lebron hits the crazy three fading out of bounds,1729,5xefvq
766,That man is feeling himself,41,gamebreaker_vol2,/r/nba/comments/5xefvq/lebron_hits_the_crazy_three_fading_out_of_bounds/dehfabn/,dehfabn,1488620049.0,1488591249.0,Lebron hits the crazy three fading out of bounds,1729,5xefvq
767,LeFuckYouImLebron,77,jameshardenisjacked,/r/nba/comments/5xefvq/lebron_hits_the_crazy_three_fading_out_of_bounds/dehfb7q/,dehfb7q,1488620087.0,1488591287.0,Lebron hits the crazy three fading out of bounds,1729,5xefvq
768,How did he score 22 and 7?,186,jaff1220,/r/nba/comments/5xeav9/lebron_james_ends_the_half_with_22_points_7/dehe7ds/,dehe7ds,1488618384.0,1488589584.0,"LeBron James ends the half with 22 points, 7 points and 5 assists on 64% shooting",263,5xeav9
769,Irving's got 23 on 10-12 shooting as well,72,That_Ohio_Guy,/r/nba/comments/5xeav9/lebron_james_ends_the_half_with_22_points_7/dehe89b/,dehe89b,1488618419.0,1488589619.0,"LeBron James ends the half with 22 points, 7 points and 5 assists on 64% shooting",263,5xeav9
770,"22/7/5 on 9-14 shooting, 3-4 from three. That's like a season-best game for half the league lol ",136,johnkphotos,/r/nba/comments/5xeav9/lebron_james_ends_the_half_with_22_points_7/dehe4yl/,dehe4yl,1488618284.0,1488589484.0,"LeBron James ends the half with 22 points, 7 points and 5 assists on 64% shooting",263,5xeav9
771,so good he's getting buckets in another game during timeouts!,24,Sim888,/r/nba/comments/5xeav9/lebron_james_ends_the_half_with_22_points_7/deheb5n/,deheb5n,1488618541.0,1488589741.0,"LeBron James ends the half with 22 points, 7 points and 5 assists on 64% shooting",263,5xeav9
772,as long as Steph and Bron stay out of my way we'll be fine,3809,connorh98,/r/nba/comments/5xagqc/could_3_redditors_lebron_and_steph_curry_win/degj1ue/,degj1ue,1488579958.0,1488551158.0,"Could 3 redditors, Lebron and Steph Curry win March Madness?",1331,5xagqc
773,If those 2 other redditors are embiid and ty Lawson. Then ya,627,h989,/r/nba/comments/5xagqc/could_3_redditors_lebron_and_steph_curry_win/degiakj/,degiakj,1488578830.0,1488550030.0,"Could 3 redditors, Lebron and Steph Curry win March Madness?",1331,5xagqc
774,Have you seen my step back?,903,Tito_Our_Saviour,/r/nba/comments/5xagqc/could_3_redditors_lebron_and_steph_curry_win/degi0lq/,degi0lq,1488578397.0,1488549597.0,"Could 3 redditors, Lebron and Steph Curry win March Madness?",1331,5xagqc
775,37 year old Keith Bogans is still better than some 19 year old kids. He got that grown man strength. ,417,BlackMathNerd,/r/nba/comments/5xagqc/could_3_redditors_lebron_and_steph_curry_win/degitbb/,degitbb,1488579616.0,1488550816.0,"Could 3 redditors, Lebron and Steph Curry win March Madness?",1331,5xagqc
776,I'd love to stand in the corner while Lebron draws 5 defenders and miss a wide open 3 pointer,82,louizzle,/r/nba/comments/5xagqc/could_3_redditors_lebron_and_steph_curry_win/deglh9o/,deglh9o,1488583231.0,1488554431.0,"Could 3 redditors, Lebron and Steph Curry win March Madness?",1331,5xagqc
777,"Yes, the 3 randos would get subbed out immediately every game by 3 of the Keith Bogans and that team would crush.",476,17461863372823734930,/r/nba/comments/5xagqc/could_3_redditors_lebron_and_steph_curry_win/degi317/,degi317,1488578500.0,1488549700.0,"Could 3 redditors, Lebron and Steph Curry win March Madness?",1331,5xagqc
778,"I'd just flagrantly foul the best player on the other team, get kicked out the game and Keith Bogans would take my place.",97,InMyPrahjects,/r/nba/comments/5xagqc/could_3_redditors_lebron_and_steph_curry_win/degin4a/,degin4a,1488579362.0,1488550562.0,"Could 3 redditors, Lebron and Steph Curry win March Madness?",1331,5xagqc
779,"No, not if the redditors are random picks.  Most people on here couldn't last a quarter of a half.",259,BKD2674,/r/nba/comments/5xagqc/could_3_redditors_lebron_and_steph_curry_win/degi260/,degi260,1488578462.0,1488549662.0,"Could 3 redditors, Lebron and Steph Curry win March Madness?",1331,5xagqc
780,They could double team both Curry and LeBron and leave it 3 vs 1 for the redditor's. ,74,Leave_Messi_Alone,/r/nba/comments/5xagqc/could_3_redditors_lebron_and_steph_curry_win/degio39/,degio39,1488579402.0,1488550602.0,"Could 3 redditors, Lebron and Steph Curry win March Madness?",1331,5xagqc
781,We can never seem to get the shitposts we deserve during the offseason. Quality work my friend.,262,karlmelo_anthony,/r/nba/comments/5xagqc/could_3_redditors_lebron_and_steph_curry_win/degi3fk/,degi3fk,1488578519.0,1488549719.0,"Could 3 redditors, Lebron and Steph Curry win March Madness?",1331,5xagqc
782,Paul Zipser,80,ImRBJ,/r/nba/comments/5x86p6/who_will_become_the_face_of_the_nba_when_lebron/deg1kd7/,deg1kd7,1488542088.0,1488513288.0,Who will become the face of the NBA when LeBron James retires?,45,5x86p6
783,Good chance they haven't been drafted yet. ,104,MikhailGorbachef,/r/nba/comments/5x86p6/who_will_become_the_face_of_the_nba_when_lebron/deg1kzn/,deg1kzn,1488542113.0,1488513313.0,Who will become the face of the NBA when LeBron James retires?,45,5x86p6
784,"buddy hield, am i doing this right?",110,exasperated_dreams,/r/nba/comments/5x86p6/who_will_become_the_face_of_the_nba_when_lebron/deg1iy3/,deg1iy3,1488542032.0,1488513232.0,Who will become the face of the NBA when LeBron James retires?,45,5x86p6
785,Giannis Antetokounmpo if he can develop a decent jump shot. ,76,nba24-7,/r/nba/comments/5x86p6/who_will_become_the_face_of_the_nba_when_lebron/deg1n4i/,deg1n4i,1488542196.0,1488513396.0,Who will become the face of the NBA when LeBron James retires?,45,5x86p6
786,No one. We will have true parity.,37,level23bulbasaur,/r/nba/comments/5x86p6/who_will_become_the_face_of_the_nba_when_lebron/deg1kyl/,deg1kyl,1488542111.0,1488513311.0,Who will become the face of the NBA when LeBron James retires?,45,5x86p6
787,Bronny Jr,31,Blestick,/r/nba/comments/5x86p6/who_will_become_the_face_of_the_nba_when_lebron/deg1j6k/,deg1j6k,1488542042.0,1488513242.0,Who will become the face of the NBA when LeBron James retires?,45,5x86p6
788,Lebron usually makes the right play. He passed to the open man. There's not much analysis that needs to go into it.,73,ceelogreen5,/r/nba/comments/5x6vf1/lebron_explains_his_mindset_when_passing_the_game/defqb0y/,defqb0y,1488527272.0,1488498472.0,Lebron explains his mindset when passing the game winning shot to Deron Williams,25,5x6vf1
789,He's getting a surprising amount of criticism for this on twitter. ,28,LordChuckleFuck,/r/nba/comments/5x6vf1/lebron_explains_his_mindset_when_passing_the_game/defpw0l/,defpw0l,1488526774.0,1488497974.0,Lebron explains his mindset when passing the game winning shot to Deron Williams,25,5x6vf1
790,his ball iq is fucking amazing ,29,passiveparrot,/r/nba/comments/5x6vf1/lebron_explains_his_mindset_when_passing_the_game/defqpt7/,defqpt7,1488527771.0,1488498971.0,Lebron explains his mindset when passing the game winning shot to Deron Williams,25,5x6vf1
