,body,score,author,permalink,comment_id,created_loc,created_utc,post_title,post_score,post_id
665,"Ish

Convington

Jerami Grant

Lebron

Noel

That would be the best defensive lineup lebron has ever had. lebron, covington, jerami switching 2-4 all day long. Noel elite rim protection. Would be a block party. Could also fuck with lebron at pg lineup. Ecf no doubt in my
Mind.",63,2274ts,/r/nba/comments/4l38in/mark_jackson_says_if_lebron_was_on_the_sixers/d3jzqmp/,d3jzqmp,1464261795.0,1464232995.0,Mark Jackson says if Lebron was on the Sixers they would be the ECF,392,4l38in
666,"I think that if you simulated 1,000 seasons of LeBron on the current season 76ers, playing in the current season... he makes the ECF (not finals) a non-trivial amount of times. ",40,stoppedlurkinglol,/r/nba/comments/4l38in/mark_jackson_says_if_lebron_was_on_the_sixers/d3jy4ts/,d3jy4ts,1464259159.0,1464230359.0,Mark Jackson says if Lebron was on the Sixers they would be the ECF,392,4l38in
667,Probably. ,40,BMC4,/r/nba/comments/4l38in/mark_jackson_says_if_lebron_was_on_the_sixers/d3jxyig/,d3jxyig,1464258877.0,1464230077.0,Mark Jackson says if Lebron was on the Sixers they would be the ECF,392,4l38in
668,"""Lebron passed me on the all time playoff games played list tonight. He has now played more playoff games than I have."" -Magic's scheduled tweet",64,KnickedUp,/r/nba/comments/4l2xd0/lebron_james_has_now_played_in_191_playoff_games/d3jwfuo/,d3jwfuo,1464256471.0,1464227671.0,"LeBron James has now played in 191 playoff games, passing Magic Johnson for 11th most in NBA history.",173,4l2xd0
669,derek fisher at 259. Lebron will crack the top 10 if they make it to the finals. ,36,lewlkewl,/r/nba/comments/4l2xd0/lebron_james_has_now_played_in_191_playoff_games/d3jw8uq/,d3jw8uq,1464256159.0,1464227359.0,"LeBron James has now played in 191 playoff games, passing Magic Johnson for 11th most in NBA history.",173,4l2xd0
670,"[deleted]  

  > 

  > meow.",168,,/r/nba/comments/4l1pqn/why_hasnt_lebron_been_wearing_his_headband_this/d3jjvok/,d3jjvok,1464237183.0,1464208383.0,Why hasn't LeBron been wearing his headband this playoffs?,22,4l1pqn
671,â€œI did it because I just wanted to look like my teammates. Just wanted to be one. Nothing more than that.â€ He did last year before the playoffs.,26,b1oconnor,/r/nba/comments/4l1pqn/why_hasnt_lebron_been_wearing_his_headband_this/d3jk7um/,d3jk7um,1464237635.0,1464208835.0,Why hasn't LeBron been wearing his headband this playoffs?,22,4l1pqn
672,He got a hair transplant. No need to cover up that hairline anymore.,49,veku1,/r/nba/comments/4l1pqn/why_hasnt_lebron_been_wearing_his_headband_this/d3jjx9r/,d3jjx9r,1464237245.0,1464208445.0,Why hasn't LeBron been wearing his headband this playoffs?,22,4l1pqn
673,Because it is all about getting one for the Land ,39,U_Z_A_Chump,/r/nba/comments/4l1pqn/why_hasnt_lebron_been_wearing_his_headband_this/d3jl18g/,d3jl18g,1464238722.0,1464209922.0,Why hasn't LeBron been wearing his headband this playoffs?,22,4l1pqn
674,Wants to show off how well the rogaine has worked.,26,AyyMVP,/r/nba/comments/4l1pqn/why_hasnt_lebron_been_wearing_his_headband_this/d3jjwpw/,d3jjwpw,1464237223.0,1464208423.0,Why hasn't LeBron been wearing his headband this playoffs?,22,4l1pqn
675,His teammates need to hit open shots,52,jumboponcho,/r/nba/comments/4kuwx3/should_lebron_start_being_more_selfish_late_in/d3hy151/,d3hy151,1464139751.0,1464110951.0,Should LeBron start being more selfish late in games?,19,4kuwx3
676,"fuck it, give em the max",574,dipset4444,/r/nba/comments/4kue54/demar_derozan_worked_out_in_the_arena_until_1_am/d3htbh6/,d3htbh6,1464133439.0,1464104639.0,"DeMar DeRozan worked out in the arena until 1 a.m. the night before Game 4, knowing LeBron James would be guarding him",786,4kue54
677,"*Upon entry into the bowl area, a female security guard spotted him and stopped him. She asked what he was doing there and even went as far to ask if he worked at the arena.*

YES I FUCKING DO, he said. YES I FUCKING DO",202,ElPlywood,/r/nba/comments/4kue54/demar_derozan_worked_out_in_the_arena_until_1_am/d3htm0d/,d3htm0d,1464133836.0,1464105036.0,"DeMar DeRozan worked out in the arena until 1 a.m. the night before Game 4, knowing LeBron James would be guarding him",786,4kue54
678,I noticed most of his shots were when Lebron was off of him.,237,Risk_Neutral,/r/nba/comments/4kue54/demar_derozan_worked_out_in_the_arena_until_1_am/d3htbqh/,d3htbqh,1464133449.0,1464104649.0,"DeMar DeRozan worked out in the arena until 1 a.m. the night before Game 4, knowing LeBron James would be guarding him",786,4kue54
679,">DeRozan worked up a sweat, shooting close to a thousand shots for about two and a half hours and didn't exit the arena until 1 a.m., cleveland.com has learned. The session placed heavy emphasis on scoring assertively and promptly.
",111,LinuxF4n,/r/nba/comments/4kue54/demar_derozan_worked_out_in_the_arena_until_1_am/d3htio6/,d3htio6,1464133712.0,1464104912.0,"DeMar DeRozan worked out in the arena until 1 a.m. the night before Game 4, knowing LeBron James would be guarding him",786,4kue54
680,[deleted],66,,/r/nba/comments/4kue54/demar_derozan_worked_out_in_the_arena_until_1_am/d3htkny/,d3htkny,1464133787.0,1464104987.0,"DeMar DeRozan worked out in the arena until 1 a.m. the night before Game 4, knowing LeBron James would be guarding him",786,4kue54
681,Word is he put on 10 pounds of muscle so he wouldn't get pushed around.  And boy did it work.,26,blagaa,/r/nba/comments/4kue54/demar_derozan_worked_out_in_the_arena_until_1_am/d3i4ya6/,d3i4ya6,1464148866.0,1464120066.0,"DeMar DeRozan worked out in the arena until 1 a.m. the night before Game 4, knowing LeBron James would be guarding him",786,4kue54
682,His shot is so money when just pulls up from a little more than free throw range after coming off a pick. I don't even know how it can be stopped.,36,Rocco427,/r/nba/comments/4kue54/demar_derozan_worked_out_in_the_arena_until_1_am/d3i1a2z/,d3i1a2z,1464144036.0,1464115236.0,"DeMar DeRozan worked out in the arena until 1 a.m. the night before Game 4, knowing LeBron James would be guarding him",786,4kue54
683,DeKobe DeBryant,57,migcal,/r/nba/comments/4kue54/demar_derozan_worked_out_in_the_arena_until_1_am/d3hubqj/,d3hubqj,1464134796.0,1464105996.0,"DeMar DeRozan worked out in the arena until 1 a.m. the night before Game 4, knowing LeBron James would be guarding him",786,4kue54
684,I wonder if a little of Kobe rubbing off on DeMar. ,66,_e_e_e_,/r/nba/comments/4kue54/demar_derozan_worked_out_in_the_arena_until_1_am/d3htgqi/,d3htgqi,1464133640.0,1464104840.0,"DeMar DeRozan worked out in the arena until 1 a.m. the night before Game 4, knowing LeBron James would be guarding him",786,4kue54
685,Biyombo telling Valanciunas: This MY team now,30,TheBronJamesHarden,/r/nba/comments/4ks5j4/biyombos_amazing_block_on_lebron/d3hczj2/,d3hczj2,1464093751.0,1464064951.0,Biyombo's Amazing Block on Lebron,65,4ks5j4
686,"I just love how fearless Biyombo is at protecting the paint, no matter who is going up with it.",25,FreeJerome,/r/nba/comments/4ks5j4/biyombos_amazing_block_on_lebron/d3hdh0k/,d3hdh0k,1464094851.0,1464066051.0,Biyombo's Amazing Block on Lebron,65,4ks5j4
687,Stop don't anger lebron,62,Kdeepsobad,/r/nba/comments/4kruqt/drake_posts_the_bismax_block_on_lebron/d3had3x/,d3had3x,1464088683.0,1464059883.0,Drake posts the BisMax block on LeBron,119,4kruqt
688,Looks like this is Drake's reply to LeBron staring him down after that run. All of a sudden this series is interesting. ,21,,/r/nba/comments/4kruqt/drake_posts_the_bismax_block_on_lebron/d3hafcq/,d3hafcq,1464088789.0,1464059989.0,Drake posts the BisMax block on LeBron,119,4kruqt
689,Drake is one of the biggest front runners out there. Just can't take him seriously when he constantly hops on the shiniest bandwagon.,42,AmbitiousSingh,/r/nba/comments/4kruqt/drake_posts_the_bismax_block_on_lebron/d3hal8t/,d3hal8t,1464089076.0,1464060276.0,Drake posts the BisMax block on LeBron,119,4kruqt
690,No where to be found when they were down 0-2 though,26,VizzyXV,/r/nba/comments/4kruqt/drake_posts_the_bismax_block_on_lebron/d3hafcj/,d3hafcj,1464088789.0,1464059989.0,Drake posts the BisMax block on LeBron,119,4kruqt
691,Now subtract Kevin Love.,45,calebkeith,/r/nba/comments/4krtdy/nonlebron_cavs_in_games_3_4_47129_fg_364_65_ppg/d3h9zuh/,d3h9zuh,1464088091.0,1464059291.0,"Non-LeBron Cavs in Games 3 & 4: 47/129 FG (36.4%), 65 ppg",55,4krtdy
692,"Lol it was a foul, it was worth it though 

Edit: mods whyd you take the post down? ",40,homicidal_penguin,/r/nba/comments/4krg8i/biyambo_blocks_lebron_gets_called_for_a_foul/d3h6fpp/,d3h6fpp,1464082750.0,1464053950.0,"Biyambo blocks Lebron, gets called for a foul",103,4krg8i
693,levitate levitate levitate levitate,28,,/r/nba/comments/4kr91u/lebron_goes_up_and_around_bismack/d3h4lqi/,d3h4lqi,1464079969.0,1464051169.0,Lebron goes up and around Bismack,193,4kr91u
694,This is absolutely mind-boggling. He was able to stay in the air for so long and then shoot it on the way down. This is an all-time LeBron play that will be showed for many years.,31,codeinesyrup,/r/nba/comments/4kr91u/lebron_goes_up_and_around_bismack/d3h4ln5/,d3h4ln5,1464079965.0,1464051165.0,Lebron goes up and around Bismack,193,4kr91u
695,Lowry with the foul then flop and Raptors fans complain about Lebrons flops.,51,jmh0697,/r/nba/comments/4kr91u/lebron_goes_up_and_around_bismack/d3h4kty/,d3h4kty,1464079931.0,1464051131.0,Lebron goes up and around Bismack,193,4kr91u
696,"""Not like the child-raping-type monster,"" he clarified, ""like the type that's really good at basketball.""",77,,/r/nba/comments/4kqrhf/herbert_dwane_casey_clarifies_that_when_he_called/d3h0c8b/,d3h0c8b,1464073412.0,1464044612.0,"[Herbert] Dwane Casey clarifies that when he called LeBron James a 'monster', he didn't mean a 'bad monster'""",94,4kqrhf
697,"LeBron ""Sulley"" James ",66,,/r/nba/comments/4kqrhf/herbert_dwane_casey_clarifies_that_when_he_called/d3h0agd/,d3h0agd,1464073348.0,1464044548.0,"[Herbert] Dwane Casey clarifies that when he called LeBron James a 'monster', he didn't mean a 'bad monster'""",94,4kqrhf
698,More like a Monstar,24,gnartard101,/r/nba/comments/4kqrhf/herbert_dwane_casey_clarifies_that_when_he_called/d3h0arj/,d3h0arj,1464073360.0,1464044560.0,"[Herbert] Dwane Casey clarifies that when he called LeBron James a 'monster', he didn't mean a 'bad monster'""",94,4kqrhf
699,Did this need to be clarified?,35,LaFlurry,/r/nba/comments/4kqrhf/herbert_dwane_casey_clarifies_that_when_he_called/d3h0ann/,d3h0ann,1464073355.0,1464044555.0,"[Herbert] Dwane Casey clarifies that when he called LeBron James a 'monster', he didn't mean a 'bad monster'""",94,4kqrhf
700,"This fine is $80, correct?",50,Fsharp88,/r/nba/comments/4kq3wr/vardon_lebron_james_to_pay_dahntay_jones_fine_has/d3gupz5/,d3gupz5,1464065290.0,1464036490.0,"[Vardon] LeBron James to pay Dahntay Jones' fine, has 'personal' game plan to beat Toronto Raptors",38,4kq3wr
701,"> has 'personal' game plan to beat Toronto Raptors

Lmao, this is almost as bad as LeBron's ""secret motivation"" to win the title last year.",41,villa4real,/r/nba/comments/4kq3wr/vardon_lebron_james_to_pay_dahntay_jones_fine_has/d3gv5yv/,d3gv5yv,1464065888.0,1464037088.0,"[Vardon] LeBron James to pay Dahntay Jones' fine, has 'personal' game plan to beat Toronto Raptors",38,4kq3wr
702,"I know there isn't really a way to police it, but I don't like players paying for other player's fines. Kind of demeans the whole purpose.",24,johnny__,/r/nba/comments/4kq3wr/vardon_lebron_james_to_pay_dahntay_jones_fine_has/d3gutlr/,d3gutlr,1464065428.0,1464036628.0,"[Vardon] LeBron James to pay Dahntay Jones' fine, has 'personal' game plan to beat Toronto Raptors",38,4kq3wr
703,$80? lmao ,314,themariokarters,/r/nba/comments/4kox40/lebron_james_to_pay_dahntay_jones_fine/d3gkdxq/,d3gkdxq,1464051417.0,1464022617.0,LeBron James to pay Dahntay Jones' fine,504,4kox40
704,[deleted],331,,/r/nba/comments/4kox40/lebron_james_to_pay_dahntay_jones_fine/d3gkdq4/,d3gkdq4,1464051409.0,1464022609.0,LeBron James to pay Dahntay Jones' fine,504,4kox40
705,Pretty sure lebron makes $80 as quick as this webpage loads up ,171,GKMC35,/r/nba/comments/4kox40/lebron_james_to_pay_dahntay_jones_fine/d3glao1/,d3glao1,1464052657.0,1464023857.0,LeBron James to pay Dahntay Jones' fine,504,4kox40
706,The price on Biyombo's head was only $80?,113,Chancelor_West,/r/nba/comments/4kox40/lebron_james_to_pay_dahntay_jones_fine/d3gkef1/,d3gkef1,1464051435.0,1464022635.0,LeBron James to pay Dahntay Jones' fine,504,4kox40
707,"Lol, well LeBron said they needed an enforcer so he might as well pay the fine, he got him in Cleveland.


edit: 80$? what the fuck",76,johncenatbh,/r/nba/comments/4kox40/lebron_james_to_pay_dahntay_jones_fine/d3gkdrv/,d3gkdrv,1464051411.0,1464022611.0,LeBron James to pay Dahntay Jones' fine,504,4kox40
708,Was that $80 worth it?!,30,hristi,/r/nba/comments/4kox40/lebron_james_to_pay_dahntay_jones_fine/d3gkihd/,d3gkihd,1464051588.0,1464022788.0,LeBron James to pay Dahntay Jones' fine,504,4kox40
709,"Man, one game and $80 seems like a pretty solid deal to get a good shot at one of the opposing team's biggest threats in a series. NBA needs to do a better job of protecting their players than this. Not saying he should do this, but imagine if James Johnson were to give an ""inadvertent"" black belt shot to one of the big three.",23,TheRastafarianRabbi,/r/nba/comments/4kox40/lebron_james_to_pay_dahntay_jones_fine/d3gmadr/,d3gmadr,1464053997.0,1464025197.0,LeBron James to pay Dahntay Jones' fine,504,4kox40
710,"Listen I want to circlejerk about LeBron being an amazing basketball player as much as anyone right now. But we are in the middle of a ""fuck draymond he needs to be suspended"" frenzy right now and we can't be distracted.",367,fear865,/r/nba/comments/4koahz/haberstroh_lebron_james_set_up_an_nbabest_55/d3gf150/,d3gf150,1464043930.0,1464015130.0,[Haberstroh] LeBron James set up an NBA-best 55 corner threes with a pass from the opposite side of the court.,228,4koahz
711,"as long as you can hit corner 3s, Lebron will find you a job in the NBA. ex. James Jones, Damon Jones, Donyell Marshall.",62,FreeGums,/r/nba/comments/4koahz/haberstroh_lebron_james_set_up_an_nbabest_55/d3gf20y/,d3gf20y,1464043963.0,1464015163.0,[Haberstroh] LeBron James set up an NBA-best 55 corner threes with a pass from the opposite side of the court.,228,4koahz
712,lebron's ability to make cross-court passes into the shooting pocket from all angles is honestly ridiculously amazing and it's basically his superpower. ,56,zigzagzil,/r/nba/comments/4koahz/haberstroh_lebron_james_set_up_an_nbabest_55/d3gfj15/,d3gfj15,1464044654.0,1464015854.0,[Haberstroh] LeBron James set up an NBA-best 55 corner threes with a pass from the opposite side of the court.,228,4koahz
713,I know some people dont like hearing it...but I think Lebron is probably the best passer of all time.,35,2274ts,/r/nba/comments/4koahz/haberstroh_lebron_james_set_up_an_nbabest_55/d3glnjf/,d3glnjf,1464053141.0,1464024341.0,[Haberstroh] LeBron James set up an NBA-best 55 corner threes with a pass from the opposite side of the court.,228,4koahz
714,"""there was no call to be selled""...lol",284,pthrowaway91321,/r/nba/comments/4kkz5x/lebron_i_do_not_sell_foul_call_to_refs/d3fpdyj/,d3fpdyj,1463987653.0,1463958853.0,Lebron: I do not sell foul call to refs,288,4kkz5x
715,Is JR laughing because of the question or because he knows the answer?,105,reversals,/r/nba/comments/4kkz5x/lebron_i_do_not_sell_foul_call_to_refs/d3fplam/,d3fplam,1463988033.0,1463959233.0,Lebron: I do not sell foul call to refs,288,4kkz5x
716,I did not have sexual relations with that woman,111,notsodarkmatter,/r/nba/comments/4kkz5x/lebron_i_do_not_sell_foul_call_to_refs/d3fpoeb/,d3fpoeb,1463988192.0,1463959392.0,Lebron: I do not sell foul call to refs,288,4kkz5x
717,"He really tripped on his own words there.

He says ""he didn't know it was is own teammate"" but then also says ""sell what call? There was nothing to sell"".

If he didn't know that it was a teammate who hit him and thought it was a Raptor (which he also said), then there certainly was a call to sell.",197,Corvese,/r/nba/comments/4kkz5x/lebron_i_do_not_sell_foul_call_to_refs/d3fownq/,d3fownq,1463986765.0,1463957965.0,Lebron: I do not sell foul call to refs,288,4kkz5x
718,[Okay then](http://i3.kym-cdn.com/entries/icons/original/000/018/847/e4a829e2-502a-42d4-898f-f3169442026b-bestSizeAvailable.png),70,wikiman2001,/r/nba/comments/4kkz5x/lebron_i_do_not_sell_foul_call_to_refs/d3fp08x/,d3fp08x,1463986945.0,1463958145.0,Lebron: I do not sell foul call to refs,288,4kkz5x
719,"Can't believe the reporter went there so casually, I guess credit for boldness? But Lebron's definitely not ever going to say ""yeah, I did.""",50,mackinac90,/r/nba/comments/4kkz5x/lebron_i_do_not_sell_foul_call_to_refs/d3foysk/,d3foysk,1463986872.0,1463958072.0,Lebron: I do not sell foul call to refs,288,4kkz5x
720,"[Yeah, he's never done stuff like this.](http://29.media.tumblr.com/tumblr_lmfmwgDOFo1qjk8bzo1_250.gif)


Then winked to the camera seconds later.",37,StringerBel-Air,/r/nba/comments/4kkz5x/lebron_i_do_not_sell_foul_call_to_refs/d3fpier/,d3fpier,1463987882.0,1463959082.0,Lebron: I do not sell foul call to refs,288,4kkz5x
721,[Two seconds on google found me this vid](https://www.youtube.com/watch?v=4fSlLdXNzPw)...,49,SnapHook,/r/nba/comments/4kkz5x/lebron_i_do_not_sell_foul_call_to_refs/d3fp528/,d3fp528,1463987186.0,1463958386.0,Lebron: I do not sell foul call to refs,288,4kkz5x
722,LeLiar,83,sadashn,/r/nba/comments/4kkz5x/lebron_i_do_not_sell_foul_call_to_refs/d3fox47/,d3fox47,1463986788.0,1463957988.0,Lebron: I do not sell foul call to refs,288,4kkz5x
723,So now he's a liar and a flopper.,23,wilsonh915,/r/nba/comments/4kkz5x/lebron_i_do_not_sell_foul_call_to_refs/d3fqkhz/,d3fqkhz,1463989830.0,1463961030.0,Lebron: I do not sell foul call to refs,288,4kkz5x
724,"So many eye popping stats in this one.

Tim Duncan with the insane playoff minutes played. Scottie with 30 more games played in the playoffs than MJ (those trailblazer teams were better than I remember). We call kobe a chucker, but even though he played 1200 minutes more and 40 more games, only had 2 more FGA than MJ. Bill Russel and Wilt clearly had to be rigging the numbers to both have around 4000 rebounds in their playoff careers.

But the insane thing to me is somehow MJ is 19th in games played, 12th in minutes played, and somehow has the 2nd most FGA, 2nd most FG makes, shot 1766 free throws over a playoff average of 83% per game, and leads the scoring category by 220 points. That's some insane shit",36,Cryinonionknight,/r/nba/comments/4kknoe/here_is_a_list_of_all_playoff_statistical/d3fqbay/,d3fqbay,1463989366.0,1463960566.0,"Here is a list of all playoff statistical categories, with LeBron James highlighted in green.",186,4kknoe
725,"I made this list, because lately LeBron has been setting records on a nightly basis. Here, you can see which categories he is likely to move up next. 

By the end of the playoffs, he will likely move up one spot or more in the following categories: 

- Games Played
- Minutes Played
- Field Goal Attempts
- 3PG Made
- Free Throws Made
- Free Throw Attempts
- Offensive Rebounds
- Total Rebounds
- Steals
- Blocks
- Personal Fouls",55,rondosfinger,/r/nba/comments/4kknoe/here_is_a_list_of_all_playoff_statistical/d3fmcwx/,d3fmcwx,1463982265.0,1463953465.0,"Here is a list of all playoff statistical categories, with LeBron James highlighted in green.",186,4kknoe
726,I'm honestly surprised by how high he is on both 3p categories.,22,TallTreeNoArms,/r/nba/comments/4kknoe/here_is_a_list_of_all_playoff_statistical/d3fmi5d/,d3fmi5d,1463982513.0,1463953713.0,"Here is a list of all playoff statistical categories, with LeBron James highlighted in green.",186,4kknoe
727,Making this in google docs was a good idea. This is very concise and easy to interpret. Well done OP.,38,Bouldabassed,/r/nba/comments/4kknoe/here_is_a_list_of_all_playoff_statistical/d3fofo2/,d3fofo2,1463985918.0,1463957118.0,"Here is a list of all playoff statistical categories, with LeBron James highlighted in green.",186,4kknoe
728,Lol the amount of salt from both sides on this thread is the perfect amount for my popcorn.,490,badoosh123,/r/nba/comments/4kjp1t/bismack_biyombo_on_getting_tangled_up_with_lebron/d3fhv6e/,d3fhv6e,1463974750.0,1463945950.0,"Bismack Biyombo on Getting Tangled up With LeBron: ""I get fouled pretty much the same way and I don't fall on the ground badly""",1093,4kjp1t
729,lol . shots fired . i just hope king james does not do what MJ did to mutombo,131,dahman96,/r/nba/comments/4kjp1t/bismack_biyombo_on_getting_tangled_up_with_lebron/d3fg0h4/,d3fg0h4,1463971697.0,1463942897.0,"Bismack Biyombo on Getting Tangled up With LeBron: ""I get fouled pretty much the same way and I don't fall on the ground badly""",1093,4kjp1t
730,Unfortunately it seems that if you don't fall down you won't get the call. ,37,,/r/nba/comments/4kjp1t/bismack_biyombo_on_getting_tangled_up_with_lebron/d3fjfkh/,d3fjfkh,1463977348.0,1463948548.0,"Bismack Biyombo on Getting Tangled up With LeBron: ""I get fouled pretty much the same way and I don't fall on the ground badly""",1093,4kjp1t
731,LeBron Brousseau,62,Your_Sweet_Mother,/r/nba/comments/4kjp1t/bismack_biyombo_on_getting_tangled_up_with_lebron/d3fh556/,d3fh556,1463973562.0,1463944762.0,"Bismack Biyombo on Getting Tangled up With LeBron: ""I get fouled pretty much the same way and I don't fall on the ground badly""",1093,4kjp1t
732,"i always considered lebron more of a drama queen with contact than a flopper, since usually there is a foul.  but he does flop, i don't like that but not much i can do.",206,go_hard_today,/r/nba/comments/4kjp1t/bismack_biyombo_on_getting_tangled_up_with_lebron/d3fh8nf/,d3fh8nf,1463973722.0,1463944922.0,"Bismack Biyombo on Getting Tangled up With LeBron: ""I get fouled pretty much the same way and I don't fall on the ground badly""",1093,4kjp1t
733,Big Business,21,Jonas_Valanciunas,/r/nba/comments/4kjp1t/bismack_biyombo_on_getting_tangled_up_with_lebron/d3ff7cq/,d3ff7cq,1463970375.0,1463941575.0,"Bismack Biyombo on Getting Tangled up With LeBron: ""I get fouled pretty much the same way and I don't fall on the ground badly""",1093,4kjp1t
734,"Lmao, I'm really liking these guys finally starting to call Bron out on his bullshit these past couple seasons. ",495,JMD__,/r/nba/comments/4kjp1t/bismack_biyombo_on_getting_tangled_up_with_lebron/d3fez6i/,d3fez6i,1463970004.0,1463941204.0,"Bismack Biyombo on Getting Tangled up With LeBron: ""I get fouled pretty much the same way and I don't fall on the ground badly""",1093,4kjp1t
735,"Are we talking about the play where he put his hands around LeBron's shoulders and LeBron fell?

If so, Biyombo has fallen on plays like that. It happens pretty frequently actually. He'll get an offensive rebound, hold the ball for a while, go up and get hit like that and fall to the ground.

It's perfectly normal to fall like that when you have 2 hands around your neck/shoulders that are bringing you down.

I hope we move on from this LeBron flopping thing, it's just idiotic. Lowry probably had a worse flop in this game that is getting 0 attention because he's not LeBron. LeBron has also gotten fined in the past so he's not being defended because he's the golden boy of the NBA or anything. Players barely get fines in general.

LeBron is so strong that he kind of has to flop to draw fouls, or else it will just look like nothing. Honestly, everyone flops. When LeBron flops, it's usually a foul that he exaggerates so the refs see it. Also, he's gotten a lot better at not doing it as much ever since coming back to Cleveland.",93,DeKobe-DeBryant,/r/nba/comments/4kjp1t/bismack_biyombo_on_getting_tangled_up_with_lebron/d3fkkz4/,d3fkkz4,1463979265.0,1463950465.0,"Bismack Biyombo on Getting Tangled up With LeBron: ""I get fouled pretty much the same way and I don't fall on the ground badly""",1093,4kjp1t
736,"I love you, Bismack Biyombo. Keep it real.

http://imgur.com/QmHEoCu",21,SugarBear4Real,/r/nba/comments/4kjp1t/bismack_biyombo_on_getting_tangled_up_with_lebron/d3filtx/,d3filtx,1463975981.0,1463947181.0,"Bismack Biyombo on Getting Tangled up With LeBron: ""I get fouled pretty much the same way and I don't fall on the ground badly""",1093,4kjp1t
737,The ref wasn't even aware what was happening until lebron got shoved on the floor by a ghost.,123,jnfviet,/r/nba/comments/4kjcr1/the_cory_joseph_technical_foul_was_before_lebron/d3fc39h/,d3fc39h,1463965299.0,1463936499.0,The Cory Joseph technical foul was BEFORE LeBron was hit in the face.,171,4kjcr1
738,"Cory still didn't deserve a tech, unless he said something to the ref which even then is pretty soft",68,ARealKoala,/r/nba/comments/4kjcr1/the_cory_joseph_technical_foul_was_before_lebron/d3fc2cd/,d3fc2cd,1463965253.0,1463936453.0,The Cory Joseph technical foul was BEFORE LeBron was hit in the face.,171,4kjcr1
739,Y'all really think Cory Jo tried to push TT in any malicious way? They're childhood friends lmao...,45,goodbyes,/r/nba/comments/4kjcr1/the_cory_joseph_technical_foul_was_before_lebron/d3fco71/,d3fco71,1463966268.0,1463937468.0,The Cory Joseph technical foul was BEFORE LeBron was hit in the face.,171,4kjcr1
740,All that matters is that we got a GOAT level flop from LeBron.,31,yeshua1986,/r/nba/comments/4kjcr1/the_cory_joseph_technical_foul_was_before_lebron/d3fc65s/,d3fc65s,1463965431.0,1463936631.0,The Cory Joseph technical foul was BEFORE LeBron was hit in the face.,171,4kjcr1
741,Biyombo and LeBron are a lot closer sizes than I thought. Biyombo is 6'9 245 and LeBron is 6'8 250. ,151,,/r/nba/comments/4kiesd/in_the_playoffs_lebron_james_is_shooting_just_33/d3f4s9x/,d3f4s9x,1463950811.0,1463922011.0,"In the playoffs, LeBron James is shooting just 33% outside of the restricted area and 61.5% from the free throw line",434,4kiesd
