,body,score,author,permalink,comment_id,created_loc,created_utc,post_title,post_score,post_id
0,"Skip Bayless tomorrow: ""Lebron wouldn't have needed to make that if he performed better the rest of the game. He really choked the first 47 minutes.""",37,,/r/nba/comments/1akiig/lebron_go_ahead_jumper_vs_cs/c8y9nx3/,c8y9nx3,1363693886.0,1363665086.0,Lebron go ahead jumper vs C's,228,1akiig
1,Can I get a video of him on the lebron game winner?,24,eru88,/r/nba/comments/1akfiu/tommy_heinsohn_reaction_to_lebron_being_called/c8y8m5d/,c8y8m5d,1363690896.0,1363662096.0,Tommy Heinsohn Reaction to LeBron Being Called For A Foul,25,1akfiu
2,Brandon Knight better send Jason Terry a thank you card.,207,DrFury,/r/nba/comments/1aka0r/lebron_goes_deandre_jordan_on_jason_terry/c8y64n8/,c8y64n8,1363684084.0,1363655284.0,Lebron goes DeAndre Jordan on Jason Terry,985,1aka0r
3,"http://i.imgur.com/pYdIHzr.jpg


EDIT: Just saw this analogy on ESPN and thought it was very fitting

""That play with four Heat players around Jason, passing the ball to each other to finally give to Lebron to kill it, reminded me of a pack of hungry wolves chasing a poor rabbit that had nowhere to go""",89,alphyc,/r/nba/comments/1aka0r/lebron_goes_deandre_jordan_on_jason_terry/c8y9jfr/,c8y9jfr,1363693513.0,1363664713.0,Lebron goes DeAndre Jordan on Jason Terry,985,1aka0r
4,Like watching a stray dog run in front of an incoming train. ,82,WalrusRider,/r/nba/comments/1aka0r/lebron_goes_deandre_jordan_on_jason_terry/c8y6dox/,c8y6dox,1363684798.0,1363655998.0,Lebron goes DeAndre Jordan on Jason Terry,985,1aka0r
5,[OH MY GOD](http://www.ibreak4bacon.com/wp-content/uploads/2009/08/Black_kid_wrestling_shock.gif),75,sonickarma,/r/nba/comments/1aka0r/lebron_goes_deandre_jordan_on_jason_terry/c8y77qk/,c8y77qk,1363687113.0,1363658313.0,Lebron goes DeAndre Jordan on Jason Terry,985,1aka0r
6,"https://twitter.com/jadande/status/313818604015603713

""The NBA should rescind that technical on LeBron. He was just standing by the grave, paying his last respects."" - J.A. Adande",589,Chouzard,/r/nba/comments/1aka0r/lebron_goes_deandre_jordan_on_jason_terry/c8y684i/,c8y684i,1363684363.0,1363655563.0,Lebron goes DeAndre Jordan on Jason Terry,985,1aka0r
7,"https://twitter.com/deandrejordan/status/313829209028038656 

""mmm touché sir...touché. lol"" - DeAndre Jordan",53,Americube,/r/nba/comments/1aka0r/lebron_goes_deandre_jordan_on_jason_terry/c8y72ow/,c8y72ow,1363686727.0,1363657927.0,Lebron goes DeAndre Jordan on Jason Terry,985,1aka0r
8,http://i.imgur.com/8VFpVP3.gif,104,Imperial_Panda,/r/nba/comments/1aka0r/lebron_goes_deandre_jordan_on_jason_terry/c8y945m/,c8y945m,1363692291.0,1363663491.0,Lebron goes DeAndre Jordan on Jason Terry,985,1aka0r
9,Some technicals are just worth it.,321,redbrick,/r/nba/comments/1aka0r/lebron_goes_deandre_jordan_on_jason_terry/c8y66o7/,c8y66o7,1363684243.0,1363655443.0,Lebron goes DeAndre Jordan on Jason Terry,985,1aka0r
10,"[I didn't create this, but Paul Pierce's (fake) reaction.](https://pbs.twimg.com/media/BFsE-aXCQAAwssL.jpg)
",43,BlueGrizzlies,/r/nba/comments/1aka0r/lebron_goes_deandre_jordan_on_jason_terry/c8yb91s/,c8yb91s,1363699440.0,1363670640.0,Lebron goes DeAndre Jordan on Jason Terry,985,1aka0r
11,LBJ knocked the Championship Trophy tat off Terry's arm with this one.,107,vuko23,/r/nba/comments/1aka0r/lebron_goes_deandre_jordan_on_jason_terry/c8y6ghy/,c8y6ghy,1363685010.0,1363656210.0,Lebron goes DeAndre Jordan on Jason Terry,985,1aka0r
12,[I guess it's just a Miami thing.](http://assets.sbnation.com/assets/2336467/daubomb.gif),92,pcgamertemp,/r/nba/comments/1ahb5j/bosh_punches_lebron_in_the_jaw_for_newest_video/c8xgkr4/,c8xgkr4,1363587569.0,1363558769.0,Bosh punches LeBron in the jaw for newest video bomb.  These guys are crazy!,174,1ahb5j
13,"Obligatory ""how anyone can hate Chris Bosh"" comment, when clearly nobody hates him",26,berluskony,/r/nba/comments/1ahb5j/bosh_punches_lebron_in_the_jaw_for_newest_video/c8xh837/,c8xh837,1363589754.0,1363560954.0,Bosh punches LeBron in the jaw for newest video bomb.  These guys are crazy!,174,1ahb5j
14,[Sooooo much fun.](http://i.imgur.com/tiA9q.gif),61,dwade420,/r/nba/comments/1ahb5j/bosh_punches_lebron_in_the_jaw_for_newest_video/c8xe8h4/,c8xe8h4,1363579818.0,1363551018.0,Bosh punches LeBron in the jaw for newest video bomb.  These guys are crazy!,174,1ahb5j
15,Lmao what a flop by lebron. Bosh didn't even touch him.....,39,noobeater,/r/nba/comments/1ahb5j/bosh_punches_lebron_in_the_jaw_for_newest_video/c8xgw81/,c8xgw81,1363588628.0,1363559828.0,Bosh punches LeBron in the jaw for newest video bomb.  These guys are crazy!,174,1ahb5j
16,"""Haha, I'm joking, that's just a joke, we like to have fun here"" - Chris Bosh",51,1252739929337,/r/nba/comments/1ahb5j/bosh_punches_lebron_in_the_jaw_for_newest_video/c8xefge/,c8xefge,1363580455.0,1363551655.0,Bosh punches LeBron in the jaw for newest video bomb.  These guys are crazy!,174,1ahb5j
17,I wonder if Perd Hapley ever gets tired of this. I doubt it. ,24,ParanoidAndroids,/r/nba/comments/1ahb5j/bosh_punches_lebron_in_the_jaw_for_newest_video/c8xfdt9/,c8xfdt9,1363583609.0,1363554809.0,Bosh punches LeBron in the jaw for newest video bomb.  These guys are crazy!,174,1ahb5j
18,[deleted],28,,/r/nba/comments/1ahb5j/bosh_punches_lebron_in_the_jaw_for_newest_video/c8xg2b6/,c8xg2b6,1363585880.0,1363557080.0,Bosh punches LeBron in the jaw for newest video bomb.  These guys are crazy!,174,1ahb5j
19,"""A nice little light snow outside, so you know, since I'm ice cold"":

[http://i.imgur.com/ObzLj5y.jpg](http://i.imgur.com/ObzLj5y.jpg)
",47,kalagula,/r/nba/comments/1ae22r/lebron_james_videobombs_chris_bosh_with_the_robot/c8wjj79/,c8wjj79,1363433070.0,1363404270.0,Lebron James videobombs Chris Bosh with the robot,281,1ae22r
20,"[If you had seen the whole interview, it seemed a little setup from the beginning, like LeBron signed on if the Heat win tonight. 
Plus when Chris Bosh stared into the camera, it freaked me out a little.](http://www.youtube.com/watch?v=6CWbFHndMlA)",30,dwade420,/r/nba/comments/1ae22r/lebron_james_videobombs_chris_bosh_with_the_robot/c8wj2rq/,c8wj2rq,1363431467.0,1363402667.0,Lebron James videobombs Chris Bosh with the robot,281,1ae22r
21,Get ready Boston.,70,FuckYouGod,/r/nba/comments/1ae22r/lebron_james_videobombs_chris_bosh_with_the_robot/c8wj28n/,c8wj28n,1363431415.0,1363402615.0,Lebron James videobombs Chris Bosh with the robot,281,1ae22r
22,"I don't care what anyone says, I love bosh",43,frimpongdingdong,/r/nba/comments/1ae22r/lebron_james_videobombs_chris_bosh_with_the_robot/c8wj956/,c8wj956,1363432089.0,1363403289.0,Lebron James videobombs Chris Bosh with the robot,281,1ae22r
23,He legally owns John Henson now.,27,Terry_Pandee,/r/nba/comments/1adxt3/lebron_james_sick_reverse_dunk_over_john_henson/c8whsrj/,c8whsrj,1363427167.0,1363398367.0,LeBron James Sick Reverse dunk over John Henson vs. Bucks,103,1adxt3
24,The team with Lebron would be better.,135,FuckYouGod,/r/nba/comments/1ac0b8/hypothetically_speaking_if_lebron_and_kevin/c8vybw7/,c8vybw7,1363351307.0,1363322507.0,"Hypothetically speaking, if Lebron and Kevin Durant switched teams, which team would be better?",20,1ac0b8
25,"I think Wade/Bosh fits KD better than Westbrook fits Lebron.

Still, its fucking Lebron.",35,cooltrainer_rob,/r/nba/comments/1ac0b8/hypothetically_speaking_if_lebron_and_kevin/c8vyfj3/,c8vyfj3,1363351675.0,1363322875.0,"Hypothetically speaking, if Lebron and Kevin Durant switched teams, which team would be better?",20,1ac0b8
26,"OKC would be better. For one, look at what LeBron was able to with a sub par Cavs team. I think LeBron brings a lot more to a team than Durant. He is a better defender and a better passer. But besides their actual playing ability I think LeBron's biggest addition to OKC would be to control Westbrook. I think LeBron would assert himself in a way tha KD does not. LeBron would control the offense and he isn't afraid to get on teamates when they do something stupid. He is always point out to his teamates where they ought to be on defense and is a great game manager. Westbrook might hate it, but I think he would fall in line 

The Heat would still be the best team in the east and one of the best team in the leauge, but I would say LeBron's team would be better.",21,D_E_S,/r/nba/comments/1ac0b8/hypothetically_speaking_if_lebron_and_kevin/c8vyr2w/,c8vyr2w,1363352878.0,1363324078.0,"Hypothetically speaking, if Lebron and Kevin Durant switched teams, which team would be better?",20,1ac0b8
27,"I was at the game... Lebron was late to the ball, it wasn't really a dunk on #6 - don't let the title fool you though.  Jrue split two defenders off the dribble and finished strong down the lane.

The sixers may stink, but give this play some love please :(",41,lolwut314,/r/nba/comments/1aa0gr/jrue_dunks_on_lebron/c8viaej/,c8viaej,1363303618.0,1363274818.0,Jrue dunks on LeBron!,98,1aa0gr
28,I remember the days where dunking on some was actually [dunking on someone](http://www.youtube.com/watch?v=srl2Bwh6A3I),25,Boxsc2,/r/nba/comments/1aa0gr/jrue_dunks_on_lebron/c8vhbel/,c8vhbel,1363300305.0,1363271505.0,Jrue dunks on LeBron!,98,1aa0gr
29,This isn't really a dunk on lebron. It's a dunk flying by lebron. Disappointing title is disappointing.,56,JarekBloodDragon,/r/nba/comments/1aa0gr/jrue_dunks_on_lebron/c8vh6rr/,c8vh6rr,1363299832.0,1363271032.0,Jrue dunks on LeBron!,98,1aa0gr
30,"> Jrue dunks near LeBron!

FTFY.",23,ccampo,/r/nba/comments/1aa0gr/jrue_dunks_on_lebron/c8vhkwc/,c8vhkwc,1363301258.0,1363272458.0,Jrue dunks on LeBron!,98,1aa0gr
31,"Big fuckin deal, I could do that in my sleep, if I was LeBron James and I was awake.",86,GalileoWasDownvoted,/r/nba/comments/1a6mgf/lebron_james_falling_down_tip_assist_to_dwyane/c8ulmu9/,c8ulmu9,1363168572.0,1363139772.0,LeBron James falling down tip assist to Dwyane Wade,162,1a6mgf
32,They have such amazing chemistry that even Walter White would be proud.,38,t_zidd,/r/nba/comments/1a6mgf/lebron_james_falling_down_tip_assist_to_dwyane/c8unzvp/,c8unzvp,1363175532.0,1363146732.0,LeBron James falling down tip assist to Dwyane Wade,162,1a6mgf
33,This Lebron guy is a pretty good tipper. ,33,24theory,/r/nba/comments/1a6mgf/lebron_james_falling_down_tip_assist_to_dwyane/c8uk3si/,c8uk3si,1363164046.0,1363135246.0,LeBron James falling down tip assist to Dwyane Wade,162,1a6mgf
34,"youre so generous, thanks for posting this",39,,/r/nba/comments/1a4g9t/will_kevin_durant_ever_win_a_ring_with_lebron/c8tzk2f/,c8tzk2f,1363084386.0,1363055586.0,Will Kevin Durant ever win a ring? (With LeBron James around?) - NBA Insider,74,1a4g9t
35,"You gotta think a guy who's already the 2nd best player in the league at 24 years of age with a young, talented team has a damn good chance to win at least one title. ",32,jamie1377,/r/nba/comments/1a4g9t/will_kevin_durant_ever_win_a_ring_with_lebron/c8tzwvi/,c8tzwvi,1363085481.0,1363056681.0,Will Kevin Durant ever win a ring? (With LeBron James around?) - NBA Insider,74,1a4g9t
36,[deleted],41,,/r/nba/comments/1a4g9t/will_kevin_durant_ever_win_a_ring_with_lebron/c8tzj5j/,c8tzj5j,1363084308.0,1363055508.0,Will Kevin Durant ever win a ring? (With LeBron James around?) - NBA Insider,74,1a4g9t
37,"Of course Durant won't win a ring. He's not that good. He can't shoot, doesn't get to the rim, doesn't hit fts or 3 point shots. KD is holding back Westbrook and that thunder team. Need to trade him ASAP for Bynum. ",117,noobeater,/r/nba/comments/1a4g9t/will_kevin_durant_ever_win_a_ring_with_lebron/c8u0114/,c8u0114,1363085838.0,1363057038.0,Will Kevin Durant ever win a ring? (With LeBron James around?) - NBA Insider,74,1a4g9t
38,"I say yes.

Remember 24 y/o Lebron? Think about how much potential Durant has.",23,,/r/nba/comments/1a4g9t/will_kevin_durant_ever_win_a_ring_with_lebron/c8tzt2v/,c8tzt2v,1363085163.0,1363056363.0,Will Kevin Durant ever win a ring? (With LeBron James around?) - NBA Insider,74,1a4g9t
39,"Durant isn't in his prime

Westbrook isn't in his prime

Ibaka(who I think will eventually become an all star caliber forward) hasn't reached his prime

I swear if they get a good c and Scott brooks develops into a better coach they are gonna be even scarier. Oh yeah,and they have picks. They're basically the 49ers of basketball right now. Young everywhere with talent to spare who lost on the grandest stage of them all..with picks.

Also,as a 49er fan,boldin.",22,kidsoda,/r/nba/comments/1a4g9t/will_kevin_durant_ever_win_a_ring_with_lebron/c8u1rxt/,c8u1rxt,1363091439.0,1363062639.0,Will Kevin Durant ever win a ring? (With LeBron James around?) - NBA Insider,74,1a4g9t
40,Why would you lay it up with LeBron trailing? ,29,yall_crazy,/r/nba/comments/1a1ulv/lebron_james_chasedown_block_pacersheat_31013/c8tch8q/,c8tch8q,1362992787.0,1362963987.0,Lebron James chasedown block Pacers-Heat 3-10-13,120,1a1ulv
41,™,48,CBInThisHo,/r/nba/comments/1a1ulv/lebron_james_chasedown_block_pacersheat_31013/c8tc1sb/,c8tc1sb,1362991395.0,1362962595.0,Lebron James chasedown block Pacers-Heat 3-10-13,120,1a1ulv
42,"I really hope the NBA pulls their heads out of their butts and gives that guy a DPOY sometime. I know stuff like dwight getting 15 rebounds and some blocks are really impressive, but Lebron's ability to totally shut down the other teams best player in crunch time while being very good at blocks and steals really deserves it at some point here, I thought he should've got it last year.",32,hurlcarl,/r/nba/comments/1a1ulv/lebron_james_chasedown_block_pacersheat_31013/c8te6ts/,c8te6ts,1362998290.0,1362969490.0,Lebron James chasedown block Pacers-Heat 3-10-13,120,1a1ulv
43,Rondo still sees those blocks in his [nightmares.](http://www.youtube.com/watch?v=WJGNkYDj_GM),52,Provid3nce,/r/nba/comments/1a1ulv/lebron_james_chasedown_block_pacersheat_31013/c8tc2az/,c8tc2az,1362991443.0,1362962643.0,Lebron James chasedown block Pacers-Heat 3-10-13,120,1a1ulv
44,Can't wait for the NBA trash talk YouTube video dude to make fun of this one,31,kaishakunin,/r/nba/comments/19yc9l/latest_videobosh_victim_lebron/c8sf9w3/,c8sf9w3,1362831658.0,1362802858.0,Latest videobosh victim: LeBron,840,19yc9l
45,CB is probably sad when he gets interviewed after the game because he hasn't figured out how to videobomb himself yet.,92,IanicRR,/r/nba/comments/19yc9l/latest_videobosh_victim_lebron/c8sf5ag/,c8sf5ag,1362831162.0,1362802362.0,Latest videobosh victim: LeBron,840,19yc9l
46,It has been impossible for me to hate the Heat.,40,IAMAHungryHippoAMA,/r/nba/comments/19yc9l/latest_videobosh_victim_lebron/c8sh12r/,c8sh12r,1362839387.0,1362810587.0,Latest videobosh victim: LeBron,840,19yc9l
47,HOW CAN YOU HATE THIS GUY?! I mean honestly...oh and while I'm here FUCK LIL' WAYNE. ,116,AfghanJesus,/r/nba/comments/19yc9l/latest_videobosh_victim_lebron/c8sfk80/,c8sfk80,1362832790.0,1362803990.0,Latest videobosh victim: LeBron,840,19yc9l
48,"I loving how simiplicities the interviewmen are reactioning to Christopher Robin Anthony Jonas Quinn Josephine Bosh videosploding them yets agains.  ""Oh looking over theres it's Christopher Robinson Corduroy Elias Miguel Robert Bosh how mundanes"" they sayings and barely even grinnings to themselves because they are antiamateurs and they can't showings that they are laughings on the imagotron but they are laughings on the insides because Christopher Johannes Guadalupe Marcus Edward Bosh is is hilariously.

:)",177,OreosOnFire,/r/nba/comments/19yc9l/latest_videobosh_victim_lebron/c8sezsx/,c8sezsx,1362830577.0,1362801777.0,Latest videobosh victim: LeBron,840,19yc9l
49,Anyone else think they look hideous? ,29,,/r/nba/comments/19wgk8/my_cousin_found_him_these_limited_edition_lebron/c8rxpwk/,c8rxpwk,1362761201.0,1362732401.0,"My cousin found him these Limited Edition LeBron X - Cork Edition, I am pretty jealous.",40,19wgk8
50,LeBron going for his second ring. ,245,Naota650,/r/nba/comments/19vpxq/lebron_james_will_get_married_to_his_long_time/c8rq0a0/,c8rq0a0,1362732601.0,1362703801.0,"LeBron James will get married to his long time girlfriend in September.  Here, have an invitation.",368,19vpxq
51,"not a date

save the WEEKEND.

party to end all parties",49,blueboybob,/r/nba/comments/19vpxq/lebron_james_will_get_married_to_his_long_time/c8rqbs5/,c8rqbs5,1362733628.0,1362704828.0,"LeBron James will get married to his long time girlfriend in September.  Here, have an invitation.",368,19vpxq
52,"Nice, happy for lebron. Anyone know the LeBron's connection to San Diego? He seems to do some offseason activities there as well",29,Ioweyounothing,/r/nba/comments/19vpxq/lebron_james_will_get_married_to_his_long_time/c8rpygq/,c8rpygq,1362732443.0,1362703643.0,"LeBron James will get married to his long time girlfriend in September.  Here, have an invitation.",368,19vpxq
53,He shoulda had the wedding in Cleveland. That way he can say that he got a ring in Cleveland. All the technicalities /shows himself out,28,BromarE115,/r/nba/comments/19vpxq/lebron_james_will_get_married_to_his_long_time/c8rs4fw/,c8rs4fw,1362739234.0,1362710434.0,"LeBron James will get married to his long time girlfriend in September.  Here, have an invitation.",368,19vpxq
54,You guys wanna get an /r/nba meet up going at his wedding? We could make t shirts. Maybe we all chip in some cash and get him a gift... maybe a basketball? I think he'd like that... ,76,SGT_756,/r/nba/comments/19vpxq/lebron_james_will_get_married_to_his_long_time/c8rqnsa/,c8rqnsa,1362734688.0,1362705888.0,"LeBron James will get married to his long time girlfriend in September.  Here, have an invitation.",368,19vpxq
55,I can just picture chris bosh in the corner of the room just dousing himself in champagne,24,SOCKS_AND_SLIDES,/r/nba/comments/19vpxq/lebron_james_will_get_married_to_his_long_time/c8rt3ep/,c8rt3ep,1362742155.0,1362713355.0,"LeBron James will get married to his long time girlfriend in September.  Here, have an invitation.",368,19vpxq
56,"Something relevant:

To me, LeBron's personal life and off the court personality and behaviour makes him a great role model.  He knows what to say, hangs out around a good people, a dedicated father from what I see, he's been with his girlfriend for about twelve years and never once heard anything about their relationship.  Girls probably throw themselves at LeBron and other superstars, some players won't have that control over their ""urges"" (Ex: Kobe...still one of my favourite players), but LeBron seems to be able to just focus on basketball and his family...also making business with Warren Buffet and Bill Gates.  If beautiful girls came at me, I probably couldnt be like LeBron.

On the other hand, his girlfriend Savannah is probably a great lady, being able to trust LeBron and make LeBron want to be with only her.  There are always two in a relationship and both of them seem to be on the path everyone dream of (relationship wise).

LeBron has had a great career and is continuing his greatness on and off the court.  I just want congratulate a pretty good role model.",65,nowayyyman,/r/nba/comments/19vpxq/lebron_james_will_get_married_to_his_long_time/c8rq55k/,c8rq55k,1362733029.0,1362704229.0,"LeBron James will get married to his long time girlfriend in September.  Here, have an invitation.",368,19vpxq
57,"Ugh, undrafted rookie vs the MVP.... I hate to be a sore loser, but ""NOT THIS FUCKING GUY""",70,,/r/nba/comments/19tkxk/lebron_james_game_winner_vs_magic/c8r6fo4/,c8r6fo4,1362655345.0,1362626545.0,Lebron James game winner vs. Magic,260,19tkxk
58,"Props to Orlando for playing such a close game. And props to Nikola. Dude is dropping Barbara Walters games out there. And when I say Barbara Walters, I mean 20/20 games.  ",50,,/r/nba/comments/19tkxk/lebron_james_game_winner_vs_magic/c8r78pp/,c8r78pp,1362657688.0,1362628888.0,Lebron James game winner vs. Magic,260,19tkxk
59,Disregard wins; acquire ping pong balls.,50,,/r/nba/comments/19tkxk/lebron_james_game_winner_vs_magic/c8r6t33/,c8r6t33,1362656411.0,1362627611.0,Lebron James game winner vs. Magic,260,19tkxk
60,"Lebron is playing like my created nba 2k player, L'Carpetron Dookmarriot, whose stats are all maxed out to 99",106,lrofe24,/r/nba/comments/19tkxk/lebron_james_game_winner_vs_magic/c8r6fxv/,c8r6fxv,1362655367.0,1362626567.0,Lebron James game winner vs. Magic,260,19tkxk
61,http://i.imgur.com/nD4fL.jpg,77,A_Slow_Descent,/r/nba/comments/19tkxk/lebron_james_game_winner_vs_magic/c8r71eo/,c8r71eo,1362657091.0,1362628291.0,Lebron James game winner vs. Magic,260,19tkxk
62,"Mr. Jordan, LeBron went left. ",184,OctoberProject,/r/nba/comments/19tkxk/lebron_james_game_winner_vs_magic/c8r65fs/,c8r65fs,1362654517.0,1362625717.0,Lebron James game winner vs. Magic,260,19tkxk
63,[Hell yeah](http://assets.sbnation.com/assets/2178399/lebronyeah.gif),34,brawnkowsky,/r/nba/comments/19tkxk/lebron_james_game_winner_vs_magic/c8r654c/,c8r654c,1362654493.0,1362625693.0,Lebron James game winner vs. Magic,260,19tkxk
64,Really can there be any other players that begin to approach Lebron in the MVP race? ,47,TenTitanTiger,/r/nba/comments/19tkxk/lebron_james_game_winner_vs_magic/c8r66l5/,c8r66l5,1362654613.0,1362625813.0,Lebron James game winner vs. Magic,260,19tkxk
65,"It's scary because now they are winning games they have no business winning. They let that one slip away to the Magic and still pulled it out.

Ain't nothing Lebron can't do at this point.",50,IanicRR,/r/nba/comments/19tkxk/lebron_james_game_winner_vs_magic/c8r665v/,c8r665v,1362654576.0,1362625776.0,Lebron James game winner vs. Magic,260,19tkxk
66,"""How does he NOT give the kid his jersey?? Absolutely classless.  Jordan would have given the kid a piggyback ride around the court and clubhouse access for life.""  -Skip",105,KnickedUp,/r/nba/comments/19sn7f/lebron_james_introduces_norris_cole_to_jayz/c8r0b76/,c8r0b76,1362636820.0,1362608020.0,Lebron James introduces Norris Cole to Jay-Z,110,19sn7f
67,come here lil nigga... this is Jay Z,80,elnegro23,/r/nba/comments/19sn7f/lebron_james_introduces_norris_cole_to_jayz/c8r0dah/,c8r0dah,1362636988.0,1362608188.0,Lebron James introduces Norris Cole to Jay-Z,110,19sn7f
68,"One day Lebron will just do his post game interview with an oak leaf over his dangle.

And then give that leaf away after the interview.",52,robotusson,/r/nba/comments/19sn7f/lebron_james_introduces_norris_cole_to_jayz/c8qyzc5/,c8qyzc5,1362633056.0,1362604256.0,Lebron James introduces Norris Cole to Jay-Z,110,19sn7f
69,Damn give the kid your socks too,24,dwade420,/r/nba/comments/19sn7f/lebron_james_introduces_norris_cole_to_jayz/c8qyd4i/,c8qyd4i,1362631282.0,1362602482.0,Lebron James introduces Norris Cole to Jay-Z,110,19sn7f
70,"There is a funny story Magic Johnson tells about the 92 Dream Team.  They were on the bus bragging about who knew the most famous person.  Jordan said he knew Janet Jackson, but no one believed him. So he calls her with whatever kind of phone they had available back then and left a message saying that MJ called.  She called right back 5 minutes later and that ended the debate.",21,,/r/nba/comments/19sn7f/lebron_james_introduces_norris_cole_to_jayz/c8r15gt/,c8r15gt,1362639308.0,1362610508.0,Lebron James introduces Norris Cole to Jay-Z,110,19sn7f
71,I see an itsreal85 video coming from this.,29,Raja101,/r/nba/comments/19sn7f/lebron_james_introduces_norris_cole_to_jayz/c8qy6bo/,c8qy6bo,1362630727.0,1362601927.0,Lebron James introduces Norris Cole to Jay-Z,110,19sn7f
72,I love that he misses two straight free throws in the midst of an otherwise ridiculous shooting stretch.,38,iantheaardvark,/r/nba/comments/19ri1y/lebron_james_16_points_in_2_minutes_game_minutes/c8qo6yq/,c8qo6yq,1362585064.0,1362556264.0,LeBron James - 16 points in 2 minutes (game minutes). Always good to rewatch this.,85,19ri1y
73,Can't even do this with Lebron in a videogame,26,Icecream_truckdriver,/r/nba/comments/19ri1y/lebron_james_16_points_in_2_minutes_game_minutes/c8qo6om/,c8qo6om,1362585013.0,1362556213.0,LeBron James - 16 points in 2 minutes (game minutes). Always good to rewatch this.,85,19ri1y
74,This is fucked up..,42,,/r/nba/comments/19ri1y/lebron_james_16_points_in_2_minutes_game_minutes/c8qnzh9/,c8qnzh9,1362583842.0,1362555042.0,LeBron James - 16 points in 2 minutes (game minutes). Always good to rewatch this.,85,19ri1y
75,Looks like a lot of NBA players are upset. Stern and his crew are so inconsistent,40,Oaysis,/r/nba/comments/19qi33/lebron_tweets_about_the_supposed_double_standard/c8qen2a/,c8qen2a,1362552792.0,1362523992.0,Lebron tweets about the supposed double standard regarding Ibaka's and DWade's penalties.,63,19qi33
76,"I just love how he referred to it as a ""groin altercation"" instead of a kick in the nuts.",48,thatmandem,/r/nba/comments/19qi33/lebron_tweets_about_the_supposed_double_standard/c8qeav3/,c8qeav3,1362551849.0,1362523049.0,Lebron tweets about the supposed double standard regarding Ibaka's and DWade's penalties.,63,19qi33
77,"That is certainly a strange tome, I agree Lebron.",23,stupid_sexyflanders,/r/nba/comments/19qi33/lebron_tweets_about_the_supposed_double_standard/c8qet27/,c8qet27,1362553274.0,1362524474.0,Lebron tweets about the supposed double standard regarding Ibaka's and DWade's penalties.,63,19qi33
78,LOL it looks so weird...,23,broompunch,/r/nba/comments/19ppmr/lebron_is_tough_to_tangle_up/c8q8xbl/,c8q8xbl,1362537171.0,1362508371.0,LeBron is tough to tangle up,88,19ppmr
79,"As soon as I saw Sex.com offers Kobe $5 million, I automatically assumed it was for a porno.

",194,USP123,/r/nba/comments/19oz8z/sexcom_offers_kobe_5_million_to_enter_the_2014/c8q09xd/,c8q09xd,1362493724.0,1362464924.0,Sex.com offers Kobe $5 Million to enter the 2014 NBA Slam Dunk Contest (with LeBron James),174,19oz8z
