,body,score,author,permalink,comment_id,created_loc,created_utc,post_title,post_score,post_id
0,"But seriously, why did Under Armour think it was a good idea to release those shoes?",28,sgt_potatopants,/r/nba/comments/4nfsk1/spoiler_alert_nba_recap_61016_6_key_takeaways/d43jlw4/,d43jlw4,1465590829.0,1465562029.0,"[Spoiler Alert] NBA Recap: 6/10/16 - 6 key takeaways going into Game 4, Meh Curry deserves LeBron-like criticism, Warriors can't count on Curry, The resurrection of Kyrie Irving, Dump Kevin Love in Lake Erie?, Highlights, Recaps, Podcasts, and more",63,4nfsk1
1,"He obviously does get fouled without calls pretty often, but maybe defenders are in better position to meet him at the rim now without fouling since they don't have to respect his jumper at all.",159,Fsharp88,/r/nba/comments/4nenhn/lebron_is_averaging_a_significantly_lower_amount/d439eeh/,d439eeh,1465560978.0,1465532178.0,LeBron is averaging a significantly lower amount of FTA in the playoffs despite a significantly higher amount of shots within 3 feet. Can we acknowledge that he's getting the Shaq treatment?,385,4nenhn
2,"Haven't looked at putbacks and post attempts, but the numbers for drives have been discussed on this sub ad nauseam.

NBA.com puts up the stats broken down by play type.

LeBron is averaging the 10th most drives per game in the playoffs.  Of the 9 players driving more than him, he is drawing fouls at a lower rate than only 3 of those players.  Of players in the top 20 for most drives per game, he is drawing fouls at a lower rate than only 4 of those players.

He may not be getting a ton of calls, but he's still getting calls more frequently than almost anybody else in the playoffs.

",327,nihcnayr,/r/nba/comments/4nenhn/lebron_is_averaging_a_significantly_lower_amount/d43ai3p/,d43ai3p,1465563311.0,1465534511.0,LeBron is averaging a significantly lower amount of FTA in the playoffs despite a significantly higher amount of shots within 3 feet. Can we acknowledge that he's getting the Shaq treatment?,385,4nenhn
3,"> I know this sub is over LeBron

wut",55,fuckitiroastedyou,/r/nba/comments/4nenhn/lebron_is_averaging_a_significantly_lower_amount/d43a8wl/,d43a8wl,1465562743.0,1465533943.0,LeBron is averaging a significantly lower amount of FTA in the playoffs despite a significantly higher amount of shots within 3 feet. Can we acknowledge that he's getting the Shaq treatment?,385,4nenhn
4,"lebron does get hit, but he initiates a lot of the contact, too. that's why it seems like he's getting a lot of no calls. the refs have definitely missed some, but nothing i would call egregious.",56,moe1984,/r/nba/comments/4nenhn/lebron_is_averaging_a_significantly_lower_amount/d439yoc/,d439yoc,1465562136.0,1465533336.0,LeBron is averaging a significantly lower amount of FTA in the playoffs despite a significantly higher amount of shots within 3 feet. Can we acknowledge that he's getting the Shaq treatment?,385,4nenhn
5,They should call every travel and elbow too,49,Theingloriousak2,/r/nba/comments/4nenhn/lebron_is_averaging_a_significantly_lower_amount/d439i3v/,d439i3v,1465561182.0,1465532382.0,LeBron is averaging a significantly lower amount of FTA in the playoffs despite a significantly higher amount of shots within 3 feet. Can we acknowledge that he's getting the Shaq treatment?,385,4nenhn
6,Maybe it would be different if LeBron loved nuggets. ,22,BearsNecessity,/r/nba/comments/4ncpxi/some_stuff_ethan_skolnick_mentioned_regarding_the/d42rvj3/,d42rvj3,1465533024.0,1465504224.0,Some stuff Ethan Skolnick mentioned regarding the LeBron/Love dynamic is pretty interesting,28,4ncpxi
7,Extrovert vs Introvert. Different people function differently and that's okay. ,29,blazinflames666,/r/nba/comments/4ncpxi/some_stuff_ethan_skolnick_mentioned_regarding_the/d42s5r7/,d42s5r7,1465533400.0,1465504600.0,Some stuff Ethan Skolnick mentioned regarding the LeBron/Love dynamic is pretty interesting,28,4ncpxi
8,"If Kevin Love plays and they lose Game 4. Oh my, the discussions will be fun.",579,khkim,/r/nba/comments/4nbzj8/lebron_james_we_cant_afford_to_go_down_31_and_go/d42rcm4/,d42rcm4,1465532328.0,1465503528.0,"LeBron James: ""We can't afford to go down 3-1 and go back to their building. It's still do or die for us""",1518,4nbzj8
9,I don't even know what to think anymore after last night. If anything I would assume tomorrow's game will be quite close. ,188,JacobCrim88,/r/nba/comments/4nbzj8/lebron_james_we_cant_afford_to_go_down_31_and_go/d42l6ab/,d42l6ab,1465524457.0,1465495657.0,"LeBron James: ""We can't afford to go down 3-1 and go back to their building. It's still do or die for us""",1518,4nbzj8
10,Reminds me of [this standup bit](https://www.youtube.com/watch?v=HcZOaOG0YOk),373,,/r/nba/comments/4nbzj8/lebron_james_we_cant_afford_to_go_down_31_and_go/d42khit/,d42khit,1465523573.0,1465494773.0,"LeBron James: ""We can't afford to go down 3-1 and go back to their building. It's still do or die for us""",1518,4nbzj8
11,Gonna be do or die if they win as well going into game 5,180,vincec135,/r/nba/comments/4nbzj8/lebron_james_we_cant_afford_to_go_down_31_and_go/d42kh9r/,d42kh9r,1465523564.0,1465494764.0,"LeBron James: ""We can't afford to go down 3-1 and go back to their building. It's still do or die for us""",1518,4nbzj8
12,"All the home games are absolute must wins for the Cavs.  Lose any of them and the series is over.  

As far as Game 5 or 7, Cavs are obviously underdogs, but I don't think Game 5 is easier to win than Game 7 or vice versa.  It really comes down to the outside shot.  If the Cavs are hitting outside shots in one of those games, then they have a chance to win.  ",34,S629A,/r/nba/comments/4nbzj8/lebron_james_we_cant_afford_to_go_down_31_and_go/d42vbpw/,d42vbpw,1465537762.0,1465508962.0,"LeBron James: ""We can't afford to go down 3-1 and go back to their building. It's still do or die for us""",1518,4nbzj8
13,Draymond saying it will be like cherries and pickles for game 4.,44,yalogin,/r/nba/comments/4nbzj8/lebron_james_we_cant_afford_to_go_down_31_and_go/d42lt4f/,d42lt4f,1465525264.0,1465496464.0,"LeBron James: ""We can't afford to go down 3-1 and go back to their building. It's still do or die for us""",1518,4nbzj8
14,Shouldn't every game be do or die in the finals?,41,thricethefun,/r/nba/comments/4nbzj8/lebron_james_we_cant_afford_to_go_down_31_and_go/d42kftj/,d42kftj,1465523516.0,1465494716.0,"LeBron James: ""We can't afford to go down 3-1 and go back to their building. It's still do or die for us""",1518,4nbzj8
15,Lil Kev hurting for this one.,346,stalequinoa,/r/nba/comments/4nbocw/i_give_the_game_ball_to_rj_starting_for_kevin_he/d42he6q/,d42he6q,1465519664.0,1465490864.0,"""I give the game ball to RJ -- starting for Kevin. He came out with so much aggression."" - LeBron James.",581,4nbocw
16,Mark Jackson says that the Cavs should start RJ over Love. Thoughts?,112,rck_james_bitch,/r/nba/comments/4nbocw/i_give_the_game_ball_to_rj_starting_for_kevin_he/d42i89b/,d42i89b,1465520724.0,1465491924.0,"""I give the game ball to RJ -- starting for Kevin. He came out with so much aggression."" - LeBron James.",581,4nbocw
17,"RIP to Love's confidence, or what was left of it ",243,migcal,/r/nba/comments/4nbocw/i_give_the_game_ball_to_rj_starting_for_kevin_he/d42hk95/,d42hk95,1465519876.0,1465491076.0,"""I give the game ball to RJ -- starting for Kevin. He came out with so much aggression."" - LeBron James.",581,4nbocw
18,"Even though I expect Kevin Love to play tomorrow, I think RJ is going to play a lot of minutes in the second half especially in the fourth (with Love on the bench).",27,iTxTi,/r/nba/comments/4nbocw/i_give_the_game_ball_to_rj_starting_for_kevin_he/d42hjsd/,d42hjsd,1465519860.0,1465491060.0,"""I give the game ball to RJ -- starting for Kevin. He came out with so much aggression."" - LeBron James.",581,4nbocw
19,"The future Laker playing in these Finals is not Harrison Barnes, or Festus Ezeli, or Kevin Love, or even LeBron James. 

[It's Richard Jefferson](http://i.imgur.com/Mn19nr1.jpg)",61,rjvir,/r/nba/comments/4nbocw/i_give_the_game_ball_to_rj_starting_for_kevin_he/d42j8ic/,d42j8ic,1465522004.0,1465493204.0,"""I give the game ball to RJ -- starting for Kevin. He came out with so much aggression."" - LeBron James.",581,4nbocw
20,How can the lowest guy on the totem pole be giving out the game ball all willy nilly?,86,harleq01,/r/nba/comments/4nbocw/i_give_the_game_ball_to_rj_starting_for_kevin_he/d42hmp4/,d42hmp4,1465519961.0,1465491161.0,"""I give the game ball to RJ -- starting for Kevin. He came out with so much aggression."" - LeBron James.",581,4nbocw
21,"When they asked LeBron why he murdered that rim he responded. ""I wanted to destroy something beautiful""",810,fear865,/r/nba/comments/4nbdsh/kyrie_on_his_lob_pass_to_lebron_being_too_high_i/d42egt9/,d42egt9,1465515889.0,1465487089.0,"Kyrie on his lob pass to LeBron being too high: ""I wanted to see something great""",1267,4nbdsh
22,"I remember seeing some interview during March Madness asking college players what made a good alley-oop. One of the answers was ""a bad pass."" Seems pretty true. ",169,ognut,/r/nba/comments/4nbdsh/kyrie_on_his_lob_pass_to_lebron_being_too_high_i/d42pt89/,d42pt89,1465530340.0,1465501540.0,"Kyrie on his lob pass to LeBron being too high: ""I wanted to see something great""",1267,4nbdsh
23,Reminds me of what some of the team USA members were saying when practicing with Carter. [They kept lobbing it higher and at weird angles and he went up to jam all of them.](http://espn.go.com/espn/feature/story/_/id/13713188/after-15-years-saw-vince-carter-leap-frederic-weis-sydney-believe-witnessed),211,PormanNowell,/r/nba/comments/4nbdsh/kyrie_on_his_lob_pass_to_lebron_being_too_high_i/d42lmpc/,d42lmpc,1465525038.0,1465496238.0,"Kyrie on his lob pass to LeBron being too high: ""I wanted to see something great""",1267,4nbdsh
24,"How many players do you think could have completed that oop? Not 3 seconds prior he was on the floor, 27 ft away, yet he still got high enough to make that happen. ",170,Cury_Us,/r/nba/comments/4nbdsh/kyrie_on_his_lob_pass_to_lebron_being_too_high_i/d42pf5j/,d42pf5j,1465529845.0,1465501045.0,"Kyrie on his lob pass to LeBron being too high: ""I wanted to see something great""",1267,4nbdsh
25,#,230,,/r/nba/comments/4nbdsh/kyrie_on_his_lob_pass_to_lebron_being_too_high_i/d42j2kf/,d42j2kf,1465521796.0,1465492996.0,"Kyrie on his lob pass to LeBron being too high: ""I wanted to see something great""",1267,4nbdsh
26,"Translation: ""I fucked up but LeBron is such a beast he threw it down anyway.""",138,ed_1138,/r/nba/comments/4nbdsh/kyrie_on_his_lob_pass_to_lebron_being_too_high_i/d42njvc/,d42njvc,1465527440.0,1465498640.0,"Kyrie on his lob pass to LeBron being too high: ""I wanted to see something great""",1267,4nbdsh
27,Damn Lebrons fit is on point. That color combo is beautiful,32,MF_Doomed,/r/nba/comments/4nbdsh/kyrie_on_his_lob_pass_to_lebron_being_too_high_i/d42q0tm/,d42q0tm,1465530607.0,1465501807.0,"Kyrie on his lob pass to LeBron being too high: ""I wanted to see something great""",1267,4nbdsh
28,"At first, I was like 'wtf is this shit I've seen this already'

Then, when he started flying it actually made me jump.

Finally, I am now convinced that this is actually what happened and the media is trying to lie to us to hide the fact that LeBron is not human.

Have you seen LeBron and an alien being in the same room? I dont think so.",50,whatisitbro,/r/nba/comments/4nbdnj/bleacher_report_with_the_best_view_of_the_lebron/d42k5c5/,d42k5c5,1465523157.0,1465494357.0,Bleacher Report with the best view of the LeBron dunk,254,4nbdnj
29,Wonder what Draymond was saying afterwards.,42,PhiladelphiaFish,/r/nba/comments/4navdv/lebron_blows_by_draymond_green_for_the_and1_slam/d429kv6/,d429kv6,1465509158.0,1465480358.0,LeBron blows by Draymond Green for the And-1 Slam!,308,4navdv
30,"[This could have been a similar play to Delly vs Iguodala.](http://i.imgur.com/aL9QRSy.png) 

Draymond too got all ball. 
",116,Kashmir33,/r/nba/comments/4navdv/lebron_blows_by_draymond_green_for_the_and1_slam/d42boj4/,d42boj4,1465512212.0,1465483412.0,LeBron blows by Draymond Green for the And-1 Slam!,308,4navdv
31,I love this version of LeBron. He was in total Fuck You mode. ,37,euph31,/r/nba/comments/4navdv/lebron_blows_by_draymond_green_for_the_and1_slam/d42drts/,d42drts,1465514987.0,1465486187.0,LeBron blows by Draymond Green for the And-1 Slam!,308,4navdv
32,FIRST TEAM ALL DEFENSE.,29,JohnnyLugnuts,/r/nba/comments/4navdv/lebron_blows_by_draymond_green_for_the_and1_slam/d42ck0r/,d42ck0r,1465513399.0,1465484599.0,LeBron blows by Draymond Green for the And-1 Slam!,308,4navdv
33,"One of the few times LeBron didn't have to deal with any additional Warriors players on a drive to the rim. If his teammates keep running decoy actions off the ball like in this play (instead of just standing around like they have the majority of this series), it'll make Cleveland's inevitable isolations a lot more palatable.",21,,/r/nba/comments/4navdv/lebron_blows_by_draymond_green_for_the_and1_slam/d42bs2c/,d42bs2c,1465512348.0,1465483548.0,LeBron blows by Draymond Green for the And-1 Slam!,308,4navdv
34,"Great stuff, but JR should be saving Kevin Love and leaving him next to the burning building.",134,iTxTi,/r/nba/comments/4nasuc/lebron_gathers_the_crew_to_stand_up_against_the/d42bgcv/,d42bgcv,1465511894.0,1465483094.0,LeBron gathers the crew to stand up against the bullies. (via BleacherReport),689,4nasuc
35,Would've been perfect if Mozgov was the one wrestling a bear.,165,,/r/nba/comments/4nasuc/lebron_gathers_the_crew_to_stand_up_against_the/d42a8xn/,d42a8xn,1465510164.0,1465481364.0,LeBron gathers the crew to stand up against the bullies. (via BleacherReport),689,4nasuc
36,"Just what I needed for a morning hangover, more laughter haha. This was pretty okay",45,krazymofo421,/r/nba/comments/4nasuc/lebron_gathers_the_crew_to_stand_up_against_the/d429bki/,d429bki,1465508752.0,1465479952.0,LeBron gathers the crew to stand up against the bullies. (via BleacherReport),689,4nasuc
37,Kevin Love is gonna have to photoshop himself in again :(,34,VizzyXV,/r/nba/comments/4nasuc/lebron_gathers_the_crew_to_stand_up_against_the/d42a3sx/,d42a3sx,1465509950.0,1465481150.0,LeBron gathers the crew to stand up against the bullies. (via BleacherReport),689,4nasuc
38,My god this is fantastic. JR putting down Blatt and patting him on the head is classic. Young Lebron being in a full sweat lather is great too.,29,KnickedUp,/r/nba/comments/4nasuc/lebron_gathers_the_crew_to_stand_up_against_the/d429pqm/,d429pqm,1465509368.0,1465480568.0,LeBron gathers the crew to stand up against the bullies. (via BleacherReport),689,4nasuc
39,I nearly spit out my drink when Lou turned into the shot with those blond curls lmfaooooo too early for this shit fam,22,DefinitelyNot_Bgross,/r/nba/comments/4nasuc/lebron_gathers_the_crew_to_stand_up_against_the/d42bpz0/,d42bpz0,1465512265.0,1465483465.0,LeBron gathers the crew to stand up against the bullies. (via BleacherReport),689,4nasuc
40,"I agree that these playoffs have been pretty boring. There's hardly been any close good games other than OKC vs GS g6.

Also love the crap tabloid stuff. Keep it coming man.",35,urgetopurge,/r/nba/comments/4nabmk/spoiler_alert_nba_recap_6916_most_boring_playoffs/d426f8t/,d426f8t,1465503291.0,1465474491.0,"[Spoiler Alert] NBA Recap: 6/9/16 - Most boring Playoffs since 2010, LeBron shines bright while Curry lays a egg and fades, The man with the Golden touch, JR Smith quotes on billboards, Looking ahead to Game 4, Highlights, Recaps, Podcasts, and more",81,4nabmk
41,"""LeBron is so jealous of Steph. Has to bully him with size since he no longer has a shot."" - my SF friend that just started watching basketball two seasons ago",99,voldewort,/r/nba/comments/4na8ty/lebron_hits_jumper_blocks_draymond_from_behind/d426ri1/,d426ri1,1465504054.0,1465475254.0,"LeBron hits jumper, blocks Draymond from behind and gets tangled up with Curry",154,4na8ty
42,"you know everyone hates on Lebron for floppin, then Curry does this shit and nobody bats an eye.

Not to mention that whenever Curry asks for a call he gets one, meanwhile Lebron could get stabbed in the paint and it would be a foul on Thompson some how",167,NebsLaw,/r/nba/comments/4na8ty/lebron_hits_jumper_blocks_draymond_from_behind/d425qlr/,d425qlr,1465501629.0,1465472829.0,"LeBron hits jumper, blocks Draymond from behind and gets tangled up with Curry",154,4na8ty
43,"[Here's the breakdown frame by frame](http://i.imgur.com/gFQrVqt.png)

Curry throws up the ""It wasn't me"" arm while simultaneously hooking Lebron with the other. Classic.",72,JPL47,/r/nba/comments/4na8ty/lebron_hits_jumper_blocks_draymond_from_behind/d424pev/,d424pev,1465498721.0,1465469921.0,"LeBron hits jumper, blocks Draymond from behind and gets tangled up with Curry",154,4na8ty
44,"Major bitch move, Curry",26,startled_panda,/r/nba/comments/4na8ty/lebron_hits_jumper_blocks_draymond_from_behind/d42a4qz/,d42a4qz,1465509990.0,1465481190.0,"LeBron hits jumper, blocks Draymond from behind and gets tangled up with Curry",154,4na8ty
45,"This is why I don't respect Curry. He does shit like this. Lebron is obviously trying to get away. And the refs always stick up for the little guy

edit: grammar.",36,GettingLostInDaSauce,/r/nba/comments/4na8ty/lebron_hits_jumper_blocks_draymond_from_behind/d427k5e/,d427k5e,1465505716.0,1465476916.0,"LeBron hits jumper, blocks Draymond from behind and gets tangled up with Curry",154,4na8ty
46,If you said all of this to me in person and you were being really drunk and loud I'd be very on board with what you're saying.,85,,/r/nba/comments/4n9hrt/a_rant_on_lebron_james_career_and_his_imapct/d41zc8q/,d41zc8q,1465480803.0,1465452003.0,A Rant on Lebron Jame's Career and His Imapct,79,4n9hrt
47,"Anytime i hear someone some bullshit reason to hate lebron, i kinda just tune out after that.",24,salmon10,/r/nba/comments/4n9hrt/a_rant_on_lebron_james_career_and_his_imapct/d4205ee/,d4205ee,1465483048.0,1465454248.0,A Rant on Lebron Jame's Career and His Imapct,79,4n9hrt
48,"ðŸ‘ŒðŸ‘ŒðŸ‘ŒðŸ‘ŒðŸ‘ŒðŸ‘ŒðŸ‘ŒðŸ‘ŒðŸ‘Œ

ðŸ‘ŒðŸ‘ŒðŸ‘ŒðŸ‘ŒðŸ‘ŒðŸ‘ŒðŸ‘ŒðŸ‘ŒðŸ‘Œ

ðŸ‘ŒðŸ‘ŒðŸ‘ŒðŸ’¯ðŸ’¯ðŸ’¯ðŸ‘ŒðŸ‘ŒðŸ‘Œ

ðŸ”¥ðŸ”¥ðŸ”¥ðŸ”¥ðŸ”¥ðŸ”¥ðŸ”¥ðŸ”¥ðŸ”¥",25,KawaiiCurrychan,/r/nba/comments/4n9hrt/a_rant_on_lebron_james_career_and_his_imapct/d41zafh/,d41zafh,1465480666.0,1465451866.0,A Rant on Lebron Jame's Career and His Imapct,79,4n9hrt
49,"Somebody in a game thread one time was saying that ""if he knew how to pass, he probaboly wouldn't turn the ball over so much"", that was pretty annoying given he's one of the best passing forwards the game has seen.",73,scmsf49,/r/nba/comments/4n9ckg/what_are_some_of_the_most_asinine_statements/d41y3h4/,d41y3h4,1465477780.0,1465448980.0,What are some of the most asinine statements you've heard about Lebron?,34,4n9ckg
50,"""Lebron James is a great athlete but not a great basketball player."" ",68,arrogantambassador_,/r/nba/comments/4n9ckg/what_are_some_of_the_most_asinine_statements/d41y3i8/,d41y3i8,1465477782.0,1465448982.0,What are some of the most asinine statements you've heard about Lebron?,34,4n9ckg
51,"""Lebron is as good as ever right now""

It's disrespectful to how special he was 2009-2013",40,Martavis,/r/nba/comments/4n9ckg/what_are_some_of_the_most_asinine_statements/d41y5gn/,d41y5gn,1465477905.0,1465449105.0,What are some of the most asinine statements you've heard about Lebron?,34,4n9ckg
52,"that he chokes lol i guess having a triple double in game 7 of a finals is something that a choker could do

i guess having 45 points in an elimination game against boston a few years back is something a choker could do 

i guess having your teams final 25 points against detroit for the win is something a choker could do ",65,,/r/nba/comments/4n9ckg/what_are_some_of_the_most_asinine_statements/d41y3ez/,d41y3ez,1465477776.0,1465448976.0,What are some of the most asinine statements you've heard about Lebron?,34,4n9ckg
53,"My dad made a pretty ridiculous comment earlier that really made me go ""WTF??"" 

He's of the old school generation. For whatever reason, he just doesn't want to give LeBron any credit. Always comparing him to MJ, Bill Russell, Larry Bird...and obviously those guys are great, but I don't know why he can't put LeBron up there with them. Like he won't even hear it even when you point out all sorts of stats that are crazy.

Anyway, I digress. So there was that one play somewhere in like the 3rd, maybe early 4th quarter, Curry was trapped in a double team and had to sort of hook pass it over two defenders. LeBron got a hand on it and poked it downcourt, but then couldn't catch up and lost it out of bounds. My dad goes ""Jordan would never do that."" And I was like...what the fuck, Jordan wouldn't have poked the ball away and not been able to catch up to it? LeBron never had full control and he just couldn't get to the ball...but my dad scoffed because apparently Jordan would've been fast enough to corral it and score. 

It was just weird. Like he ignored the crazy athletic other plays he had tonight and focused on that one thing.",23,tkykid91,/r/nba/comments/4n9ckg/what_are_some_of_the_most_asinine_statements/d41z1ge/,d41z1ge,1465480020.0,1465451220.0,What are some of the most asinine statements you've heard about Lebron?,34,4n9ckg
54,"Yeah there have been some gems but I'm pretty sure ""If the refs didn't let Lebron push off on every single one of his drives he'd be in the d-league"" takes the cake.",30,Ohio_Is_Not_That_Bad,/r/nba/comments/4n9ckg/what_are_some_of_the_most_asinine_statements/d41yjc6/,d41yjc6,1465478804.0,1465450004.0,What are some of the most asinine statements you've heard about Lebron?,34,4n9ckg
55,"Love how confident he was in his J after that disastrous first half. That's all he needs to do. Make or miss, he just needs to take them if that's what the defense gives him. They're literally wide open shots. He's not going to miss them all. ",44,t_mac1,/r/nba/comments/4n99zs/lebron_james_vs_warriors_2016_finals_32_pts_11/d41y1r1/,d41y1r1,1465477673.0,1465448873.0,"LeBron James vs Warriors 2016 Finals - 32 Pts, 11 Reb, 6 Ast, 2 Blk, BEAST!",224,4n99zs
56,"We dont compare him to his peers, we compare him to all time legends. Since he was like 16.",31,salmon10,/r/nba/comments/4n99zs/lebron_james_vs_warriors_2016_finals_32_pts_11/d41ynt5/,d41ynt5,1465479095.0,1465450295.0,"LeBron James vs Warriors 2016 Finals - 32 Pts, 11 Reb, 6 Ast, 2 Blk, BEAST!",224,4n99zs
57,when Lebron makes one jumper that's enough for him to take a heat check. Tonight it worked out for him. He really bounced back in the 2nd half after a horrible 2nd quarter,51,btbmate444,/r/nba/comments/4n99zs/lebron_james_vs_warriors_2016_finals_32_pts_11/d41xhq6/,d41xhq6,1465476453.0,1465447653.0,"LeBron James vs Warriors 2016 Finals - 32 Pts, 11 Reb, 6 Ast, 2 Blk, BEAST!",224,4n99zs
58,Best player in the league,84,cowboysfan88,/r/nba/comments/4n99zs/lebron_james_vs_warriors_2016_finals_32_pts_11/d41y7vx/,d41y7vx,1465478061.0,1465449261.0,"LeBron James vs Warriors 2016 Finals - 32 Pts, 11 Reb, 6 Ast, 2 Blk, BEAST!",224,4n99zs
59,Lebron with his midrange on is just unfair to the other team.,24,Kenya151,/r/nba/comments/4n99zs/lebron_james_vs_warriors_2016_finals_32_pts_11/d41xt7z/,d41xt7z,1465477150.0,1465448350.0,"LeBron James vs Warriors 2016 Finals - 32 Pts, 11 Reb, 6 Ast, 2 Blk, BEAST!",224,4n99zs
60,it always does seem they make their comebacks when he rests. ,69,claydavisismyhero,/r/nba/comments/4n97py/cavs_are_137_without_lebron_gsw_is_107_without/d41x07y/,d41x07y,1465475437.0,1465446637.0,Cavs are -13.7 without Lebron. GSW is -10.7 without Draymond. Without Curry? +10.8.,220,4n97py
61,[deleted],106,,/r/nba/comments/4n97py/cavs_are_137_without_lebron_gsw_is_107_without/d41wzt8/,d41wzt8,1465475413.0,1465446613.0,Cavs are -13.7 without Lebron. GSW is -10.7 without Draymond. Without Curry? +10.8.,220,4n97py
62,Also LeBron's winning percentage is 100 when there is at least one Ghostbusters commercial per break,496,iliketocookfood,/r/nba/comments/4n96sg/lebron_just_won_his_first_career_finals_game/d41wus4/,d41wus4,1465475115.0,1465446315.0,LeBron just won his first career Finals game without Dwyane Wade in the building,1692,4n96sg
63,now THIS is a dank stat ,813,themariokarters,/r/nba/comments/4n96sg/lebron_just_won_his_first_career_finals_game/d41wowa/,d41wowa,1465474816.0,1465446016.0,LeBron just won his first career Finals game without Dwyane Wade in the building,1692,4n96sg
64,Shitposting MVP,48,imeda,/r/nba/comments/4n96sg/lebron_just_won_his_first_career_finals_game/d422usr/,d422usr,1465492208.0,1465463408.0,LeBron just won his first career Finals game without Dwyane Wade in the building,1692,4n96sg
65,I'm just imaging Wade getting denied entry and standing by the entrance with security the whole game watching it on his phone.,92,buckwheat328,/r/nba/comments/4n96sg/lebron_just_won_his_first_career_finals_game/d420xaa/,d420xaa,1465485401.0,1465456601.0,LeBron just won his first career Finals game without Dwyane Wade in the building,1692,4n96sg
66,[deleted],118,,/r/nba/comments/4n96sg/lebron_just_won_his_first_career_finals_game/d423alc/,d423alc,1465493879.0,1465465079.0,LeBron just won his first career Finals game without Dwyane Wade in the building,1692,4n96sg
67,Lebron is no longer in the shadow of D-Wade's massive chin,147,ifaptwohanded,/r/nba/comments/4n96sg/lebron_just_won_his_first_career_finals_game/d41ya0i/,d41ya0i,1465478204.0,1465449404.0,LeBron just won his first career Finals game without Dwyane Wade in the building,1692,4n96sg
