,body,score,author,permalink,comment_id,created_loc,created_utc,post_title,post_score,post_id
0,Waiting for DatDissonance to show up to see how he spins this into a negative...,106,ctuck917,/r/nba/comments/3jn6ue/lebron_james_is_now_helping_akron_adults_get/cuqorxw/,cuqorxw,1441418994.0,1441390194.0,LeBron James is now helping Akron adults get their GED,621,3jn6ue
1,LEBRON JAMES WITH SOME REGARD FOR HUMAN LIFE,21,killerknives,/r/nba/comments/3jn6ue/lebron_james_is_now_helping_akron_adults_get/cur3kgq/,cur3kgq,1441444700.0,1441415900.0,LeBron James is now helping Akron adults get their GED,621,3jn6ue
2,"If Lebron ends up winning a ring with Cleveland, he'd basically be Ohio Jesus.",31,Jayang,/r/nba/comments/3jn6ue/lebron_james_is_now_helping_akron_adults_get/cuqud8m/,cuqud8m,1441427615.0,1441398815.0,LeBron James is now helping Akron adults get their GED,621,3jn6ue
3,Lebron has made it really hard to hate him. ,56,bigdogblast,/r/nba/comments/3jn6ue/lebron_james_is_now_helping_akron_adults_get/cuqoqc3/,cuqoqc3,1441418926.0,1441390126.0,LeBron James is now helping Akron adults get their GED,621,3jn6ue
4,"More like PED, amirite?
",64,,/r/nba/comments/3jn6ue/lebron_james_is_now_helping_akron_adults_get/cuqnti2/,cuqnti2,1441417567.0,1441388767.0,LeBron James is now helping Akron adults get their GED,621,3jn6ue
5,Holy crap we absolutely clobbered LeBron in about three quarters of those shots and he still made them and didn't even get the calls. Fucking amazing. ,121,Curryboy2day,/r/nba/comments/3jex93/lebron_james_finals_highlights_vs_warriors_358/cuos2qh/,cuos2qh,1441269947.0,1441241147.0,"LeBron James Finals Highlights vs Warriors - 35.8 PPG, 13.3 RPG, 8.8 APG, 1.3 SPG",233,3jex93
6,I'm still mad he didn't average 60 like he said he would if he got all those shots.,91,SonOfSkipBaeless,/r/nba/comments/3jex93/lebron_james_finals_highlights_vs_warriors_358/cuon837/,cuon837,1441260944.0,1441232144.0,"LeBron James Finals Highlights vs Warriors - 35.8 PPG, 13.3 RPG, 8.8 APG, 1.3 SPG",233,3jex93
7,"To all the people pointing out his shot percentage, do you actually play basketball and understand how fatigue impacts shot quality?",69,Jpsla,/r/nba/comments/3jex93/lebron_james_finals_highlights_vs_warriors_358/cuoth8u/,cuoth8u,1441272626.0,1441243826.0,"LeBron James Finals Highlights vs Warriors - 35.8 PPG, 13.3 RPG, 8.8 APG, 1.3 SPG",233,3jex93
8,"don't know my history well enough to say with certainty, but seems like this has to be top-three in all-time finals performances by a losing player.",51,itskerem,/r/nba/comments/3jex93/lebron_james_finals_highlights_vs_warriors_358/cuott8o/,cuott8o,1441273274.0,1441244474.0,"LeBron James Finals Highlights vs Warriors - 35.8 PPG, 13.3 RPG, 8.8 APG, 1.3 SPG",233,3jex93
9,"Insane performance. 2015 Lebron in the playoffs was incredible to watch. Shame Irving and Love were out, but still a great Finals to watch. The fact that James kept the Cavs in it as close as they were is a testament to how hard he played that series.",49,SoftShoeShuffler,/r/nba/comments/3jex93/lebron_james_finals_highlights_vs_warriors_358/cuop0ne/,cuop0ne,1441264190.0,1441235390.0,"LeBron James Finals Highlights vs Warriors - 35.8 PPG, 13.3 RPG, 8.8 APG, 1.3 SPG",233,3jex93
10,ITT: ppl who criticize LeBron who had an insane playoffs and was forced to play 48mpg in the finals ,32,BuurDown,/r/nba/comments/3jex93/lebron_james_finals_highlights_vs_warriors_358/cuowpl5/,cuowpl5,1441278616.0,1441249816.0,"LeBron James Finals Highlights vs Warriors - 35.8 PPG, 13.3 RPG, 8.8 APG, 1.3 SPG",233,3jex93
11,whis is this downvoted so heavily?,44,swfl55,/r/nba/comments/3jex93/lebron_james_finals_highlights_vs_warriors_358/cuongdd/,cuongdd,1441261354.0,1441232554.0,"LeBron James Finals Highlights vs Warriors - 35.8 PPG, 13.3 RPG, 8.8 APG, 1.3 SPG",233,3jex93
12,"the 1996-97 San Antonio Spurs

That was the year David Robinson was injured. His injury allowed them to be bad enough to luck into the #1 pick and select Tim Duncan. Present LeBron would kill that chance, and I think Spurs fans would rather have a career worth of Tim Duncan starting in 1997, rather than half a career of LeBron James. They'd still win championships, though.",346,benwalker14,/r/nba/comments/3jdlcj/historically_which_nba_team_would_benefit_the/cuocjx6/,cuocjx6,1441244280.0,1441215480.0,"Historically, which NBA team would benefit the LEAST from having present LeBron on the roster?",81,3jdlcj
13,2002-2003 Cavaliers.,26,Drak_is_Right,/r/nba/comments/3jdlcj/historically_which_nba_team_would_benefit_the/cuoqwit/,cuoqwit,1441267732.0,1441238932.0,"Historically, which NBA team would benefit the LEAST from having present LeBron on the roster?",81,3jdlcj
14,"Maybe I'm off, but teams with Magic on it come to mind.  Watching old games, he seemed more ball-dominant and Lebron seems to struggle as a spot-up shooter and purely a slasher.  Defenders would sag more to the middle with him standing in the corner.  I'm thinking of 2011 Miami where they struggled with offense initially watching each other do ISO after ISO. ",67,,/r/nba/comments/3jdlcj/historically_which_nba_team_would_benefit_the/cuoasqw/,cuoasqw,1441241583.0,1441212783.0,"Historically, which NBA team would benefit the LEAST from having present LeBron on the roster?",81,3jdlcj
15,"Would MJ, Pippen and Lebron work? ",52,brandoi,/r/nba/comments/3jdlcj/historically_which_nba_team_would_benefit_the/cuoap8q/,cuoap8q,1441241431.0,1441212631.0,"Historically, which NBA team would benefit the LEAST from having present LeBron on the roster?",81,3jdlcj
16,I gotta go for the first Celtics dynasty from 1957 to 1966. They won every title. Lebron couldn't help them do any better ,28,jimmaybob,/r/nba/comments/3jdlcj/historically_which_nba_team_would_benefit_the/cuoggbs/,cuoggbs,1441250287.0,1441221487.0,"Historically, which NBA team would benefit the LEAST from having present LeBron on the roster?",81,3jdlcj
17,"The Kobe/Shaq Lakers maybe? Neither Kobe or Shaq would ever defer to LeBron and LeBron would probably be forced to the perimeter. The team is probably way too talented to fail. If Kobe/Shaq bought into allowing LeBron to run the show, they're probably the GOAT team though. ",30,BizGilwalker,/r/nba/comments/3jdlcj/historically_which_nba_team_would_benefit_the/cuobg18/,cuobg18,1441242589.0,1441213789.0,"Historically, which NBA team would benefit the LEAST from having present LeBron on the roster?",81,3jdlcj
18,Those Sacramento teams too man... The early 2000s west was sick. Which goes to show you how amazing of a duo Shaq & Kobe were.,105,rbutler89,/r/nba/comments/3jdkuo/lebron_blown_away_by_talent_in_2000_wcf/cuobwss/,cuobwss,1441243300.0,1441214500.0,Lebron blown away by talent in 2000 WCF,169,3jdkuo
19,:(,64,sacr3dc0w,/r/nba/comments/3jdkuo/lebron_blown_away_by_talent_in_2000_wcf/cuob0z5/,cuob0z5,1441241943.0,1441213143.0,Lebron blown away by talent in 2000 WCF,169,3jdkuo
20,"Nice to hear it straight from the mouth of Lebron: that 2000 Blazers squad was probably the deepest team to ever not win a championship.  When ever they matched up with the Lakers that season it was TOO DEEP vs. TWO DEEP.  That team was literally 12 minutes away from the finals, where they would have been heavy, heavy favorites against the Pacers.  The size on those two teams (Lakers and Blazers) was just incredible, this was before small ball existed.  Would have been so fun to see one of these gargantuan teams play against the current Warriors.",59,stupid_sexyflanders,/r/nba/comments/3jdkuo/lebron_blown_away_by_talent_in_2000_wcf/cuocab2/,cuocab2,1441243868.0,1441215068.0,Lebron blown away by talent in 2000 WCF,169,3jdkuo
21,This is definitely cool seeing Lebron react/comment on older games. That series was definitely one of the more fun to watch ones out there.,28,DarylDouglas,/r/nba/comments/3jdkuo/lebron_blown_away_by_talent_in_2000_wcf/cuoaprs/,cuoaprs,1441241453.0,1441212653.0,Lebron blown away by talent in 2000 WCF,169,3jdkuo
22,http://i.imgur.com/6TaRhRt.jpg,51,noahsbun,/r/nba/comments/3jc03h/lebron_james_suffering_from_kuru_disease/cunz1p7/,cunz1p7,1441214600.0,1441185800.0,Lebron James suffering from Kuru disease.,72,3jc03h
23,I know this was a bad joke but I actually sat and watched the entire thing,32,VulcanRyu07,/r/nba/comments/3jc03h/lebron_james_suffering_from_kuru_disease/cunzci6/,cunzci6,1441216055.0,1441187255.0,Lebron James suffering from Kuru disease.,72,3jc03h
24,"damn I watched the whole thing, fucking chimpanzees sacrifice so much for us guys. we give them viral brain disease just to save our own asses. ",30,dickassdick,/r/nba/comments/3jc03h/lebron_james_suffering_from_kuru_disease/cunzk6m/,cunzk6m,1441217038.0,1441188238.0,Lebron James suffering from Kuru disease.,72,3jc03h
25,"Kendrick Perkins 5th in rebounds 

I SEE YOU WORKIN PERK",215,Brad-Stevens,/r/nba/comments/3j5u3k/in_the_last_7_years_lebron_is_1st_in_points/cumkax0/,cumkax0,1441101388.0,1441072588.0,"In The Last 7 Years Lebron Is 1st in Points, Rebounds, Assists, Steals and 5th in Blocks In The Playoffs",447,3j5u3k
26,Quite impressive that Rondo is second in assists and third in steals and he hasn't even played in either of the past two post-seasons.,218,HistoryBaller,/r/nba/comments/3j5u3k/in_the_last_7_years_lebron_is_1st_in_points/cumof6w/,cumof6w,1441108642.0,1441079842.0,"In The Last 7 Years Lebron Is 1st in Points, Rebounds, Assists, Steals and 5th in Blocks In The Playoffs",447,3j5u3k
27,Damn. I mean 5 straight runs deep into the Finals aint no joke ,96,DJQuik,/r/nba/comments/3j5u3k/in_the_last_7_years_lebron_is_1st_in_points/cumjgc4/,cumjgc4,1441099974.0,1441071174.0,"In The Last 7 Years Lebron Is 1st in Points, Rebounds, Assists, Steals and 5th in Blocks In The Playoffs",447,3j5u3k
28,"I really enjoy your info graphs they're awesome.

It's so surreal how dominant* this man is.",50,,/r/nba/comments/3j5u3k/in_the_last_7_years_lebron_is_1st_in_points/cumjwje/,cumjwje,1441100728.0,1441071928.0,"In The Last 7 Years Lebron Is 1st in Points, Rebounds, Assists, Steals and 5th in Blocks In The Playoffs",447,3j5u3k
29,Quite impressive that Rondo is second in assists and third in steals and he hasn't even played in either of the past two post-seasons.  ,32,HistoryBaller,/r/nba/comments/3j5u3k/in_the_last_7_years_lebron_is_1st_in_points/cumoduy/,cumoduy,1441108567.0,1441079767.0,"In The Last 7 Years Lebron Is 1st in Points, Rebounds, Assists, Steals and 5th in Blocks In The Playoffs",447,3j5u3k
30,"how many more games has he played than everyone else, tho? not saying it's not impressive, but, you know, context.",53,moe1984,/r/nba/comments/3j5u3k/in_the_last_7_years_lebron_is_1st_in_points/cumm8uf/,cumm8uf,1441104638.0,1441075838.0,"In The Last 7 Years Lebron Is 1st in Points, Rebounds, Assists, Steals and 5th in Blocks In The Playoffs",447,3j5u3k
31,They sure as fuck did here,269,,/r/nba/comments/3j2x05/did_people_hate_jordan_like_people_hate_lebron_now/cultuda/,cultuda,1441059723.0,1441030923.0,Did people hate Jordan like people hate Lebron now?,166,3j2x05
32,Nope. But people have to understand how different things were before the Internet or during its early days. Hate for a player didn't spread so quickly and easily back in the day. People did hate on the Pistons though.,376,Prehistoricshark,/r/nba/comments/3j2x05/did_people_hate_jordan_like_people_hate_lebron_now/culro4v/,culro4v,1441055313.0,1441026513.0,Did people hate Jordan like people hate Lebron now?,166,3j2x05
33,People loved Jordan to the extent that journalists intentionally didn't write about his gambling problem because he asked them to keep it a secret. And they did. ,228,TestedOnAnimals,/r/nba/comments/3j2x05/did_people_hate_jordan_like_people_hate_lebron_now/culszc7/,culszc7,1441058096.0,1441029296.0,Did people hate Jordan like people hate Lebron now?,166,3j2x05
34,I'd like to see public reaction if Lebron ever punched his teammate in practice,173,bumbleb333,/r/nba/comments/3j2x05/did_people_hate_jordan_like_people_hate_lebron_now/cultj76/,cultj76,1441059165.0,1441030365.0,Did people hate Jordan like people hate Lebron now?,166,3j2x05
35,"The 2 years in a row we played the Bulls in the finals you'd think everyone would hate Jordan, but I don't remember that being the case. The town was decorated with ""No-Bull(s)"" signs and yet, I don't remember anyone hating Jordan specifically. He was just amazing and everyone respected that.",48,S0PES,/r/nba/comments/3j2x05/did_people_hate_jordan_like_people_hate_lebron_now/culrtqt/,culrtqt,1441055675.0,1441026875.0,Did people hate Jordan like people hate Lebron now?,166,3j2x05
36,"Jordan was universally beloved after he was able to finally topple the Pistons, in the mid 90's the Bulls were so popular that I remember their merchandise being carried everywhere. Also, social media is the reason why the disdain for Lebron is so prevalent in comparison.",37,djgojira,/r/nba/comments/3j2x05/did_people_hate_jordan_like_people_hate_lebron_now/culrop2/,culrop2,1441055348.0,1441026548.0,Did people hate Jordan like people hate Lebron now?,166,3j2x05
37,"From what I gathered from my dad (huge Celtics fan in the 80's) and his friends, the Jordan ""hate"" was more of a hate him because he's soo good, so surreal and so dominant. Cavs, Knicks, Pacers and Pistons fans hated him the most, but not because of his personality, but because he would be their teams' worst nightmare. He was respected as the GOAT, but still hated for being the GOAT.

With Lebron, it's entirely different, especially with social media now. There was the cockiness, the self-proclaimed king at age 18, inability to win early in his career (he was on some bad teams), The Decision (which ultimately was for a good cause), Pre-Heat championship ceremony, and playing the villain on the Heat. But there's also a lot of the same hate that Jordan got that Lebron gets too. Everyone now accepts how dominant he is, and most of the hate comes from fans wanting him to lose because he's so dominant. The shit where non-NBA fans would make fun of his cramps in the finals or 3/4 Quarters Lechoke jokes all come from just not wanting to see a dominant player win.",28,mr_duong567,/r/nba/comments/3j2x05/did_people_hate_jordan_like_people_hate_lebron_now/culssy2/,culssy2,1441057741.0,1441028941.0,Did people hate Jordan like people hate Lebron now?,166,3j2x05
38,[deleted],763,,/r/nba/comments/3iurbe/usain_bolt_paying_homage_to_lebron_with_the_celly/cujsk9v/,cujsk9v,1440892015.0,1440863215.0,Usain Bolt paying homage to Lebron with the celly,1277,3iurbe
39,I'm definitely doing this when I win the 200m championships. ,201,atm_vestibule,/r/nba/comments/3iurbe/usain_bolt_paying_homage_to_lebron_with_the_celly/cujt0oj/,cujt0oj,1440892841.0,1440864041.0,Usain Bolt paying homage to Lebron with the celly,1277,3iurbe
40,"Usain Bolt is seriously one of the coolest people ever. 

Also it took me a full minute to type this sentence on mobile because my iPhone kept trying to autocorrect ""Usain"" to Jason. C'mon Apple, have some respect!",174,OneManIndian,/r/nba/comments/3iurbe/usain_bolt_paying_homage_to_lebron_with_the_celly/cujtfyk/,cujtfyk,1440893625.0,1440864825.0,Usain Bolt paying homage to Lebron with the celly,1277,3iurbe
41,I like the one [Dez Bryant](https://www.youtube.com/watch?v=qpjMkV1_UbM) did ,21,frankyahb,/r/nba/comments/3iurbe/usain_bolt_paying_homage_to_lebron_with_the_celly/cujuhr8/,cujuhr8,1440895605.0,1440866805.0,Usain Bolt paying homage to Lebron with the celly,1277,3iurbe
42,What is this celebration supposed to mean? I never understood it. ,26,shknbke028,/r/nba/comments/3iurbe/usain_bolt_paying_homage_to_lebron_with_the_celly/cujszaq/,cujszaq,1440892774.0,1440863974.0,Usain Bolt paying homage to Lebron with the celly,1277,3iurbe
43,"i'm canadian and have never once heard anyone say ""celly"" to refer to celebration ",36,Joe-Bananas,/r/nba/comments/3iurbe/usain_bolt_paying_homage_to_lebron_with_the_celly/cujuhgt/,cujuhgt,1440895589.0,1440866789.0,Usain Bolt paying homage to Lebron with the celly,1277,3iurbe
44,"such an embarrassing loss for the USA team, nothing went right ",41,E-Miles,/r/nba/comments/3iurbe/usain_bolt_paying_homage_to_lebron_with_the_celly/cujswkm/,cujswkm,1440892640.0,1440863840.0,Usain Bolt paying homage to Lebron with the celly,1277,3iurbe
45,[deleted],121,,/r/nba/comments/3iurbe/usain_bolt_paying_homage_to_lebron_with_the_celly/cujtysu/,cujtysu,1440894605.0,1440865805.0,Usain Bolt paying homage to Lebron with the celly,1277,3iurbe
46,I wish I was LeBron,355,MasterGater,/r/nba/comments/3iqyu2/lebron_says_yeet_to_groupie/cuitvwu/,cuitvwu,1440811527.0,1440782727.0,lebron says yeet to groupie,487,3iqyu2
47,Excellent court vision shown by LeBron.,189,T4Gx,/r/nba/comments/3iqyu2/lebron_says_yeet_to_groupie/cuiwjbp/,cuiwjbp,1440815444.0,1440786644.0,lebron says yeet to groupie,487,3iqyu2
48,Always have a fall guy ,167,AZF1,/r/nba/comments/3iqyu2/lebron_says_yeet_to_groupie/cuiuz50/,cuiuz50,1440813148.0,1440784348.0,lebron says yeet to groupie,487,3iqyu2
49,Mike Woodson stylin' on 'em.,62,jonathanlaniado,/r/nba/comments/3iqyu2/lebron_says_yeet_to_groupie/cuiv079/,cuiv079,1440813191.0,1440784391.0,lebron says yeet to groupie,487,3iqyu2
50,What's yeet? Am I that out of touch. ,340,,/r/nba/comments/3iqyu2/lebron_says_yeet_to_groupie/cuix3kp/,cuix3kp,1440816281.0,1440787481.0,lebron says yeet to groupie,487,3iqyu2
51,[Singing](https://www.youtube.com/watch?v=XE78j52Aomc),36,arcangeltx,/r/nba/comments/3iqyu2/lebron_says_yeet_to_groupie/cuiy5yj/,cuiy5yj,1440817875.0,1440789075.0,lebron says yeet to groupie,487,3iqyu2
52,this dude always turnt to some future,133,LRW35,/r/nba/comments/3iqyu2/lebron_says_yeet_to_groupie/cuivqy9/,cuivqy9,1440814285.0,1440785485.0,lebron says yeet to groupie,487,3iqyu2
53,I have no idea what's going on in this thread. ,52,,/r/nba/comments/3iqyu2/lebron_says_yeet_to_groupie/cuj16ji/,cuj16ji,1440822402.0,1440793602.0,lebron says yeet to groupie,487,3iqyu2
54,That's swag right there. ,42,FeversMirrors,/r/nba/comments/3iqyu2/lebron_says_yeet_to_groupie/cuiu13n/,cuiu13n,1440811741.0,1440782941.0,lebron says yeet to groupie,487,3iqyu2
55,"dirty soda in my styrofoam, curving groupies put my mans on",26,JasperFeelingsworth,/r/nba/comments/3iqyu2/lebron_says_yeet_to_groupie/cuixbmo/,cuixbmo,1440816615.0,1440787815.0,lebron says yeet to groupie,487,3iqyu2
56,11th in Regular Season and 3rd in Post Season,72,Hankscorpio17,/r/nba/comments/3ii4uk/lebron_now_ranks_7th_alltime_in_combine_regular/cugloac/,cugloac,1440645858.0,1440617058.0,Lebron now ranks 7th all-time in combine regular season and playoff Win Shares,214,3ii4uk
57,"Jordan is #1 in playoff Win Shares despite playing around 60 less games than Duncan and Kareem. For reference he also has played 1 more playoff game than LeBron.

Bonus; despite the fact that Chris Paul gets shit on for not having playoff success he is #3 all time in WS/48 in the playoffs. (.0014 less than Jordan, and .009 more than LeBron.)",43,LeafySeahorse,/r/nba/comments/3ii4uk/lebron_now_ranks_7th_alltime_in_combine_regular/cugp9yi/,cugp9yi,1440651047.0,1440622247.0,Lebron now ranks 7th all-time in combine regular season and playoff Win Shares,214,3ii4uk
58,Looks like LeBron might take the #1 spot in playoff win shares after this season. ,47,Extremeaty,/r/nba/comments/3ii4uk/lebron_now_ranks_7th_alltime_in_combine_regular/cuglrrq/,cuglrrq,1440645995.0,1440617195.0,Lebron now ranks 7th all-time in combine regular season and playoff Win Shares,214,3ii4uk
59,"For all the flak he gets, LeBron's numbers never lie. 

",21,WhenItsHalfPastFive,/r/nba/comments/3ii4uk/lebron_now_ranks_7th_alltime_in_combine_regular/cugpk8g/,cugpk8g,1440651464.0,1440622664.0,Lebron now ranks 7th all-time in combine regular season and playoff Win Shares,214,3ii4uk
60,This is pretty cool. Not sure if LeBron watched wrestling but being an 18 year old kid being right there front row for Stone Cold has gotta be dope ,922,peanutbutter1236,/r/nba/comments/3ifc0u/lebron_james_showing_off_his_flip_phone_in_an/cufx5di/,cufx5di,1440591003.0,1440562203.0,LeBron James showing off his flip phone in an episode of Raw in 2003 (x-post from r/squaredcircle),4838,3ifc0u
61,Cell phones have come a long way in 12 years,113,BORN-IN-1994-AMA,/r/nba/comments/3ifc0u/lebron_james_showing_off_his_flip_phone_in_an/cufzgt1/,cufzgt1,1440596676.0,1440567876.0,LeBron James showing off his flip phone in an episode of Raw in 2003 (x-post from r/squaredcircle),4838,3ifc0u
62,I wonder how good at snake he was,225,therealgreenbeans,/r/nba/comments/3ifc0u/lebron_james_showing_off_his_flip_phone_in_an/cufyase/,cufyase,1440593626.0,1440564826.0,LeBron James showing off his flip phone in an episode of Raw in 2003 (x-post from r/squaredcircle),4838,3ifc0u
63,He's showing off the photo he took but whatever.,189,,/r/nba/comments/3ifc0u/lebron_james_showing_off_his_flip_phone_in_an/cufxy85/,cufxy85,1440592793.0,1440563993.0,LeBron James showing off his flip phone in an episode of Raw in 2003 (x-post from r/squaredcircle),4838,3ifc0u
64,somehow someway i still find this [funny](https://www.youtube.com/watch?v=Mn51TngJM1g&hd=1),90,HelloImKebin,/r/nba/comments/3ifc0u/lebron_james_showing_off_his_flip_phone_in_an/cug0uk6/,cug0uk6,1440601077.0,1440572277.0,LeBron James showing off his flip phone in an episode of Raw in 2003 (x-post from r/squaredcircle),4838,3ifc0u
65,That flip phone from 2003 is still more relevant than the diva's revolution,178,hobojarpen,/r/nba/comments/3ifc0u/lebron_james_showing_off_his_flip_phone_in_an/cufznk4/,cufznk4,1440597223.0,1440568423.0,LeBron James showing off his flip phone in an episode of Raw in 2003 (x-post from r/squaredcircle),4838,3ifc0u
66,"[Mark Cuban getting Rko'd](https://www.youtube.com/watch?v=lnCXFzap63c)

[Karl Malone vs Dennis Rodman](https://www.youtube.com/watch?v=HN2ffgG9ANM)",96,argentuned,/r/nba/comments/3ifc0u/lebron_james_showing_off_his_flip_phone_in_an/cufyhmk/,cufyhmk,1440594083.0,1440565283.0,LeBron James showing off his flip phone in an episode of Raw in 2003 (x-post from r/squaredcircle),4838,3ifc0u
67,Is he still on contract with Panasonic?,25,bazblazer66,/r/nba/comments/3ifc0u/lebron_james_showing_off_his_flip_phone_in_an/cufz1pq/,cufz1pq,1440595496.0,1440566696.0,LeBron James showing off his flip phone in an episode of Raw in 2003 (x-post from r/squaredcircle),4838,3ifc0u
68,Andrew Luck is still flaunting a flip phone.,31,Dhylan18,/r/nba/comments/3ifc0u/lebron_james_showing_off_his_flip_phone_in_an/cug0fz5/,cug0fz5,1440599668.0,1440570868.0,LeBron James showing off his flip phone in an episode of Raw in 2003 (x-post from r/squaredcircle),4838,3ifc0u
69,"Apex Lebron is one of the most athletic human beings to ever grace American sports. That being said, Westbrook is still an ungodly athlete and one of the most athletic PGs of all time. Not to undersell Westbrook, but I gotta take Lebron.",76,largetoes,/r/nba/comments/3i3m8s/more_athletic_player_westbrook_or_lebron/cuczpi9/,cuczpi9,1440381393.0,1440352593.0,More Athletic Player: Westbrook or LeBron?,25,3i3m8s
70,Lebron... people seem to forget he's a giant man.  Dude's athletic ability for his size is straight up non-realistic.  ,27,Ben--Affleck,/r/nba/comments/3i3m8s/more_athletic_player_westbrook_or_lebron/cud26yb/,cud26yb,1440385819.0,1440357019.0,More Athletic Player: Westbrook or LeBron?,25,3i3m8s
71,Right now Westbrook but younger Lebron is arguably one of the best athletes of all time. ,117,t3h_shammy,/r/nba/comments/3i3m8s/more_athletic_player_westbrook_or_lebron/cucza4p/,cucza4p,1440380617.0,1440351817.0,More Athletic Player: Westbrook or LeBron?,25,3i3m8s
72,"I look at it like this, Lebron is one of the 5 most athletic rare specimens, almost never found in the world. Only people I can think of top of my head is Randy Moss and Bo Jackson. Westbrook is one of the top 20 athletes in the modern era",38,OrlMagicfan1334,/r/nba/comments/3i3m8s/more_athletic_player_westbrook_or_lebron/cuczekk/,cuczekk,1440380844.0,1440352044.0,More Athletic Player: Westbrook or LeBron?,25,3i3m8s
73,"And this is why you bring Kevin Love back, and why Kevin Love returns. With the decrease in minutes for both Kevin Love will have a larger share of the offence and should go back to putting up numbers. ",38,jamiry,/r/nba/comments/3i2z8r/pluto_one_of_the_teams_regularseason_goals_is_to/cucz1cp/,cucz1cp,1440380170.0,1440351370.0,"[Pluto] ""One of the team's regular-season goals is to cut down the minutes for LeBron James...also want to cut Irving's.""",82,3i2z8r
74,"There is no reason for Cleveland to go all out during the regular season anymore. 50 wins guarantees you a top 4 seed in the East, and it's clear a healthy LeBron + healthy Kyrie + healthy Love are overwhelming favorites to get to the Finals.   
  
Cut down the minutes for the main guys, give the role players some run, cut some parsley and season with some pepper, and baby you've got a stew going.   ",29,BearsNecessity,/r/nba/comments/3i2z8r/pluto_one_of_the_teams_regularseason_goals_is_to/cud3cdf/,cud3cdf,1440387769.0,1440358969.0,"[Pluto] ""One of the team's regular-season goals is to cut down the minutes for LeBron James...also want to cut Irving's.""",82,3i2z8r
75,Id give Love over 32 tbh. His shoulder injury was abnormal and he's usually very healthy. Give him more minutes and you can cut down Irving's injuries and Bron's fatigue.,48,IrishBro17,/r/nba/comments/3i2z8r/pluto_one_of_the_teams_regularseason_goals_is_to/cucwzxb/,cucwzxb,1440376463.0,1440347663.0,"[Pluto] ""One of the team's regular-season goals is to cut down the minutes for LeBron James...also want to cut Irving's.""",82,3i2z8r
