,body,score,author,permalink,comment_id,created_loc,created_utc,post_title,post_score,post_id
0,I saw this earlier this morning. Dude did good. ,23,alandizzle,/r/nba/comments/60r8i9/lebron_james_praises_good_samaritan_who_diffused/df8s51w/,df8s51w,1490175554.0,1490146754.0,LeBron James Praises Good Samaritan Who Diffused Teen Fight In Atlantic City,387,60r8i9
1,If only they had been there for our game tonight.,38,MadDoctor5813,/r/nba/comments/60r8i9/lebron_james_praises_good_samaritan_who_diffused/df8qg5v/,df8qg5v,1490173441.0,1490144641.0,LeBron James Praises Good Samaritan Who Diffused Teen Fight In Atlantic City,387,60r8i9
2,That's what happens when you are immune to every type of injury and came into the NBA straight from high school,90,theconfuserx2,/r/nba/comments/60r768/in_5_games_lebron_is_about_to_surpass_mjs_career/df8mjws/,df8mjws,1490168377.0,1490139577.0,"In 5 games, LeBron is about to surpass MJ's career MP",47,60r768
3,> Kevin McCale,25,Juniper41,/r/nba/comments/60r768/in_5_games_lebron_is_about_to_surpass_mjs_career/df8mq3t/,df8mq3t,1490168599.0,1490139799.0,"In 5 games, LeBron is about to surpass MJ's career MP",47,60r768
4,"Lmfao, literally just announced he'll be in the 80s for the playoffs.



",245,DeKobe-DeBryant,/r/nba/comments/60qrcs/lebron_addresses_his_struggles_at_the_ft_line/df8j1l7/,df8j1l7,1490163837.0,1490135037.0,LeBron addresses his struggles at the FT line this season,185,60qrcs
5,"LOL. Guy just says ""yeah I'll be better in the playoffs"" like it's a fucking insult that that reporter doesn't know about the LeCoast variable",191,,/r/nba/comments/60qrcs/lebron_addresses_his_struggles_at_the_ft_line/df8ivaa/,df8ivaa,1490163615.0,1490134815.0,LeBron addresses his struggles at the FT line this season,185,60qrcs
6,"""Postseason I'll be up to 80%""

LeConfidence",121,No32,/r/nba/comments/60qrcs/lebron_addresses_his_struggles_at_the_ft_line/df8ivf0/,df8ivf0,1490163619.0,1490134819.0,LeBron addresses his struggles at the FT line this season,185,60qrcs
7,Perhaps 2k sliders aren't that far off from real life. ,24,,/r/nba/comments/60qrcs/lebron_addresses_his_struggles_at_the_ft_line/df8j8kq/,df8j8kq,1490164083.0,1490135283.0,LeBron addresses his struggles at the FT line this season,185,60qrcs
8,"LeShaq - ""I'll make them when it counts""",34,erldn123,/r/nba/comments/60qrcs/lebron_addresses_his_struggles_at_the_ft_line/df8jk17/,df8jk17,1490164491.0,1490135691.0,LeBron addresses his struggles at the FT line this season,185,60qrcs
9,"I can get not going 100% on defense and stuff but for something as simple and important as FTs if you have an ""on"" switch why not just leave it on all the time? It's not like FTs are physically draining.",46,The_Great_Saiyaman21,/r/nba/comments/60qrcs/lebron_addresses_his_struggles_at_the_ft_line/df8j2t7/,df8j2t7,1490163879.0,1490135079.0,LeBron addresses his struggles at the FT line this season,185,60qrcs
10,I have a feeling Pop has done much smarter things than let his players rest..,459,,/r/nba/comments/60qmf0/lebron_weighs_in_on_nbas_rest_conundrum_listen/df8hrgy/,df8hrgy,1490162236.0,1490133436.0,"LeBron weighs in on NBA's rest conundrum: ""Listen, Pop's been doing this for 10 years, 12 years, 15 years and everybody was like, 'You know what? That's the smartest thing Pop has ever done.""",749,60qmf0
11,"I can't recall completely accurately, but wasn't a narrative last year with the Warriors season that they shouldn't be pushing so hard every game to chase the record etc, and consider resting, to not face burn out in the Playoffs? There's no winning for teams, narratives will always write themselves ",67,splinternz,/r/nba/comments/60qmf0/lebron_weighs_in_on_nbas_rest_conundrum_listen/df8lhyy/,df8lhyy,1490167001.0,1490138201.0,"LeBron weighs in on NBA's rest conundrum: ""Listen, Pop's been doing this for 10 years, 12 years, 15 years and everybody was like, 'You know what? That's the smartest thing Pop has ever done.""",749,60qmf0
12,"It's about the money. Duncan didn't double the price of a ticket like a Lebron, Curry or Kobe. Imagine having to pay $150 more for a ticket pretty much only because Lebron's in the game, and then he doesn't play and fans obviously get miffed. Yes you're technically paying to watch Cavs vs Warriors, but in reality the inflated price reflects Curry, Durant and Lebron in there. Without them it wouldn't fetch nearly that much money.

The NBA is having their cake and eating it too. They're fine charging the fans extra to see Curry and Lebron live, but if they end up resting, they fall back on the excuse of it's Cavs v Warriors not Curry v Lebron or teams have a right to rest.",201,anuhobo,/r/nba/comments/60qmf0/lebron_weighs_in_on_nbas_rest_conundrum_listen/df8hthg/,df8hthg,1490162302.0,1490133502.0,"LeBron weighs in on NBA's rest conundrum: ""Listen, Pop's been doing this for 10 years, 12 years, 15 years and everybody was like, 'You know what? That's the smartest thing Pop has ever done.""",749,60qmf0
13,"Five years maybe, but 10-15 years?  In 2007, the Spurs swept the Cavs in the Finals and their big starters played tons of games - Duncan (80), Parker (77), Bowen (82), Ginobli (75), Finley (82), Oberto (79).  That was after Duncan had already won three championships.   
  
Pop resting guys was based on guys getting nagging injuries in their mid-30s.  If it was such a great strategy purely to keep stars fresh, regardless of their age or injury status, then he would have been doing it his whole career.  It was born out of a specific situation of the players he had, and it's been bastardized since then.",52,JedEckert,/r/nba/comments/60qmf0/lebron_weighs_in_on_nbas_rest_conundrum_listen/df8l75o/,df8l75o,1490166610.0,1490137810.0,"LeBron weighs in on NBA's rest conundrum: ""Listen, Pop's been doing this for 10 years, 12 years, 15 years and everybody was like, 'You know what? That's the smartest thing Pop has ever done.""",749,60qmf0
14,"Pop definitely hasn't done this for 15 years, has he?

The first I remember him doing it was in 2011/2012, can anyone confirm or refute this?",23,,/r/nba/comments/60qmf0/lebron_weighs_in_on_nbas_rest_conundrum_listen/df8ng4d/,df8ng4d,1490169540.0,1490140740.0,"LeBron weighs in on NBA's rest conundrum: ""Listen, Pop's been doing this for 10 years, 12 years, 15 years and everybody was like, 'You know what? That's the smartest thing Pop has ever done.""",749,60qmf0
15,"As much as I'm not a Lebron fan, the part about it not being a big deal for years is true. You see the Spurs as perennial contenders and it only makes sense that the rest of the league would catch on to that strategy. ",55,just_a_sports_nut,/r/nba/comments/60qmf0/lebron_weighs_in_on_nbas_rest_conundrum_listen/df8huqu/,df8huqu,1490162344.0,1490133544.0,"LeBron weighs in on NBA's rest conundrum: ""Listen, Pop's been doing this for 10 years, 12 years, 15 years and everybody was like, 'You know what? That's the smartest thing Pop has ever done.""",749,60qmf0
16,The smartest thing Pop ever did was saving 15% by switching to Geico.,23,irrationalportions,/r/nba/comments/60qmf0/lebron_weighs_in_on_nbas_rest_conundrum_listen/df8hw9m/,df8hw9m,1490162398.0,1490133598.0,"LeBron weighs in on NBA's rest conundrum: ""Listen, Pop's been doing this for 10 years, 12 years, 15 years and everybody was like, 'You know what? That's the smartest thing Pop has ever done.""",749,60qmf0
17,"Unfortunately LeBron, everything is magnified when you do it. First people were complaining about your minutes then when you miss a game, you are disappointing the fans and the audience. When Popovich rested players, he was ""making sure they are healthy for the Playoffs."" Again, this is a league problem, make the regular season shorted or get rid of the back to backs. ",22,mr_antman85,/r/nba/comments/60qmf0/lebron_weighs_in_on_nbas_rest_conundrum_listen/df8hvjj/,df8hvjj,1490162372.0,1490133572.0,"LeBron weighs in on NBA's rest conundrum: ""Listen, Pop's been doing this for 10 years, 12 years, 15 years and everybody was like, 'You know what? That's the smartest thing Pop has ever done.""",749,60qmf0
18,"I don't understand why people are upset at the players. Sure, LeBron could probably say ""no, I'm playing tonight"" and he'd be on the court however many minutes he wants, but the coaches are saying ""data shows our odds of postseason success increase and odds of injuries decrease if you rest these particular games."" there's a bit of strategy to not showing your hand against top tier opponents as well, but that's a hidden factor we don't have definitive evidence for or against. Just last year, the Warriors players were controlling the rest schedule because they wanted to get to 73-9. This year, Kerr made them rest, they didn't all choose the same night. 

Tl;dr the flak should go to the coaches for choosing to sit players for nationally televised games. But really the schedule is to blame. ",362,canond08,/r/nba/comments/60pno5/withers_lebron_points_out_that_rest_issue_has/df8airt/,df8airt,1490153826.0,1490125026.0,"[Withers] LeBron points out that ""rest"" issue has only become huge deal since he's sat out, and that Popovich has been applauded for the strategy.",1792,60pno5
19,Maybe he can get DNP- Old'd next ,55,xjcs97sy,/r/nba/comments/60pno5/withers_lebron_points_out_that_rest_issue_has/df89q7n/,df89q7n,1490152945.0,1490124145.0,"[Withers] LeBron points out that ""rest"" issue has only become huge deal since he's sat out, and that Popovich has been applauded for the strategy.",1792,60pno5
20,"I don't have a problem with it, as long as ticket prices fluctuate with who's going to be on the floor.",1029,NathanDrake_,/r/nba/comments/60pno5/withers_lebron_points_out_that_rest_issue_has/df89prk/,df89prk,1490152931.0,1490124131.0,"[Withers] LeBron points out that ""rest"" issue has only become huge deal since he's sat out, and that Popovich has been applauded for the strategy.",1792,60pno5
21,"As someone who can't afford court side seats or 100 level, I don't give a fuck.",40,Jollygrand,/r/nba/comments/60pno5/withers_lebron_points_out_that_rest_issue_has/df8i423/,df8i423,1490162665.0,1490133865.0,"[Withers] LeBron points out that ""rest"" issue has only become huge deal since he's sat out, and that Popovich has been applauded for the strategy.",1792,60pno5
22,"Dont think of it as he goes from 82 games played to 75ish, think of it as him going from 102 to 95is, because they plan on going to the finals

Are we gonna blame a guy for ""only"" playing 95 games?",219,Jonesalot,/r/nba/comments/60pno5/withers_lebron_points_out_that_rest_issue_has/df8bvkp/,df8bvkp,1490155339.0,1490126539.0,"[Withers] LeBron points out that ""rest"" issue has only become huge deal since he's sat out, and that Popovich has been applauded for the strategy.",1792,60pno5
23,"I would say that the Spurs are generally more competitive even when they rest players, but that doesn't really matter in this case. The issue is how it impacts fans, and in that way the Spurs are maybe the worst offenders of it. 

Though I'd counter Lebron's specific point by saying it's not about him resting vs the Spurs resting. It's more about the difference between 1 team resting guys a few times a season vs a bunch of teams doing it. It's just a bigger overall deal now. 

But ya Lebron gets more flack for it than anyone. If the Spurs announced that they were sitting 3 guys tonight vs Minny I don't think people would really be up in arms, and in that sense he definitely has a point",91,Youbestnotmisss,/r/nba/comments/60pno5/withers_lebron_points_out_that_rest_issue_has/df89u68/,df89u68,1490153068.0,1490124268.0,"[Withers] LeBron points out that ""rest"" issue has only become huge deal since he's sat out, and that Popovich has been applauded for the strategy.",1792,60pno5
24,Pretty sure a lot of people bitched when Pop did it for big games. I was pissed when he did it for that big game against Miami.,38,korny12345,/r/nba/comments/60pno5/withers_lebron_points_out_that_rest_issue_has/df8bu5l/,df8bu5l,1490155294.0,1490126494.0,"[Withers] LeBron points out that ""rest"" issue has only become huge deal since he's sat out, and that Popovich has been applauded for the strategy.",1792,60pno5
25,"You can argue if Jordan or LeBron was the GOAT on the court, but LBJ is the undisputed GOAT off the court. He does so much for the communites he's a part of.",780,Dontrell,/r/nba/comments/60oswo/ap_lebron_helps_design_sneaker_for_disabled/df83v4h/,df83v4h,1490146571.0,1490117771.0,"[AP] LeBron helps design sneaker for disabled athletes. ""To be able to have shoes that are easy to get on and off gives kids another opportunity to live out their dreams.""",1407,60oswo
26,"LeBrons a good dude. I remember a Celtics game last year when the Celtics were recognizing a special olympics athlete at center court during a timeout, LeBon came over and game him a hug. The kid was so happy. ",173,,/r/nba/comments/60oswo/ap_lebron_helps_design_sneaker_for_disabled/df82wnr/,df82wnr,1490145522.0,1490116722.0,"[AP] LeBron helps design sneaker for disabled athletes. ""To be able to have shoes that are easy to get on and off gives kids another opportunity to live out their dreams.""",1407,60oswo
27,"[Reminds me of this story.]( https://www.boston.com/sports/boston-celtics/2015/12/16/lebron-james-surprises-inspirational-teen-celtics-fan-with-game-worn-sneakers)

This kid looked to be so genuinely excited and happy that he came over. ",31,Kashmir33,/r/nba/comments/60oswo/ap_lebron_helps_design_sneaker_for_disabled/df82gpk/,df82gpk,1490145033.0,1490116233.0,"[AP] LeBron helps design sneaker for disabled athletes. ""To be able to have shoes that are easy to get on and off gives kids another opportunity to live out their dreams.""",1407,60oswo
28,"As much as I want to hate LeBron, it's his continual efforts off the court that make me a fan of his. 

Has any other athlete lived up to and exceeded their potential like LeBron has? So many other athletes wash out from the pressure of being #1 picks and anointed the ""next superstar."" LeBron has not only lived with that pressure since his SI cover story at 16, he's excelled and hasn't fucked up ONCE. I'm not even a star athlete and I've fucked up many times in my life. He's fucking legit. 

",28,kchin16,/r/nba/comments/60oswo/ap_lebron_helps_design_sneaker_for_disabled/df8dx13/,df8dx13,1490157622.0,1490128822.0,"[AP] LeBron helps design sneaker for disabled athletes. ""To be able to have shoes that are easy to get on and off gives kids another opportunity to live out their dreams.""",1407,60oswo
29,LeClassAct,181,,/r/nba/comments/60oswo/ap_lebron_helps_design_sneaker_for_disabled/df82bmz/,df82bmz,1490144876.0,1490116076.0,"[AP] LeBron helps design sneaker for disabled athletes. ""To be able to have shoes that are easy to get on and off gives kids another opportunity to live out their dreams.""",1407,60oswo
30,Kinda curious how much they cost?,54,Tito_Our_Saviour,/r/nba/comments/60oswo/ap_lebron_helps_design_sneaker_for_disabled/df82mky/,df82mky,1490145211.0,1490116411.0,"[AP] LeBron helps design sneaker for disabled athletes. ""To be able to have shoes that are easy to get on and off gives kids another opportunity to live out their dreams.""",1407,60oswo
31,Good for him and those kids who can finally play! Hate LBJ on court but he is a fantastic guy off the court and does so much for people not as fortunate for him.,52,Fozzy24,/r/nba/comments/60oswo/ap_lebron_helps_design_sneaker_for_disabled/df827vs/,df827vs,1490144749.0,1490115949.0,"[AP] LeBron helps design sneaker for disabled athletes. ""To be able to have shoes that are easy to get on and off gives kids another opportunity to live out their dreams.""",1407,60oswo
32,Really proud of LeCharitable here. Definitely someone you can look up to.,45,lynchedlandlord,/r/nba/comments/60oswo/ap_lebron_helps_design_sneaker_for_disabled/df827zn/,df827zn,1490144754.0,1490115954.0,"[AP] LeBron helps design sneaker for disabled athletes. ""To be able to have shoes that are easy to get on and off gives kids another opportunity to live out their dreams.""",1407,60oswo
33,[deleted],21,,/r/nba/comments/60oswo/ap_lebron_helps_design_sneaker_for_disabled/df87owq/,df87owq,1490150709.0,1490121909.0,"[AP] LeBron helps design sneaker for disabled athletes. ""To be able to have shoes that are easy to get on and off gives kids another opportunity to live out their dreams.""",1407,60oswo
34,Funny that harden would go from not making an all NBA team one year to league MVP the next 😂😂,606,Driew27,/r/nba/comments/60o4dx/according_to_basketballreference_james_harden_now/df7x6r6/,df7x6r6,1490139149.0,1490110349.0,"According to BasketballReference, James Harden now has a higher chance of winning the MVP (44.2%) than Westbrook (10.4%), Lebron (10.3%), and Kawhi (7.2%) combined.",785,60o4dx
35,Does anyone know when voting begins and ends?,71,SirScooby,/r/nba/comments/60o4dx/according_to_basketballreference_james_harden_now/df7wfws/,df7wfws,1490138285.0,1490109485.0,"According to BasketballReference, James Harden now has a higher chance of winning the MVP (44.2%) than Westbrook (10.4%), Lebron (10.3%), and Kawhi (7.2%) combined.",785,60o4dx
36,He was always the favourite imo,143,exasperated_dreams,/r/nba/comments/60o4dx/according_to_basketballreference_james_harden_now/df7w39o/,df7w39o,1490137868.0,1490109068.0,"According to BasketballReference, James Harden now has a higher chance of winning the MVP (44.2%) than Westbrook (10.4%), Lebron (10.3%), and Kawhi (7.2%) combined.",785,60o4dx
37,All I keep remembering is all the betting odds for Harden to win MVP. My gut was telling me to bet but I didn't. smh SO MUCH MONEY that could have been won.,29,Shogun_Ro,/r/nba/comments/60o4dx/according_to_basketballreference_james_harden_now/df8157p/,df8157p,1490143568.0,1490114768.0,"According to BasketballReference, James Harden now has a higher chance of winning the MVP (44.2%) than Westbrook (10.4%), Lebron (10.3%), and Kawhi (7.2%) combined.",785,60o4dx
38,Finally one of these has Lebron ahead of Kawhi.,63,azur08,/r/nba/comments/60o4dx/according_to_basketballreference_james_harden_now/df7x33t/,df7x33t,1490139033.0,1490110233.0,"According to BasketballReference, James Harden now has a higher chance of winning the MVP (44.2%) than Westbrook (10.4%), Lebron (10.3%), and Kawhi (7.2%) combined.",785,60o4dx
39,"iow, Harden has roughly equal chance of winning MVP as KD+Russ+Lebron+Kawhi combined",28,-917-,/r/nba/comments/60o4dx/according_to_basketballreference_james_harden_now/df7wb6b/,df7wb6b,1490138129.0,1490109329.0,"According to BasketballReference, James Harden now has a higher chance of winning the MVP (44.2%) than Westbrook (10.4%), Lebron (10.3%), and Kawhi (7.2%) combined.",785,60o4dx
40,"Lmao there's a guy that downvoted every single LeJoke

EDIT: Including my comment",41,viniribeiro,/r/nba/comments/60o3t3/crazy_stat_lebron_is_averaging_the_least_fga_per/df7w6ax/,df7w6ax,1490137968.0,1490109168.0,Crazy stat: Lebron is averaging the least FGA per 100 of his career,30,60o3t3
41,"For all the hate LeBron gets, the worst thing he's done is the Decision... while still raised $$$ for Boys and Girls Club

He's seriously a great role model",172,landon34,/r/nba/comments/60nh1w/lebron_releases_new_shoes_designed_for_disables/df7r62t/,df7r62t,1490131473.0,1490102673.0,LeBron releases new shoes designed for disables athletes,280,60nh1w
42,"Lebron is such a respectable man. The stuff he does on the court is amazing, but off the court it's great to see someone give back so much. 
He's the best face of the  NBA we could ever ask for. ",63,Itsyaboibiggyt,/r/nba/comments/60nh1w/lebron_releases_new_shoes_designed_for_disables/df7rfo5/,df7rfo5,1490131850.0,1490103050.0,LeBron releases new shoes designed for disables athletes,280,60nh1w
43,That is so *adorable*. Who's crying? I'm not crying...,41,,/r/nba/comments/60nh1w/lebron_releases_new_shoes_designed_for_disables/df7rb16/,df7rb16,1490131667.0,1490102867.0,LeBron releases new shoes designed for disables athletes,280,60nh1w
44,[The original Zoom Soldier FlyEase](https://www.youtube.com/watch?v=TaNM_T1d1as). Worth a watch.,29,flintmichigantropics,/r/nba/comments/60nh1w/lebron_releases_new_shoes_designed_for_disables/df7sh51/,df7sh51,1490133284.0,1490104484.0,LeBron releases new shoes designed for disables athletes,280,60nh1w
45,"Wow, the music in the background and the look on those kids faces and the most sincere ""here you go buddy"" I have ever heard. Almost in tears brb ",22,ISHLDPROBABLYBWRKING,/r/nba/comments/60nh1w/lebron_releases_new_shoes_designed_for_disables/df7qtr5/,df7qtr5,1490130969.0,1490102169.0,LeBron releases new shoes designed for disables athletes,280,60nh1w
46,">how well rounded this guy is

lebron james is lebron james",66,theconfuserx2,/r/nba/comments/60k8rl/lebron_will_pass_maurice_cheeks_for_12th_all_time/df71oid/,df71oid,1490082998.0,1490054198.0,LeBron will pass Maurice Cheeks for 12th all time in assists and Sam Perkins for 71st all time in rebounds before the end of the season,76,60k8rl
47,Mo Cheeks might be the best name of all time. ,31,minkmachete,/r/nba/comments/60k8rl/lebron_will_pass_maurice_cheeks_for_12th_all_time/df729qa/,df729qa,1490083749.0,1490054949.0,LeBron will pass Maurice Cheeks for 12th all time in assists and Sam Perkins for 71st all time in rebounds before the end of the season,76,60k8rl
48,LeRound(Earth),27,yeontura,/r/nba/comments/60k8rl/lebron_will_pass_maurice_cheeks_for_12th_all_time/df71t0z/,df71t0z,1490083158.0,1490054358.0,LeBron will pass Maurice Cheeks for 12th all time in assists and Sam Perkins for 71st all time in rebounds before the end of the season,76,60k8rl
49,"One of these names does not belong.





Paul George. Only one with consecutive vowels in two different places.",189,,/r/nba/comments/60k25s/joseph_uncontested_rebound_paul_george_808/df70dge/,df70dge,1490081328.0,1490052528.0,[Joseph] Uncontested Rebound %: Paul George 80.8%. Russell Westbrook 79.7%. James Harden 78.8%. LeBron James 76.3%. Kevin Durant 76.3%. Stats are fun.,302,60k25s
50,But this stat isn't fun at all.,100,SidMoncrief,/r/nba/comments/60k25s/joseph_uncontested_rebound_paul_george_808/df705kq/,df705kq,1490081045.0,1490052245.0,[Joseph] Uncontested Rebound %: Paul George 80.8%. Russell Westbrook 79.7%. James Harden 78.8%. LeBron James 76.3%. Kevin Durant 76.3%. Stats are fun.,302,60k25s
51,none of those players are making an mvp case because of their raw rebound numbers ,150,,/r/nba/comments/60k25s/joseph_uncontested_rebound_paul_george_808/df709xs/,df709xs,1490081199.0,1490052399.0,[Joseph] Uncontested Rebound %: Paul George 80.8%. Russell Westbrook 79.7%. James Harden 78.8%. LeBron James 76.3%. Kevin Durant 76.3%. Stats are fun.,302,60k25s
52,"I don't think you guys are reading the stat correctly. These players have roughly the same uncontested rebound percentage but Westbrook has significantly more rebounds per game. So all this shows is that he goes for more rebounds than bigger players who naturally should get more rebounds. I'm not sure how this shows that Russell isn't stat-padding, it actually reinforces that argument.",64,luckster44,/r/nba/comments/60k25s/joseph_uncontested_rebound_paul_george_808/df70ttj/,df70ttj,1490081912.0,1490053112.0,[Joseph] Uncontested Rebound %: Paul George 80.8%. Russell Westbrook 79.7%. James Harden 78.8%. LeBron James 76.3%. Kevin Durant 76.3%. Stats are fun.,302,60k25s
53,this is hilarious ,1469,Kamoner,/r/nba/comments/60ixh5/tania_ganguli_per_lakers_a_transcript_they_gave/df6r5e3/,df6r5e3,1490070277.0,1490041477.0,"[Tania Ganguli] Per Lakers, a transcript they gave last night had a mistake. LeBron didnt call D'Angelo Russell a ""special player."" Was talking about Kyrie.",1849,60ixh5
54,"This is like somebody waving at you, you waving back,  then you realize they were waving at the person behind you.",938,Truenewf,/r/nba/comments/60ixh5/tania_ganguli_per_lakers_a_transcript_they_gave/df6rd59/,df6rd59,1490070521.0,1490041721.0,"[Tania Ganguli] Per Lakers, a transcript they gave last night had a mistake. LeBron didnt call D'Angelo Russell a ""special player."" Was talking about Kyrie.",1849,60ixh5
55,"This is like the PR version of that scene in teen comedies where the nerdy kid thinks he's getting waved at by Stacy the cheerleader, so he awkwardly waves back and smiles, only to have Stacy's friend come into frame from behind him and be her actual target. ",212,ayybreezy,/r/nba/comments/60ixh5/tania_ganguli_per_lakers_a_transcript_they_gave/df6rgy6/,df6rgy6,1490070638.0,1490041838.0,"[Tania Ganguli] Per Lakers, a transcript they gave last night had a mistake. LeBron didnt call D'Angelo Russell a ""special player."" Was talking about Kyrie.",1849,60ixh5
56,lol awkward. ,293,AccountSave,/r/nba/comments/60ixh5/tania_ganguli_per_lakers_a_transcript_they_gave/df6r6he/,df6r6he,1490070311.0,1490041511.0,"[Tania Ganguli] Per Lakers, a transcript they gave last night had a mistake. LeBron didnt call D'Angelo Russell a ""special player."" Was talking about Kyrie.",1849,60ixh5
57,https://pbs.twimg.com/media/C7Y0WTqVoAAX5WH.jpg,101,Chancelor_West,/r/nba/comments/60ixh5/tania_ganguli_per_lakers_a_transcript_they_gave/df6rnl2/,df6rnl2,1490070845.0,1490042045.0,"[Tania Ganguli] Per Lakers, a transcript they gave last night had a mistake. LeBron didnt call D'Angelo Russell a ""special player."" Was talking about Kyrie.",1849,60ixh5
58,"LaLa Land... I mean, Moonlight!",67,lars5,/r/nba/comments/60ixh5/tania_ganguli_per_lakers_a_transcript_they_gave/df6u28f/,df6u28f,1490073591.0,1490044791.0,"[Tania Ganguli] Per Lakers, a transcript they gave last night had a mistake. LeBron didnt call D'Angelo Russell a ""special player."" Was talking about Kyrie.",1849,60ixh5
