,body,score,author,permalink,comment_id,created_loc,created_utc,post_title,post_score,post_id
0,Punching your PG in the face is another thing Jordan already did first,125,unbelievre,/r/nba/comments/6pcnpg/stephen_a_smith_if_kyrie_were_in_front_of_lebron/dkodr8d/,dkodr8d,1500975952.0,1500947152.0,"Stephen A. Smith: ""If Kyrie were in front of LeBron right now LeBron would be 'tempted to beat his ass'""",1081,6pcnpg
1,This might be the best offseason in any sport ever. ,49,JoeRealNameNoGimmick,/r/nba/comments/6pcnpg/stephen_a_smith_if_kyrie_were_in_front_of_lebron/dkocbqi/,dkocbqi,1500974111.0,1500945311.0,"Stephen A. Smith: ""If Kyrie were in front of LeBron right now LeBron would be 'tempted to beat his ass'""",1081,6pcnpg
2,"""Kyrie, you and me are going to take a bro trip around the world and hash this whole thing out. I really think we can make it work""

""The fuck you mean around?""",204,tsavorite4,/r/nba/comments/6pcgfe/lowe_as_i_wrote_today_situation_is_pretty_badraw/dkoc8rc/,dkoc8rc,1500974006.0,1500945206.0,"[Lowe] As I wrote today, situation is pretty bad/raw now, but a Kyrie-LeBron summit could reverse it",138,6pcgfe
3,"HELL IN THE CELL

KING JAMES VS UNCLE DREW",128,EhStonedTurtle,/r/nba/comments/6pcgfe/lowe_as_i_wrote_today_situation_is_pretty_badraw/dko8q3i/,dko8q3i,1500969543.0,1500940743.0,"[Lowe] As I wrote today, situation is pretty bad/raw now, but a Kyrie-LeBron summit could reverse it",138,6pcgfe
4,I'd would love to summit Kyrie-LeBron,82,DrWolves,/r/nba/comments/6pcgfe/lowe_as_i_wrote_today_situation_is_pretty_badraw/dko8ohn/,dko8ohn,1500969486.0,1500940686.0,"[Lowe] As I wrote today, situation is pretty bad/raw now, but a Kyrie-LeBron summit could reverse it",138,6pcgfe
5,Kyrie should go. It's better for the Cavs as long as they get a playmaker in his place.,28,kibretw,/r/nba/comments/6pcgfe/lowe_as_i_wrote_today_situation_is_pretty_badraw/dko8pf5/,dko8pf5,1500969520.0,1500940720.0,"[Lowe] As I wrote today, situation is pretty bad/raw now, but a Kyrie-LeBron summit could reverse it",138,6pcgfe
6,holy shit this offseason is fucking incredible ,102,DoctorDeebo,/r/nba/comments/6pcgda/lebron_is_now_eager_to_have_kyrie_traded_after/dko8odk/,dko8odk,1500969482.0,1500940682.0,LeBron is now eager to have Kyrie traded after Cavs sign Derrick Rose,103,6pcgda
7,Kyrie tried to break up with LeBron and LBJ had his side chick on speed dial,71,Vandyvan5,/r/nba/comments/6pcgda/lebron_is_now_eager_to_have_kyrie_traded_after/dko8obi/,dko8obi,1500969480.0,1500940680.0,LeBron is now eager to have Kyrie traded after Cavs sign Derrick Rose,103,6pcgda
8,"Damn, Bron is done with Kyrie lol",132,lolimdivine,/r/nba/comments/6pcgda/lebron_is_now_eager_to_have_kyrie_traded_after/dko8np3/,dko8np3,1500969457.0,1500940657.0,LeBron is now eager to have Kyrie traded after Cavs sign Derrick Rose,103,6pcgda
9,B Y R I E ,60,CUNT__FUCKER,/r/nba/comments/6pcgda/lebron_is_now_eager_to_have_kyrie_traded_after/dko8nqo/,dko8nqo,1500969458.0,1500940658.0,LeBron is now eager to have Kyrie traded after Cavs sign Derrick Rose,103,6pcgda
10,well that escalated quickly...,21,spjs51,/r/nba/comments/6pcgda/lebron_is_now_eager_to_have_kyrie_traded_after/dko8o0r/,dko8o0r,1500969468.0,1500940668.0,LeBron is now eager to have Kyrie traded after Cavs sign Derrick Rose,103,6pcgda
11,"There is one unsupported line in the article that says that. It's been brought up nowhere else. 

> James is eager to see him off

Where did the writer get that from?",39,Jaerba,/r/nba/comments/6pcgda/lebron_is_now_eager_to_have_kyrie_traded_after/dko8u75/,dko8u75,1500969689.0,1500940889.0,LeBron is now eager to have Kyrie traded after Cavs sign Derrick Rose,103,6pcgda
12,"""Would you like to play with the best player in the league"" - Lebron

""Who wouldn't"" - Rose

""You'd be surprised""",672,rrevivedme,/r/nba/comments/6pcf6o/wojnarowski_derrick_rose_has_communicated_with/dko8ijj/,dko8ijj,1500969270.0,1500940470.0,"[Wojnarowski] Derrick Rose has communicated with LeBron James through the process that led him to the Cavaliers, league sources tell ESPN.",338,6pcf6o
13,"What must have LeBron said....

""Fuck Kyrie, you're our guy now"" ?",126,Jayveesac,/r/nba/comments/6pcf6o/wojnarowski_derrick_rose_has_communicated_with/dko8dsv/,dko8dsv,1500969101.0,1500940301.0,"[Wojnarowski] Derrick Rose has communicated with LeBron James through the process that led him to the Cavaliers, league sources tell ESPN.",338,6pcf6o
14,"I honestly feel (I know I'm a homer), that LeBron has as much respect for Derrick Rose as he does for anyone in the league.  They had epic battles as recently as two seasons ago.  

So it's not surprising to me that LeBron has recruited him.  Especially for $2 mil.",123,nowandlater,/r/nba/comments/6pcf6o/wojnarowski_derrick_rose_has_communicated_with/dko8j2n/,dko8j2n,1500969289.0,1500940489.0,"[Wojnarowski] Derrick Rose has communicated with LeBron James through the process that led him to the Cavaliers, league sources tell ESPN.",338,6pcf6o
15,the anti-Kyrie,67,,/r/nba/comments/6pcf6o/wojnarowski_derrick_rose_has_communicated_with/dko8d9v/,dko8d9v,1500969082.0,1500940282.0,"[Wojnarowski] Derrick Rose has communicated with LeBron James through the process that led him to the Cavaliers, league sources tell ESPN.",338,6pcf6o
16,"Lebron asked him ""Is the world flat?"" as his closer.",38,cutethrow,/r/nba/comments/6pcf6o/wojnarowski_derrick_rose_has_communicated_with/dko8lpc/,dko8lpc,1500969383.0,1500940583.0,"[Wojnarowski] Derrick Rose has communicated with LeBron James through the process that led him to the Cavaliers, league sources tell ESPN.",338,6pcf6o
17,"I thought LeBron wasn't recruiting anybody this summer anymore...


Every news report is contradictory.",46,TrashCarryPlayer,/r/nba/comments/6pcf6o/wojnarowski_derrick_rose_has_communicated_with/dko8dtr/,dko8dtr,1500969101.0,1500940301.0,"[Wojnarowski] Derrick Rose has communicated with LeBron James through the process that led him to the Cavaliers, league sources tell ESPN.",338,6pcf6o
18,This is one stat that sounds a lot more impressive than it actually ks,173,happyhappy7,/r/nba/comments/6pcblt/espn_stats_info_when_he_takes_the_court_with_the/dko7kuz/,dko7kuz,1500968079.0,1500939279.0,"[ESPN Stats & Info] When he takes the court with the Cavaliers, Derrick Rose will be the 6th No. 1 overall pick to team with LeBron James. (The others are Andrew Bogut, Kyrie Irving, Greg Oden, Shaquille O'Neal and Joe Smith.)",170,6pcblt
19,Fun fact: Andrew bogut never missed a shot playing with lebron james,134,,/r/nba/comments/6pcblt/espn_stats_info_when_he_takes_the_court_with_the/dko7mk0/,dko7mk0,1500968138.0,1500939338.0,"[ESPN Stats & Info] When he takes the court with the Cavaliers, Derrick Rose will be the 6th No. 1 overall pick to team with LeBron James. (The others are Andrew Bogut, Kyrie Irving, Greg Oden, Shaquille O'Neal and Joe Smith.)",170,6pcblt
20,Nearly Wiggins and Bennett as well,55,zuckdaddyd,/r/nba/comments/6pcblt/espn_stats_info_when_he_takes_the_court_with_the/dko7yit/,dko7yit,1500968564.0,1500939764.0,"[ESPN Stats & Info] When he takes the court with the Cavaliers, Derrick Rose will be the 6th No. 1 overall pick to team with LeBron James. (The others are Andrew Bogut, Kyrie Irving, Greg Oden, Shaquille O'Neal and Joe Smith.)",170,6pcblt
21,Andrew Bogut and Greg Oden really shouldnt even count,41,BenIsLowInfo,/r/nba/comments/6pcblt/espn_stats_info_when_he_takes_the_court_with_the/dko7lkh/,dko7lkh,1500968104.0,1500939304.0,"[ESPN Stats & Info] When he takes the court with the Cavaliers, Derrick Rose will be the 6th No. 1 overall pick to team with LeBron James. (The others are Andrew Bogut, Kyrie Irving, Greg Oden, Shaquille O'Neal and Joe Smith.)",170,6pcblt
22,basically all the bads ones + old Shaq lol (and Kyrie),29,,/r/nba/comments/6pcblt/espn_stats_info_when_he_takes_the_court_with_the/dko7kh5/,dko7kh5,1500968064.0,1500939264.0,"[ESPN Stats & Info] When he takes the court with the Cavaliers, Derrick Rose will be the 6th No. 1 overall pick to team with LeBron James. (The others are Andrew Bogut, Kyrie Irving, Greg Oden, Shaquille O'Neal and Joe Smith.)",170,6pcblt
23,"Also, does anyone know who the hell is joe smith",31,Smugleaf_Raptors2012,/r/nba/comments/6pcblt/espn_stats_info_when_he_takes_the_court_with_the/dko7kb1/,dko7kb1,1500968058.0,1500939258.0,"[ESPN Stats & Info] When he takes the court with the Cavaliers, Derrick Rose will be the 6th No. 1 overall pick to team with LeBron James. (The others are Andrew Bogut, Kyrie Irving, Greg Oden, Shaquille O'Neal and Joe Smith.)",170,6pcblt
24,How much of that is against GSW though?,104,K_multiplied-by_K,/r/nba/comments/6paxdv/mike_mike_in_61_postseason_minutes_with_kyrie/dknwbsd/,dknwbsd,1500955082.0,1500926282.0,"[Mike & Mike] In 61 postseason minutes with Kyrie Irving on the floor and LeBron off of it, the Cavaliers were outscored by 30 points.",220,6paxdv
25,"Breakdown by playoff round:

VS Pacers: 15 minutes -18

VS Raptors: 14 minutes +9

VS Celtics: 15 minutes +3

VS Warriors: 15 minutes - 24",57,,/r/nba/comments/6paxdv/mike_mike_in_61_postseason_minutes_with_kyrie/dknwmdv/,dknwmdv,1500955406.0,1500926606.0,"[Mike & Mike] In 61 postseason minutes with Kyrie Irving on the floor and LeBron off of it, the Cavaliers were outscored by 30 points.",220,6paxdv
26,"While they aren't useless, stats like these are blown way out of proportion ",43,b0flex,/r/nba/comments/6paxdv/mike_mike_in_61_postseason_minutes_with_kyrie/dknwc7f/,dknwc7f,1500955094.0,1500926294.0,"[Mike & Mike] In 61 postseason minutes with Kyrie Irving on the floor and LeBron off of it, the Cavaliers were outscored by 30 points.",220,6paxdv
27,"I really hope this saga ends with Kyrie saying:

""See this is what's so crazy about the media they take anything and just focus on it so much man. It's so peculiar how easy it is to manipulate the media and such. Me and Bron are bros I love Cleveland and clearly the earth is round jeez guys""",59,thephotobooths,/r/nba/comments/6pai8f/kyrielebron_fallout_and_carmelotookc_with_kevin/dknst9s/,dknst9s,1500951344.0,1500922544.0,Kyrie-LeBron Fallout and Carmelo-to-OKC With Kevin O'Connor and Joe House (Ep. 241) by The Bill Simmons Podcast,48,6pai8f
28,[deleted],29,,/r/nba/comments/6pai8f/kyrielebron_fallout_and_carmelotookc_with_kevin/dknswh4/,dknswh4,1500951438.0,1500922638.0,Kyrie-LeBron Fallout and Carmelo-to-OKC With Kevin O'Connor and Joe House (Ep. 241) by The Bill Simmons Podcast,48,6pai8f
29,Wade and Melo will be free agents and can join him.,27,,/r/nba/comments/6pa995/if_you_believe_lebron_cares_about_his_legacy_at/dknr0xy/,dknr0xy,1500949485.0,1500920685.0,"If you believe LeBron cares about his legacy at all anymore, going to the Lakers should seem ridiculous to you",118,6pa995
30,Spurs or he stays imo,56,fuck_going_shopping,/r/nba/comments/6pa995/if_you_believe_lebron_cares_about_his_legacy_at/dknrcnd/,dknrcnd,1500949821.0,1500921021.0,"If you believe LeBron cares about his legacy at all anymore, going to the Lakers should seem ridiculous to you",118,6pa995
31,"Eh, I think there are plausible scenarios where the Lakers could field a team that would be able to be competitive against the Warriors with LeBron. Plausible, but not likely.

*If* they could field such a team, this *absolutely* would fit with LeBron's legacy. LeBron loves being a part of basketball history. Is there a much better story than bringing one of the greatest franchises in the NBA back to greatness after its worst stretch in recent memory?",27,mr_showboat,/r/nba/comments/6pa995/if_you_believe_lebron_cares_about_his_legacy_at/dknr02r/,dknr02r,1500949460.0,1500920660.0,"If you believe LeBron cares about his legacy at all anymore, going to the Lakers should seem ridiculous to you",118,6pa995
32,"Stretch Deng, let Randle go, trade Clarkson for a 2nd round pick.

We now have cap space to put a better team together than the Cavs.

Is that likely? Nah, not at all. But it's still definitely possible, lol. You can't say it's unfathomable.

Thinking that LeBron joining the same division as the Warriors is LeBron waiving the white flag has to be the stupidest thing I've heard about the entire situation though.",82,lakerswiz,/r/nba/comments/6pa995/if_you_believe_lebron_cares_about_his_legacy_at/dknqvro/,dknqvro,1500949335.0,1500920535.0,"If you believe LeBron cares about his legacy at all anymore, going to the Lakers should seem ridiculous to you",118,6pa995
33,Wasn't kobe just mad that Shaq took his talent for granted and didn't work as hard as him?,48,,/r/nba/comments/6p9m46/ding_harking_back_to_october_column_in_which_ty/dknljdp/,dknljdp,1500943682.0,1500914882.0,"[Ding] Harking back to October column in which Ty Lue told me of Kyrie-LeBron vs. Kobe-Shaq: ""It's like it's the same.""",43,6p9m46
34,I got hurt on company time so I'll heal on company time ,24,Dongsquad420BlazeIt,/r/nba/comments/6p9m46/ding_harking_back_to_october_column_in_which_ty/dknm4y9/,dknm4y9,1500944317.0,1500915517.0,"[Ding] Harking back to October column in which Ty Lue told me of Kyrie-LeBron vs. Kobe-Shaq: ""It's like it's the same.""",43,6p9m46
35,"So, how long until people start making ""Lillard for Kyrie, who says no"" posts?",2040,Ghenii,/r/nba/comments/6p9d0k/damian_lillard_speaks_on_the_kyrie_irving/dknjiey/,dknjiey,1500941500.0,1500912700.0,"Damian Lillard speaks on the Kyrie Irving situation: ""Who wouldn't want to go to the Finals every year? I would love to do that. Just watching from the outside, you see how easy [LeBron] makes the game for everybody else. I don't see why anybody wouldn't want to play with him.""",7101,6p9d0k
36,Speaks like a guy that thinks earth is round,6618,viniribeiro,/r/nba/comments/6p9d0k/damian_lillard_speaks_on_the_kyrie_irving/dknjhba/,dknjhba,1500941466.0,1500912666.0,"Damian Lillard speaks on the Kyrie Irving situation: ""Who wouldn't want to go to the Finals every year? I would love to do that. Just watching from the outside, you see how easy [LeBron] makes the game for everybody else. I don't see why anybody wouldn't want to play with him.""",7101,6p9d0k
37,Getting a ring early in his career seems to really have influenced what Kyrie wants next. ,1041,Not_A_Doctor__,/r/nba/comments/6p9d0k/damian_lillard_speaks_on_the_kyrie_irving/dknkauh/,dknkauh,1500942364.0,1500913564.0,"Damian Lillard speaks on the Kyrie Irving situation: ""Who wouldn't want to go to the Finals every year? I would love to do that. Just watching from the outside, you see how easy [LeBron] makes the game for everybody else. I don't see why anybody wouldn't want to play with him.""",7101,6p9d0k
38,Dame is just trying to get LeBron all buttered up for Portland.,304,,/r/nba/comments/6p9d0k/damian_lillard_speaks_on_the_kyrie_irving/dknkoio/,dknkoio,1500942770.0,1500913970.0,"Damian Lillard speaks on the Kyrie Irving situation: ""Who wouldn't want to go to the Finals every year? I would love to do that. Just watching from the outside, you see how easy [LeBron] makes the game for everybody else. I don't see why anybody wouldn't want to play with him.""",7101,6p9d0k
39,LeBron to Portland confirmed. ,1561,shy247er,/r/nba/comments/6p9d0k/damian_lillard_speaks_on_the_kyrie_irving/dknjewr/,dknjewr,1500941393.0,1500912593.0,"Damian Lillard speaks on the Kyrie Irving situation: ""Who wouldn't want to go to the Finals every year? I would love to do that. Just watching from the outside, you see how easy [LeBron] makes the game for everybody else. I don't see why anybody wouldn't want to play with him.""",7101,6p9d0k
40,Portland LeBlazers,359,Jayveesac,/r/nba/comments/6p9d0k/damian_lillard_speaks_on_the_kyrie_irving/dknjg7n/,dknjg7n,1500941432.0,1500912632.0,"Damian Lillard speaks on the Kyrie Irving situation: ""Who wouldn't want to go to the Finals every year? I would love to do that. Just watching from the outside, you see how easy [LeBron] makes the game for everybody else. I don't see why anybody wouldn't want to play with him.""",7101,6p9d0k
41,"From listening to multiple episodes of Road Trippin featuring Kyrie, I believe he is sincere or at least puts off a genuine vibe, however the thing is he also comes off as a pseudo intellect or at least not completely in tune with the world in a naive way. 

The reason I say this isn't just from the flat earth episode but also from the episode about how he is the Luaryn Hil of the NBA and how he wants to and plans on building a commune, his perspectiv was pure but you can tell there isn't depth to why and how any of what he was saying would happen. I've seen this sort of perspective so often from people that are young and sheltered from a life that's uncomfortable, it leads to an entitlement in that things have to be black or white.",191,RevinWurant,/r/nba/comments/6p9d0k/damian_lillard_speaks_on_the_kyrie_irving/dknlumm/,dknlumm,1500944014.0,1500915214.0,"Damian Lillard speaks on the Kyrie Irving situation: ""Who wouldn't want to go to the Finals every year? I would love to do that. Just watching from the outside, you see how easy [LeBron] makes the game for everybody else. I don't see why anybody wouldn't want to play with him.""",7101,6p9d0k
42,Fucking love you Lillard. No one but Kyrie knows whats in kyries head but I straight up so not understand how in the world you wouldn't be ok with being as successful as he's been with LeBron. ,496,cryolems,/r/nba/comments/6p9d0k/damian_lillard_speaks_on_the_kyrie_irving/dknjiu2/,dknjiu2,1500941513.0,1500912713.0,"Damian Lillard speaks on the Kyrie Irving situation: ""Who wouldn't want to go to the Finals every year? I would love to do that. Just watching from the outside, you see how easy [LeBron] makes the game for everybody else. I don't see why anybody wouldn't want to play with him.""",7101,6p9d0k
43,"Man I love Lillard. Him, Schroeder, and John Wall are my three favorite point guards in the league.",43,BlitzArchangel,/r/nba/comments/6p9d0k/damian_lillard_speaks_on_the_kyrie_irving/dknjgj1/,dknjgj1,1500941442.0,1500912642.0,"Damian Lillard speaks on the Kyrie Irving situation: ""Who wouldn't want to go to the Finals every year? I would love to do that. Just watching from the outside, you see how easy [LeBron] makes the game for everybody else. I don't see why anybody wouldn't want to play with him.""",7101,6p9d0k
44,Top 10 animus betrayals,760,wikiman2001,/r/nba/comments/6p8o0s/scott_wfny_windy_theres_an_incredible_amount_of/dkndtdm/,dkndtdm,1500934962.0,1500906162.0,"[Scott @ WFNY] Windy: ""There's an incredible amount of animus that has built up between LeBron and Kyrie.""",458,6p8o0s
45,"""Kyrie, tell me how my ass taste""",252,VinceJumpmanCarter,/r/nba/comments/6p8o0s/scott_wfny_windy_theres_an_incredible_amount_of/dkndvc1/,dkndvc1,1500935031.0,1500906231.0,"[Scott @ WFNY] Windy: ""There's an incredible amount of animus that has built up between LeBron and Kyrie.""",458,6p8o0s
46,"30 for 30

Kyrie "" The second i knew i had to leave to be my own man?""


Reporter "" yeah?""


Kyrie "" When Bron shot that off the backboard 3 against the Wizards, that moment i knew...... i knew nobody cared about the 3 i hit in game 7""


Reporter "" that was just a regular season game""


Kyrie "" not to me............. not to me...........""",570,VikusVidz,/r/nba/comments/6p8o0s/scott_wfny_windy_theres_an_incredible_amount_of/dkne75t/,dkne75t,1500935440.0,1500906640.0,"[Scott @ WFNY] Windy: ""There's an incredible amount of animus that has built up between LeBron and Kyrie.""",458,6p8o0s
47,With the new Assassins Creed coming out soon I'm thinking of getting it. I only played the first one through to Black Flag are the ones after that worth playing or should I just go straight to the new one?,260,friskydongo,/r/nba/comments/6p8o0s/scott_wfny_windy_theres_an_incredible_amount_of/dkndzi1/,dkndzi1,1500935176.0,1500906376.0,"[Scott @ WFNY] Windy: ""There's an incredible amount of animus that has built up between LeBron and Kyrie.""",458,6p8o0s
48,Before or after Kyrie said he didn't want to play with LeBron anymore?,51,malowry0124,/r/nba/comments/6p8o0s/scott_wfny_windy_theres_an_incredible_amount_of/dkndv68/,dkndv68,1500935025.0,1500906225.0,"[Scott @ WFNY] Windy: ""There's an incredible amount of animus that has built up between LeBron and Kyrie.""",458,6p8o0s
49,I feel like the media is fabricating 99% of this stuff. ,273,Climaximis,/r/nba/comments/6p8o0s/scott_wfny_windy_theres_an_incredible_amount_of/dkne0j3/,dkne0j3,1500935210.0,1500906410.0,"[Scott @ WFNY] Windy: ""There's an incredible amount of animus that has built up between LeBron and Kyrie.""",458,6p8o0s
50,"KD texts Russ ""And they thought our shit was bad lol"" 

Russ ""LOL"" ",120,RealPunyParker,/r/nba/comments/6p8o0s/scott_wfny_windy_theres_an_incredible_amount_of/dkneopk/,dkneopk,1500936036.0,1500907236.0,"[Scott @ WFNY] Windy: ""There's an incredible amount of animus that has built up between LeBron and Kyrie.""",458,6p8o0s
51,Fucking dammit. We getting wrecked for the last 2 days.,43,tapk69,/r/nba/comments/6p8o0s/scott_wfny_windy_theres_an_incredible_amount_of/dkndvta/,dkndvta,1500935049.0,1500906249.0,"[Scott @ WFNY] Windy: ""There's an incredible amount of animus that has built up between LeBron and Kyrie.""",458,6p8o0s
52,"Kyrie really wants to go back to winning 20 games a year.

He had the most reporters at his locker then.",52,FoFoAndFo,/r/nba/comments/6p8o0s/scott_wfny_windy_theres_an_incredible_amount_of/dkne00m/,dkne00m,1500935193.0,1500906393.0,"[Scott @ WFNY] Windy: ""There's an incredible amount of animus that has built up between LeBron and Kyrie.""",458,6p8o0s
53,Holy title,1501,,/r/nba/comments/6p8hk1/is_lebron_james_is_walmart_of_nba/dkncdzu/,dkncdzu,1500933119.0,1500904319.0,Is LeBron James is Walmart of NBA?,994,6p8hk1
54,Amazon > Walmart,312,LL_Cruel_J,/r/nba/comments/6p8hk1/is_lebron_james_is_walmart_of_nba/dknce1l/,dknce1l,1500933121.0,1500904321.0,Is LeBron James is Walmart of NBA?,994,6p8hk1
55,"Is Lebron James is Triceritops of the NBA?

He is by far biggest/baddest force in the jungle.


He comes to the team (any jungle in the world) and builds the powerhouse (gets fat on veggies) while killing future talent (plants).

Everything works well until taxes kick in (Meteor comes).

Once that happens team (World) becomes prohibitively expensive. He bails for another location (Triceritops' have been known to leave planets after global catastrophes) leaving an empty shell (meteor hole) and dead team with little to no future.
",546,sirhumphry,/r/nba/comments/6p8hk1/is_lebron_james_is_walmart_of_nba/dkncspo/,dkncspo,1500933653.0,1500904853.0,Is LeBron James is Walmart of NBA?,994,6p8hk1
56,Who is LeBron's great value brand? Andre Igoudala? ,79,Extremeaty,/r/nba/comments/6p8hk1/is_lebron_james_is_walmart_of_nba/dknclwl/,dknclwl,1500933408.0,1500904608.0,Is LeBron James is Walmart of NBA?,994,6p8hk1
57,I came here expecting a shit shitpost but ended up getting an almost reasonable shitpost,201,chinqs96,/r/nba/comments/6p8hk1/is_lebron_james_is_walmart_of_nba/dkncg02/,dkncg02,1500933193.0,1500904393.0,Is LeBron James is Walmart of NBA?,994,6p8hk1
58,Is the homeless man asking for change outside Delonte West? ,51,NaciremaBlack,/r/nba/comments/6p8hk1/is_lebron_james_is_walmart_of_nba/dkncqx6/,dkncqx6,1500933590.0,1500904790.0,Is LeBron James is Walmart of NBA?,994,6p8hk1
59,"Your last two points don't make any sense at all.  Walmart doesn't make a habit of building stores for a couple of years and then abandon them.  And when it does close stores it is usually to dodge labor unions, not property taxes.  ",26,Fuzzy_Dunlops,/r/nba/comments/6p8hk1/is_lebron_james_is_walmart_of_nba/dknmfxf/,dknmfxf,1500944639.0,1500915839.0,Is LeBron James is Walmart of NBA?,994,6p8hk1
60,You should quit your day job and write headlines for ESPN.,21,BotSimulator,/r/nba/comments/6p8hk1/is_lebron_james_is_walmart_of_nba/dknipqh/,dknipqh,1500940621.0,1500911821.0,Is LeBron James is Walmart of NBA?,994,6p8hk1
61,"Lebron James  
2011 Lebron James  
2003 Lebron James  
2007 Lebron James  
James Jones",192,Vordeo,/r/nba/comments/6p83cm/if_lebron_constructed_his_own_team_from_scratch/dkn9me7/,dkn9me7,1500928926.0,1500900126.0,"If LeBron constructed his own team from scratch, who do you think would be in his starting lineup of choice?",81,6p83cm
62,"Ben Simmons, Joel Embiid, Markelle Fultz, Dario Saric. ",238,orangemetal,/r/nba/comments/6p83cm/if_lebron_constructed_his_own_team_from_scratch/dkn9pwn/,dkn9pwn,1500929092.0,1500900292.0,"If LeBron constructed his own team from scratch, who do you think would be in his starting lineup of choice?",81,6p83cm
63,Banana boat and Tristian Thompson,64,WillConway2016,/r/nba/comments/6p83cm/if_lebron_constructed_his_own_team_from_scratch/dkn9iwx/,dkn9iwx,1500928754.0,1500899954.0,"If LeBron constructed his own team from scratch, who do you think would be in his starting lineup of choice?",81,6p83cm
64,"James Jones, James Jones, James Jones, LeBron James Jr.",49,,/r/nba/comments/6p83cm/if_lebron_constructed_his_own_team_from_scratch/dkn9mgo/,dkn9mgo,1500928929.0,1500900129.0,"If LeBron constructed his own team from scratch, who do you think would be in his starting lineup of choice?",81,6p83cm
65,"Assuming vs warriors: cp3, harden, Kawhi, Lebron, KAT",69,_felagund,/r/nba/comments/6p83cm/if_lebron_constructed_his_own_team_from_scratch/dkn9qqf/,dkn9qqf,1500929130.0,1500900330.0,"If LeBron constructed his own team from scratch, who do you think would be in his starting lineup of choice?",81,6p83cm
66,"LeBron, LeBron clone 1 (name LeBro), LeBron clone 2 (name LeBronda), LeBron clone 3 (named LeDong), and LeBron clone 4 (named Todd). ",40,SwanSong18,/r/nba/comments/6p83cm/if_lebron_constructed_his_own_team_from_scratch/dkn9kgs/,dkn9kgs,1500928831.0,1500900031.0,"If LeBron constructed his own team from scratch, who do you think would be in his starting lineup of choice?",81,6p83cm
