,body,score,author,permalink,comment_id,created_loc,created_utc,post_title,post_score,post_id
220,"You know what's kinda stupid about that statement?

KG and Jason Kidd have been quite successful in this era, and they're both so damn old that they were **also** successful in the 90s.",81,toldyaso,/r/nba/comments/18lwfp/kobe_lebron_duncan_and_dirk_mj_lists_the_only_4/c8fxmvo/,c8fxmvo,1361000272.0,1360971472.0,"Kobe, Lebron, Duncan and Dirk: MJ lists the only 4 players who he thinks would have been successful in his era. Thoughts?",69,18lwfp
221,"MJ reminds me of my parents when they're going on about how everything used to be better in the ""old times"". Even if the league has become somewhat soft, players can adapt so I don't see why they wouldn't be as successful.",33,,/r/nba/comments/18lwfp/kobe_lebron_duncan_and_dirk_mj_lists_the_only_4/c8fxc5h/,c8fxc5h,1360999174.0,1360970374.0,"Kobe, Lebron, Duncan and Dirk: MJ lists the only 4 players who he thinks would have been successful in his era. Thoughts?",69,18lwfp
222,The era wasn't as tough or as hard as those guys seemingly make it out to be.,49,lakerswiz,/r/nba/comments/18lwfp/kobe_lebron_duncan_and_dirk_mj_lists_the_only_4/c8fyfbp/,c8fyfbp,1361003286.0,1360974486.0,"Kobe, Lebron, Duncan and Dirk: MJ lists the only 4 players who he thinks would have been successful in his era. Thoughts?",69,18lwfp
223,[deleted],62,,/r/nba/comments/18lwfp/kobe_lebron_duncan_and_dirk_mj_lists_the_only_4/c8fxd8p/,c8fxd8p,1360999286.0,1360970486.0,"Kobe, Lebron, Duncan and Dirk: MJ lists the only 4 players who he thinks would have been successful in his era. Thoughts?",69,18lwfp
224,"If heckling really motivates Lebron, the Heat should find the best heckler (unbeknownst to Lebron), buy him court side seats for the playoffs, and profit.",83,clever_user_name,/r/nba/comments/18l6ys/so_my_little_brothers_heckling_motivated_lebron/c8frnbd/,c8frnbd,1360980716.0,1360951916.0,So my little brother's heckling motivated LeBron to going on a scoring tear last night. :-/,380,18l6ys
225,"This is equivalent to heckling a lion then being surprised when said lion bites your arm off.
",192,kbhowareya,/r/nba/comments/18l6ys/so_my_little_brothers_heckling_motivated_lebron/c8fr6ge/,c8fr6ge,1360979224.0,1360950424.0,So my little brother's heckling motivated LeBron to going on a scoring tear last night. :-/,380,18l6ys
226,"I don't even see the point in heckling LeBron anymore. Just pray silently that the shot doesn't go in, because otherwise you are filling his rage-meter which results in Beast(lier)-Mode. ",41,ParanoidAndroids,/r/nba/comments/18l6ys/so_my_little_brothers_heckling_motivated_lebron/c8fr63h/,c8fr63h,1360979193.0,1360950393.0,So my little brother's heckling motivated LeBron to going on a scoring tear last night. :-/,380,18l6ys
227,"What's the point in that kind of heckling? Ya gotta go all reverse psychology on them with things like ""HEY LEBRON YOURE PRETTY GOOD, NOT SURE IF YOU CAN HIT THAT JUMPSHOT BUT WELL SEE""",124,,/r/nba/comments/18l6ys/so_my_little_brothers_heckling_motivated_lebron/c8fqwfo/,c8fqwfo,1360978330.0,1360949530.0,So my little brother's heckling motivated LeBron to going on a scoring tear last night. :-/,380,18l6ys
228,This is random but I fucking hate the author of this article for using smh in published content.,65,DystopiaX,/r/nba/comments/18l6ys/so_my_little_brothers_heckling_motivated_lebron/c8ft7d4/,c8ft7d4,1360985644.0,1360956844.0,So my little brother's heckling motivated LeBron to going on a scoring tear last night. :-/,380,18l6ys
229,Is it just me or does lebron look a lot like kratos in [that picture?](http://cdnl.complex.com/mp/620/400/80/0/bb/1/ffffff/fc60cc39bff713f6093fda8eb793d758/images_/assets/CHANNEL_IMAGES/SPORTS/2013/02/lebron_neufb.jpg),47,xx23465xx,/r/nba/comments/18l6ys/so_my_little_brothers_heckling_motivated_lebron/c8frcs8/,c8frcs8,1360979781.0,1360950981.0,So my little brother's heckling motivated LeBron to going on a scoring tear last night. :-/,380,18l6ys
230,Now people can't be mad when he makes jump shots in NBA 2K.,39,akgamestar,/r/nba/comments/18kcrk/lebron_with_the_amazing_stepback_over_durant/c8fm7xj/,c8fm7xj,1360947444.0,1360918644.0,Lebron with the amazing stepback over Durant,437,18kcrk
231,Its over folks. he can go to his left too. We should all just pack up and leave.,33,edtehgar,/r/nba/comments/18kcrk/lebron_with_the_amazing_stepback_over_durant/c8flve2/,c8flve2,1360944787.0,1360915987.0,Lebron with the amazing stepback over Durant,437,18kcrk
232,[Another ridiculous shot right after this possession](http://assets.sbnation.com/assets/2170125/ohnoperkins.gif),42,lebrown21,/r/nba/comments/18kcrk/lebron_with_the_amazing_stepback_over_durant/c8fjfv9/,c8fjfv9,1360933073.0,1360904273.0,Lebron with the amazing stepback over Durant,437,18kcrk
233,It doesn't matter what team you root for.. if you do not enjoy watching LeBron play at this level then you just don't like basketball. ,28,Ghenges,/r/nba/comments/18kcrk/lebron_with_the_amazing_stepback_over_durant/c8fnkfr/,c8fnkfr,1360960757.0,1360931957.0,Lebron with the amazing stepback over Durant,437,18kcrk
234,Lots of pissed off OKC fans downvoting this thread haha.,49,IanicRR,/r/nba/comments/18kcrk/lebron_with_the_amazing_stepback_over_durant/c8fkhua/,c8fkhua,1360937197.0,1360908397.0,Lebron with the amazing stepback over Durant,437,18kcrk
235,Michael Jordan also picked Kwame Brown over Tyson Chandler and Pau Gasol.,665,k3vlar80,/r/nba/comments/18jmn0/michael_jordan_says_he_would_pick_kobe_bryant/c8fcxv3/,c8fcxv3,1360911369.0,1360882569.0,Michael Jordan says he would pick Kobe Bryant over Lebron James,249,18jmn0
236,"I can't believe everyone is buying into the media's inflammatory take on what Jordan was asked and how he responded.  [Here's the original article.](http://www.sun-sentinel.com/sports/miami-heat/sfl-miami-heat-michael-jordan-s021413,0,123103.story)  ""Interviewed for a special that will run Monday at 8 p.m. on NBA TV, Jordan said he currently views Bryant as having the more successful career to this point than James.""  

Does anyone actually disagree with this?  Isn't success -- not who is the better player, but who is more successful -- all about championships?  And yes, that does mean Russell was more successful than Jordan, absolutely.  Maybe not Horry, because it is not fair to compare role players to stars, but certainly Russell.

Sheesh, I just feel like people love piling on Jordan these days.  Yes, he can be a jerk, but don't buy into the media hype.

Edit: I hope everyone watched Inside the NBA tonight.  Chuck picked James if he wins six championships like Jordan.  Kenny picked Kobe because there is a proven record there, not just potential.  Shaq picked Kobe because he has those five championships and that's how players are measured.  None of them were arguing that Kobe is a better player than James, just that at this point he has been more successful, while with James it's about what's to come, what seems inevitable -- but it hasn't happened yet, and we don't know that it will.",130,wjbc,/r/nba/comments/18jmn0/michael_jordan_says_he_would_pick_kobe_bryant/c8fegif/,c8fegif,1360916238.0,1360887438.0,Michael Jordan says he would pick Kobe Bryant over Lebron James,249,18jmn0
237,"He's just saying it's too early to judge James' career.  Of course, there's self interest there as well, since six beats five or one.",61,wjbc,/r/nba/comments/18jmn0/michael_jordan_says_he_would_pick_kobe_bryant/c8fcy1i/,c8fcy1i,1360911383.0,1360882583.0,Michael Jordan says he would pick Kobe Bryant over Lebron James,249,18jmn0
238,"This is an awful title that misrepresents the story.  Jordan said that Kobe is more accomplished, not that he would pick him now.  There's a big difference.",22,maxelrod,/r/nba/comments/18jmn0/michael_jordan_says_he_would_pick_kobe_bryant/c8ff3j2/,c8ff3j2,1360918407.0,1360889607.0,Michael Jordan says he would pick Kobe Bryant over Lebron James,249,18jmn0
239,">""If you had to pick between the two, that would be a tough choice,"" said Jordan, ""but five beats one every time I look at it.""


Bill Russell>Jordan",256,FuckYouGod,/r/nba/comments/18jmn0/michael_jordan_says_he_would_pick_kobe_bryant/c8fcxn6/,c8fcxn6,1360911350.0,1360882550.0,Michael Jordan says he would pick Kobe Bryant over Lebron James,249,18jmn0
240,Great players do not make great GMs. I think we already knew that.,106,WhatYouProbablyMeant,/r/nba/comments/18jmn0/michael_jordan_says_he_would_pick_kobe_bryant/c8fcxol/,c8fcxol,1360911354.0,1360882554.0,Michael Jordan says he would pick Kobe Bryant over Lebron James,249,18jmn0
241,"Well, that explains the Bobcats.",128,,/r/nba/comments/18jmn0/michael_jordan_says_he_would_pick_kobe_bryant/c8fd0j8/,c8fd0j8,1360911598.0,1360882798.0,Michael Jordan says he would pick Kobe Bryant over Lebron James,249,18jmn0
242,"In context of their careers, it's obvious that Kobe is still superior. He's been dominating for 17 years. Just cause he's getting old, people's already forgetting just how batshit insane he was back in the 2000s. ",26,Paladinoras,/r/nba/comments/18jmn0/michael_jordan_says_he_would_pick_kobe_bryant/c8fe8ft/,c8fe8ft,1360915488.0,1360886688.0,Michael Jordan says he would pick Kobe Bryant over Lebron James,249,18jmn0
243,And James says he doesn't care at all.,50,PedosoKJ,/r/nba/comments/18jmn0/michael_jordan_says_he_would_pick_kobe_bryant/c8fcw8s/,c8fcw8s,1360911230.0,1360882430.0,Michael Jordan says he would pick Kobe Bryant over Lebron James,249,18jmn0
244,"Flawless? Excuse me, but he had a turnover on Feb. 12th. **AND** he missed a free throw. ",121,ReallyGuysImCool,/r/nba/comments/18is77/lebron_james_playing_flawless_basketball_in/c8f8dz3/,c8f8dz3,1360897839.0,1360869039.0,LeBron James Playing Flawless Basketball In Pathetic Bid For Nation's Approval [ONION],555,18is77
245,"What kind of example is LeBron setting for young black kids? How can he in good conscious incorperate *steals* into his game as well.

-Steve Smith",90,,/r/nba/comments/18is77/lebron_james_playing_flawless_basketball_in/c8f6sv8/,c8f6sv8,1360892973.0,1360864173.0,LeBron James Playing Flawless Basketball In Pathetic Bid For Nation's Approval [ONION],555,18is77
246,Skip Bayless writes for The Onion??,36,motez23,/r/nba/comments/18is77/lebron_james_playing_flawless_basketball_in/c8f7c0z/,c8f7c0z,1360894641.0,1360865841.0,LeBron James Playing Flawless Basketball In Pathetic Bid For Nation's Approval [ONION],555,18is77
247,"Did anyone else read the related articles? ""Kobe Bryant holds Kobe Bryant-only meeting to discuss Lakers"" 

",22,kemycko,/r/nba/comments/18is77/lebron_james_playing_flawless_basketball_in/c8f9wsp/,c8f9wsp,1360902423.0,1360873623.0,LeBron James Playing Flawless Basketball In Pathetic Bid For Nation's Approval [ONION],555,18is77
248,Seems like something Skip Bayless would write.,44,adamd28,/r/nba/comments/18is77/lebron_james_playing_flawless_basketball_in/c8f6uyp/,c8f6uyp,1360893152.0,1360864352.0,LeBron James Playing Flawless Basketball In Pathetic Bid For Nation's Approval [ONION],555,18is77
249,[deleted],29,,/r/nba/comments/18is77/lebron_james_playing_flawless_basketball_in/c8f6f7y/,c8f6f7y,1360891803.0,1360863003.0,LeBron James Playing Flawless Basketball In Pathetic Bid For Nation's Approval [ONION],555,18is77
250,Jennings far exceeds lebron's skills from the left corner.,45,noobeater,/r/nba/comments/18ihkp/lebron_james_vs_brandon_jennings_over_the_last_6/c8f3chj/,c8f3chj,1360880961.0,1360852161.0,Lebron James vs Brandon Jennings over the last 6 games. ,41,18ihkp
251,How can anyone go 14/40 at the rim?  Lmao,25,ashishduh,/r/nba/comments/18ihkp/lebron_james_vs_brandon_jennings_over_the_last_6/c8f4sy2/,c8f4sy2,1360886596.0,1360857796.0,Lebron James vs Brandon Jennings over the last 6 games. ,41,18ihkp
252,"LBJs play of late has certainly sparked a discussion of his greatness, and while LeBron makes a good case already for being the greatest ever, I'll personally refrain from applying the GOAT title until after he retires.
He's just got way too much of his career ahead of him still.",99,,/r/nba/comments/18ggzg/why_lebron_is_and_isnt_jordan/c8elo35/,c8elo35,1360810275.0,1360781475.0,Why LeBron is and isn't Jordan,156,18ggzg
253,"I see a lot of this ""GOAT"" talk, but I'm not even sure people agree on what that even means. When we say ""GOAT"", there are two meanings to it: greatest CAREER of all time and greatest PLAYER of all time. 

Jordan had what almost everyone considers the greatest career of all time -- individual accomplishments, lots of awards, lots of rings. That's hard to beat. No one could seriously try to assert that Lebron right now has had a better career than Jordan.

But in terms of simply being a ""damn good basketball player"", I think it is indeed arguable that Lebron might be one of THE greatest players to play the game. Sure as hell doesn't mean his career has been storybook or that his legacy is cemented, but in terms of what he does on the basketball court I don't have a problem with people saying he may be, along with Jordan, one of the greatest ever. It's kind of like with Shaq -- not many consider him to be the greatest of all time in terms of overall career, but in terms of being one hell of a dominant player, he is among the very best ever.

I think some people confuse the two ideas and that makes ""GOAT"" claims sound ridiculous depending on what your stance is on what that term means. It's downright silly to say that Lebron has had a better NBA career and legacy than Jordan and at this point it shouldn't really even be discussed. But in terms of simply being a great -- and maybe one of the greatest -- basketball players ever, I think that's fair to discuss. 

More simply stated: What Lebron DOES on the court compared to MJ, we can have a meaningful discussion about. What Lebron HAS DONE on the court compared to MJ is a pointless argument at this moment.",55,theblackhole25,/r/nba/comments/18ggzg/why_lebron_is_and_isnt_jordan/c8eq5s1/,c8eq5s1,1360822568.0,1360793768.0,Why LeBron is and isn't Jordan,156,18ggzg
254,">Four scoring titles and nothing to show for it before his xxxx-xx season.

there's someone else that sounds dangerously close to this right now...",37,,/r/nba/comments/18ggzg/why_lebron_is_and_isnt_jordan/c8eon90/,c8eon90,1360818561.0,1360789761.0,Why LeBron is and isn't Jordan,156,18ggzg
255,"This is great. The thing that bothers me about the GOAT discussion is that MJ was/is so sensationalized as a sports icon that people are completely stuck on the idea of him being the GOAT forever. If we look at it objectively, LeBron clearly has the potential at the end of his career to go down as the GOAT.

On LBJ's facebook status a bunch of mouth-breathers saying things like ""LeBron doesn't have the heart MJ had!!!"" and ""MJ would slaughter LeBron 1v1!!!"". Its like reading a million skip bayless comments",62,,/r/nba/comments/18ggzg/why_lebron_is_and_isnt_jordan/c8em949/,c8em949,1360811982.0,1360783182.0,Why LeBron is and isn't Jordan,156,18ggzg
256,"Good article. 

Should be mandatory to read before posting in this sub to avoid all further ""who is the GOAT?"" discussion.",40,Kashmir33,/r/nba/comments/18ggzg/why_lebron_is_and_isnt_jordan/c8eliaa/,c8eliaa,1360809795.0,1360780995.0,Why LeBron is and isn't Jordan,156,18ggzg
257,Never go full espn,51,Fakeaccount234,/r/nba/comments/18fym1/lebron_james_just_tweeted_im_not_mj_im_lj/c8egbdc/,c8egbdc,1360791697.0,1360762897.0,"lebron james just tweeted ""I'm not MJ, I'm LJ""",26,18fym1
258,"what he is basically saying, ""skip bayless, you retarded nigga""",21,A_Slow_Descent,/r/nba/comments/18fym1/lebron_james_just_tweeted_im_not_mj_im_lj/c8egirx/,c8egirx,1360792796.0,1360763996.0,"lebron james just tweeted ""I'm not MJ, I'm LJ""",26,18fym1
259,"Pfft, my MyPlayer, Tank McLargeHuge does this every game and then some. Off the bench too",73,Completebeast,/r/nba/comments/18f5io/lebron_james_is_the_first_nba_player_in_history/c8eaa90/,c8eaa90,1360758057.0,1360729257.0,Lebron James is the first NBA player in history to have  six straight games with over 30 points and %60+ shooting,819,18f5io
260,You guys are forgetting the real reason LeBron is doing so well this year:  he has a top 5 pg in Chalmers,164,frantic_zombie,/r/nba/comments/18f5io/lebron_james_is_the_first_nba_player_in_history/c8ec2y0/,c8ec2y0,1360763667.0,1360734867.0,Lebron James is the first NBA player in history to have  six straight games with over 30 points and %60+ shooting,819,18f5io
261,Sure is Heat in here.,59,Decatur_Psalm,/r/nba/comments/18f5io/lebron_james_is_the_first_nba_player_in_history/c8e937i/,c8e937i,1360754714.0,1360725914.0,Lebron James is the first NBA player in history to have  six straight games with over 30 points and %60+ shooting,819,18f5io
262,"Sorry to all the Thunder fans, but Lebron is playing better than Durant right now and deserves the MVP.",332,cbaswag,/r/nba/comments/18f5io/lebron_james_is_the_first_nba_player_in_history/c8e8ojk/,c8e8ojk,1360753533.0,1360724733.0,Lebron James is the first NBA player in history to have  six straight games with over 30 points and %60+ shooting,819,18f5io
263,"This is getting kind of ridiculous, someone tell lebron to turn off the cheat codes. ",100,Skyline9,/r/nba/comments/18f5io/lebron_james_is_the_first_nba_player_in_history/c8e8k6x/,c8e8k6x,1360753184.0,1360724384.0,Lebron James is the first NBA player in history to have  six straight games with over 30 points and %60+ shooting,819,18f5io
264,"I'm just so happy that I get to watch this guy play, I will be able to say that I watched Lebron James play in his prime!

We are all Witnesses!!",159,SATAN888,/r/nba/comments/18f5io/lebron_james_is_the_first_nba_player_in_history/c8e8pz8/,c8e8pz8,1360753648.0,1360724848.0,Lebron James is the first NBA player in history to have  six straight games with over 30 points and %60+ shooting,819,18f5io
265,"Lebron and Messi in the same lifetime. Two of the greatest athletes ever, It is a pleasure to witness. ",107,jimbo-5-,/r/nba/comments/18f5io/lebron_james_is_the_first_nba_player_in_history/c8e9qgt/,c8e9qgt,1360756547.0,1360727747.0,Lebron James is the first NBA player in history to have  six straight games with over 30 points and %60+ shooting,819,18f5io
266,It's getting harder and harder to deny his dominance,35,Bubs604,/r/nba/comments/18f5io/lebron_james_is_the_first_nba_player_in_history/c8e9e1a/,c8e9e1a,1360755590.0,1360726790.0,Lebron James is the first NBA player in history to have  six straight games with over 30 points and %60+ shooting,819,18f5io
267,"What amazes me about LeBron by this point is how he's been playing for a number of years in the league and *still* makes that jump. Seriously. He makes extremely athletic leaps every game and, if he were any other player, I'd be wincing by this point. But I've never seen him land bad *and* have an extended injury. His freakish durability is part of his, well, his overall package of freakishness. There are guys as big as LeBron in the L (but none with nearly the pure talent and skill). But we've grown pretty accustomed to seeing them routinely out with knee and ankle injuries. LeBron is just... different. ",22,,/r/nba/comments/18drmn/anyone_remember_this_lebron_james_superhuman/c8dw6d5/,c8dw6d5,1360716514.0,1360687714.0,Anyone remember this? LeBron James superhuman leaping ability,85,18drmn
268,"He has a point.  LeBron really wasn't that great of an NBA player.

Then he turned 20.",21,Markups,/r/nba/comments/18cvt5/espns_charley_rosens_scathing_scouting_report_of/c8do4mx/,c8do4mx,1360672109.0,1360643309.0,"ESPN's Charley Rosen's scathing scouting report of Lebron Jame's at age 17. ""In high school, LeBron James might be a man among boys -- but in the NBA, he'll be a boy among men""",34,18cvt5
269,"The impressive thing about Harden is that defenses can arguably cue in more on him as he doesn't have the same offensive star power to take the pressure off (Wade, Bosh).",98,CaucasianAsian8,/r/nba/comments/189cwh/everyone_is_talking_about_lebron_james_last_5/c8crwld/,c8crwld,1360553582.0,1360524782.0,Everyone is talking about Lebron James last 5 games... I think James Hardens last 5 have been just as impressive.,168,189cwh
270,"I'm not disputing how good Lebron has been. It's just that this is such a big circle jerk that the media doesn't even notice somebody else is performing incredibly well also. 

http://oi48.tinypic.com/sctg5i.jpg

the thing I don't get is that the media is also a big circle jerk for kobe since he's 6th in the mvp race and harden isn't even on it. http://www.nba.com/mvp-ladder/2012-13/index.html

Harden has a better per, and his team has had a better record all season.

Harden was as high as 5th on this page, but the 7 game losing streak took him out of the race. Kobe on the other hand, never falls out of the top ten. No matter how shitty his team is. It's so annoying!",69,ienjoycows,/r/nba/comments/189cwh/everyone_is_talking_about_lebron_james_last_5/c8cs02w/,c8cs02w,1360553908.0,1360525108.0,Everyone is talking about Lebron James last 5 games... I think James Hardens last 5 have been just as impressive.,168,189cwh
271,"Nah. It's still a 2-man MVP race between KD and LeBron. 

And yeah, it's a sample size issue. People were saying the same thing 2 games into the season when he dropped 43 or whatever in his first game. 

For example, the last 3 games, KD has averaged 22 pts on 52.5% FG, 80% from 3P, 8 rebounds, 4 assists, a block, and 2 steals. Oh and he sat on the bench for the **entire 4th quarter in all 3 games**. ",36,FightForYourMind,/r/nba/comments/189cwh/everyone_is_talking_about_lebron_james_last_5/c8cu7po/,c8cu7po,1360561333.0,1360532533.0,Everyone is talking about Lebron James last 5 games... I think James Hardens last 5 have been just as impressive.,168,189cwh
272,"My how perceptions change. Remember when Wade and Bosh committed the day before the Decision and they were immediately considered a contender in the East? You have to consider that without LeBron, they'd have the cap space to surround Wade and Bosh with much better role players. Certainly if you simply take LeBron off the current roster, they'd have a hard time contending and would probably have a lower playoff seed.",50,sactownroyalty93,/r/nba/comments/1898vf/how_good_are_the_miami_heat_without_lebron_james/c8crc3z/,c8crc3z,1360551689.0,1360522889.0,How good are the Miami Heat without Lebron James? What seed would you give them in the east?,27,1898vf
273,"Tough to say, considering any Heat games I've watched this season, it looks like the rest of the team is almost content not giving a shit and letting LeBron carry them. 

Maybe without LBJ, they're still a 4-6 seed at worst. Possibly a 1-2 if Wade/Bosh actually step it up on a nightly basis, given how weak the East is. ",34,,/r/nba/comments/1898vf/how_good_are_the_miami_heat_without_lebron_james/c8crblk/,c8crblk,1360551643.0,1360522843.0,How good are the Miami Heat without Lebron James? What seed would you give them in the east?,27,1898vf
274,4th behind Knicks Pacers and Bulls,24,ienjoycows,/r/nba/comments/1898vf/how_good_are_the_miami_heat_without_lebron_james/c8csby5/,c8csby5,1360555031.0,1360526231.0,How good are the Miami Heat without Lebron James? What seed would you give them in the east?,27,1898vf
275,"Well there's your problem right there, you need to keep him away from where he is most effective: your half of the court.",122,PizzaOnTheMind,/r/nba/comments/188701/lebron_james_shooting_chart_in_past_4_games/c8clmbu/,c8clmbu,1360518271.0,1360489471.0,LeBron James shooting chart in past 4 games,241,188701
276,Shooting 56% for the season right now ... un-freaking-believable.,54,LulSayWhat,/r/nba/comments/188701/lebron_james_shooting_chart_in_past_4_games/c8civg7/,c8civg7,1360503270.0,1360474470.0,LeBron James shooting chart in past 4 games,241,188701
277,1-5 from the left 3PT corner. Can you say Frozen One?,141,Not_BillMurray,/r/nba/comments/188701/lebron_james_shooting_chart_in_past_4_games/c8chan0/,c8chan0,1360497280.0,1360468480.0,LeBron James shooting chart in past 4 games,241,188701
278,he's in full on NBA Jam mode right now.,30,,/r/nba/comments/188701/lebron_james_shooting_chart_in_past_4_games/c8cjsri/,c8cjsri,1360507004.0,1360478204.0,LeBron James shooting chart in past 4 games,241,188701
279,missed 5 shots at the rim?? what a bum.,39,noobeater,/r/nba/comments/188701/lebron_james_shooting_chart_in_past_4_games/c8chxlb/,c8chxlb,1360499757.0,1360470957.0,LeBron James shooting chart in past 4 games,241,188701
280,"""The floor is hot lava""",37,dwade420,/r/nba/comments/188701/lebron_james_shooting_chart_in_past_4_games/c8cggi9/,c8cggi9,1360494046.0,1360465246.0,LeBron James shooting chart in past 4 games,241,188701
281,tough times for his haters,37,Faronas,/r/nba/comments/188701/lebron_james_shooting_chart_in_past_4_games/c8cjpzv/,c8cjpzv,1360506651.0,1360477851.0,LeBron James shooting chart in past 4 games,241,188701
282,Why would Lebron have a Kobe rubber duck???,23,The-Assman,/r/nba/comments/1881c5/when_lebron_has_one_of_these_then_lll_consider/c8chot1/,c8chot1,1360498813.0,1360470013.0,"When LeBron has one of these, then l'll consider him the best",513,1881c5
283,How can he be the best when he's only won one rookie of the year?,61,RobotKitten,/r/nba/comments/1881c5/when_lebron_has_one_of_these_then_lll_consider/c8cgdl7/,c8cgdl7,1360493734.0,1360464934.0,"When LeBron has one of these, then l'll consider him the best",513,1881c5
284,This just in: [Young Andre Miller considered better than Lebron.](http://imgur.com/L4l43vX),51,chazoid,/r/nba/comments/1881c5/when_lebron_has_one_of_these_then_lll_consider/c8cfyfk/,c8cfyfk,1360492108.0,1360463308.0,"When LeBron has one of these, then l'll consider him the best",513,1881c5
