,body,score,author,permalink,comment_id,created_loc,created_utc,post_title,post_score,post_id
219,One short lol classic lebron ,380,GotMyFeetUp,/r/nba/comments/5hnzl1/post_game_thread_the_cleveland_cavaliers_175/db1lj17/,db1lj17,1481453710.0,1481424910.0,"[Post Game Thread] The Cleveland Cavaliers (17-5) defeat the Charlotte Hornets (14-10) 116-105 behind 44 points, 10 assists, and 9 rebounds from LeBron James.",896,5hnzl1
220,[LeBron hitting that LeButton in the regular season. Yessir](https://imgflip.com/i/1fqse4),148,jkenley28,/r/nba/comments/5hnzl1/post_game_thread_the_cleveland_cavaliers_175/db1ljeu/,db1ljeu,1481453727.0,1481424927.0,"[Post Game Thread] The Cleveland Cavaliers (17-5) defeat the Charlotte Hornets (14-10) 116-105 behind 44 points, 10 assists, and 9 rebounds from LeBron James.",896,5hnzl1
221,The fuck does Bron have against Charlotte,122,gtgfast,/r/nba/comments/5hnzl1/post_game_thread_the_cleveland_cavaliers_175/db1lxvo/,db1lxvo,1481454381.0,1481425581.0,"[Post Game Thread] The Cleveland Cavaliers (17-5) defeat the Charlotte Hornets (14-10) 116-105 behind 44 points, 10 assists, and 9 rebounds from LeBron James.",896,5hnzl1
222,i'm obsessed with LeBron. aint no one gonna see this comment so ill let yall know tht i'd deadass jerk him off,657,Lamentably,/r/nba/comments/5hnzl1/post_game_thread_the_cleveland_cavaliers_175/db1m4xi/,db1m4xi,1481454699.0,1481425899.0,"[Post Game Thread] The Cleveland Cavaliers (17-5) defeat the Charlotte Hornets (14-10) 116-105 behind 44 points, 10 assists, and 9 rebounds from LeBron James.",896,5hnzl1
223,Rare playoff lebron sighting in regular season,90,pimpsquadforlife,/r/nba/comments/5hnzl1/post_game_thread_the_cleveland_cavaliers_175/db1lwfp/,db1lwfp,1481454313.0,1481425513.0,"[Post Game Thread] The Cleveland Cavaliers (17-5) defeat the Charlotte Hornets (14-10) 116-105 behind 44 points, 10 assists, and 9 rebounds from LeBron James.",896,5hnzl1
224,I wanted him to get that triple double more than him he wasn't even trying wtf,172,vicente8a,/r/nba/comments/5hnzl1/post_game_thread_the_cleveland_cavaliers_175/db1llke/,db1llke,1481453821.0,1481425021.0,"[Post Game Thread] The Cleveland Cavaliers (17-5) defeat the Charlotte Hornets (14-10) 116-105 behind 44 points, 10 assists, and 9 rebounds from LeBron James.",896,5hnzl1
225,Someone forgot to tell LeBron he coasts during the regular season.,166,Psycho188,/r/nba/comments/5hnzl1/post_game_thread_the_cleveland_cavaliers_175/db1lpk0/,db1lpk0,1481454002.0,1481425202.0,"[Post Game Thread] The Cleveland Cavaliers (17-5) defeat the Charlotte Hornets (14-10) 116-105 behind 44 points, 10 assists, and 9 rebounds from LeBron James.",896,5hnzl1
226,"classic lebron. pulling a lebron to achieve the ultimate lebron of 27k, 7k ,7k. ",82,FatLever12,/r/nba/comments/5hnzl1/post_game_thread_the_cleveland_cavaliers_175/db1lz95/,db1lz95,1481454444.0,1481425644.0,"[Post Game Thread] The Cleveland Cavaliers (17-5) defeat the Charlotte Hornets (14-10) 116-105 behind 44 points, 10 assists, and 9 rebounds from LeBron James.",896,5hnzl1
227,The ball nodded.,869,Tundraaa,/r/nba/comments/5hnwx4/lebron_didnt_agree_with_a_foul_called_on_him/db1kwnj/,db1kwnj,1481452738.0,1481423938.0,"Lebron didn't agree with a foul called on him. Kaminsky misses the free throw and Lebron says ""ball don't lie""",1833,5hnwx4
228,Lelbron,188,XHyp3rX,/r/nba/comments/5hnwx4/lebron_didnt_agree_with_a_foul_called_on_him/db1l0zf/,db1l0zf,1481452926.0,1481424126.0,"Lebron didn't agree with a foul called on him. Kaminsky misses the free throw and Lebron says ""ball don't lie""",1833,5hnwx4
229,I'm salty af about how this game is going but this is hilarious,225,BuzzCityFan,/r/nba/comments/5hnwx4/lebron_didnt_agree_with_a_foul_called_on_him/db1kvis/,db1kvis,1481452688.0,1481423888.0,"Lebron didn't agree with a foul called on him. Kaminsky misses the free throw and Lebron says ""ball don't lie""",1833,5hnwx4
230,Sheed is mad that Bron didn't get a T for saying that.,92,jae34,/r/nba/comments/5hnwx4/lebron_didnt_agree_with_a_foul_called_on_him/db1ls7e/,db1ls7e,1481454121.0,1481425321.0,"Lebron didn't agree with a foul called on him. Kaminsky misses the free throw and Lebron says ""ball don't lie""",1833,5hnwx4
231,"and somewhere, a 'T' was called on Rasheed...",45,pericles123,/r/nba/comments/5hnwx4/lebron_didnt_agree_with_a_foul_called_on_him/db1mm9l/,db1mm9l,1481455504.0,1481426704.0,"Lebron didn't agree with a foul called on him. Kaminsky misses the free throw and Lebron says ""ball don't lie""",1833,5hnwx4
232,He's going full Sheed,125,BlindManBaldwin,/r/nba/comments/5hnwx4/lebron_didnt_agree_with_a_foul_called_on_him/db1l63g/,db1l63g,1481453149.0,1481424349.0,"Lebron didn't agree with a foul called on him. Kaminsky misses the free throw and Lebron says ""ball don't lie""",1833,5hnwx4
233,I'm impressed Lauren Holtkamp didn't T him up,227,themariokarters,/r/nba/comments/5hnwx4/lebron_didnt_agree_with_a_foul_called_on_him/db1kwaa/,db1kwaa,1481452721.0,1481423921.0,"Lebron didn't agree with a foul called on him. Kaminsky misses the free throw and Lebron says ""ball don't lie""",1833,5hnwx4
234,Isn't that supposed to be an instant technical? ,140,lolwutomgbbq,/r/nba/comments/5hnwx4/lebron_didnt_agree_with_a_foul_called_on_him/db1kv1o/,db1kv1o,1481452667.0,1481423867.0,"Lebron didn't agree with a foul called on him. Kaminsky misses the free throw and Lebron says ""ball don't lie""",1833,5hnwx4
235,LeSheed James,36,yuhanz,/r/nba/comments/5hnwx4/lebron_didnt_agree_with_a_foul_called_on_him/db1mb31/,db1mb31,1481454981.0,1481426181.0,"Lebron didn't agree with a foul called on him. Kaminsky misses the free throw and Lebron says ""ball don't lie""",1833,5hnwx4
236,"Belinelli, 3-pt shooting chair. ",69,,/r/nba/comments/5hnlzg/lebron_punishes_the_rim_with_a_reverse/db1ia3n/,db1ia3n,1481448692.0,1481419892.0,LeBron punishes the rim with a reverse,284,5hnlzg
237,The fuck kind of defense was that?,40,Chris13Haughey,/r/nba/comments/5hnlzg/lebron_punishes_the_rim_with_a_reverse/db1ik8o/,db1ik8o,1481449133.0,1481420333.0,LeBron punishes the rim with a reverse,284,5hnlzg
238,"LeBron James is so dope. Just dunked ball through a young rim during game. Asked rim to pass it back to him for a shot. Rim does, flabbergasted!",94,obligatoryfinalboss,/r/nba/comments/5hnlzg/lebron_punishes_the_rim_with_a_reverse/db1iaq4/,db1iaq4,1481448719.0,1481419919.0,LeBron punishes the rim with a reverse,284,5hnlzg
239,"Did you know, that despite averaging roughly 27-7-7 for his career, LeBron James has never finished a game with exactly 27 points, 7 rebounds and 7 assists?

[Proof](http://www.basketball-reference.com/play-index/pgl_finder.cgi?request=1&match=game&is_playoffs=N&age_min=0&age_max=99&pos_is_g=Y&pos_is_gf=Y&pos_is_f=Y&pos_is_fg=Y&pos_is_fc=Y&pos_is_c=Y&pos_is_cf=Y&c1stat=pts&c1comp=eq&c1val=27&c2stat=trb&c2comp=eq&c2val=7&c3stat=ast&c3comp=eq&c3val=7&order_by=pts&player_id=jamesle01)",2709,BNC6,/r/nba/comments/5hnjg0/lebron_james_becomes_the_first_ever_player_in_nba/db1iu6e/,db1iu6e,1481449529.0,1481420729.0,"Lebron James becomes the FIRST ever player in NBA history to achieve totals of 27,000 points, 7,000 rebounds and 7,000 assists! #TheUltimateLeBron",12055,5hnjg0
240,LeBron averages 1000 LeBrons per career. ,2761,TwoFreeThrows,/r/nba/comments/5hnjg0/lebron_james_becomes_the_first_ever_player_in_nba/db1hj2j/,db1hj2j,1481447534.0,1481418734.0,"Lebron James becomes the FIRST ever player in NBA history to achieve totals of 27,000 points, 7,000 rebounds and 7,000 assists! #TheUltimateLeBron",12055,5hnjg0
241,LeBron nodded,609,Letsgocavs99,/r/nba/comments/5hnjg0/lebron_james_becomes_the_first_ever_player_in_nba/db1hk7f/,db1hk7f,1481447583.0,1481418783.0,"Lebron James becomes the FIRST ever player in NBA history to achieve totals of 27,000 points, 7,000 rebounds and 7,000 assists! #TheUltimateLeBron",12055,5hnjg0
242,[deleted],1131,,/r/nba/comments/5hnjg0/lebron_james_becomes_the_first_ever_player_in_nba/db1hkxc/,db1hkxc,1481447613.0,1481418813.0,"Lebron James becomes the FIRST ever player in NBA history to achieve totals of 27,000 points, 7,000 rebounds and 7,000 assists! #TheUltimateLeBron",12055,5hnjg0
243,"His career statline is going to look so nice after it's all said and done (hopefully, knock on wood).

**30,000+ Points**-**10,000 assists**-**10,000 rebounds**",474,Spike__Jonze,/r/nba/comments/5hnjg0/lebron_james_becomes_the_first_ever_player_in_nba/db1hrhz/,db1hrhz,1481447903.0,1481419103.0,"Lebron James becomes the FIRST ever player in NBA history to achieve totals of 27,000 points, 7,000 rebounds and 7,000 assists! #TheUltimateLeBron",12055,5hnjg0
244,Is it wrong that I want someone to make a 100-hr lebron highlight film with every single point reb and assist?,380,gamjar,/r/nba/comments/5hnjg0/lebron_james_becomes_the_first_ever_player_in_nba/db1i8hv/,db1i8hv,1481448624.0,1481419824.0,"Lebron James becomes the FIRST ever player in NBA history to achieve totals of 27,000 points, 7,000 rebounds and 7,000 assists! #TheUltimateLeBron",12055,5hnjg0
245,"The LeBron, LeBron...only amplified. 27-7-7. ",297,Deja-Vu-Virus,/r/nba/comments/5hnjg0/lebron_james_becomes_the_first_ever_player_in_nba/db1hlj6/,db1hlj6,1481447639.0,1481418839.0,"Lebron James becomes the FIRST ever player in NBA history to achieve totals of 27,000 points, 7,000 rebounds and 7,000 assists! #TheUltimateLeBron",12055,5hnjg0
246,The Greatest LeBron of all time.,208,xenobyz,/r/nba/comments/5hnjg0/lebron_james_becomes_the_first_ever_player_in_nba/db1i1vk/,db1i1vk,1481448344.0,1481419544.0,"Lebron James becomes the FIRST ever player in NBA history to achieve totals of 27,000 points, 7,000 rebounds and 7,000 assists! #TheUltimateLeBron",12055,5hnjg0
247,"What are the odds LeBron gets 3,000 more rebounds and assists? The Ultimate Triple Double!",47,Ibetno1hasdisnameyt,/r/nba/comments/5hnjg0/lebron_james_becomes_the_first_ever_player_in_nba/db1imp1/,db1imp1,1481449224.0,1481420424.0,"Lebron James becomes the FIRST ever player in NBA history to achieve totals of 27,000 points, 7,000 rebounds and 7,000 assists! #TheUltimateLeBron",12055,5hnjg0
248,"Can't wait until he reaches a playoff lebron of 30000, 9000, and 9000",138,,/r/nba/comments/5hnjg0/lebron_james_becomes_the_first_ever_player_in_nba/db1i7hy/,db1i7hy,1481448584.0,1481419784.0,"Lebron James becomes the FIRST ever player in NBA history to achieve totals of 27,000 points, 7,000 rebounds and 7,000 assists! #TheUltimateLeBron",12055,5hnjg0
249,I wanna see lebron dish to his kid so damn bad.,163,,/r/nba/comments/5hiewb/lebron_james_jr_showing_off_his_range/db0g4zp/,db0g4zp,1481373165.0,1481344365.0,LeBron James Jr. showing off his range,240,5hiewb
250,Kid is 13 now? So will LeBron start him on the heavyweight lifting to get him up to a solid 250 by age 16?,80,heat_forever,/r/nba/comments/5hiewb/lebron_james_jr_showing_off_his_range/db0gpaz/,db0gpaz,1481374270.0,1481345470.0,LeBron James Jr. showing off his range,240,5hiewb
251,"Bron: ""ey, where you learn that?!""

Jr: ""uh...internet?""

Bron: ""you best not be watching those stefanie curry videos again. I warned you not to""

jr: ""but dad!!!""

Bron: ""now go to your room and put on that nice headband I bought you""

",350,wikiman2001,/r/nba/comments/5hiewb/lebron_james_jr_showing_off_his_range/db0gt30/,db0gt30,1481374482.0,1481345682.0,LeBron James Jr. showing off his range,240,5hiewb
252,Fuck,42,GangstasAndStrippers,/r/nba/comments/5hiewb/lebron_james_jr_showing_off_his_range/db0g11n/,db0g11n,1481372958.0,1481344158.0,LeBron James Jr. showing off his range,240,5hiewb
253,league fucked,99,dank-kush,/r/nba/comments/5hiewb/lebron_james_jr_showing_off_his_range/db0fzkr/,db0fzkr,1481372880.0,1481344080.0,LeBron James Jr. showing off his range,240,5hiewb
254,"He got it from his brother, Steph Curry.",121,Crimson_Clap_,/r/nba/comments/5hiewb/lebron_james_jr_showing_off_his_range/db0igbj/,db0igbj,1481377946.0,1481349146.0,LeBron James Jr. showing off his range,240,5hiewb
255,He's getting big holy shit. Time flies.,67,,/r/nba/comments/5hiewb/lebron_james_jr_showing_off_his_range/db0g82e/,db0g82e,1481373330.0,1481344530.0,LeBron James Jr. showing off his range,240,5hiewb
256,"Man... the kid is 12 years old and looks like he should be a senior. To have the strength to heave a shot from half court at that age let alone with the accuracy and form to score. Im  interested to see how his game is different from his dad's when he (assuming he gets there) enters the nba and even in college considering how much the game has changed and how young players are developing different skills. Watching a James in March madness will be incredible. 

Ladies and gentlemen we think what we are watching now is special. I have a feeling we have a lot more wonderful basketball for years to come.",99,Bornicus,/r/nba/comments/5hiewb/lebron_james_jr_showing_off_his_range/db0gqig/,db0gqig,1481374340.0,1481345540.0,LeBron James Jr. showing off his range,240,5hiewb
257,"Like every other 13 year old, Bron Jr is a Curry fan.

/s",34,EnterAdman,/r/nba/comments/5hiewb/lebron_james_jr_showing_off_his_range/db0h3qs/,db0h3qs,1481375086.0,1481346286.0,LeBron James Jr. showing off his range,240,5hiewb
258,because he wants to ,76,lebrons-jockstrap,/r/nba/comments/5hi49x/why_is_lebron_playing_so_many_minutes/db0dizk/,db0dizk,1481368535.0,1481339735.0,Why Is Lebron Playing So Many Minutes?,23,5hi49x
259,Jesus Christ LeBron played 37 minutes tonight?? Maybe the Cavs should rest him tomorrow :D,39,YizWasHere,/r/nba/comments/5hi49x/why_is_lebron_playing_so_many_minutes/db0dkcc/,db0dkcc,1481368599.0,1481339799.0,Why Is Lebron Playing So Many Minutes?,23,5hi49x
260,Can't believe he lived up to the hype,147,SunsFan97,/r/nba/comments/5hhxn9/lebron_james_moves_to_9_on_nba_alltime_scoring/db0dail/,db0dail,1481368135.0,1481339335.0,LeBron James moves to #9 on NBA All-Time Scoring List passing Elvin Hayes,1111,5hhxn9
261,and he's not too far off from #8. will be so interesting to see where he finishes his career. ,209,yenzy,/r/nba/comments/5hhxn9/lebron_james_moves_to_9_on_nba_alltime_scoring/db0c0r9/,db0c0r9,1481365995.0,1481337195.0,LeBron James moves to #9 on NBA All-Time Scoring List passing Elvin Hayes,1111,5hhxn9
262,"I feel that we have been truly blessed to have been able to watch this guy play. Someone who is a true all around player, a great teammate, a good person, and a literal team transformer.

Love this guy.",350,jspeed04,/r/nba/comments/5hhxn9/lebron_james_moves_to_9_on_nba_alltime_scoring/db0c899/,db0c899,1481366342.0,1481337542.0,LeBron James moves to #9 on NBA All-Time Scoring List passing Elvin Hayes,1111,5hhxn9
263,Enjoy this man while you can.,95,,/r/nba/comments/5hhxn9/lebron_james_moves_to_9_on_nba_alltime_scoring/db0c039/,db0c039,1481365964.0,1481337164.0,LeBron James moves to #9 on NBA All-Time Scoring List passing Elvin Hayes,1111,5hhxn9
264,I can't believe I'm lucky enough to be alive watching this man play.,42,notathrowaway75,/r/nba/comments/5hhxn9/lebron_james_moves_to_9_on_nba_alltime_scoring/db0ciwt/,db0ciwt,1481366844.0,1481338044.0,LeBron James moves to #9 on NBA All-Time Scoring List passing Elvin Hayes,1111,5hhxn9
265,About 100 points away from Moses!,69,,/r/nba/comments/5hhxn9/lebron_james_moves_to_9_on_nba_alltime_scoring/db0c1l8/,db0c1l8,1481366034.0,1481337234.0,LeBron James moves to #9 on NBA All-Time Scoring List passing Elvin Hayes,1111,5hhxn9
266,"Its been an honor watching this man
",31,Blaaa5,/r/nba/comments/5hhxn9/lebron_james_moves_to_9_on_nba_alltime_scoring/db0ca9x/,db0ca9x,1481366436.0,1481337636.0,LeBron James moves to #9 on NBA All-Time Scoring List passing Elvin Hayes,1111,5hhxn9
267,LeBron passing again! With all this passing he'll never be a great scorer!,32,moneyinacoatatikea,/r/nba/comments/5hhxn9/lebron_james_moves_to_9_on_nba_alltime_scoring/db0cwy7/,db0cwy7,1481367495.0,1481338695.0,LeBron James moves to #9 on NBA All-Time Scoring List passing Elvin Hayes,1111,5hhxn9
268,Seriously incredible player. He's so consistent it's insane. ,25,,/r/nba/comments/5hhxn9/lebron_james_moves_to_9_on_nba_alltime_scoring/db0cost/,db0cost,1481367118.0,1481338318.0,LeBron James moves to #9 on NBA All-Time Scoring List passing Elvin Hayes,1111,5hhxn9
269,"Pushes past the top ten with a Lebron stat line, nice.",22,almar89,/r/nba/comments/5hhxn9/lebron_james_moves_to_9_on_nba_alltime_scoring/db0cw1u/,db0cw1u,1481367455.0,1481338655.0,LeBron James moves to #9 on NBA All-Time Scoring List passing Elvin Hayes,1111,5hhxn9
270,"First Lebron eating popcorn in the sidelines, Jr Smith talking to Terry mid-play and now this!? Cavs in full LeCoast mode.",2279,XHyp3rX,/r/nba/comments/5h4nxl/lebron_and_his_posse_doing_the_water_bottle/daxe3ey/,daxe3ey,1481196987.0,1481168187.0,LeBron and his posse doing the water bottle challenge on the bench,10167,5h4nxl
271,they showed replays of this lmao,2525,emintheblack,/r/nba/comments/5h4nxl/lebron_and_his_posse_doing_the_water_bottle/daxdzxg/,daxdzxg,1481196847.0,1481168047.0,LeBron and his posse doing the water bottle challenge on the bench,10167,5h4nxl
272,"""Lebron to take 2 weeks off to practice water bottle flipping with D-wade in south beach.""",428,,/r/nba/comments/5h4nxl/lebron_and_his_posse_doing_the_water_bottle/daxe1pg/,daxe1pg,1481196919.0,1481168119.0,LeBron and his posse doing the water bottle challenge on the bench,10167,5h4nxl
273,Bench Focus level: Blowout,915,hando300,/r/nba/comments/5h4nxl/lebron_and_his_posse_doing_the_water_bottle/daxe01n/,daxe01n,1481196852.0,1481168052.0,LeBron and his posse doing the water bottle challenge on the bench,10167,5h4nxl
274,ESPN even replayed LeBron's attempt in slow-mo,549,Xlow48,/r/nba/comments/5h4nxl/lebron_and_his_posse_doing_the_water_bottle/daxe095/,daxe095,1481196860.0,1481168060.0,LeBron and his posse doing the water bottle challenge on the bench,10167,5h4nxl
275,The disrespect,3098,minkmachete,/r/nba/comments/5h4nxl/lebron_and_his_posse_doing_the_water_bottle/daxdy2t/,daxdy2t,1481196775.0,1481167975.0,LeBron and his posse doing the water bottle challenge on the bench,10167,5h4nxl
276,Holy shit they were that bored,985,padowan,/r/nba/comments/5h4nxl/lebron_and_his_posse_doing_the_water_bottle/daxdy0o/,daxdy0o,1481196773.0,1481167973.0,LeBron and his posse doing the water bottle challenge on the bench,10167,5h4nxl
277,Kevin Love noticeably absent. Chemistry issues? Is Kevin not cool enough to be a part of Lebron's posse?,316,ItHurtsMeSoulo,/r/nba/comments/5h4nxl/lebron_and_his_posse_doing_the_water_bottle/daxejms/,daxejms,1481197639.0,1481168839.0,LeBron and his posse doing the water bottle challenge on the bench,10167,5h4nxl
278,"*Bleacher report unzips, violent fapping commences*",604,next-dart,/r/nba/comments/5h4nxl/lebron_and_his_posse_doing_the_water_bottle/daxdygi/,daxdygi,1481196789.0,1481167989.0,LeBron and his posse doing the water bottle challenge on the bench,10167,5h4nxl
279,[mfw](http://imgur.com/a/l1itY),71,APF429,/r/nba/comments/5h4nxl/lebron_and_his_posse_doing_the_water_bottle/daxe5ob/,daxe5ob,1481197077.0,1481168277.0,LeBron and his posse doing the water bottle challenge on the bench,10167,5h4nxl
280,Thompson with that vintage Rodman statline.,308,Truenewf,/r/nba/comments/5h4ng4/postgame_thread_lebron_james_and_his_posse_the/daxduu8/,daxduu8,1481196651.0,1481167851.0,"[Post-Game Thread] LeBron James and his Posse, the Cleveland Cavaliers (15-5), defeat the New York Knicks (12-10) 126-94",946,5h4ng4
281,"LeBron is so trash...

At water bottle flipping ",629,EvenGandhiHatesLVG,/r/nba/comments/5h4ng4/postgame_thread_lebron_james_and_his_posse_the/daxdu2g/,daxdu2g,1481196620.0,1481167820.0,"[Post-Game Thread] LeBron James and his Posse, the Cleveland Cavaliers (15-5), defeat the New York Knicks (12-10) 126-94",946,5h4ng4
282,Fortunately this only counts as one loss.,195,Chrisp722,/r/nba/comments/5h4ng4/postgame_thread_lebron_james_and_his_posse_the/daxdua0/,daxdua0,1481196629.0,1481167829.0,"[Post-Game Thread] LeBron James and his Posse, the Cleveland Cavaliers (15-5), defeat the New York Knicks (12-10) 126-94",946,5h4ng4
283,Casual 22 threes on 55% from deep,183,holaimaaron,/r/nba/comments/5h4ng4/postgame_thread_lebron_james_and_his_posse_the/daxdvgi/,daxdvgi,1481196674.0,1481167874.0,"[Post-Game Thread] LeBron James and his Posse, the Cleveland Cavaliers (15-5), defeat the New York Knicks (12-10) 126-94",946,5h4ng4
284,Grab them by the posse.  ,276,equinoxaeonian,/r/nba/comments/5h4ng4/postgame_thread_lebron_james_and_his_posse_the/daxduf5/,daxduf5,1481196634.0,1481167834.0,"[Post-Game Thread] LeBron James and his Posse, the Cleveland Cavaliers (15-5), defeat the New York Knicks (12-10) 126-94",946,5h4ng4
285,jesus christ bro. this game was deadass over from the tip-off,360,Lamentably,/r/nba/comments/5h4ng4/postgame_thread_lebron_james_and_his_posse_the/daxdtq7/,daxdtq7,1481196607.0,1481167807.0,"[Post-Game Thread] LeBron James and his Posse, the Cleveland Cavaliers (15-5), defeat the New York Knicks (12-10) 126-94",946,5h4ng4
286,You know it's bad when Mike and JVG start talking about which celebrities have left or are leaving and which ones had stayed.... not a good way for the Knicks to start their road trip. Bonus: TT with the classic Rodman statline! 3-20-1 lol,119,Blobattack124,/r/nba/comments/5h4ng4/postgame_thread_lebron_james_and_his_posse_the/daxdubh/,daxdubh,1481196630.0,1481167830.0,"[Post-Game Thread] LeBron James and his Posse, the Cleveland Cavaliers (15-5), defeat the New York Knicks (12-10) 126-94",946,5h4ng4
287,I was told there'd be superteam*s*...,362,LamboLogan,/r/nba/comments/5h4ng4/postgame_thread_lebron_james_and_his_posse_the/daxduci/,daxduci,1481196631.0,1481167831.0,"[Post-Game Thread] LeBron James and his Posse, the Cleveland Cavaliers (15-5), defeat the New York Knicks (12-10) 126-94",946,5h4ng4
288,Lebron with the horrid bottle flip attempt,42,billjohn_,/r/nba/comments/5h4ng4/postgame_thread_lebron_james_and_his_posse_the/daxdu4s/,daxdu4s,1481196623.0,1481167823.0,"[Post-Game Thread] LeBron James and his Posse, the Cleveland Cavaliers (15-5), defeat the New York Knicks (12-10) 126-94",946,5h4ng4
289,TT you wanna chill out ,31,BlindManBaldwin,/r/nba/comments/5h4ng4/postgame_thread_lebron_james_and_his_posse_the/daxdwr7/,daxdwr7,1481196724.0,1481167924.0,"[Post-Game Thread] LeBron James and his Posse, the Cleveland Cavaliers (15-5), defeat the New York Knicks (12-10) 126-94",946,5h4ng4
290,"[mfw a 6'8"" 250lb monster comes storming right at me](http://imgur.com/a/zx60a)",358,APF429,/r/nba/comments/5h49er/lebron_james_throws_down_the_dunk/daxakzx/,daxakzx,1481192071.0,1481163271.0,LeBron James throws down the dunk,788,5h49er
291,why did he walk into the stands lol,199,jritz611,/r/nba/comments/5h49er/lebron_james_throws_down_the_dunk/daxak43/,daxak43,1481192035.0,1481163235.0,LeBron James throws down the dunk,788,5h49er
292,LeBoom,66,,/r/nba/comments/5h49er/lebron_james_throws_down_the_dunk/daxajnx/,daxajnx,1481192018.0,1481163218.0,LeBron James throws down the dunk,788,5h49er
293,Lebron walked into the crowd to find Phil jackson ,99,nba-anime-fan,/r/nba/comments/5h49er/lebron_james_throws_down_the_dunk/daxatp0/,daxatp0,1481192399.0,1481163599.0,LeBron James throws down the dunk,788,5h49er
294,The shit this man can do is insane,49,zachwilson23,/r/nba/comments/5h49er/lebron_james_throws_down_the_dunk/daxakcb/,daxakcb,1481192046.0,1481163246.0,LeBron James throws down the dunk,788,5h49er
295,Pretty standard dunk for LeBron,89,felipenasr,/r/nba/comments/5h49er/lebron_james_throws_down_the_dunk/daxamr4/,daxamr4,1481192137.0,1481163337.0,LeBron James throws down the dunk,788,5h49er
296,He don't give a fuck. These last few seasons of him not having a care in the world will be a treat.,120,padowan,/r/nba/comments/5h49er/lebron_james_throws_down_the_dunk/daxalgo/,daxalgo,1481192088.0,1481163288.0,LeBron James throws down the dunk,788,5h49er
297,Knicks here playing that pick-up game defense,37,pooperville,/r/nba/comments/5h49er/lebron_james_throws_down_the_dunk/daxcjsq/,daxcjsq,1481194814.0,1481166014.0,LeBron James throws down the dunk,788,5h49er
298,one of the best dunks i've seen from him this season,30,,/r/nba/comments/5h49er/lebron_james_throws_down_the_dunk/daxao4z/,daxao4z,1481192188.0,1481163388.0,LeBron James throws down the dunk,788,5h49er
299,The fact he's backup is a joke smh,253,flintmichigantropics,/r/nba/comments/5h44io/browns_backup_qb_kevin_love_throws_touchdown_pass/dax9f41/,dax9f41,1481190534.0,1481161734.0,"Browns backup QB, Kevin Love, throws touchdown pass to LeBron",760,5h44io
300,Throwing an overhead pass like that is insane. Kevin Love is so good at them,123,PNWSwag,/r/nba/comments/5h44io/browns_backup_qb_kevin_love_throws_touchdown_pass/dax9ozu/,dax9ozu,1481190892.0,1481162092.0,"Browns backup QB, Kevin Love, throws touchdown pass to LeBron",760,5h44io
301,"Damn, he flicked that shit like a booger.",123,,/r/nba/comments/5h44io/browns_backup_qb_kevin_love_throws_touchdown_pass/daxa0ee/,daxa0ee,1481191304.0,1481162504.0,"Browns backup QB, Kevin Love, throws touchdown pass to LeBron",760,5h44io
302,More like the new Rory Delap on that one,31,IAmRobbb,/r/nba/comments/5h44io/browns_backup_qb_kevin_love_throws_touchdown_pass/daxbuvh/,daxbuvh,1481193843.0,1481165043.0,"Browns backup QB, Kevin Love, throws touchdown pass to LeBron",760,5h44io
303,Could the Cavs beat the browns,64,drcash360-2ndaccount,/r/nba/comments/5h44io/browns_backup_qb_kevin_love_throws_touchdown_pass/daxc97o/,daxc97o,1481194401.0,1481165601.0,"Browns backup QB, Kevin Love, throws touchdown pass to LeBron",760,5h44io
304,"Honestly, if you gave these guys 2 weeks in training camp and threw them into the Browns offense, it'd make them a better team. 

",75,frodakai,/r/nba/comments/5h44io/browns_backup_qb_kevin_love_throws_touchdown_pass/daxbu8a/,daxbu8a,1481193819.0,1481165019.0,"Browns backup QB, Kevin Love, throws touchdown pass to LeBron",760,5h44io
