,body,score,author,permalink,comment_id,created_loc,created_utc,post_title,post_score,post_id
467,"Cp3, Melo, Wade",68,DwyaneWadesJaw,/r/nba/comments/3e8djw/if_space_jam_2_really_does_happen_what_players/ctcg877/,ctcg877,1437621262.0,1437592462.0,"If Space Jam 2 really does happen, what players other then Lebron would you like to see in it?",76,3e8djw
468,Would be great for ~~Melo's~~ Me7o's brand.,42,J_K_E,/r/nba/comments/3e8djw/if_space_jam_2_really_does_happen_what_players/ctcg8iw/,ctcg8iw,1437621275.0,1437592475.0,"If Space Jam 2 really does happen, what players other then Lebron would you like to see in it?",76,3e8djw
469,"Roy Hibbert should be in it.  Then when one of the monstars takes his talent from him, they end up just falling down all over the court and missing sky hooks everywhere, then he gets traded for a second round pick.",49,,/r/nba/comments/3e8djw/if_space_jam_2_really_does_happen_what_players/ctcilzw/,ctcilzw,1437624553.0,1437595753.0,"If Space Jam 2 really does happen, what players other then Lebron would you like to see in it?",76,3e8djw
470,Bill murray,21,Masterd89,/r/nba/comments/3e8djw/if_space_jam_2_really_does_happen_what_players/ctcgjge/,ctcgjge,1437621689.0,1437592889.0,"If Space Jam 2 really does happen, what players other then Lebron would you like to see in it?",76,3e8djw
471,Lmao some dude on twitter asking Windhurst if he'll play Lebron's fat sidekick. (Played by Wayne Knight in the original),1563,Rswany,/r/nba/comments/3e89ir/weprin_warner_bros_filed_new_trademarks_for_space/ctcfl5m/,ctcfl5m,1437620357.0,1437591557.0,"[Weprin] Warner Bros. filed new trademarks for ""Space Jam"" last month. Today announced deal with LeBron James.",2256,3e89ir
472,"MJ appears and gives LeBron his secret drink before the game

LeBron: Come on man, I know this is only water.

Jordan: Of course. It's to avoid the cramps.",1496,X-Craft,/r/nba/comments/3e89ir/weprin_warner_bros_filed_new_trademarks_for_space/ctcgk7h/,ctcgk7h,1437621717.0,1437592917.0,"[Weprin] Warner Bros. filed new trademarks for ""Space Jam"" last month. Today announced deal with LeBron James.",2256,3e89ir
473,According to sources: The Monstars have already stolen all of Rajon Rondo's talent in preparation for Space Jam 2. ,550,ImanShumpertplus,/r/nba/comments/3e89ir/weprin_warner_bros_filed_new_trademarks_for_space/ctchp6d/,ctchp6d,1437623288.0,1437594488.0,"[Weprin] Warner Bros. filed new trademarks for ""Space Jam"" last month. Today announced deal with LeBron James.",2256,3e89ir
474,"SPACE JAM 2 WITH CHRIS PRATT, JENNIFER LAWRENCE, DANIEL CRAIG, BILL MURRAY, AND JOHN CENA",822,,/r/nba/comments/3e89ir/weprin_warner_bros_filed_new_trademarks_for_space/ctcf9t8/,ctcf9t8,1437619919.0,1437591119.0,"[Weprin] Warner Bros. filed new trademarks for ""Space Jam"" last month. Today announced deal with LeBron James.",2256,3e89ir
475,"""Space Jam 2 is where LeBron James saves Michael Jordan from his imprisonment on an alien planet for not paying his alien gambling debts.""",674,iggyazaleatown,/r/nba/comments/3e89ir/weprin_warner_bros_filed_new_trademarks_for_space/ctcfrjt/,ctcfrjt,1437620607.0,1437591807.0,"[Weprin] Warner Bros. filed new trademarks for ""Space Jam"" last month. Today announced deal with LeBron James.",2256,3e89ir
476,"Everybody just assumed Swaggy P was joking when he said Lebron's secret motivation in the finals was to set up Space Jam 2, but I feel like he knew what he was talking about.",281,circa1015,/r/nba/comments/3e89ir/weprin_warner_bros_filed_new_trademarks_for_space/ctcfxuu/,ctcfxuu,1437620861.0,1437592061.0,"[Weprin] Warner Bros. filed new trademarks for ""Space Jam"" last month. Today announced deal with LeBron James.",2256,3e89ir
477,Nothing is sacred.,588,Noob_The_Legend,/r/nba/comments/3e89ir/weprin_warner_bros_filed_new_trademarks_for_space/ctcf4k8/,ctcf4k8,1437619712.0,1437590912.0,"[Weprin] Warner Bros. filed new trademarks for ""Space Jam"" last month. Today announced deal with LeBron James.",2256,3e89ir
478,"When I was in high school, I watched Space Jam on mushrooms. I was convinced about 15 minutes into the movie that it was the greatest screenplay idea of all-time and that it would never be surpassed.",102,yooston,/r/nba/comments/3e89ir/weprin_warner_bros_filed_new_trademarks_for_space/ctciafz/,ctciafz,1437624110.0,1437595310.0,"[Weprin] Warner Bros. filed new trademarks for ""Space Jam"" last month. Today announced deal with LeBron James.",2256,3e89ir
479,Please re-cast [Natalie Dormer](http://i.imgur.com/MgOQPLx.jpg) as Lola Bunny. ,236,Palifaith,/r/nba/comments/3e89ir/weprin_warner_bros_filed_new_trademarks_for_space/ctcfo8x/,ctcfo8x,1437620476.0,1437591676.0,"[Weprin] Warner Bros. filed new trademarks for ""Space Jam"" last month. Today announced deal with LeBron James.",2256,3e89ir
480,"Space Jam 2, the Monstars steal Lebrons hairline and he has to ball to get it back",88,Gentlescholar_AMA,/r/nba/comments/3e89ir/weprin_warner_bros_filed_new_trademarks_for_space/ctcg002/,ctcg002,1437620944.0,1437592144.0,"[Weprin] Warner Bros. filed new trademarks for ""Space Jam"" last month. Today announced deal with LeBron James.",2256,3e89ir
481,"This is the thing he was talking about with Wade.

Watch out for a buddy cop movie with Lebron and Wade in the near future.",115,,/r/nba/comments/3e87eg/wall_street_journal_lebron_james_is_forming_a/ctcetbn/,ctcetbn,1437619272.0,1437590472.0,[Wall Street Journal] LeBron James is forming a movie and TV production partnership with Warner Bros.,281,3e87eg
482,Jeremy Lin and Lance Stephenson in Rush Hour 5: Ball is life with Lebron as the main villain. ,52,,/r/nba/comments/3e87eg/wall_street_journal_lebron_james_is_forming_a/ctcfo81/,ctcfo81,1437620475.0,1437591675.0,[Wall Street Journal] LeBron James is forming a movie and TV production partnership with Warner Bros.,281,3e87eg
483,LeBron taking his talent to Burbank.  ,41,grandmasterkif,/r/nba/comments/3e87eg/wall_street_journal_lebron_james_is_forming_a/ctcek9o/,ctcek9o,1437618917.0,1437590117.0,[Wall Street Journal] LeBron James is forming a movie and TV production partnership with Warner Bros.,281,3e87eg
484,"> NBA stars have appeared in some **forgettable flicks, such as “Space Jam,”** which featured Michael Jordan alongside Looney Tunes characters, and “Kazaam,” with Shaquille O’Neal.

I hope they mean legendary",178,nate317,/r/nba/comments/3e87eg/wall_street_journal_lebron_james_is_forming_a/ctcfc1n/,ctcfc1n,1437620006.0,1437591206.0,[Wall Street Journal] LeBron James is forming a movie and TV production partnership with Warner Bros.,281,3e87eg
485,SPACE JAM 2 IS COMING,175,ORANG_DRAGIC,/r/nba/comments/3e87eg/wall_street_journal_lebron_james_is_forming_a/ctcei0w/,ctcei0w,1437618825.0,1437590025.0,[Wall Street Journal] LeBron James is forming a movie and TV production partnership with Warner Bros.,281,3e87eg
486,Give a guy one cameo and suddenly he's Harvey Weinstein,66,freerealestatedotbiz,/r/nba/comments/3e87eg/wall_street_journal_lebron_james_is_forming_a/ctceoq8/,ctceoq8,1437619094.0,1437590294.0,[Wall Street Journal] LeBron James is forming a movie and TV production partnership with Warner Bros.,281,3e87eg
487,LeBusiness Man,68,J_K_E,/r/nba/comments/3e87eg/wall_street_journal_lebron_james_is_forming_a/ctces46/,ctces46,1437619225.0,1437590425.0,[Wall Street Journal] LeBron James is forming a movie and TV production partnership with Warner Bros.,281,3e87eg
488,This is basically WB's only shot at making another Space Jam. I'd be surprised if they didn't take it.,22,J_K_E,/r/nba/comments/3e87eg/wall_street_journal_lebron_james_is_forming_a/ctcetcl/,ctcetcl,1437619273.0,1437590473.0,[Wall Street Journal] LeBron James is forming a movie and TV production partnership with Warner Bros.,281,3e87eg
489,Lebron needs to ask him where to find the fountain of youth.,27,impossiber,/r/nba/comments/3dzed6/repost_from_rhockey_nhl_legend_jaromir_jagr_met/cta1mj3/,cta1mj3,1437450254.0,1437421454.0,(repost from r/Hockey) NHL legend Jaromir Jagr met LeBron James,31,3dzed6
490,Weird seeing a Chicago sports fan *not* already on the Hawks wagon,29,BurtKusch51,/r/nba/comments/3dzed6/repost_from_rhockey_nhl_legend_jaromir_jagr_met/cta32hh/,cta32hh,1437452380.0,1437423580.0,(repost from r/Hockey) NHL legend Jaromir Jagr met LeBron James,31,3dzed6
491,Mike Bibby scoring 14 points might be more impressive ,389,OohKillEmmm,/r/nba/comments/3dy210/in_2011_lebron_james_dwyane_wade_and_chris_bosh/ct9p3jj/,ct9p3jj,1437430911.0,1437402111.0,"In 2011, Lebron James, Dwyane Wade, and Chris Bosh all had at least 30 points and 10 rebounds in the same game.",1441,3dy210
492,Yeah that's a pretty fucking crazy thing to have happen. They were pretty good. ,602,irelli,/r/nba/comments/3dy210/in_2011_lebron_james_dwyane_wade_and_chris_bosh/ct9oemo/,ct9oemo,1437429570.0,1437400770.0,"In 2011, Lebron James, Dwyane Wade, and Chris Bosh all had at least 30 points and 10 rebounds in the same game.",1441,3dy210
493,"Goran Dragic only playing 8 minutes, damn this sure was a long time ago.",80,,/r/nba/comments/3dy210/in_2011_lebron_james_dwyane_wade_and_chris_bosh/ct9p54h/,ct9p54h,1437430993.0,1437402193.0,"In 2011, Lebron James, Dwyane Wade, and Chris Bosh all had at least 30 points and 10 rebounds in the same game.",1441,3dy210
494,"I'll leave this here

https://www.youtube.com/watch?v=0DLJ-IoyL8w",65,brendamn,/r/nba/comments/3dy210/in_2011_lebron_james_dwyane_wade_and_chris_bosh/ct9t4fb/,ct9t4fb,1437437557.0,1437408757.0,"In 2011, Lebron James, Dwyane Wade, and Chris Bosh all had at least 30 points and 10 rebounds in the same game.",1441,3dy210
495,"""It was the first time since February 1961 that three teammates finished with at least 30 points and 10 rebounds in a non-overtime game.""",166,,/r/nba/comments/3dy210/in_2011_lebron_james_dwyane_wade_and_chris_bosh/ct9ooga/,ct9ooga,1437430116.0,1437401316.0,"In 2011, Lebron James, Dwyane Wade, and Chris Bosh all had at least 30 points and 10 rebounds in the same game.",1441,3dy210
496,"Aaron Brooks, Luis Scola, and Kevin Martin also had a 30-30-30 game. Except they didn't also have double doubles.",49,fatty_fatshits,/r/nba/comments/3dy210/in_2011_lebron_james_dwyane_wade_and_chris_bosh/ct9q620/,ct9q620,1437432805.0,1437404005.0,"In 2011, Lebron James, Dwyane Wade, and Chris Bosh all had at least 30 points and 10 rebounds in the same game.",1441,3dy210
497,33% of that Rockets lineup play for the Raptors now,45,,/r/nba/comments/3dy210/in_2011_lebron_james_dwyane_wade_and_chris_bosh/ct9sbyx/,ct9sbyx,1437436325.0,1437407525.0,"In 2011, Lebron James, Dwyane Wade, and Chris Bosh all had at least 30 points and 10 rebounds in the same game.",1441,3dy210
498,"In [2014-15](http://www.basketball-reference.com/play-index/pgl_finder.cgi?request=1&player_id=&match=game&year_min=2015&year_max=2015&age_min=0&age_max=99&team_id=&opp_id=&is_playoffs=N&round_id=&game_num_type=&game_num_min=&game_num_max=&game_month=&game_location=&game_result=&is_starter=&is_active=&is_hof=&pos_is_g=Y&pos_is_gf=Y&pos_is_f=Y&pos_is_fg=Y&pos_is_fc=Y&pos_is_c=Y&pos_is_cf=Y&c1stat=pts&c1comp=gt&c1val=30&c2stat=trb&c2comp=gt&c2val=10&c3stat=&c3comp=gt&c3val=&c4stat=&c4comp=gt&c4val=&order_by=player), OKC was the only team to have 3 different players record a 30 point/10 rebound game over the ENTIRE season (Durant, Westbrook, Kanter). 

Having 3 players on the same team do it one game is INSANE.",46,Beatbox_,/r/nba/comments/3dy210/in_2011_lebron_james_dwyane_wade_and_chris_bosh/ct9vhc3/,ct9vhc3,1437441065.0,1437412265.0,"In 2011, Lebron James, Dwyane Wade, and Chris Bosh all had at least 30 points and 10 rebounds in the same game.",1441,3dy210
499,"That's 94 points, 33 rebounds and 15 assists just by themselves. God damn. ",46,,/r/nba/comments/3dy210/in_2011_lebron_james_dwyane_wade_and_chris_bosh/ct9ux0y/,ct9ux0y,1437440234.0,1437411434.0,"In 2011, Lebron James, Dwyane Wade, and Chris Bosh all had at least 30 points and 10 rebounds in the same game.",1441,3dy210
500,"[speaking of crazy statlines in a single game](http://www.basketball-reference.com/boxscores/201203230OKC.html)

KD: 40 pts, 17 reb, 5 ast

Russ: 45 pts, 4 reb, 6 ast

Harden: 25 pts, 6 reb, 6 ast

K-Love: 51 pts, 14 reb

JJ Barea: 25 pts, 10 reb, 14 ast",30,brob,/r/nba/comments/3dy210/in_2011_lebron_james_dwyane_wade_and_chris_bosh/ct9znyj/,ct9znyj,1437447225.0,1437418425.0,"In 2011, Lebron James, Dwyane Wade, and Chris Bosh all had at least 30 points and 10 rebounds in the same game.",1441,3dy210
501,"Ignoring all the circle jerk comments that happen in every dumb offseason post I'll actually answer this one. Lebron hits a game winner in game seven and screams ""Jeb Bush 2016"" that shit is going to break the Internet. Like shut down twitter for a deep minute. So every news station will be talking about Jeb Bush and Lebron James endorsing him as President. That's media time nobody can buy. It wouldn't swing the election but it'd be a big help.",934,Iknifecuzimgay,/r/nba/comments/3du2o8/could_lebron_turn_the_election/ct8o60c/,ct8o60c,1437347592.0,1437318792.0,Could Lebron turn the election?,752,3du2o8
502,what in the fuck ,1177,themariokarters,/r/nba/comments/3du2o8/could_lebron_turn_the_election/ct8mcz7/,ct8mcz7,1437343191.0,1437314391.0,Could Lebron turn the election?,752,3du2o8
503,Quality offseason post,445,wikiman2001,/r/nba/comments/3du2o8/could_lebron_turn_the_election/ct8mmc2/,ct8mmc2,1437343896.0,1437315096.0,Could Lebron turn the election?,752,3du2o8
504,"Last election LeBron [publicly supported Obama.](http://www.cbsnews.com/news/athletes-get-political-lebron-backs-obama-a-rod-picks-romney/) This election I think he could have an large impact on the democratic primaries, if he decided to support someone, but I am not sure if he would have that much of an impact on the general election.

His voice means a lot in Northern Ohio, but the south will still vote Red. I am sure any candidate would love his endorsement, though if you really wanted impact in Ohio you have to turn to Ohio State. I am not sure people outside the state really understand how dominant Ohio State is over Ohio culture and day to day life. Had LeBron won a championship there and gone on to Cleveland without leaving to the Heat his statements would have a much larger impact. As he is now? I believe a minor impact, nothing huge.",54,sexualsecondaccount,/r/nba/comments/3du2o8/could_lebron_turn_the_election/ct8nqzc/,ct8nqzc,1437346648.0,1437317848.0,Could Lebron turn the election?,752,3du2o8
505,"Doubtful, the three cities normally vote democrat and the rest of the state votes republican and it's a battle of which side gets more people to the polls.",75,rompskee,/r/nba/comments/3du2o8/could_lebron_turn_the_election/ct8mdip/,ct8mdip,1437343233.0,1437314433.0,Could Lebron turn the election?,752,3du2o8
506,"For the good of this country, I really hope nobody's voting based on what a professional athlete is telling them.",69,tealjaker94,/r/nba/comments/3du2o8/could_lebron_turn_the_election/ct8mk0q/,ct8mk0q,1437343718.0,1437314918.0,Could Lebron turn the election?,752,3du2o8
507,"I think LeBron could increase voting amongst the younger generation, but his teflon PR team would never let him get involved in political endorsements",142,tomorrowman,/r/nba/comments/3du2o8/could_lebron_turn_the_election/ct8mzt8/,ct8mzt8,1437344857.0,1437316057.0,Could Lebron turn the election?,752,3du2o8
508,"""barry sanders for president"" -lebron",31,Dzungana,/r/nba/comments/3du2o8/could_lebron_turn_the_election/ct8ogmm/,ct8ogmm,1437348239.0,1437319439.0,Could Lebron turn the election?,752,3du2o8
509,">Kobe, LeBron, Jason highlights

Side note: I definitely have selective memory, that block on kobe, don't remember it at all. ",27,Dresanity93,/r/nba/comments/3dr8c2/kobelebron_highlights_2007_white_vs_blue_team_usa/ct810p4/,ct810p4,1437283185.0,1437254385.0,"Kobe/Lebron Highlights, 2007 White Vs Blue Team USA Scrimmage",112,3dr8c2
510,Prime Kidd and LeBron on the same team would have been incredible.,36,kingsincommon,/r/nba/comments/3dr8c2/kobelebron_highlights_2007_white_vs_blue_team_usa/ct7ya7t/,ct7ya7t,1437277710.0,1437248910.0,"Kobe/Lebron Highlights, 2007 White Vs Blue Team USA Scrimmage",112,3dr8c2
511,Lebron and Blatt together? Does this mean that LBJ may be looking to hire Blatt to replace him as Cleveland's coach?!,62,,/r/nba/comments/3dod0e/nba_summer_league_lebron_and_david_blatt_are/ct73n5g/,ct73n5g,1437201395.0,1437172595.0,"[NBA Summer League] LeBron and David Blatt are sitting courtside together, watching the Cavs summer league game",113,3dod0e
512,And Lebron is wearing an Indians jersey and not a Yankees one. Damn. ,39,,/r/nba/comments/3dod0e/nba_summer_league_lebron_and_david_blatt_are/ct73klb/,ct73klb,1437201273.0,1437172473.0,"[NBA Summer League] LeBron and David Blatt are sitting courtside together, watching the Cavs summer league game",113,3dod0e
513,"Well fuck everybody else.  I enjoyed your post, OP.",45,,/r/nba/comments/3dod0e/nba_summer_league_lebron_and_david_blatt_are/ct73rdu/,ct73rdu,1437201602.0,1437172802.0,"[NBA Summer League] LeBron and David Blatt are sitting courtside together, watching the Cavs summer league game",113,3dod0e
514,Can we get a body language expert in here? ,25,tealjaker94,/r/nba/comments/3dod0e/nba_summer_league_lebron_and_david_blatt_are/ct73o2p/,ct73o2p,1437201441.0,1437172641.0,"[NBA Summer League] LeBron and David Blatt are sitting courtside together, watching the Cavs summer league game",113,3dod0e
515,But...espn told me LBJ hates Blatt and he's gonna get fired for losing the finals even though it was is first year coaching here.,92,Kancer86,/r/nba/comments/3dod0e/nba_summer_league_lebron_and_david_blatt_are/ct73n4s/,ct73n4s,1437201394.0,1437172594.0,"[NBA Summer League] LeBron and David Blatt are sitting courtside together, watching the Cavs summer league game",113,3dod0e
516,I wish he did. just once,29,PORZINGOD,/r/nba/comments/3do7yh/krawczynski_sounds_like_lebron_will_be_in_the/ct72413/,ct72413,1437198704.0,1437169904.0,[Krawczynski] Sounds like LeBron will be in the house for Wolves-Cavs summer league game. I don't think he is going to play,63,3do7yh
517,"Obviously not, he'd be exposed.",54,viscaelbarca1899,/r/nba/comments/3do7yh/krawczynski_sounds_like_lebron_will_be_in_the/ct724sh/,ct724sh,1437198740.0,1437169940.0,[Krawczynski] Sounds like LeBron will be in the house for Wolves-Cavs summer league game. I don't think he is going to play,63,3do7yh
518,Smh how are we supposed to know if they guy can ball if he won't play? ,21,,/r/nba/comments/3do7yh/krawczynski_sounds_like_lebron_will_be_in_the/ct72zru/,ct72zru,1437200237.0,1437171437.0,[Krawczynski] Sounds like LeBron will be in the house for Wolves-Cavs summer league game. I don't think he is going to play,63,3do7yh
519,[deleted],68,,/r/nba/comments/3do7yh/krawczynski_sounds_like_lebron_will_be_in_the/ct724pj/,ct724pj,1437198736.0,1437169936.0,[Krawczynski] Sounds like LeBron will be in the house for Wolves-Cavs summer league game. I don't think he is going to play,63,3do7yh
520,What would his stats be if he did play? Like 50/20/10?,26,insanedreamer_,/r/nba/comments/3do7yh/krawczynski_sounds_like_lebron_will_be_in_the/ct72568/,ct72568,1437198759.0,1437169959.0,[Krawczynski] Sounds like LeBron will be in the house for Wolves-Cavs summer league game. I don't think he is going to play,63,3do7yh
521,if he played KAT would destroy him. good on LeBron.,26,fresh_smelling_rip,/r/nba/comments/3do7yh/krawczynski_sounds_like_lebron_will_be_in_the/ct72lz3/,ct72lz3,1437199572.0,1437170772.0,[Krawczynski] Sounds like LeBron will be in the house for Wolves-Cavs summer league game. I don't think he is going to play,63,3do7yh
522,"Lots of interesting stuff here, but perhaps most importantly, Malone confirms that he was asked about playing 4 on 5.

**Were you ever actually approached about playing 4-on-5?**

Ha, ha, ha. It came up. I was approached. I’m a defensive guy, and I know you can’t defend well if you only have four guys out there.",83,Quinnett,/r/nba/comments/3dmipn/lowe_qa_new_nuggets_head_coach_mike_malone_on_ty/ct6jrjh/,ct6jrjh,1437170647.0,1437141847.0,"[Lowe] Q&A: New Nuggets Head Coach Mike Malone on Ty Lawson’s Future, What Happened to LeBron in the 2010 Playoffs, and the Art of Managing Boogie",170,3dmipn
523,Lot of respect for Malone here. Mudiay is my favorite rookie and I'm glad Malone is there to coach him. One of the best culture building guys in the NBA. ,40,Dragic-Bronson,/r/nba/comments/3dmipn/lowe_qa_new_nuggets_head_coach_mike_malone_on_ty/ct6l3s1/,ct6l3s1,1437172905.0,1437144105.0,"[Lowe] Q&A: New Nuggets Head Coach Mike Malone on Ty Lawson’s Future, What Happened to LeBron in the 2010 Playoffs, and the Art of Managing Boogie",170,3dmipn
524,"anyone else get the feeling he really misses/enjoyed coaching Boogie, almost bring him up every other question",37,fobbywillie,/r/nba/comments/3dmipn/lowe_qa_new_nuggets_head_coach_mike_malone_on_ty/ct6obov/,ct6obov,1437177783.0,1437148983.0,"[Lowe] Q&A: New Nuggets Head Coach Mike Malone on Ty Lawson’s Future, What Happened to LeBron in the 2010 Playoffs, and the Art of Managing Boogie",170,3dmipn
525,"Great interview. If Malone can turn Faried into a plus defender, his whole outlook changes.

Wonder why he was initially reluctant to say the other guy was Justise Winslow.",32,SonOfSkipBaeless,/r/nba/comments/3dmipn/lowe_qa_new_nuggets_head_coach_mike_malone_on_ty/ct6kcdy/,ct6kcdy,1437171640.0,1437142840.0,"[Lowe] Q&A: New Nuggets Head Coach Mike Malone on Ty Lawson’s Future, What Happened to LeBron in the 2010 Playoffs, and the Art of Managing Boogie",170,3dmipn
526,"Demarcus Cousins is ""a big African African guy from deep down south""

Danny Ferry ""He's got a LOT of African in him"" 
",25,freshwes,/r/nba/comments/3dmipn/lowe_qa_new_nuggets_head_coach_mike_malone_on_ty/ct6lxyk/,ct6lxyk,1437174220.0,1437145420.0,"[Lowe] Q&A: New Nuggets Head Coach Mike Malone on Ty Lawson’s Future, What Happened to LeBron in the 2010 Playoffs, and the Art of Managing Boogie",170,3dmipn
527,Nice pic of LeBron at the TJ Warren Skills Academy,95,,/r/nba/comments/3dkc86/lebron_excited_to_meet_tj_warren/ct5z7ge/,ct5z7ge,1437118757.0,1437089957.0,LeBron excited to meet TJ Warren,133,3dkc86
528,http://i.imgur.com/fS9KiGQ.jpg,60,lightbadkid,/r/nba/comments/3dkc86/lebron_excited_to_meet_tj_warren/ct5zb1q/,ct5zb1q,1437118942.0,1437090142.0,LeBron excited to meet TJ Warren,133,3dkc86
529,TJ Warren looks like an evil alternate universe Harrison Barnes. ,22,FunWinterSport,/r/nba/comments/3dkc86/lebron_excited_to_meet_tj_warren/ct5z9jy/,ct5z9jy,1437118864.0,1437090064.0,LeBron excited to meet TJ Warren,133,3dkc86
530,"""Get this LeBron off of me""",41,,/r/nba/comments/3dkc86/lebron_excited_to_meet_tj_warren/ct5z6g1/,ct5z6g1,1437118705.0,1437089905.0,LeBron excited to meet TJ Warren,133,3dkc86
531,Guy looks like he wants to kill someone,27,,/r/nba/comments/3dkc86/lebron_excited_to_meet_tj_warren/ct5z4zj/,ct5z4zj,1437118631.0,1437089831.0,LeBron excited to meet TJ Warren,133,3dkc86
532,He really didn't want it lol...,573,,/r/nba/comments/3dg845/lebron_james_win_2015_espy_for_best_championship/ct4ttpq/,ct4ttpq,1437036910.0,1437008110.0,Lebron James win 2015 ESPY for best Championship performance.,630,3dg845
533,"Not to mention they gave Mo'ne Davis the best breakthrough athlete over Spieth. I think winning 5 golf tournaments and 2 majors, one being the masters, is a bit more impressive than getting clobbered in the national semi finals",299,putterthrow,/r/nba/comments/3dg845/lebron_james_win_2015_espy_for_best_championship/ct4ukcv/,ct4ukcv,1437038262.0,1437009462.0,Lebron James win 2015 ESPY for best Championship performance.,630,3dg845
534,"If they didn't want to give it to a horse, Madison Bumgarner definitely deserved it.  He carried his team practically to the same level than LeBron did and, well, his team actually won.

Edit: Also, I guess it happened too recently to be nominated (?), but Carli Lloyd could have been a runaway winner.",479,imeanYOLOright,/r/nba/comments/3dg845/lebron_james_win_2015_espy_for_best_championship/ct4tvtr/,ct4tvtr,1437037019.0,1437008219.0,Lebron James win 2015 ESPY for best Championship performance.,630,3dg845
535,He was actually surprised that he won it,80,cookies50796,/r/nba/comments/3dg845/lebron_james_win_2015_espy_for_best_championship/ct4ttpn/,ct4ttpn,1437036910.0,1437008110.0,Lebron James win 2015 ESPY for best Championship performance.,630,3dg845
536,"""I'll take this second place award, and I'll take it to my house too.""

Lebron keeping it real lol.",94,Needs_Improvement,/r/nba/comments/3dg845/lebron_james_win_2015_espy_for_best_championship/ct4ttyq/,ct4ttyq,1437036922.0,1437008122.0,Lebron James win 2015 ESPY for best Championship performance.,630,3dg845
537,"At least now we kinda know what his response to winning finals MVP would've been.

Albeit probably more agitated and intense in the moment.",28,jrg114,/r/nba/comments/3dg845/lebron_james_win_2015_espy_for_best_championship/ct4ttsy/,ct4ttsy,1437036914.0,1437008114.0,Lebron James win 2015 ESPY for best Championship performance.,630,3dg845
538,I'm extremely disappointed Bumgarner didn't win. ,273,AutisticForFences,/r/nba/comments/3dg845/lebron_james_win_2015_espy_for_best_championship/ct4tt1c/,ct4tt1c,1437036877.0,1437008077.0,Lebron James win 2015 ESPY for best Championship performance.,630,3dg845
539,"I know what LeBron did was historic, but Bumgarner's performance was the best in World Series history",236,MyDogAteMyJordans,/r/nba/comments/3dg845/lebron_james_win_2015_espy_for_best_championship/ct4tuzo/,ct4tuzo,1437036976.0,1437008176.0,Lebron James win 2015 ESPY for best Championship performance.,630,3dg845
