,body,score,author,permalink,comment_id,created_loc,created_utc,post_title,post_score,post_id
219,"I don't think you can blame that abysmal record just on it being Lebron's system like many are making it out to be.

Irving is good, but he hasn't shown he can lead teams to victory as the lead man. He's a great scoring side kick.",50,Human_On_Reddit,/r/nba/comments/6ourmv/in_the_last_three_seasons_sincelebron_james_made/dkkiqf5/,dkkiqf5,1500766658.0,1500737858.0,"In the last three seasons, since#LeBron James made his returnto the Cavaliers. Cleveland is 4-21without LeBron James playing.",1353,6ourmv
220,"Most of those games were also road games, second games on a back to back, and against playoff teams. ",55,gatx370,/r/nba/comments/6ourmv/in_the_last_three_seasons_sincelebron_james_made/dkkd6do/,dkkd6do,1500757810.0,1500729010.0,"In the last three seasons, since#LeBron James made his returnto the Cavaliers. Cleveland is 4-21without LeBron James playing.",1353,6ourmv
221,Let the fun begin,23,jalapenobusiness11,/r/nba/comments/6ouhm0/wojnarowski_talking_the_kyrie_trade_request/dkka9t7/,dkka9t7,1500751282.0,1500722482.0,Wojnarowski talking the Kyrie trade request : 'Probably wouldn't be happening' if Lebron was committed to Cavs | SC6 | ESPN,55,6ouhm0
222,"Boiiii this is getting better and better. It sucks that Kyrie is leaving, but this will be fun. ",23,uTukan,/r/nba/comments/6ouhm0/wojnarowski_talking_the_kyrie_trade_request/dkkaoo7/,dkkaoo7,1500752352.0,1500723552.0,Wojnarowski talking the Kyrie trade request : 'Probably wouldn't be happening' if Lebron was committed to Cavs | SC6 | ESPN,55,6ouhm0
223,He said himself he's never not taking the max again so,55,amad3000,/r/nba/comments/6ou53e/how_large_of_a_financial_sacrifice_do_you_think/dkk81nz/,dkk81nz,1500744563.0,1500715763.0,How large of a financial sacrifice do you think Lebron would be willing to make in order to have a chance at winning another title?,19,6ou53e
224,But he's playing basketball,483,MoistNips007,/r/nba/comments/6oseqi/kyrie_on_lebron_thats_the_type_of_guy_that_i_want/dkjtoxv/,dkjtoxv,1500717004.0,1500688204.0,"Kyrie on Lebron: ""That's the type of guy that I want to be with every single time I'm going to war.""",446,6oseqi
225,good thing Kyrie's never been to war ,87,DrWolves,/r/nba/comments/6oseqi/kyrie_on_lebron_thats_the_type_of_guy_that_i_want/dkjtp5c/,dkjtp5c,1500717012.0,1500688212.0,"Kyrie on Lebron: ""That's the type of guy that I want to be with every single time I'm going to war.""",446,6oseqi
226,Breaking: Kyrie to give up professional basketball for career in the military. ,21,PVT_Stanley,/r/nba/comments/6oseqi/kyrie_on_lebron_thats_the_type_of_guy_that_i_want/dkju7o7/,dkju7o7,1500717750.0,1500688950.0,"Kyrie on Lebron: ""That's the type of guy that I want to be with every single time I'm going to war.""",446,6oseqi
227,"Kyrie was on the worst team in the league for 3 years, then Lebron came and he's been to 3 straight finals + won a ship + hit the dagger in said ship.  

The only logical reason for wanting to leave is an ill informed ego. ",246,this_place_stinks,/r/nba/comments/6oseqi/kyrie_on_lebron_thats_the_type_of_guy_that_i_want/dkjtr8p/,dkjtr8p,1500717095.0,1500688295.0,"Kyrie on Lebron: ""That's the type of guy that I want to be with every single time I'm going to war.""",446,6oseqi
228,[deleted],33,,/r/nba/comments/6oseqi/kyrie_on_lebron_thats_the_type_of_guy_that_i_want/dkjtp63/,dkjtp63,1500717013.0,1500688213.0,"Kyrie on Lebron: ""That's the type of guy that I want to be with every single time I'm going to war.""",446,6oseqi
229,"lebron whispered in his ear one night ""yo kyrie the earth ain't flat ya dumb fuck""

and kyrie lost his shit ",1353,DrWolves,/r/nba/comments/6ose02/adande_lebron_was_already_willing_to_let_kyrie_do/dkjtixh/,dkjtixh,1500716763.0,1500687963.0,"[Adande] LeBron was already willing to let Kyrie do the heavy lifting in reg season. Kyrie took more shots, had higher usage rate than Bron in 16-17",1058,6ose02
230,I think its more that Kyrie doesn't want to live in Lebron's shadow his entire career.,461,ClickClackKobeShaq,/r/nba/comments/6ose02/adande_lebron_was_already_willing_to_let_kyrie_do/dkjtjk7/,dkjtjk7,1500716789.0,1500687989.0,"[Adande] LeBron was already willing to let Kyrie do the heavy lifting in reg season. Kyrie took more shots, had higher usage rate than Bron in 16-17",1058,6ose02
231,Still obviously LeBron's team,160,DurantHasGrossHair,/r/nba/comments/6ose02/adande_lebron_was_already_willing_to_let_kyrie_do/dkjtim6/,dkjtim6,1500716750.0,1500687950.0,"[Adande] LeBron was already willing to let Kyrie do the heavy lifting in reg season. Kyrie took more shots, had higher usage rate than Bron in 16-17",1058,6ose02
232,In a way it makes sense. Kyrie is 25. LeBron is 32. Let's say LeBron plays another 5-6 years. At that point Kyrie is 30-31 -- he can't really re-define himself at that point.,47,rufusdoofusmcgoofus,/r/nba/comments/6ose02/adande_lebron_was_already_willing_to_let_kyrie_do/dkjxaj1/,dkjxaj1,1500722222.0,1500693422.0,"[Adande] LeBron was already willing to let Kyrie do the heavy lifting in reg season. Kyrie took more shots, had higher usage rate than Bron in 16-17",1058,6ose02
233,"I believe this is Lebron and Kyrie sticking it to DG. Kyrie takes the fall as the ""bad"" guy, the ingrate. Lebron can leave on his terms next year with a legitimate beef. They both screw over Dan Gilbert. ",88,-917-,/r/nba/comments/6ose02/adande_lebron_was_already_willing_to_let_kyrie_do/dkju3kd/,dkju3kd,1500717583.0,1500688783.0,"[Adande] LeBron was already willing to let Kyrie do the heavy lifting in reg season. Kyrie took more shots, had higher usage rate than Bron in 16-17",1058,6ose02
234,This is about Lebron leaving next season. Nothing more. ,107,red2213,/r/nba/comments/6ose02/adande_lebron_was_already_willing_to_let_kyrie_do/dkjtifm/,dkjtifm,1500716743.0,1500687943.0,"[Adande] LeBron was already willing to let Kyrie do the heavy lifting in reg season. Kyrie took more shots, had higher usage rate than Bron in 16-17",1058,6ose02
235,Kobe: Fuck friends get buckets,352,redbrick,/r/nba/comments/6orwlt/remember_june_kyrie_irving_sought_out_kobe/dkjpdsm/,dkjpdsm,1500710937.0,1500682137.0,Remember June : Kyrie Irving Sought Out Kobe Bryants Advice on Co-Existing With LeBron James,199,6orwlt
236,"Kyrie: So when should I pass it to Leb....

Kobe: Fuck that. Stockton passed all the time, how many rings he got?",301,TheKnicksHateMe,/r/nba/comments/6orwlt/remember_june_kyrie_irving_sought_out_kobe/dkjpj4i/,dkjpj4i,1500711139.0,1500682339.0,Remember June : Kyrie Irving Sought Out Kobe Bryants Advice on Co-Existing With LeBron James,199,6orwlt
237,The Kobe-LeBron proxy war continues.,155,Dontrell,/r/nba/comments/6orwlt/remember_june_kyrie_irving_sought_out_kobe/dkjpdsz/,dkjpdsz,1500710937.0,1500682137.0,Remember June : Kyrie Irving Sought Out Kobe Bryants Advice on Co-Existing With LeBron James,199,6orwlt
238,Kobe: Fuck Dan Gilbert,40,EvanH98,/r/nba/comments/6orwlt/remember_june_kyrie_irving_sought_out_kobe/dkjpet7/,dkjpet7,1500710975.0,1500682175.0,Remember June : Kyrie Irving Sought Out Kobe Bryants Advice on Co-Existing With LeBron James,199,6orwlt
239,"Remember the rumor of Kobe telling Westbrook he needed to be more ball dominant while KD was in OKC? Now this? 

Mamba is a genius. ",108,DabToTheFuture,/r/nba/comments/6orwlt/remember_june_kyrie_irving_sought_out_kobe/dkjpyli/,dkjpyli,1500711730.0,1500682930.0,Remember June : Kyrie Irving Sought Out Kobe Bryants Advice on Co-Existing With LeBron James,199,6orwlt
240,Should've known Kobe was behind this,42,bigmeatyclaws22,/r/nba/comments/6orwlt/remember_june_kyrie_irving_sought_out_kobe/dkjpf40/,dkjpf40,1500710987.0,1500682187.0,Remember June : Kyrie Irving Sought Out Kobe Bryants Advice on Co-Existing With LeBron James,199,6orwlt
241,"LeBron racking up rings, in discussion for greatest player (and over Kobe)

Kobe : Hold my beer (picks up phone)",41,barath_s,/r/nba/comments/6orwlt/remember_june_kyrie_irving_sought_out_kobe/dkjpsxr/,dkjpsxr,1500711514.0,1500682714.0,Remember June : Kyrie Irving Sought Out Kobe Bryants Advice on Co-Existing With LeBron James,199,6orwlt
242,"Oh shit. 

Kyrie = Kobe

LeBron = Shaq

JR = Fisher

Fox = ...Kuzma

Wait where does Lavar want to be traded again?",36,jcw4455,/r/nba/comments/6orwlt/remember_june_kyrie_irving_sought_out_kobe/dkjqaw5/,dkjqaw5,1500712187.0,1500683387.0,Remember June : Kyrie Irving Sought Out Kobe Bryants Advice on Co-Existing With LeBron James,199,6orwlt
243,Everything Woj is true... unless he's mentioning LeBron. Positive or negative.,215,thunderchunky34,/r/nba/comments/6orvvk/wojnarowski_i_think_right_now_if_lebron_was/dkjp99l/,dkjp99l,1500710763.0,1500681963.0,"[Wojnarowski] I think right now if Lebron was committed going forward and he[Kyrie] knew Lebron would be here, this probably wouldn't be happening right now",376,6orvvk
244,LeBron stuff is literally the only thing you can't trust Woj on,319,,/r/nba/comments/6orvvk/wojnarowski_i_think_right_now_if_lebron_was/dkjp7ip/,dkjp7ip,1500710697.0,1500681897.0,"[Wojnarowski] I think right now if Lebron was committed going forward and he[Kyrie] knew Lebron would be here, this probably wouldn't be happening right now",376,6orvvk
245,Or the opposite ,94,Kirch21,/r/nba/comments/6orvvk/wojnarowski_i_think_right_now_if_lebron_was/dkjp661/,dkjp661,1500710645.0,1500681845.0,"[Wojnarowski] I think right now if Lebron was committed going forward and he[Kyrie] knew Lebron would be here, this probably wouldn't be happening right now",376,6orvvk
246,Low but possible,84,,/r/nba/comments/6orqsv/serious_could_this_be_a_blessing_in_disguise_for/dkjnzhd/,dkjnzhd,1500709035.0,1500680235.0,(Serious) Could this be a blessing in disguise for LeBron James?,29,6orqsv
247,[deleted],56,,/r/nba/comments/6orqsv/serious_could_this_be_a_blessing_in_disguise_for/dkjo190/,dkjo190,1500709101.0,1500680301.0,(Serious) Could this be a blessing in disguise for LeBron James?,29,6orqsv
248,It's already close so yea,173,Bigbadbuck,/r/nba/comments/6orlu2/if_kyrie_and_lebron_both_move_to_the_west_will/dkjmude/,dkjmude,1500707511.0,1500678711.0,"If Kyrie and LeBron both move to the west, will the east be considered as the worst eastern conference of all time in the NBA?",84,6orlu2
249,"It probably already is the weakest ever, then take out two best players. On bright side Embiid can start racking up the All Star Appearances",57,wingjinx,/r/nba/comments/6orlu2/if_kyrie_and_lebron_both_move_to_the_west_will/dkjmw4a/,dkjmw4a,1500707575.0,1500678775.0,"If Kyrie and LeBron both move to the west, will the east be considered as the worst eastern conference of all time in the NBA?",84,6orlu2
250,No question.,43,Kjtl98,/r/nba/comments/6orlu2/if_kyrie_and_lebron_both_move_to_the_west_will/dkjmug0/,dkjmug0,1500707514.0,1500678714.0,"If Kyrie and LeBron both move to the west, will the east be considered as the worst eastern conference of all time in the NBA?",84,6orlu2
251,"going off the reddit top 300, the east would have only 1 top 10 player (greek freek at #9) followed by #12 wall, and then all the way down at #21 with derozan. that's beyond insane. the west hold every slot from 1 to 20 except 9 and 12. there for sure has never been a time in the league that a conf was this bad, not even during the mediocre 60s when there were 8 teams being kicked around by boston.",26,deliciouspuppy,/r/nba/comments/6orlu2/if_kyrie_and_lebron_both_move_to_the_west_will/dkjn8sv/,dkjn8sv,1500708036.0,1500679236.0,"If Kyrie and LeBron both move to the west, will the east be considered as the worst eastern conference of all time in the NBA?",84,6orlu2
252,"My theory has always been that he saw Miami as a team that was old and declining, little to no cap space, and looked at the Cavs as a budding team with tons of cap, pieces to trade for a star, and Kyrie. Going back to the Cavs would also help his image a ton so it was a win-win situation. Now the same problem is happening with the Cavs as they just got destroyed in the Finals the same way the Heat did with the Spurs and have no means to improve the roster.",102,DwyaneWade305,/r/nba/comments/6orjfn/oc_why_lebron_really_left_miami_and_what_it_means/dkjnc9c/,dkjnc9c,1500708163.0,1500679363.0,[OC] Why LeBron really left Miami and what it means for his future moving forward,191,6orjfn
253,"I see wall of text, I upvote",101,,/r/nba/comments/6orjfn/oc_why_lebron_really_left_miami_and_what_it_means/dkjmee7/,dkjmee7,1500706936.0,1500678136.0,[OC] Why LeBron really left Miami and what it means for his future moving forward,191,6orjfn
254,I think the main reason is he saw that he had a better chance at winning with Cleveland after they won the lottery. Wade's play was going downhill from his superstar level and knew the heat were getting too old. ,39,slamdunk23,/r/nba/comments/6orjfn/oc_why_lebron_really_left_miami_and_what_it_means/dkjmfbo/,dkjmfbo,1500706969.0,1500678169.0,[OC] Why LeBron really left Miami and what it means for his future moving forward,191,6orjfn
255,[removed],39,,/r/nba/comments/6orjfn/oc_why_lebron_really_left_miami_and_what_it_means/dkjn5bp/,dkjn5bp,1500707908.0,1500679108.0,[OC] Why LeBron really left Miami and what it means for his future moving forward,191,6orjfn
256,Prayers to LeBron during this dark time. ,946,,/r/nba/comments/6orghv/windhorst_on_espn_lebron_was_devastated_from_what/dkjln90/,dkjln90,1500705997.0,1500677197.0,"Windhorst on ESPN: ""LeBron was devastated, from what I understand... He learned this several days ago. This wasn't new to him today.""",856,6orghv
257,"ben must have found out when he sent this.  
https://twitter.com/BenSimmons25/status/887414039365562368",241,Jcael,/r/nba/comments/6orghv/windhorst_on_espn_lebron_was_devastated_from_what/dkjltyl/,dkjltyl,1500706235.0,1500677435.0,"Windhorst on ESPN: ""LeBron was devastated, from what I understand... He learned this several days ago. This wasn't new to him today.""",856,6orghv
258,LeDevastated,204,SgtDowns,/r/nba/comments/6orghv/windhorst_on_espn_lebron_was_devastated_from_what/dkjlnr9/,dkjlnr9,1500706014.0,1500677214.0,"Windhorst on ESPN: ""LeBron was devastated, from what I understand... He learned this several days ago. This wasn't new to him today.""",856,6orghv
259,We are LeBron James *adds red and cold snapchat filter*,42,Redditmymistress,/r/nba/comments/6orghv/windhorst_on_espn_lebron_was_devastated_from_what/dkjmzpx/,dkjmzpx,1500707705.0,1500678905.0,"Windhorst on ESPN: ""LeBron was devastated, from what I understand... He learned this several days ago. This wasn't new to him today.""",856,6orghv
260,"The one that got away. 

Drummond has McCurdy. Lebron has Kyrie.",24,lebbe,/r/nba/comments/6orghv/windhorst_on_espn_lebron_was_devastated_from_what/dkjx2kf/,dkjx2kf,1500721892.0,1500693092.0,"Windhorst on ESPN: ""LeBron was devastated, from what I understand... He learned this several days ago. This wasn't new to him today.""",856,6orghv
261,I believe it. Kyrie was LeBron's protg. ,171,APF429,/r/nba/comments/6orghv/windhorst_on_espn_lebron_was_devastated_from_what/dkjlo8w/,dkjlo8w,1500706030.0,1500677230.0,"Windhorst on ESPN: ""LeBron was devastated, from what I understand... He learned this several days ago. This wasn't new to him today.""",856,6orghv
262,LeDepression Era,61,dbaxter123,/r/nba/comments/6orghv/windhorst_on_espn_lebron_was_devastated_from_what/dkjlrco/,dkjlrco,1500706141.0,1500677341.0,"Windhorst on ESPN: ""LeBron was devastated, from what I understand... He learned this several days ago. This wasn't new to him today.""",856,6orghv
263,LeBron to OKC confirmed,21,335i_fanatic,/r/nba/comments/6orghv/windhorst_on_espn_lebron_was_devastated_from_what/dkjnlnq/,dkjnlnq,1500708513.0,1500679713.0,"Windhorst on ESPN: ""LeBron was devastated, from what I understand... He learned this several days ago. This wasn't new to him today.""",856,6orghv
264,who was making 'GM Lebron' jokes? we were making 'LeGM' jokes smh,643,riverdancejonas,/r/nba/comments/6orfy6/kennedy_now_does_everyone_see_how_important_david/dkjlkqt/,dkjlkqt,1500705906.0,1500677106.0,"[Kennedy] NOW does everyone see how important David Griffin was in CLE? While Twitter made ""GM Lebron"" jokes, he was making moves, managing egos, etc.",572,6orfy6
265,Go away Alex. ,146,bockers,/r/nba/comments/6orfy6/kennedy_now_does_everyone_see_how_important_david/dkjlj5y/,dkjlj5y,1500705850.0,1500677050.0,"[Kennedy] NOW does everyone see how important David Griffin was in CLE? While Twitter made ""GM Lebron"" jokes, he was making moves, managing egos, etc.",572,6orfy6
266,"There's no way to even confirm that to me, I don't know if he was managing ego's at all ",71,shanmustafa,/r/nba/comments/6orfy6/kennedy_now_does_everyone_see_how_important_david/dkjljqy/,dkjljqy,1500705871.0,1500677071.0,"[Kennedy] NOW does everyone see how important David Griffin was in CLE? While Twitter made ""GM Lebron"" jokes, he was making moves, managing egos, etc.",572,6orfy6
267,So tired of sports writers piously shaming their audience. ,31,JoeBruiser,/r/nba/comments/6orfy6/kennedy_now_does_everyone_see_how_important_david/dkjlwds/,dkjlwds,1500706318.0,1500677518.0,"[Kennedy] NOW does everyone see how important David Griffin was in CLE? While Twitter made ""GM Lebron"" jokes, he was making moves, managing egos, etc.",572,6orfy6
268,Nope. Still LeGm ,39,PieWithCoolHwip,/r/nba/comments/6orfy6/kennedy_now_does_everyone_see_how_important_david/dkjlk1w/,dkjlk1w,1500705881.0,1500677081.0,"[Kennedy] NOW does everyone see how important David Griffin was in CLE? While Twitter made ""GM Lebron"" jokes, he was making moves, managing egos, etc.",572,6orfy6
269,"I'm sure he still feels that way, he just wants a different role ",101,shanmustafa,/r/nba/comments/6orce0/crazy_how_things_change_kyrie_praises_lebron_as/dkjkq99/,dkjkq99,1500704840.0,1500676040.0,Crazy how things change. Kyrie praises Lebron as Leader after Finals Loss.,33,6orce0
270,[deleted],29,,/r/nba/comments/6orce0/crazy_how_things_change_kyrie_praises_lebron_as/dkjkqzv/,dkjkqzv,1500704865.0,1500676065.0,Crazy how things change. Kyrie praises Lebron as Leader after Finals Loss.,33,6orce0
271,Bron loved Kyrie more than Kyrie loved Bron.,1581,,/r/nba/comments/6or93t/lebron_about_kyrie_in_june_you_know_no_matter_if/dkjk20m/,dkjk20m,1500704014.0,1500675214.0,"LeBron about Kyrie in June: ""You know, no matter if we're teammates for the rest of his career or for the rest of my career, listen, it won't be because we didn't want to play with each other no more.""",2325,6or93t
272,Brings a tear to my eye ,1070,10rf15,/r/nba/comments/6or93t/lebron_about_kyrie_in_june_you_know_no_matter_if/dkjjyls/,dkjjyls,1500703898.0,1500675098.0,"LeBron about Kyrie in June: ""You know, no matter if we're teammates for the rest of his career or for the rest of my career, listen, it won't be because we didn't want to play with each other no more.""",2325,6or93t
273,LeBron implying that his career could last longer than kyrie's lol ,798,Jfklikeskfc,/r/nba/comments/6or93t/lebron_about_kyrie_in_june_you_know_no_matter_if/dkjjz9k/,dkjjz9k,1500703920.0,1500675120.0,"LeBron about Kyrie in June: ""You know, no matter if we're teammates for the rest of his career or for the rest of my career, listen, it won't be because we didn't want to play with each other no more.""",2325,6or93t
274,"I think there's way more going on behind the scenes here than just ""I don't wanna play with LeBron anymore."" Kyrie is 13 months out of hitting one of those most legendary shots in NBA Finals history, and has made the finals 3 straight years. I suspect he thinks LeBron is on his way out and doesn't want to get stuck with a lackluster franchise.",495,thephotobooths,/r/nba/comments/6or93t/lebron_about_kyrie_in_june_you_know_no_matter_if/dkjk16z/,dkjk16z,1500703987.0,1500675187.0,"LeBron about Kyrie in June: ""You know, no matter if we're teammates for the rest of his career or for the rest of my career, listen, it won't be because we didn't want to play with each other no more.""",2325,6or93t
275,"Tim Duncan about Lebron in 2007, ""My wife don't suck dick too well i need an L-BJ""",208,,/r/nba/comments/6or93t/lebron_about_kyrie_in_june_you_know_no_matter_if/dkjk01j/,dkjk01j,1500703947.0,1500675147.0,"LeBron about Kyrie in June: ""You know, no matter if we're teammates for the rest of his career or for the rest of my career, listen, it won't be because we didn't want to play with each other no more.""",2325,6or93t
276,Fast forward a month and a few days....,47,jeremy9931,/r/nba/comments/6or93t/lebron_about_kyrie_in_june_you_know_no_matter_if/dkjjz60/,dkjjz60,1500703917.0,1500675117.0,"LeBron about Kyrie in June: ""You know, no matter if we're teammates for the rest of his career or for the rest of my career, listen, it won't be because we didn't want to play with each other no more.""",2325,6or93t
277,Damn this quote didn't age well at all,45,elchupanibre5,/r/nba/comments/6or93t/lebron_about_kyrie_in_june_you_know_no_matter_if/dkjjzle/,dkjjzle,1500703932.0,1500675132.0,"LeBron about Kyrie in June: ""You know, no matter if we're teammates for the rest of his career or for the rest of my career, listen, it won't be because we didn't want to play with each other no more.""",2325,6or93t
278,Top 10 anime betrayals ,142,,/r/nba/comments/6or93t/lebron_about_kyrie_in_june_you_know_no_matter_if/dkjk3nm/,dkjk3nm,1500704070.0,1500675270.0,"LeBron about Kyrie in June: ""You know, no matter if we're teammates for the rest of his career or for the rest of my career, listen, it won't be because we didn't want to play with each other no more.""",2325,6or93t
279,Related if true,84,thephotobooths,/r/nba/comments/6or443/lebron_spotted_at_his_his_sons_usba_tournament/dkjisc7/,dkjisc7,1500702508.0,1500673708.0,"LeBron spotted at his his son's USBA tournament wearing a shirt that says ""We Are Family""",108,6or443
280,The master of subtweeting ,53,turtlechef,/r/nba/comments/6or443/lebron_spotted_at_his_his_sons_usba_tournament/dkjit0a/,dkjit0a,1500702530.0,1500673730.0,"LeBron spotted at his his son's USBA tournament wearing a shirt that says ""We Are Family""",108,6or443
281,Does the color shorts he was wearing indicate if he's leaving the cavs next year. ,41,MikeRotch4756,/r/nba/comments/6or443/lebron_spotted_at_his_his_sons_usba_tournament/dkjiu97/,dkjiu97,1500702570.0,1500673770.0,"LeBron spotted at his his son's USBA tournament wearing a shirt that says ""We Are Family""",108,6or443
282,why is he wearing a shooting sleeve,29,,/r/nba/comments/6or443/lebron_spotted_at_his_his_sons_usba_tournament/dkjiv56/,dkjiv56,1500702599.0,1500673799.0,"LeBron spotted at his his son's USBA tournament wearing a shirt that says ""We Are Family""",108,6or443
283,"and then windhorst broke down in tears screaming ""I DONT WANNA MOVE TO LA""",224,thephotobooths,/r/nba/comments/6or27o/windhorst_on_pti_lebron_was_devastated_when_he/dkjifbe/,dkjifbe,1500702088.0,1500673288.0,Windhorst on PTI: LeBron was devastated when he found out Kyrie wanted a trade,550,6or27o
284,Lebron is driving around cleveland begging for Kyrie's home address.,459,mathpoet,/r/nba/comments/6or27o/windhorst_on_pti_lebron_was_devastated_when_he/dkjids8/,dkjids8,1500702037.0,1500673237.0,Windhorst on PTI: LeBron was devastated when he found out Kyrie wanted a trade,550,6or27o
285,He even cried. But In the end everyone grew closer. ,128,,/r/nba/comments/6or27o/windhorst_on_pti_lebron_was_devastated_when_he/dkjifrf/,dkjifrf,1500702101.0,1500673301.0,Windhorst on PTI: LeBron was devastated when he found out Kyrie wanted a trade,550,6or27o
286,Does Windhorst live in LBJ house?,127,_Papasmurf_,/r/nba/comments/6or27o/windhorst_on_pti_lebron_was_devastated_when_he/dkjidj9/,dkjidj9,1500702029.0,1500673229.0,Windhorst on PTI: LeBron was devastated when he found out Kyrie wanted a trade,550,6or27o
287,This is how I feel,81,wineman3,/r/nba/comments/6or27o/windhorst_on_pti_lebron_was_devastated_when_he/dkjick6/,dkjick6,1500701997.0,1500673197.0,Windhorst on PTI: LeBron was devastated when he found out Kyrie wanted a trade,550,6or27o
288," i used to feel so devastated 

 at times I thought wed never make iiiiiitt ",28,,/r/nba/comments/6or27o/windhorst_on_pti_lebron_was_devastated_when_he/dkjieqr/,dkjieqr,1500702069.0,1500673269.0,Windhorst on PTI: LeBron was devastated when he found out Kyrie wanted a trade,550,6or27o
289,"Lebron James felt bamboozled, hoodwinked, led astray, run amuck, and flat out deceived!",21,Coolguynumber01,/r/nba/comments/6or27o/windhorst_on_pti_lebron_was_devastated_when_he/dkjit9p/,dkjit9p,1500702539.0,1500673739.0,Windhorst on PTI: LeBron was devastated when he found out Kyrie wanted a trade,550,6or27o
290,It's okay Lebron ,29,crvilmxow,/r/nba/comments/6or27o/windhorst_on_pti_lebron_was_devastated_when_he/dkjicgw/,dkjicgw,1500701994.0,1500673194.0,Windhorst on PTI: LeBron was devastated when he found out Kyrie wanted a trade,550,6or27o
291,"devasted

shook

astonished

surprised

dumbfounded

shocked",31,49GiantSharkWarriors,/r/nba/comments/6or27o/windhorst_on_pti_lebron_was_devastated_when_he/dkjidqi/,dkjidqi,1500702035.0,1500673235.0,Windhorst on PTI: LeBron was devastated when he found out Kyrie wanted a trade,550,6or27o
292,LeBron doesn't give a fuck anymore lol,229,DeKobe-DeBryant,/r/nba/comments/6oqwc9/windhorst_more_lebron_intends_to_let_the_cavs/dkjgxej/,dkjgxej,1500700399.0,1500671599.0,[Windhorst] More: LeBron intends to let the Cavs front office and owner Dan Gilbert take the lead with Kyrie Irving's demands.,139,6oqwc9
293,LeBron: I'm leaving anyways.,118,IamOlderthanMe,/r/nba/comments/6oqwc9/windhorst_more_lebron_intends_to_let_the_cavs/dkjgxi2/,dkjgxi2,1500700402.0,1500671602.0,[Windhorst] More: LeBron intends to let the Cavs front office and owner Dan Gilbert take the lead with Kyrie Irving's demands.,139,6oqwc9
