,body,score,author,permalink,comment_id,created_loc,created_utc,post_title,post_score,post_id
435,"Lebron has played 39 more playoff games, though, owing to playoff expansion.

8383 playoff minutes for LBJ vs. 7559 for Wilt. So not really closing the gap on minutes with those extra playoff games.",62,ChiantiAndFavaBeans,/r/nba/comments/5ypo1i/fun_fact_lebron_and_wilt_chamberlain_have_played/derysht/,derysht,1489220072.0,1489191272.0,Fun fact: LeBron and Wilt Chamberlain have played the same amount games,211,5ypo1i
436,Chamberlain averaged over 48 mpg for a season.,96,HoodedNinj4,/r/nba/comments/5ypo1i/fun_fact_lebron_and_wilt_chamberlain_have_played/deryf4z/,deryf4z,1489219537.0,1489190737.0,Fun fact: LeBron and Wilt Chamberlain have played the same amount games,211,5ypo1i
437,Shows you how fucking dominant Wilt was. Numbers put to shame the most dominant player since Jordan.,52,,/r/nba/comments/5ypo1i/fun_fact_lebron_and_wilt_chamberlain_have_played/derzujq/,derzujq,1489221619.0,1489192819.0,Fun fact: LeBron and Wilt Chamberlain have played the same amount games,211,5ypo1i
438,Being that large wth that stamina has to be one of the greatest feats of athleticism in NBA history ,70,Rimmmer93,/r/nba/comments/5ypo1i/fun_fact_lebron_and_wilt_chamberlain_have_played/des5w8n/,des5w8n,1489230556.0,1489201756.0,Fun fact: LeBron and Wilt Chamberlain have played the same amount games,211,5ypo1i
439,Wilt is a beast. To me he is the G.O.A.T,29,epicshawty,/r/nba/comments/5ypo1i/fun_fact_lebron_and_wilt_chamberlain_have_played/des0h63/,des0h63,1489222497.0,1489193697.0,Fun fact: LeBron and Wilt Chamberlain have played the same amount games,211,5ypo1i
440,Sport history imo,27,Schildkrotes,/r/nba/comments/5ypo1i/fun_fact_lebron_and_wilt_chamberlain_have_played/des84iq/,des84iq,1489234049.0,1489205249.0,Fun fact: LeBron and Wilt Chamberlain have played the same amount games,211,5ypo1i
441,probably because the % of 3 point shots in general is rising. classic third variable problem,84,,/r/nba/comments/5ynz5j/lebron_james_and_three_point_assists/derkj6e/,derkj6e,1489202692.0,1489173892.0,LeBron James and Three Point Assists.,211,5ynz5j
442,"Neat post, OP. Thanks for writing.",40,imkunu,/r/nba/comments/5ynz5j/lebron_james_and_three_point_assists/derjhh2/,derjhh2,1489201535.0,1489172735.0,LeBron James and Three Point Assists.,211,5ynz5j
443,Lebron James says he hopes to play long enough to play against his oldest son,63,ChavezwithaZ,/r/nba/comments/5ynhwn/will_lebron_james28345_surpass_kareem/derffmr/,derffmr,1489197108.0,1489168308.0,"Will LeBron James(28,345) surpass Kareem Abdul-Jabbar(38,387) for the career record in points?",42,5ynhwn
444,"Better question, will LeBron James release a graphic novel following Mycroft Holmes?",79,save_the_pigs,/r/nba/comments/5ynhwn/will_lebron_james28345_surpass_kareem/derf7yj/,derf7yj,1489196872.0,1489168072.0,"Will LeBron James(28,345) surpass Kareem Abdul-Jabbar(38,387) for the career record in points?",42,5ynhwn
445,I don't think he'll retire until he does. ,29,TheOnlyOneWhoKnows,/r/nba/comments/5ynhwn/will_lebron_james28345_surpass_kareem/derf9rf/,derf9rf,1489196929.0,1489168129.0,"Will LeBron James(28,345) surpass Kareem Abdul-Jabbar(38,387) for the career record in points?",42,5ynhwn
446,A front page post yesterday literally answered this question,22,salmon10,/r/nba/comments/5ynhwn/will_lebron_james28345_surpass_kareem/dergq5r/,dergq5r,1489198540.0,1489169740.0,"Will LeBron James(28,345) surpass Kareem Abdul-Jabbar(38,387) for the career record in points?",42,5ynhwn
447,"I love how defenders bump into his shoulders and get thrown away, and then keep running after him, only to get dunked on.",248,myseriousredditacc,/r/nba/comments/5ymk8b/lebron_ties_career_high_for_dunks_in_game_most_in/der7pn4/,der7pn4,1489188509.0,1489159709.0,Lebron ties career high for dunks in game (most in 8 years) - all dunks in one highlight,1378,5ymk8b
448,That dunk where he hangs on the rim with one arm to swing around and point to a ref... I wish I could do those things.,381,Hoser117,/r/nba/comments/5ymk8b/lebron_ties_career_high_for_dunks_in_game_most_in/der78l4/,der78l4,1489187938.0,1489159138.0,Lebron ties career high for dunks in game (most in 8 years) - all dunks in one highlight,1378,5ymk8b
449,That spin move was deadly,77,,/r/nba/comments/5ymk8b/lebron_ties_career_high_for_dunks_in_game_most_in/derdc4j/,derdc4j,1489194807.0,1489166007.0,Lebron ties career high for dunks in game (most in 8 years) - all dunks in one highlight,1378,5ymk8b
450,Whats the record for most dunks in game anyways?,50,Estoca,/r/nba/comments/5ymk8b/lebron_ties_career_high_for_dunks_in_game_most_in/der7xdj/,der7xdj,1489188767.0,1489159967.0,Lebron ties career high for dunks in game (most in 8 years) - all dunks in one highlight,1378,5ymk8b
451,"It seems like he's picking a specific thing to focus on in each game this season. There have been nights where he's focusing on passing, not much attacking the basket but racking up 13-15 assists. Or that night earlier this week he grabbed 17 rebounds, which is twice his average. He had a game a couple of weeks ago with multiple chase-down blocks. And now this game, with a ton of slashing for dunks. Might be a training strategy to work on specific things each game. ",261,__gcd,/r/nba/comments/5ymk8b/lebron_ties_career_high_for_dunks_in_game_most_in/derf9ei/,derf9ei,1489196918.0,1489168118.0,Lebron ties career high for dunks in game (most in 8 years) - all dunks in one highlight,1378,5ymk8b
452,This is better than a lot of guys career dunk highlight film.,306,KnickedUp,/r/nba/comments/5ymk8b/lebron_ties_career_high_for_dunks_in_game_most_in/derb4xn/,derb4xn,1489192402.0,1489163602.0,Lebron ties career high for dunks in game (most in 8 years) - all dunks in one highlight,1378,5ymk8b
453,Fuck me this dude is gonna be able to slam it down forever isn't he ,47,MCSealClubber,/r/nba/comments/5ymk8b/lebron_ties_career_high_for_dunks_in_game_most_in/derefxg/,derefxg,1489196027.0,1489167227.0,Lebron ties career high for dunks in game (most in 8 years) - all dunks in one highlight,1378,5ymk8b
454,LeIncline,184,17hazard,/r/nba/comments/5ymk8b/lebron_ties_career_high_for_dunks_in_game_most_in/der7f0u/,der7f0u,1489188154.0,1489159354.0,Lebron ties career high for dunks in game (most in 8 years) - all dunks in one highlight,1378,5ymk8b
455,Playoffs,27,yaboybaconandlettuce,/r/nba/comments/5ymk8b/lebron_ties_career_high_for_dunks_in_game_most_in/der71xj/,der71xj,1489187707.0,1489158907.0,Lebron ties career high for dunks in game (most in 8 years) - all dunks in one highlight,1378,5ymk8b
456,This guy dunks,42,BirdsAndBirdies,/r/nba/comments/5ymk8b/lebron_ties_career_high_for_dunks_in_game_most_in/dereih7/,dereih7,1489196101.0,1489167301.0,Lebron ties career high for dunks in game (most in 8 years) - all dunks in one highlight,1378,5ymk8b
457,LeConcern,104,OneRiotTooMany,/r/nba/comments/5ym2qf/lebron_in_march_3131485_on_514058_his_team_record/der2vrf/,der2vrf,1489181787.0,1489152987.0,LeBron in March: 31.3/14/8.5 on 51/40/58. His team record? 1-5.,88,5ym2qf
458,That 58% free throw tho. Pretty soon they're going to be implementing Hack-a-'Bron,79,Somali_Kamikaze,/r/nba/comments/5ym2qf/lebron_in_march_3131485_on_514058_his_team_record/der37hv/,der37hv,1489182334.0,1489153534.0,LeBron in March: 31.3/14/8.5 on 51/40/58. His team record? 1-5.,88,5ym2qf
459,They're 1-5 in March and LeBron is shooting 58% from the line?,35,NBADraft2003,/r/nba/comments/5ym2qf/lebron_in_march_3131485_on_514058_his_team_record/der2xxb/,der2xxb,1489181888.0,1489153088.0,LeBron in March: 31.3/14/8.5 on 51/40/58. His team record? 1-5.,88,5ym2qf
460,I think they'll be okay when Love gets back,51,landon34,/r/nba/comments/5ym2qf/lebron_in_march_3131485_on_514058_his_team_record/der2vss/,der2vss,1489181789.0,1489152989.0,LeBron in March: 31.3/14/8.5 on 51/40/58. His team record? 1-5.,88,5ym2qf
461,Waiters 2nd unanimous MVP,589,thr33beggars,/r/nba/comments/5yly7v/basketball_reference_efg_last_200_of_close_games/der3bdv/,der3bdv,1489182509.0,1489153709.0,"[Basketball Reference] eFG%, last 2:00 of close games: LeBron: 48.1%, Curry: 25%, Westbrook: 44.7%, Harden: 30%, KD: 47.1%, DION WAITERS: 52.9%",1688,5yly7v
462,"Filtering that, DeMar has an eFG of 53% with 47 FGA. Cardiac Kemba close behind with 52% in 48 attempts. Isiah also has 51% after 54 attempts. Pretty neat.",215,NBAFAN2000,/r/nba/comments/5yly7v/basketball_reference_efg_last_200_of_close_games/der7omg/,der7omg,1489188477.0,1489159677.0,"[Basketball Reference] eFG%, last 2:00 of close games: LeBron: 48.1%, Curry: 25%, Westbrook: 44.7%, Harden: 30%, KD: 47.1%, DION WAITERS: 52.9%",1688,5yly7v
463,https://imgur.com/E4zr1XM,158,Tito_Our_Saviour,/r/nba/comments/5yly7v/basketball_reference_efg_last_200_of_close_games/der1z0d/,der1z0d,1489180162.0,1489151362.0,"[Basketball Reference] eFG%, last 2:00 of close games: LeBron: 48.1%, Curry: 25%, Westbrook: 44.7%, Harden: 30%, KD: 47.1%, DION WAITERS: 52.9%",1688,5yly7v
464,What are their effective swag percentages?,34,OutlookNotGood,/r/nba/comments/5yly7v/basketball_reference_efg_last_200_of_close_games/der4el9/,der4el9,1489184184.0,1489155384.0,"[Basketball Reference] eFG%, last 2:00 of close games: LeBron: 48.1%, Curry: 25%, Westbrook: 44.7%, Harden: 30%, KD: 47.1%, DION WAITERS: 52.9%",1688,5yly7v
465,Can't believe we traded away the GOAT.,66,redblade13,/r/nba/comments/5yly7v/basketball_reference_efg_last_200_of_close_games/der8c4x/,der8c4x,1489189247.0,1489160447.0,"[Basketball Reference] eFG%, last 2:00 of close games: LeBron: 48.1%, Curry: 25%, Westbrook: 44.7%, Harden: 30%, KD: 47.1%, DION WAITERS: 52.9%",1688,5yly7v
466,"And there's four former thunder players on this list. 
Feels bad man ",48,Ziggensgreatesthits,/r/nba/comments/5yly7v/basketball_reference_efg_last_200_of_close_games/derefi7/,derefi7,1489196014.0,1489167214.0,"[Basketball Reference] eFG%, last 2:00 of close games: LeBron: 48.1%, Curry: 25%, Westbrook: 44.7%, Harden: 30%, KD: 47.1%, DION WAITERS: 52.9%",1688,5yly7v
467,[deleted],347,,/r/nba/comments/5yly7v/basketball_reference_efg_last_200_of_close_games/der22v4/,der22v4,1489180364.0,1489151564.0,"[Basketball Reference] eFG%, last 2:00 of close games: LeBron: 48.1%, Curry: 25%, Westbrook: 44.7%, Harden: 30%, KD: 47.1%, DION WAITERS: 52.9%",1688,5yly7v
468,Held the lead for a whole day lol ,117,ilara31,/r/nba/comments/5yjsfz/stephen_curry_now_has_a_higher_3pt_fg_397_than/deqm76q/,deqm76q,1489144935.0,1489116135.0,Stephen Curry now has a higher 3pt fg% (39.7) than Lebron James (38.9) this season.,450,5yjsfz
469,"Lmao, this is what you call petty",497,ninj03,/r/nba/comments/5yjsfz/stephen_curry_now_has_a_higher_3pt_fg_397_than/deqm78i/,deqm78i,1489144937.0,1489116137.0,Stephen Curry now has a higher 3pt fg% (39.7) than Lebron James (38.9) this season.,450,5yjsfz
470,Ledecline,240,BismackMyBiyombo,/r/nba/comments/5yjsfz/stephen_curry_now_has_a_higher_3pt_fg_397_than/deqm743/,deqm743,1489144932.0,1489116132.0,Stephen Curry now has a higher 3pt fg% (39.7) than Lebron James (38.9) this season.,450,5yjsfz
471,Lebron blew a 0.1% lead,83,,/r/nba/comments/5yjsfz/stephen_curry_now_has_a_higher_3pt_fg_397_than/deqmms4/,deqmms4,1489145548.0,1489116748.0,Stephen Curry now has a higher 3pt fg% (39.7) than Lebron James (38.9) this season.,450,5yjsfz
472,This thread is made everyday ,82,,/r/nba/comments/5yjsfz/stephen_curry_now_has_a_higher_3pt_fg_397_than/deqm73h/,deqm73h,1489144931.0,1489116131.0,Stephen Curry now has a higher 3pt fg% (39.7) than Lebron James (38.9) this season.,450,5yjsfz
473,Hahaha I love the pettiness between Cavs and Warriors fans making these threads,79,jackobanter,/r/nba/comments/5yjsfz/stephen_curry_now_has_a_higher_3pt_fg_397_than/deqm8pn/,deqm8pn,1489144994.0,1489116194.0,Stephen Curry now has a higher 3pt fg% (39.7) than Lebron James (38.9) this season.,450,5yjsfz
474,Well it makes sense since Curry is the best all around player in the league but you would think the best shooter in NBA history (Lebron James) would be shooting around 45% from the 3,61,,/r/nba/comments/5yjsfz/stephen_curry_now_has_a_higher_3pt_fg_397_than/deqm7n6/,deqm7n6,1489144953.0,1489116153.0,Stephen Curry now has a higher 3pt fg% (39.7) than Lebron James (38.9) this season.,450,5yjsfz
475,So are we getting this post every time Steph/Bron plays now?,72,VichoL10,/r/nba/comments/5yjsfz/stephen_curry_now_has_a_higher_3pt_fg_397_than/deqm795/,deqm795,1489144937.0,1489116137.0,Stephen Curry now has a higher 3pt fg% (39.7) than Lebron James (38.9) this season.,450,5yjsfz
476,Curry really has regressed this year.  He is now dropped to being compared to LeBron in 3pt shooting.,21,Superplex123,/r/nba/comments/5yjsfz/stephen_curry_now_has_a_higher_3pt_fg_397_than/deqmsgr/,deqmsgr,1489145773.0,1489116973.0,Stephen Curry now has a higher 3pt fg% (39.7) than Lebron James (38.9) this season.,450,5yjsfz
477,How the hell do you go -44 in 18 minutes Jesus ,30,TheLightSkinMamba,/r/nba/comments/5yjqdl/over_their_last_two_games_the_cavs_have_been_31/deqlso2/,deqlso2,1489144378.0,1489115578.0,"Over Their Last Two Games, The Cavs Have Been +31 for the 78 Minutes LeBron Has Been On the Floor, and -44 for the 18 Minutes He Hasn't",47,5yjqdl
478,"He has 8 this year.

That's really impressive.

He didn't even have 1 in the 2015 season.",23,DeKobe-DeBryant,/r/nba/comments/5yjmys/50th_career_tripledouble_for_lebron/deql1jq/,deql1jq,1489143348.0,1489114548.0,50th career triple-double for Lebron,69,5yjmys
479,And we lost because the second unit refuses to hold leads 😀🗡,43,ilara31,/r/nba/comments/5yjmys/50th_career_tripledouble_for_lebron/deqkvkr/,deqkvkr,1489143115.0,1489114315.0,50th career triple-double for Lebron,69,5yjmys
480,and an L,31,JPR231317,/r/nba/comments/5yjmys/50th_career_tripledouble_for_lebron/deqksmm/,deqksmm,1489143001.0,1489114201.0,50th career triple-double for Lebron,69,5yjmys
481,"You'd think Detroit are getting murdered with all the Cavs highlight uploads. Not hating, these are all sick plays.",22,chefhurry,/r/nba/comments/5yjmbw/lebron_james_goes_coasttocoast_and_slams_it_down/deqks7p/,deqks7p,1489142985.0,1489114185.0,Lebron James goes coast-to-coast and slams it down on two defenders AND-1,114,5yjmbw
482,LeBron +17 and they're about to fucking lose ,73,camsteria,/r/nba/comments/5yjm6n/with_his_10th_assist_of_the_night_lebron_james/deqkn6s/,deqkn6s,1489142794.0,1489113994.0,"With his 10th assist of the night, LeBron James sets a new career-high for most triple-doubles (8) in a season",113,5yjm6n
483,"At 32 years old.  Unreal.


Edit:  That's the 50th of his career",26,,/r/nba/comments/5yjm6n/with_his_10th_assist_of_the_night_lebron_james/deqkld3/,deqkld3,1489142722.0,1489113922.0,"With his 10th assist of the night, LeBron James sets a new career-high for most triple-doubles (8) in a season",113,5yjm6n
484,LeDecline is LeNothappening,24,BizGilwalker,/r/nba/comments/5yjm6n/with_his_10th_assist_of_the_night_lebron_james/deqklre/,deqklre,1489142738.0,1489113938.0,"With his 10th assist of the night, LeBron James sets a new career-high for most triple-doubles (8) in a season",113,5yjm6n
485,This fucking guy.,244,MeesterAndrew,/r/nba/comments/5yjlk0/lebron_relegates_tobias_harris_and_marcus_morris/deqkg65/,deqkg65,1489142520.0,1489113720.0,LeBron relegates Tobias Harris and Marcus Morris to the shadow realm,1185,5yjlk0
486,"Man, dunno how we won this game with Lebron pulling all of this shit. He was fucking scury tonight erneh.",132,great-nba-comment,/r/nba/comments/5yjlk0/lebron_relegates_tobias_harris_and_marcus_morris/deqlan0/,deqlan0,1489143685.0,1489114885.0,LeBron relegates Tobias Harris and Marcus Morris to the shadow realm,1185,5yjlk0
487,WHAT THE FUCK DID THE RIM DO TO HIM,211,DeKobe-DeBryant,/r/nba/comments/5yjlk0/lebron_relegates_tobias_harris_and_marcus_morris/deqkg1t/,deqkg1t,1489142515.0,1489113715.0,LeBron relegates Tobias Harris and Marcus Morris to the shadow realm,1185,5yjlk0
488,http://i.imgur.com/XDuTVyy.png,113,Sim888,/r/nba/comments/5yjlk0/lebron_relegates_tobias_harris_and_marcus_morris/deql932/,deql932,1489143628.0,1489114828.0,LeBron relegates Tobias Harris and Marcus Morris to the shadow realm,1185,5yjlk0
489,Lmao love the title,152,,/r/nba/comments/5yjlk0/lebron_relegates_tobias_harris_and_marcus_morris/deqkg3r/,deqkg3r,1489142517.0,1489113717.0,LeBron relegates Tobias Harris and Marcus Morris to the shadow realm,1185,5yjlk0
490,"""You get a poster...and you get a poster... and my team fucking blows"" -Lebron tonight",29,KnickedUp,/r/nba/comments/5yjlk0/lebron_relegates_tobias_harris_and_marcus_morris/deqofr7/,deqofr7,1489148157.0,1489119357.0,LeBron relegates Tobias Harris and Marcus Morris to the shadow realm,1185,5yjlk0
491,The butt slap by Richard as LeBron is coming back around is nothing short of outstanding.,23,TheMentatBashar,/r/nba/comments/5yjlk0/lebron_relegates_tobias_harris_and_marcus_morris/deqltsm/,deqltsm,1489144422.0,1489115622.0,LeBron relegates Tobias Harris and Marcus Morris to the shadow realm,1185,5yjlk0
492,Holy fuck. Hes been dunking all day ,23,5469932,/r/nba/comments/5yjlk0/lebron_relegates_tobias_harris_and_marcus_morris/deqklgb/,deqklgb,1489142725.0,1489113925.0,LeBron relegates Tobias Harris and Marcus Morris to the shadow realm,1185,5yjlk0
493,LeShimmy,47,johnstocktonshorts,/r/nba/comments/5yjlk0/lebron_relegates_tobias_harris_and_marcus_morris/deqkker/,deqkker,1489142685.0,1489113885.0,LeBron relegates Tobias Harris and Marcus Morris to the shadow realm,1185,5yjlk0
494,dunked all over j cole,179,Blestick,/r/nba/comments/5yjilb/lebron_posterizes_tobias_harris/deqjrg0/,deqjrg0,1489141574.0,1489112774.0,Lebron posterizes Tobias Harris!,1261,5yjilb
495,what was amazing was the screen by jr smith ,150,passiveparrot,/r/nba/comments/5yjilb/lebron_posterizes_tobias_harris/deqjs8a/,deqjs8a,1489141603.0,1489112803.0,Lebron posterizes Tobias Harris!,1261,5yjilb
496,that was fucking disgusting,309,DeKobe-DeBryant,/r/nba/comments/5yjilb/lebron_posterizes_tobias_harris/deqjqn8/,deqjqn8,1489141546.0,1489112746.0,Lebron posterizes Tobias Harris!,1261,5yjilb
497,[Replays](https://streamable.com/2hllv),65,HardKnockRiffe,/r/nba/comments/5yjilb/lebron_posterizes_tobias_harris/deqjpya/,deqjpya,1489141519.0,1489112719.0,Lebron posterizes Tobias Harris!,1261,5yjilb
498,Oh look it's my neighbour Ho Lee Fuk.,52,YourMajesty90,/r/nba/comments/5yjilb/lebron_posterizes_tobias_harris/deqjrmp/,deqjrmp,1489141581.0,1489112781.0,Lebron posterizes Tobias Harris!,1261,5yjilb
499,Tobias instantly regretted jumping. LeBron you are a baaaaaaad man,40,happyhappy7,/r/nba/comments/5yjilb/lebron_posterizes_tobias_harris/deqjrth/,deqjrth,1489141588.0,1489112788.0,Lebron posterizes Tobias Harris!,1261,5yjilb
500,How does he keep doing this??,56,jonhadinger,/r/nba/comments/5yjilb/lebron_posterizes_tobias_harris/deqjsbn/,deqjsbn,1489141607.0,1489112807.0,Lebron posterizes Tobias Harris!,1261,5yjilb
501,That was one of the nastiest things I've ever seen. ,33,footballvessel,/r/nba/comments/5yjilb/lebron_posterizes_tobias_harris/deqjttc/,deqjttc,1489141665.0,1489112865.0,Lebron posterizes Tobias Harris!,1261,5yjilb
502,LeBron playing like prime Shaq,56,DeKobe-DeBryant,/r/nba/comments/5yj5kc/lebron_making_it_look_easy_with_a_spinning/deqgmbz/,deqgmbz,1489137270.0,1489108470.0,LeBron making it look easy with a spinning dropstep + slam!,174,5yj5kc
503,Just going to be a dunk highlight fest for LeBron this game.,22,fear865,/r/nba/comments/5yj5kc/lebron_making_it_look_easy_with_a_spinning/deqgm1y/,deqgm1y,1489137260.0,1489108460.0,LeBron making it look easy with a spinning dropstep + slam!,174,5yj5kc
504,Lebrons wearing his big boy pants tonight ,21,AblettsInTheAir,/r/nba/comments/5yj5kc/lebron_making_it_look_easy_with_a_spinning/deqgln3/,deqgln3,1489137245.0,1489108445.0,LeBron making it look easy with a spinning dropstep + slam!,174,5yj5kc
505,$2000 dunk,88,GoblinEar,/r/nba/comments/5yj2k9/lebron_assaults_the_rim/deqfxs2/,deqfxs2,1489136347.0,1489107547.0,Lebron assaults the rim,457,5yj2k9
506,"If the ref could feel what it's like to dunk with that much power, he'd understand why LeBron has to hold on for dear life",115,qule,/r/nba/comments/5yj2k9/lebron_assaults_the_rim/deqg24s/,deqg24s,1489136507.0,1489107707.0,Lebron assaults the rim,457,5yj2k9
507,Weak tech hopefully its rescinded because of his momentum going forward what else is he supposed to do?,181,YaBoiWhit,/r/nba/comments/5yj2k9/lebron_assaults_the_rim/deqfzn7/,deqfzn7,1489136416.0,1489107616.0,Lebron assaults the rim,457,5yj2k9
508,Why is swinging/hanging on the rim even a tech?  They should just allow it and teams could just capitalize by running the fastbreak,63,,/r/nba/comments/5yj2k9/lebron_assaults_the_rim/deqgbhc/,deqgbhc,1489136862.0,1489108062.0,Lebron assaults the rim,457,5yj2k9
509,Was he supposed to let go and land on his back Bogut style? ,36,datyellowguy,/r/nba/comments/5yj2k9/lebron_assaults_the_rim/deqgf83/,deqgf83,1489137001.0,1489108201.0,Lebron assaults the rim,457,5yj2k9
510,Weak technical foul,23,,/r/nba/comments/5yj2k9/lebron_assaults_the_rim/deqfxuj/,deqfxuj,1489136349.0,1489107549.0,Lebron assaults the rim,457,5yj2k9
511,Lebron and Kawhi. What's up? ,196,hoopdummy,/r/nba/comments/5yh4qp/lebron_can_take_one_current_nba_player_with_him/depye41/,depye41,1489116435.0,1489087635.0,LeBron can take one current NBA player with him back in time to battle the 95-96 Bulls. Which player should he choose and which team should he land on?,83,5yh4qp
512,"in order

Steph- have fun stopping that PnR

Durant - same

Kawhi - defense wins championships",61,richp1180,/r/nba/comments/5yh4qp/lebron_can_take_one_current_nba_player_with_him/depytsa/,depytsa,1489116891.0,1489088091.0,LeBron can take one current NBA player with him back in time to battle the 95-96 Bulls. Which player should he choose and which team should he land on?,83,5yh4qp
513,Mo Williams,42,north_weast_1,/r/nba/comments/5yh4qp/lebron_can_take_one_current_nba_player_with_him/depycr6/,depycr6,1489116397.0,1489087597.0,LeBron can take one current NBA player with him back in time to battle the 95-96 Bulls. Which player should he choose and which team should he land on?,83,5yh4qp
514,i just dont know how an 11 year old is gonna be able to stop jordan,41,thats_fine_,/r/nba/comments/5yh4qp/lebron_can_take_one_current_nba_player_with_him/depzhxj/,depzhxj,1489117593.0,1489088793.0,LeBron can take one current NBA player with him back in time to battle the 95-96 Bulls. Which player should he choose and which team should he land on?,83,5yh4qp
515,[deleted],143,,/r/nba/comments/5yh4qp/lebron_can_take_one_current_nba_player_with_him/depycgs/,depycgs,1489116388.0,1489087588.0,LeBron can take one current NBA player with him back in time to battle the 95-96 Bulls. Which player should he choose and which team should he land on?,83,5yh4qp
516,Probably Curry,55,SPAGHETTI_CAKE,/r/nba/comments/5yh4qp/lebron_can_take_one_current_nba_player_with_him/depybo0/,depybo0,1489116365.0,1489087565.0,LeBron can take one current NBA player with him back in time to battle the 95-96 Bulls. Which player should he choose and which team should he land on?,83,5yh4qp
517,"Yeah easily LBJ and Curry, the league wouldn't be able to handle Curry's shooting and his dribbling. 
The hand checking wouldn't be able to stop the speed and strength on LBJ attacking the rack. 

Plus could you imagine the old school 2-man game of LBJ and Curry isoing fools?",24,mickboogy,/r/nba/comments/5yh4qp/lebron_can_take_one_current_nba_player_with_him/depym2w/,depym2w,1489116668.0,1489087868.0,LeBron can take one current NBA player with him back in time to battle the 95-96 Bulls. Which player should he choose and which team should he land on?,83,5yh4qp
518,"Curry with that amateur-hour 3 point line is a joke. 

Potential to shoot 10-15 threes a game at around 50% accuracy. ",120,rjvir,/r/nba/comments/5yh4qp/lebron_can_take_one_current_nba_player_with_him/depyeij/,depyeij,1489116446.0,1489087646.0,LeBron can take one current NBA player with him back in time to battle the 95-96 Bulls. Which player should he choose and which team should he land on?,83,5yh4qp
519,"I don't think I've ever been more attracted to a player on and off the court. Love his 3 point stroke, and passing ability, but he's also such a good looking and collected man. He also isn't afraid to back down from anyone, and has already been involved in a few scraps. He's exactly what you look for in a man, flawless. I can't wait until the playoffs when most of you guys get to experience Mr Big Cocka 

",188,latman,/r/nba/comments/5ygwwf/rowan_kyrie_is_currently_averaging_the_second/depwlww/,depwlww,1489114578.0,1489085778.0,"Rowan- Kyrie is currently averaging the second highest PPG of any LeBron teammate at 25.1 (Wade 25.5), and the highest APG of any teammate at 5.9",234,5ygwwf
520,But they told me he's not a point guard,76,,/r/nba/comments/5ygwwf/rowan_kyrie_is_currently_averaging_the_second/depwfm7/,depwfm7,1489114399.0,1489085599.0,"Rowan- Kyrie is currently averaging the second highest PPG of any LeBron teammate at 25.1 (Wade 25.5), and the highest APG of any teammate at 5.9",234,5ygwwf
521,So you telling me Kyrie is a top 50 PG? Blasphemy,21,viniribeiro,/r/nba/comments/5ygwwf/rowan_kyrie_is_currently_averaging_the_second/deq3s51/,deq3s51,1489122008.0,1489093208.0,"Rowan- Kyrie is currently averaging the second highest PPG of any LeBron teammate at 25.1 (Wade 25.5), and the highest APG of any teammate at 5.9",234,5ygwwf
522,"And at four, he's the franchise leader in triple doubles. ",72,,/r/nba/comments/5yez7m/per_eliassports_in_last_30_yrs_elfrid_payton/depfg92/,depfg92,1489094441.0,1489065641.0,"Per @EliasSports, in last 30 yrs, Elfrid Payton joins Jason Kidd & LeBron James as only players w/ 2 triple-double streaks at 23 or younger",130,5yez7m
