,body,score,author,permalink,comment_id,created_loc,created_utc,post_title,post_score,post_id
755,"Top to bottom, I think this is the best starting lineup in the league. I'd take it over any other teams starting 5",34,landon34,/r/nba/comments/2vngjo/espn_infographic_shows_cavaliers_starting_lineup/coj7no5/,coj7no5,1423778793.0,1423749993.0,ESPN infographic shows Cavaliers' starting line-up (Kyrie|J.R.|LeBron|Love|Mozgov) leads league in net efficiency.,57,2vngjo
756,Wow. And he'll be in first by the end of the season,49,swfl55,/r/nba/comments/2vmz2p/last_night_lebron_james_moved_into_second_place/coj4lli/,coj4lli,1423767529.0,1423738729.0,Last night Lebron James moved into second place for most assists by a forward in league history.,107,2vmz2p
757,And he's only 30. What a freak of nature.,64,BoyWhoCrapped,/r/nba/comments/2vmz2p/last_night_lebron_james_moved_into_second_place/coj41ah/,coj41ah,1423764681.0,1423735881.0,Last night Lebron James moved into second place for most assists by a forward in league history.,107,2vmz2p
758,"""LeBron has (almost) stolen the title from Havelick!!""

edit: my post is supposed to be a wordplay/reference/paraphrase from the famous radio call of ""John Haverlick has stolen the ball"" in the NBA Finals.",30,simplycass,/r/nba/comments/2vmz2p/last_night_lebron_james_moved_into_second_place/coj3ym6/,coj3ym6,1423764296.0,1423735496.0,Last night Lebron James moved into second place for most assists by a forward in league history.,107,2vmz2p
759,Lebrons makes getting to the rim look so fucking easy. ,68,The_Black_Unicorn,/r/nba/comments/2vlsl2/lebron_ignores_the_miami_defense_on_his_way_to/coiv2jd/,coiv2jd,1423739240.0,1423710440.0,Lebron ignores the Miami defense on his way to the rim,712,2vlsl2
760,holding R2,120,z0ne-X,/r/nba/comments/2vlsl2/lebron_ignores_the_miami_defense_on_his_way_to/coiu57g/,coiu57g,1423737644.0,1423708844.0,Lebron ignores the Miami defense on his way to the rim,712,2vlsl2
761,That defense was more porous than water. They molded to his body shape and let him pass.,156,,/r/nba/comments/2vlsl2/lebron_ignores_the_miami_defense_on_his_way_to/coisua0/,coisua0,1423735303.0,1423706503.0,Lebron ignores the Miami defense on his way to the rim,712,2vlsl2
762,"Lol Lebron's like ""excuse me, just gonna dunk this real quick"" and there's nothing the defense could do

Fuck this guy",108,OneManIndian,/r/nba/comments/2vlsl2/lebron_ignores_the_miami_defense_on_his_way_to/coiv7ea/,coiv7ea,1423739479.0,1423710679.0,Lebron ignores the Miami defense on his way to the rim,712,2vlsl2
763,That was some classic 2009 Lebron. ,77,,/r/nba/comments/2vlsl2/lebron_ignores_the_miami_defense_on_his_way_to/coit9rc/,coit9rc,1423736089.0,1423707289.0,Lebron ignores the Miami defense on his way to the rim,712,2vlsl2
764,How can one ignore that which does not exist?,37,thajugganuat,/r/nba/comments/2vlsl2/lebron_ignores_the_miami_defense_on_his_way_to/coiwtvz/,coiwtvz,1423742420.0,1423713620.0,Lebron ignores the Miami defense on his way to the rim,712,2vlsl2
765,Lebron tryin' to meet dudes at the rim...,32,mking22,/r/nba/comments/2vlsl2/lebron_ignores_the_miami_defense_on_his_way_to/coiugv4/,coiugv4,1423738212.0,1423709412.0,Lebron ignores the Miami defense on his way to the rim,712,2vlsl2
766,You mean Miami's defense ignores Lebron,29,MiaCannons,/r/nba/comments/2vlsl2/lebron_ignores_the_miami_defense_on_his_way_to/coix395/,coix395,1423742920.0,1423714120.0,Lebron ignores the Miami defense on his way to the rim,712,2vlsl2
767,"Damn, thirty years old, and almost got his eyes above the rim. He has a Trident Layers level prime, with a Stride Gum longevity.",129,TorchandToast,/r/nba/comments/2vlpjr/lebron_gets_up_for_the_lob_from_mozgov_umarcusd/coiu7zx/,coiu7zx,1423737780.0,1423708980.0,LeBron gets up for the lob from Mozgov (/u/-MarcusD-),307,2vlpjr
768,no idea Mozgov played for cavs in 06.,96,,/r/nba/comments/2vlpjr/lebron_gets_up_for_the_lob_from_mozgov_umarcusd/coirp9v/,coirp9v,1423733206.0,1423704406.0,LeBron gets up for the lob from Mozgov (/u/-MarcusD-),307,2vlpjr
769,He had to make sure he didn't hit his head on the rim. FFS.,45,,/r/nba/comments/2vlpjr/lebron_gets_up_for_the_lob_from_mozgov_umarcusd/coisbtk/,coisbtk,1423734365.0,1423705565.0,LeBron gets up for the lob from Mozgov (/u/-MarcusD-),307,2vlpjr
770,Mozlob,61,schnide1,/r/nba/comments/2vlpjr/lebron_gets_up_for_the_lob_from_mozgov_umarcusd/coitrba/,coitrba,1423736956.0,1423708156.0,LeBron gets up for the lob from Mozgov (/u/-MarcusD-),307,2vlpjr
771,[deleted],56,,/r/nba/comments/2vlpjr/lebron_gets_up_for_the_lob_from_mozgov_umarcusd/coitf8o/,coitf8o,1423736363.0,1423707563.0,LeBron gets up for the lob from Mozgov (/u/-MarcusD-),307,2vlpjr
772,something something no longer athletic lost a step,22,PossiblyRelevantGing,/r/nba/comments/2vlpjr/lebron_gets_up_for_the_lob_from_mozgov_umarcusd/coiwpns/,coiwpns,1423742198.0,1423713398.0,LeBron gets up for the lob from Mozgov (/u/-MarcusD-),307,2vlpjr
773,That potato has wiiiiiiings,37,MozgodTheRussianBear,/r/nba/comments/2vlpjr/lebron_gets_up_for_the_lob_from_mozgov_umarcusd/coivw6o/,coivw6o,1423740711.0,1423711911.0,LeBron gets up for the lob from Mozgov (/u/-MarcusD-),307,2vlpjr
774,"Am I the only person who hopes he opts out and then waits a few days to resign? That would keep everyone on edge for a few days. Maybe he takes a trip to Miami or LA or New York, not with any intention to sign, just as a vacation. I personally think it would be hilarious but now that I think about it /r/nba would be a nightmare if that happened.",98,jhairfield,/r/nba/comments/2vjhoi/lebron_to_opt_out_and_resign_a_one_year_contract/coiby0u/,coiby0u,1423706790.0,1423677990.0,"LeBron to opt out and resign a one year contract, at the end of the season, to maximize his earning potential.",622,2vjhoi
775,"The NBA Players Association has put pressure on LeBron and other superstars to not accept less money, but rather sign the max they and/or a team feels they deserve. 

LeBron has earned enough money throughout his career where he could sign for the vet min. for the rest of his career and have at least two lifetimes worth of wealth, but signing a maximum contract is viewed as a statement of solidarity amongst the players association, which is a big deal.",222,TheDreamShaker,/r/nba/comments/2vjhoi/lebron_to_opt_out_and_resign_a_one_year_contract/coi782x/,coi782x,1423698832.0,1423670032.0,"LeBron to opt out and resign a one year contract, at the end of the season, to maximize his earning potential.",622,2vjhoi
776,[deleted],229,,/r/nba/comments/2vjhoi/lebron_to_opt_out_and_resign_a_one_year_contract/coi6abn/,coi6abn,1423697129.0,1423668329.0,"LeBron to opt out and resign a one year contract, at the end of the season, to maximize his earning potential.",622,2vjhoi
777,"I know he deserves it but he is going to get a whole lot of shit for this.


He said ""My main goal is to bring a title to Cleveland"" and now he is trying to get the most money possible.


He deserves every penny but he is about to get a lot of shit.",446,saintscanucks,/r/nba/comments/2vjhoi/lebron_to_opt_out_and_resign_a_one_year_contract/coi5xr4/,coi5xr4,1423696464.0,1423667664.0,"LeBron to opt out and resign a one year contract, at the end of the season, to maximize his earning potential.",622,2vjhoi
778,"As he should, players shouldnt have to give up money to make the managaments job easier, its a bad system that shifts the responsibility of assembling a team from the front office to the players.

He shouldnt be criticized for getting paid(neither should carmelo,kobe etc.), although players who do take less money to help the team deserve praise for their selflesness.",108,stojan1993,/r/nba/comments/2vjhoi/lebron_to_opt_out_and_resign_a_one_year_contract/coi6bxm/,coi6bxm,1423697215.0,1423668415.0,"LeBron to opt out and resign a one year contract, at the end of the season, to maximize his earning potential.",622,2vjhoi
779,"Good for him, more basketball players should do this.",25,,/r/nba/comments/2vjhoi/lebron_to_opt_out_and_resign_a_one_year_contract/coi5y8r/,coi5y8r,1423696491.0,1423667691.0,"LeBron to opt out and resign a one year contract, at the end of the season, to maximize his earning potential.",622,2vjhoi
780,"I don't understand why this is all of a sudden ok, but
Melo got a ton of shit for signing a max contract with NY despite the fact that the salary cap is going up",25,AIg0rithm,/r/nba/comments/2vjhoi/lebron_to_opt_out_and_resign_a_one_year_contract/coi9j8h/,coi9j8h,1423702818.0,1423674018.0,"LeBron to opt out and resign a one year contract, at the end of the season, to maximize his earning potential.",622,2vjhoi
781,"Really though, this was a very interesting read. I don't really have much to put towards it, but I appreciate the effort you put in to this. ",33,VisionSixteen,/r/nba/comments/2vgpjt/stats_shooting_passing_mentality_for_top_players/cohi01w/,cohi01w,1423636294.0,1423607494.0,Stats: Shooting/ Passing mentality for top players (Lebron passes way less when the Cavs are down),224,2vgpjt
782,"Mike Conley: ""Hold my beer""",87,VisionSixteen,/r/nba/comments/2vgpjt/stats_shooting_passing_mentality_for_top_players/cohh627/,cohh627,1423634967.0,1423606167.0,Stats: Shooting/ Passing mentality for top players (Lebron passes way less when the Cavs are down),224,2vgpjt
783,"I see Whiteside has reached the vaunted ""/r/nba will post literally anything he says"" status.",466,,/r/nba/comments/2vgkrp/michael_wallace_hassan_whiteside_on_facing_lebron/cohh9h7/,cohh9h7,1423635116.0,1423606316.0,"[Michael Wallace] ""Hassan Whiteside on facing LeBron: ""I mean, he a good player ... I don't know him ... I'm not guarding him. I'll meet him at the rim.""""",324,2vgkrp
784,"Whiteside: I think he's a good man. I like him. I got nothing against him, but I'm definitely gonna make orphans of his children.

Reporter: Uh, you know, they do have a mother?

Whiteside: Yes, but I would imagine that she would die of grief. ",213,hallan05,/r/nba/comments/2vgkrp/michael_wallace_hassan_whiteside_on_facing_lebron/cohhn5r/,cohhn5r,1423635716.0,1423606916.0,"[Michael Wallace] ""Hassan Whiteside on facing LeBron: ""I mean, he a good player ... I don't know him ... I'm not guarding him. I'll meet him at the rim.""""",324,2vgkrp
785,what's a king to a god,166,IamSHLARF,/r/nba/comments/2vgkrp/michael_wallace_hassan_whiteside_on_facing_lebron/cohipni/,cohipni,1423637478.0,1423608678.0,"[Michael Wallace] ""Hassan Whiteside on facing LeBron: ""I mean, he a good player ... I don't know him ... I'm not guarding him. I'll meet him at the rim.""""",324,2vgkrp
786,I refuse to watch until he promises to make Kevin Love cry,66,Hey_Im_Joe,/r/nba/comments/2vgkrp/michael_wallace_hassan_whiteside_on_facing_lebron/cohgvqr/,cohgvqr,1423634515.0,1423605715.0,"[Michael Wallace] ""Hassan Whiteside on facing LeBron: ""I mean, he a good player ... I don't know him ... I'm not guarding him. I'll meet him at the rim.""""",324,2vgkrp
787,"Also if anyone was wondering why he didn't triple double last game, he wasn't even supposed to play originally, but hopped in the game for limited minutes and still did pretty well. ",21,ProbablyMyLastLogin,/r/nba/comments/2vgkrp/michael_wallace_hassan_whiteside_on_facing_lebron/cohh76h/,cohh76h,1423635016.0,1423606216.0,"[Michael Wallace] ""Hassan Whiteside on facing LeBron: ""I mean, he a good player ... I don't know him ... I'm not guarding him. I'll meet him at the rim.""""",324,2vgkrp
788,KEVIN LOVE IS AVERAGING 33 POINTS POST TWEET> IT WORKED!!!,64,,/r/nba/comments/2v9igz/lebron_admits_fitin_tweet_was_aimed_at_kevin_love/cofnniw/,cofnniw,1423482930.0,1423454130.0,"LeBron admits ""FIT-IN"" Tweet Was Aimed At Kevin Love",106,2v9igz
789,The first 60 minutes of First Take are now booked.,165,,/r/nba/comments/2v9igz/lebron_admits_fitin_tweet_was_aimed_at_kevin_love/cofo1p6/,cofo1p6,1423483710.0,1423454910.0,"LeBron admits ""FIT-IN"" Tweet Was Aimed At Kevin Love",106,2v9igz
790,"> ""I lost the Finals in 2007, 2011 and 2014 and that was the same day I came back to Cleveland. Put it together, seven, 11, 14. Coincidence"" James said, proving his point.

From http://www.cleveland.com/cavs/index.ssf/2015/02/lebron_james_called_out_kevin.html

either Lebron is just fucking with the reporters and it went over their heads or he's losing it",72,,/r/nba/comments/2v9igz/lebron_admits_fitin_tweet_was_aimed_at_kevin_love/cofof0m/,cofof0m,1423484423.0,1423455623.0,"LeBron admits ""FIT-IN"" Tweet Was Aimed At Kevin Love",106,2v9igz
791,"> Cleveland's star pairing has posted a net rating of plus-8.7 points per 100 possessions, which is a full point better than the net rating Love and Kyrie Irving have generated when sharing the floor. 

This has to be the worst fucking statistic in the history of statistics. **A full point better** when he shares the floor with the world's greatest player??? A full point??? Color me impressed",54,cssher,/r/nba/comments/2v9igz/lebron_admits_fitin_tweet_was_aimed_at_kevin_love/cofo37l/,cofo37l,1423483783.0,1423454983.0,"LeBron admits ""FIT-IN"" Tweet Was Aimed At Kevin Love",106,2v9igz
792,THE DRAMA,42,Cefkovod,/r/nba/comments/2v9igz/lebron_admits_fitin_tweet_was_aimed_at_kevin_love/cofni22/,cofni22,1423482630.0,1423453830.0,"LeBron admits ""FIT-IN"" Tweet Was Aimed At Kevin Love",106,2v9igz
793,bryons like in fuckit mode and just dropping truth bombs recently.,47,HEATerade,/r/nba/comments/2v8kxp/dave_mcmenamin_on_twitter_byron_scott_said_pat/cofe31n/,cofe31n,1423465027.0,1423436227.0,"Dave McMenamin on Twitter: ""Byron Scott said Pat Riley's ""it takes guts"" speech may have contributed to LeBron leaving: ""I was like 'Whoa,' and I guess so did LeBron""""",24,2v8kxp
794,The fans,140,raptorlescence,/r/nba/comments/2v5bg8/which_team_would_win_in_a_seven_game_series_hawks/coeknyy/,coeknyy,1423387391.0,1423358591.0,Which team would win in a seven game series: Hawks + Lebron or Warriors + KD?,44,2v5bg8
795,"Hawks + LeBron, plain simple. ",92,spread-summer,/r/nba/comments/2v5bg8/which_team_would_win_in_a_seven_game_series_hawks/coekbtz/,coekbtz,1423386685.0,1423357885.0,Which team would win in a seven game series: Hawks + Lebron or Warriors + KD?,44,2v5bg8
796,"Hawks + Lebron. Obviously KD would help us out, but the biggest knock on ATL is their supposed lack of a ""go-to"" guy, and Lebron is the best ""go-to"" guy in the league. He solves a ton of problems.",57,,/r/nba/comments/2v5bg8/which_team_would_win_in_a_seven_game_series_hawks/coekdr9/,coekdr9,1423386804.0,1423358004.0,Which team would win in a seven game series: Hawks + Lebron or Warriors + KD?,44,2v5bg8
797,"Doesn't LeBron added to any team beat KD added to another comparable team. Like if you switched this and put LeBron on GSW and KD on Atl, doesn't GSW win?

",24,paashpointo,/r/nba/comments/2v5bg8/which_team_would_win_in_a_seven_game_series_hawks/coesh20/,coesh20,1423405867.0,1423377067.0,Which team would win in a seven game series: Hawks + Lebron or Warriors + KD?,44,2v5bg8
798,I feel like a ball dominant player like Lebron would either derail the Hawks or make them godly.,35,,/r/nba/comments/2v5bg8/which_team_would_win_in_a_seven_game_series_hawks/coekc9t/,coekc9t,1423386712.0,1423357912.0,Which team would win in a seven game series: Hawks + Lebron or Warriors + KD?,44,2v5bg8
799,"Ah yes, the elusive 48 point/ 11 assist/ 9 rebound club",30,Garrett_N,/r/nba/comments/2v25iy/anthony_slater_russell_westbrook_joins_larry_bird/codsinm/,codsinm,1423310022.0,1423281222.0,"Anthony Slater: Russell Westbrook joins Larry Bird and LeBron James as the only players since '85-86 with at least 48 pts, 11 asts and 9 rebs in a game.",38,2v25iy
800,First player with a [45+ point and 10+ assist game since 2009](http://bkref.com/tiny/unnMw). Which is less specific obviously.,23,lverson,/r/nba/comments/2v25iy/anthony_slater_russell_westbrook_joins_larry_bird/codskj1/,codskj1,1423310145.0,1423281345.0,"Anthony Slater: Russell Westbrook joins Larry Bird and LeBron James as the only players since '85-86 with at least 48 pts, 11 asts and 9 rebs in a game.",38,2v25iy
801,these stats are so stupid lol,44,iloveoprah,/r/nba/comments/2v25iy/anthony_slater_russell_westbrook_joins_larry_bird/codsi1p/,codsi1p,1423309983.0,1423281183.0,"Anthony Slater: Russell Westbrook joins Larry Bird and LeBron James as the only players since '85-86 with at least 48 pts, 11 asts and 9 rebs in a game.",38,2v25iy
802,How is Lillard 7th and LMA not even in the top 10?,127,Goodbadfugly,/r/nba/comments/2v0l1x/lebron_moves_up_to_2_on_nbacoms_race_to_mvp/coddeme/,coddeme,1423281054.0,1423252254.0,LeBron moves up to #2 on NBA.com's Race to MVP.,160,2v0l1x
803,Race to MVP is heavily skewed towards guys who have been rising/falling. ,41,CapturedSoul,/r/nba/comments/2v0l1x/lebron_moves_up_to_2_on_nbacoms_race_to_mvp/code7tm/,code7tm,1423282382.0,1423253582.0,LeBron moves up to #2 on NBA.com's Race to MVP.,160,2v0l1x
804,"I'm sorry, but I think Harden at #3 is being shafted. The Rockets have the 4th best record in the entire league, and Harden has been carrying them on his back on a nightly basis due to injuries. 

LeBron's still having a good year, but in my honest opinion, the mid-season MVP is a toss-up between Harden and Curry.
Might have to give the slight edge to Harden due to a weaker supporting cast, but it wouldn't be wrong to see Curry win.",224,Clutch_,/r/nba/comments/2v0l1x/lebron_moves_up_to_2_on_nbacoms_race_to_mvp/codd6vx/,codd6vx,1423280701.0,1423251901.0,LeBron moves up to #2 on NBA.com's Race to MVP.,160,2v0l1x
805,"Since LeBron came back from injury and spurred this winning streak,  he's been the best player in the NBA. No arguments here.",74,PENIS__FINGERS,/r/nba/comments/2v0l1x/lebron_moves_up_to_2_on_nbacoms_race_to_mvp/coddv35/,coddv35,1423281796.0,1423252996.0,LeBron moves up to #2 on NBA.com's Race to MVP.,160,2v0l1x
806,"Posted this yesterday you decide


Player | PPG | AST/TOV | REB | FG/3pt/FT% | PER/TS% | WS and WS per 48 | OBPM/DBPM | VORP | Team record| Plays in stacked West
---|---|----|----|----|----|----|----|----|----|---
Steph | 23.6 | **8.1/3.2**| 4.7 | **49/40/91** | **27.7/63%**| 9.5/**.291** | **8.7**/.7| **7.9** | **39-8**| **Yes**
Lebron | 26.2 | 7.4/4 | 5.5 | 49/35/73| 26.1/58.3%| 6/193 | 6.5/0.0 | 5.3 | 30-20| No
Harden| **27** | 6.8/4 | **5.6** | 45/39/88 | 27.2/61% | **10.3**/.277 | 7.4/**1.1** | **7.9** | 34-15 |**Yes**
",110,vforprez2,/r/nba/comments/2v0l1x/lebron_moves_up_to_2_on_nbacoms_race_to_mvp/codg1mk/,codg1mk,1423285427.0,1423256627.0,LeBron moves up to #2 on NBA.com's Race to MVP.,160,2v0l1x
807,"Everyone has been talking about Curry vs Harden all season, but if the Cavs end up getting a top 2 seed in the East, the award might honestly be LeBron's to lose",41,DrizzlinDrizzy,/r/nba/comments/2v0l1x/lebron_moves_up_to_2_on_nbacoms_race_to_mvp/codd940/,codd940,1423280802.0,1423252002.0,LeBron moves up to #2 on NBA.com's Race to MVP.,160,2v0l1x
808,"Man, it was so fun when we weren't talking about LeBron for MVP. 

EDIT: Not a LeBron hater at all, just thought it was nice to talk about Curry and Harden as our MVP's. ",44,DawsonOler,/r/nba/comments/2v0l1x/lebron_moves_up_to_2_on_nbacoms_race_to_mvp/coddrwu/,coddrwu,1423281653.0,1423252853.0,LeBron moves up to #2 on NBA.com's Race to MVP.,160,2v0l1x
809,Oh no guys he's back... The real MVP...,52,KoreanBBQcookie,/r/nba/comments/2uy1we/lebron_james_first_half_dunk_fest_vs_los_angeles/cocq66f/,cocq66f,1423221582.0,1423192782.0,LeBron James First Half Dunk Fest vs Los Angeles Clippers,135,2uy1we
810,"In my opinion, James is undisputed MVP and whoever is second really isn't close.",103,anonatitagain,/r/nba/comments/2uy1we/lebron_james_first_half_dunk_fest_vs_los_angeles/cocq0jw/,cocq0jw,1423221271.0,1423192471.0,LeBron James First Half Dunk Fest vs Los Angeles Clippers,135,2uy1we
811,The Dark MVP Rises,21,alphyc,/r/nba/comments/2uy1we/lebron_james_first_half_dunk_fest_vs_los_angeles/cocq7rp/,cocq7rp,1423221671.0,1423192871.0,LeBron James First Half Dunk Fest vs Los Angeles Clippers,135,2uy1we
812,"""LeBron has totally lost a step.""",26,DrTom,/r/nba/comments/2uy1we/lebron_james_first_half_dunk_fest_vs_los_angeles/cocqdsy/,cocqdsy,1423222006.0,1423193206.0,LeBron James First Half Dunk Fest vs Los Angeles Clippers,135,2uy1we
813,I like Mozgovs effort getting up and down the floor,78,drafort,/r/nba/comments/2uxutx/jr_smiths_steal_on_the_inbound_leads_to_a_lebron/cocpp7e/,cocpp7e,1423220648.0,1423191848.0,JR Smith's steal on the inbound leads to a Lebron James alley oop,674,2uxutx
814,I will never get tired of seeing LeBron alley oops,151,ThisIsMyFavoriteSub,/r/nba/comments/2uxutx/jr_smiths_steal_on_the_inbound_leads_to_a_lebron/cocnypb/,cocnypb,1423217291.0,1423188491.0,JR Smith's steal on the inbound leads to a Lebron James alley oop,674,2uxutx
815,This is what I envisioned before the season started. But the feeling of actually seeing it is just....WOOOW,124,rey1294,/r/nba/comments/2uxutx/jr_smiths_steal_on_the_inbound_leads_to_a_lebron/coco4qm/,coco4qm,1423217606.0,1423188806.0,JR Smith's steal on the inbound leads to a Lebron James alley oop,674,2uxutx
816,David Blatt's job is getting more and more secure by the day. ,85,suzakutrading,/r/nba/comments/2uxutx/jr_smiths_steal_on_the_inbound_leads_to_a_lebron/cocpbql/,cocpbql,1423219915.0,1423191115.0,JR Smith's steal on the inbound leads to a Lebron James alley oop,674,2uxutx
817,This team is fucking showtime all over again ,34,ashishvp,/r/nba/comments/2uxutx/jr_smiths_steal_on_the_inbound_leads_to_a_lebron/cocop4x/,cocop4x,1423218702.0,1423189902.0,JR Smith's steal on the inbound leads to a Lebron James alley oop,674,2uxutx
818,"Got home from the dispensary, sparked the blunt, flipped on the tube and this was the first play I saw Hahaha sometimes shit just works out fellas ",208,,/r/nba/comments/2uxutx/jr_smiths_steal_on_the_inbound_leads_to_a_lebron/cocoim4/,cocoim4,1423218352.0,1423189552.0,JR Smith's steal on the inbound leads to a Lebron James alley oop,674,2uxutx
819,Jr is a rejuvenated player. Just look at how much he puts into that pass!,21,coopdegrace,/r/nba/comments/2uxutx/jr_smiths_steal_on_the_inbound_leads_to_a_lebron/cocqsjc/,cocqsjc,1423222829.0,1423194029.0,JR Smith's steal on the inbound leads to a Lebron James alley oop,674,2uxutx
820,LeBron's been jumping out of the building tonight,52,Vargolol,/r/nba/comments/2uxutx/jr_smiths_steal_on_the_inbound_leads_to_a_lebron/coco168/,coco168,1423217419.0,1423188619.0,JR Smith's steal on the inbound leads to a Lebron James alley oop,674,2uxutx
821,Imagine if he came off the bench.,74,DiRub,/r/nba/comments/2uw8b7/skolnick_lebron_james_during_cavs_11game_streak/coca58d/,coca58d,1423192480.0,1423163680.0,"[Skolnick] LeBron James during Cavs' 11-game streak (played 10): 117.2 ORating, 97.1 DRating. During Heat's 27-gm streak, 116.1 ORating, 97.6 DRating.",211,2uw8b7
822,Its almost like Cavs are better when Lebron plays,123,FreeGums,/r/nba/comments/2uw8b7/skolnick_lebron_james_during_cavs_11game_streak/coc8enx/,coc8enx,1423189691.0,1423160891.0,"[Skolnick] LeBron James during Cavs' 11-game streak (played 10): 117.2 ORating, 97.1 DRating. During Heat's 27-gm streak, 116.1 ORating, 97.6 DRating.",211,2uw8b7
823,I don't know how you can't vote this guy for MVP. I really hope Cavs work their way up the ladder ,109,akushdakyng,/r/nba/comments/2uw8b7/skolnick_lebron_james_during_cavs_11game_streak/coc8ac0/,coc8ac0,1423189501.0,1423160701.0,"[Skolnick] LeBron James during Cavs' 11-game streak (played 10): 117.2 ORating, 97.1 DRating. During Heat's 27-gm streak, 116.1 ORating, 97.6 DRating.",211,2uw8b7
824,"He legitimately is a freak, and he's still the best player at moment and I want to say it's by far too.",44,BizzaroPie,/r/nba/comments/2uw8b7/skolnick_lebron_james_during_cavs_11game_streak/coc8ntv/,coc8ntv,1423190101.0,1423161301.0,"[Skolnick] LeBron James during Cavs' 11-game streak (played 10): 117.2 ORating, 97.1 DRating. During Heat's 27-gm streak, 116.1 ORating, 97.6 DRating.",211,2uw8b7
825,"If LeBron plays this good for the rest of the season, he's the MVP. I don't give a shit about what statistics you pull, but watching these games, LeBron is doing everything for them and dominating",38,curry_in_a_hurry,/r/nba/comments/2uw8b7/skolnick_lebron_james_during_cavs_11game_streak/cocas3g/,cocas3g,1423193462.0,1423164662.0,"[Skolnick] LeBron James during Cavs' 11-game streak (played 10): 117.2 ORating, 97.1 DRating. During Heat's 27-gm streak, 116.1 ORating, 97.6 DRating.",211,2uw8b7
826,Looks like old age has caught up with him! .5 worse DRating? He's gone full potato. Not even trying out there. ,31,brobro2,/r/nba/comments/2uw8b7/skolnick_lebron_james_during_cavs_11game_streak/cocaygu/,cocaygu,1423193749.0,1423164949.0,"[Skolnick] LeBron James during Cavs' 11-game streak (played 10): 117.2 ORating, 97.1 DRating. During Heat's 27-gm streak, 116.1 ORating, 97.6 DRating.",211,2uw8b7
827,[deleted],36,,/r/nba/comments/2upae2/kevin_love_denies_lebron_james_claims_about_his/coagxl0/,coagxl0,1423043979.0,1423015179.0,Kevin Love denies LeBron James' claims about his lack of confidence,54,2upae2
828,Well at least he's defending something.,106,,/r/nba/comments/2upae2/kevin_love_denies_lebron_james_claims_about_his/coaft4z/,coaft4z,1423041938.0,1423013138.0,Kevin Love denies LeBron James' claims about his lack of confidence,54,2upae2
