,body,score,author,permalink,comment_id,created_loc,created_utc,post_title,post_score,post_id
248,isn't the animal at the bottom of the pole the most important ,40,,/r/nba/comments/4mkyhr/lebron_james_im_one_of_the_lower_guys_on_the/d3warkm/,d3warkm,1465115777.0,1465086977.0,"LeBron James: ""I'm One of the Lower Guys On The Totem Pole""",249,4mkyhr
249,Ahhhh trying to disassociate himself from the roster construction. ,98,xJustinian,/r/nba/comments/4mkyhr/lebron_james_im_one_of_the_lower_guys_on_the/d3w9k0n/,d3w9k0n,1465113646.0,1465084846.0,"LeBron James: ""I'm One of the Lower Guys On The Totem Pole""",249,4mkyhr
250,LeFalseHumility,25,dwcmwa,/r/nba/comments/4mkyhr/lebron_james_im_one_of_the_lower_guys_on_the/d3wb1dz/,d3wb1dz,1465116275.0,1465087475.0,"LeBron James: ""I'm One of the Lower Guys On The Totem Pole""",249,4mkyhr
251,Lebron averages 2.4 goofy-ass statements like this a year. ,26,talkGOT,/r/nba/comments/4mkyhr/lebron_james_im_one_of_the_lower_guys_on_the/d3wcboz/,d3wcboz,1465118612.0,1465089812.0,"LeBron James: ""I'm One of the Lower Guys On The Totem Pole""",249,4mkyhr
252,A lot. Franchises like OKC and Memphis probably wouldn't exist. ,269,,/r/nba/comments/4mknza/how_much_would_stars_like_lebron_and_kd_make_if/d3w7bib/,d3w7bib,1465109582.0,1465080782.0,How much would stars like LeBron and KD make if there was no hard cap for salary?,135,4mknza
253,[deleted],74,,/r/nba/comments/4mknza/how_much_would_stars_like_lebron_and_kd_make_if/d3w7dor/,d3w7dor,1465109690.0,1465080890.0,How much would stars like LeBron and KD make if there was no hard cap for salary?,135,4mknza
254,"lebron's projection based on jordan's $30,000,000 salary back in 98 would be $66 million this year

so it's safe to say in the $60-75 million range",177,sagehoof,/r/nba/comments/4mknza/how_much_would_stars_like_lebron_and_kd_make_if/d3w7dk3/,d3w7dk3,1465109684.0,1465080884.0,How much would stars like LeBron and KD make if there was no hard cap for salary?,135,4mknza
255,50-60 million per year,81,Ihatemywifey,/r/nba/comments/4mknza/how_much_would_stars_like_lebron_and_kd_make_if/d3w7bj7/,d3w7bj7,1465109583.0,1465080783.0,How much would stars like LeBron and KD make if there was no hard cap for salary?,135,4mknza
256,There was an article floating around Last year that the city of Cleveland would make almost half a billion more dollars per year because of Lebron coming back. These player can affect entire economies. Lebron is literally worth billions of dollars. ,60,Buckelroo,/r/nba/comments/4mknza/how_much_would_stars_like_lebron_and_kd_make_if/d3w8m07/,d3w8m07,1465111947.0,1465083147.0,How much would stars like LeBron and KD make if there was no hard cap for salary?,135,4mknza
257,"According to Forbes the Cavs dropped to $350,000,000 valuation after LeBron left, now they are valued at over a billion with their former owner/current minority owner looking to sell his 15% stake.",23,HoodedNinj4,/r/nba/comments/4mknza/how_much_would_stars_like_lebron_and_kd_make_if/d3w8gz8/,d3w8gz8,1465111686.0,1465082886.0,How much would stars like LeBron and KD make if there was no hard cap for salary?,135,4mknza
258,Look at star player baseball contracts and you have your answer.,32,AyyMVP,/r/nba/comments/4mknza/how_much_would_stars_like_lebron_and_kd_make_if/d3w7cwy/,d3w7cwy,1465109651.0,1465080851.0,How much would stars like LeBron and KD make if there was no hard cap for salary?,135,4mknza
259,Let he who has not liked a perfect booty cast the first stone.,32,HoodedNinj4,/r/nba/comments/4mjnks/how_the_undefeateds_americas_lovehate/d3vzkxz/,d3vzkxz,1465095634.0,1465066834.0,"How The Undefeated's ""America's love-hate relationship with LeBron James"" Got It Wrong: A Real Theory for Why People Hate LeBron",35,4mjnks
260,"I think that's 9-0, ""last 10 instances"" include the unplayed game from tomorrow. Still, crazy.",809,hooldini,/r/nba/comments/4mjisx/last_10_games_lebron_has_lost_game_1_lebron_is/d3vyh0t/,d3vyh0t,1465093667.0,1465064867.0,"Last 10 games LeBron has lost Game 1, LeBron is 10-0 in Game 2s",2698,4mjisx
261,Makes sense. LeBron has lost only three out of his last 23 playoff series.,538,BearsNecessity,/r/nba/comments/4mjisx/last_10_games_lebron_has_lost_game_1_lebron_is/d3vypz2/,d3vypz2,1465094106.0,1465065306.0,"Last 10 games LeBron has lost Game 1, LeBron is 10-0 in Game 2s",2698,4mjisx
262,"It's funny everyone on TV says it's over already.  If the Cass steal a game in GS then the story is ""LeBron is willing this team to victory,  Cavs in 7"", then GS will steal a win in Cleveland and those same people will say "" you can't stop them,  historic,  GS in 6"" ",68,HotBananaa,/r/nba/comments/4mjisx/last_10_games_lebron_has_lost_game_1_lebron_is/d3we616/,d3we616,1465122005.0,1465093205.0,"Last 10 games LeBron has lost Game 1, LeBron is 10-0 in Game 2s",2698,4mjisx
263,Wow he is 6-3 in series where he loses game 1,154,frugalNOTcheap,/r/nba/comments/4mjisx/last_10_games_lebron_has_lost_game_1_lebron_is/d3w0fl4/,d3w0fl4,1465097175.0,1465068375.0,"Last 10 games LeBron has lost Game 1, LeBron is 10-0 in Game 2s",2698,4mjisx
264,RIP Bulls. Maybe next year they'll beat LeBron.  ,213,,/r/nba/comments/4mjisx/last_10_games_lebron_has_lost_game_1_lebron_is/d3vyf7a/,d3vyf7a,1465093578.0,1465064778.0,"Last 10 games LeBron has lost Game 1, LeBron is 10-0 in Game 2s",2698,4mjisx
265,Is it just me or do these stats hold very little weight? I feel as though it should at least differentiate between home and away games. ,141,ThatsPrettyGnar,/r/nba/comments/4mjisx/last_10_games_lebron_has_lost_game_1_lebron_is/d3w01j9/,d3w01j9,1465096472.0,1465067672.0,"Last 10 games LeBron has lost Game 1, LeBron is 10-0 in Game 2s",2698,4mjisx
266,"Well the Warriors are all about breaking records, doing the impossible, and making history this year...",264,FGCHENG,/r/nba/comments/4mjisx/last_10_games_lebron_has_lost_game_1_lebron_is/d3w0by2/,d3w0by2,1465096991.0,1465068191.0,"Last 10 games LeBron has lost Game 1, LeBron is 10-0 in Game 2s",2698,4mjisx
267,"Ok this actually made my jaw drop, so the last time he lost game 1 and game 2 was before 2009.",70,EddieisKing,/r/nba/comments/4mjisx/last_10_games_lebron_has_lost_game_1_lebron_is/d3vz5m9/,d3vz5m9,1465094874.0,1465066074.0,"Last 10 games LeBron has lost Game 1, LeBron is 10-0 in Game 2s",2698,4mjisx
268,Warriors are record breakers so I can see them taking game 2.,55,matthewheat,/r/nba/comments/4mjisx/last_10_games_lebron_has_lost_game_1_lebron_is/d3w0id3/,d3w0id3,1465097313.0,1465068513.0,"Last 10 games LeBron has lost Game 1, LeBron is 10-0 in Game 2s",2698,4mjisx
269,"Thing is they wouldn't be able to afford Deng or Dragic, huge parts of the team. Probably wouldn't have lost enough games to pick up Winslow either.",198,InsertWittyTaco,/r/nba/comments/4mj018/how_good_would_the_heat_be_this_year_if_lebron/d3vuaco/,d3vuaco,1465086452.0,1465057652.0,How good would the Heat be this year if Lebron didn't leave?,104,4mj018
270,"I'd rather have Dragic/Wade/Deng(Johnson)/Lebron/Whiteside than the Cavs starting lineup, if that's what you're asking. 
",86,irelli,/r/nba/comments/4mj018/how_good_would_the_heat_be_this_year_if_lebron/d3vudwf/,d3vudwf,1465086626.0,1465057826.0,How good would the Heat be this year if Lebron didn't leave?,104,4mj018
271,"Probably play better defense than the cavs, still say we lose though ",27,Tito_Our_Saviour,/r/nba/comments/4mj018/how_good_would_the_heat_be_this_year_if_lebron/d3vuanz/,d3vuanz,1465086467.0,1465057667.0,How good would the Heat be this year if Lebron didn't leave?,104,4mj018
272,"first off RIP GOAT

second, that was well said by lebron, he obviously had so much respect for him

third, i like reading comments just to get a feel of how others feel but some of those FB comments on the article are just sad",364,ducehlmg,/r/nba/comments/4mhx0l/lebron_james_says_muhammad_ali_a_big_reason_why/d3vnrmx/,d3vnrmx,1465072675.0,1465043875.0,"LeBron James says Muhammad Ali a big reason why African-American athletes can enjoy fame, opportunities",1407,4mhx0l
273,"Well said by LeBron. It's completely true. I don't know a single athlete who had Ali's charisma, theatrics, knowledge, and eloquence, both inside the ring and out. He had such a mark on the world. So unfortunate with the Parkinson's, so in a way, I hope death was a release for him. RIP Ali. ",148,,/r/nba/comments/4mhx0l/lebron_james_says_muhammad_ali_a_big_reason_why/d3vv8pr/,d3vv8pr,1465088076.0,1465059276.0,"LeBron James says Muhammad Ali a big reason why African-American athletes can enjoy fame, opportunities",1407,4mhx0l
274,"Not just a GOAT in the sporting realm, but he truly was a memorable & legendary human being. He truly left a positive impact to this world.

His value & positive impact to the African American, Muslim, Sports, & Political Activist community will never be forgotten. 

* My Favorite quote: 
""It isn't the mountains ahead to climb that will wear you out; it's the pebble in the shoe."" - Muhammad Ali",45,RoseGrewFromConcrete,/r/nba/comments/4mhx0l/lebron_james_says_muhammad_ali_a_big_reason_why/d3vyspo/,d3vyspo,1465094241.0,1465065441.0,"LeBron James says Muhammad Ali a big reason why African-American athletes can enjoy fame, opportunities",1407,4mhx0l
275,"That's what made him such a legend, his influence transcended way beyond the ring ",31,Poplorok,/r/nba/comments/4mhx0l/lebron_james_says_muhammad_ali_a_big_reason_why/d3vut2d/,d3vut2d,1465087334.0,1465058534.0,"LeBron James says Muhammad Ali a big reason why African-American athletes can enjoy fame, opportunities",1407,4mhx0l
276,Shitpost with references and citation. We are truly evolving. ,731,EvenGandhiHatesLVG,/r/nba/comments/4mgh74/when_lebron_james_guards_steph_curry_mike_breen/d3vc0y2/,d3vc0y2,1465037892.0,1465009092.0,"When Lebron James guards Steph Curry, Mike Breen says JamesOn Curry. This is also the name of a former NBA player",892,4mgh74
277,I have Player Card installed so I saw it as the player instead of the phrase and was really confused for a second.,38,real_eEe,/r/nba/comments/4mgh74/when_lebron_james_guards_steph_curry_mike_breen/d3vdk9t/,d3vdk9t,1465040789.0,1465011989.0,"When Lebron James guards Steph Curry, Mike Breen says JamesOn Curry. This is also the name of a former NBA player",892,4mgh74
278,"Somebody watched Oklahoma State college ball. 

I noticed this as well. ",33,bleev,/r/nba/comments/4mgh74/when_lebron_james_guards_steph_curry_mike_breen/d3ve0uy/,d3ve0uy,1465041725.0,1465012925.0,"When Lebron James guards Steph Curry, Mike Breen says JamesOn Curry. This is also the name of a former NBA player",892,4mgh74
279,"I can't believe JamesOn only played 3.9 seconds total in his NBA career. For some reason, I always thought he was some sort of consistent 12th man on a team like the Cavs or something.",28,mr_squidward,/r/nba/comments/4mgh74/when_lebron_james_guards_steph_curry_mike_breen/d3vdbt3/,d3vdbt3,1465040322.0,1465011522.0,"When Lebron James guards Steph Curry, Mike Breen says JamesOn Curry. This is also the name of a former NBA player",892,4mgh74
280,I am proud to say this is a great shitpost. ,128,xorphz,/r/nba/comments/4mgh74/when_lebron_james_guards_steph_curry_mike_breen/d3vc3la/,d3vc3la,1465038026.0,1465009226.0,"When Lebron James guards Steph Curry, Mike Breen says JamesOn Curry. This is also the name of a former NBA player",892,4mgh74
281,[throwback](https://www.reddit.com/r/nba/comments/43zc24/random_fact_of_the_day_jameson_curry_the_51st/czm5vfa?context=3),49,themariokarters,/r/nba/comments/4mgh74/when_lebron_james_guards_steph_curry_mike_breen/d3vc9pi/,d3vc9pi,1465038342.0,1465009542.0,"When Lebron James guards Steph Curry, Mike Breen says JamesOn Curry. This is also the name of a former NBA player",892,4mgh74
282,His strip on Kyrie live looked like when an adult blocks a little kid going for a layup. He made it look so easy.,58,ZedsShadow,/r/nba/comments/4mfr3b/iguodala_w_back_to_back_strips_on_lebron_kyrie/d3vebpp/,d3vebpp,1465042349.0,1465013549.0,Iguodala w/ back to back strips on Lebron & Kyrie. Stares down the Cavs bench.,384,4mfr3b
283,I've never seen someone so good at swiping down on the ball without fouling,97,wlm12,/r/nba/comments/4mfr3b/iguodala_w_back_to_back_strips_on_lebron_kyrie/d3vdy0u/,d3vdy0u,1465041563.0,1465012763.0,Iguodala w/ back to back strips on Lebron & Kyrie. Stares down the Cavs bench.,384,4mfr3b
284,B2B FMVP?,113,Triccogekuhan,/r/nba/comments/4mfr3b/iguodala_w_back_to_back_strips_on_lebron_kyrie/d3v5ifp/,d3v5ifp,1465026573.0,1464997773.0,Iguodala w/ back to back strips on Lebron & Kyrie. Stares down the Cavs bench.,384,4mfr3b
285,jesus christ i would hate to go up against Iggy.    ,36,abcocktail,/r/nba/comments/4mfr3b/iguodala_w_back_to_back_strips_on_lebron_kyrie/d3v6kcv/,d3v6kcv,1465028439.0,1464999639.0,Iguodala w/ back to back strips on Lebron & Kyrie. Stares down the Cavs bench.,384,4mfr3b
286,I'm starting to think he might be the 3rd best defensive player in the league behind Kawhi and Draymond. ,37,bustedracquet,/r/nba/comments/4mfr3b/iguodala_w_back_to_back_strips_on_lebron_kyrie/d3v9414/,d3v9414,1465032835.0,1465004035.0,Iguodala w/ back to back strips on Lebron & Kyrie. Stares down the Cavs bench.,384,4mfr3b
287,Coolest dude in the league ,62,JustiseWinfast,/r/nba/comments/4mfr3b/iguodala_w_back_to_back_strips_on_lebron_kyrie/d3v5q5z/,d3v5q5z,1465026954.0,1464998154.0,Iguodala w/ back to back strips on Lebron & Kyrie. Stares down the Cavs bench.,384,4mfr3b
288,"The only way to stop Steph is to do weird shit to him. I think in Game 2, the entire Cavs team will sing Ignition Remix for a whole quarter. It's worth a shot.",1005,,/r/nba/comments/4mfc40/lebron_smacking_stephs_hand/d3v1wmw/,d3v1wmw,1465020497.0,1464991697.0,LeBron smacking Steph's hand,1280,4mfc40
289,"""Charlie Murphy!""",249,YaBoiBeefCat,/r/nba/comments/4mfc40/lebron_smacking_stephs_hand/d3v1uf0/,d3v1uf0,1465020401.0,1464991601.0,LeBron smacking Steph's hand,1280,4mfc40
290,Holy crap that was loud,117,Doorook,/r/nba/comments/4mfc40/lebron_smacking_stephs_hand/d3v4x1m/,d3v4x1m,1465025546.0,1464996746.0,LeBron smacking Steph's hand,1280,4mfc40
291,"Lebron: Just know I got your back in Rio if you got mine!

Steph: Deal! 

*High-five*",174,MacDerfus,/r/nba/comments/4mfc40/lebron_smacking_stephs_hand/d3v52ja/,d3v52ja,1465025808.0,1464997008.0,LeBron smacking Steph's hand,1280,4mfc40
292,"[Reminds me of this.](https://www.youtube.com/watch?v=Ny_utO73eJY) 

EDIT: Just for the record I don't think what Lebron did is that big of a deal in either case. I'm not about the soft shit.",204,suize,/r/nba/comments/4mfc40/lebron_smacking_stephs_hand/d3v3vuk/,d3v3vuk,1465023769.0,1464994969.0,LeBron smacking Steph's hand,1280,4mfc40
293,"I like how Steph gave the ""dafuq"" look and realized its Lebron and just carried on. ",418,dirtyshits,/r/nba/comments/4mfc40/lebron_smacking_stephs_hand/d3v2xul/,d3v2xul,1465022180.0,1464993380.0,LeBron smacking Steph's hand,1280,4mfc40
294,Just Lebron working on his handshakes during the game.,29,BigPhoCup,/r/nba/comments/4mfc40/lebron_smacking_stephs_hand/d3v39t7/,d3v39t7,1465022738.0,1464993938.0,LeBron smacking Steph's hand,1280,4mfc40
295,how could she slap!,190,msarvar,/r/nba/comments/4mfc40/lebron_smacking_stephs_hand/d3v1v5q/,d3v1v5q,1465020433.0,1464991633.0,LeBron smacking Steph's hand,1280,4mfc40
296,Damn you can really hear that shit. SMACK.,22,yuleen3,/r/nba/comments/4mfc40/lebron_smacking_stephs_hand/d3v4n12/,d3v4n12,1465025067.0,1464996267.0,LeBron smacking Steph's hand,1280,4mfc40
297,You can do whatever you want to Steph off ball save for murder,382,ConsumedAM,/r/nba/comments/4mfc40/lebron_smacking_stephs_hand/d3v1tfd/,d3v1tfd,1465020356.0,1464991556.0,LeBron smacking Steph's hand,1280,4mfc40
298,"Why do they say that LBJ vs Curry is even remotely close to Bird vs Magic? 

That is absolutely dumb. There isn't a hate between LBJ / Curry. They didn't play each other in college. They have only played in two finals against each other.

Everyone keeps trying to make this into a thing, and it isn't a thing at all",47,Yellow_Odd_Fellow,/r/nba/comments/4mcdxj/spoiler_alert_nba_recap_6316_finals_game_2/d3uinis/,d3uinis,1464994599.0,1464965799.0,"[Spoiler Alert] NBA Recap: 6/3/16 - Finals game 2 preview, Everything we learned in game 1, Are you a LeBron or a Curry?, LeBron is obsessed with Curry, LeBron vs. Curry approaching Magic vs. Bird level, Low blows and unsung heroes, NBA mean tweets compilation, Highlights, Recaps, Podcasts, and more",135,4mcdxj
299,"I've been using this sub for over two years and never participated in one of these threads and don't even know what the purpose of one is. 

What goes on here?",37,,/r/nba/comments/4mcdxj/spoiler_alert_nba_recap_6316_finals_game_2/d3ue74g/,d3ue74g,1464987649.0,1464958849.0,"[Spoiler Alert] NBA Recap: 6/3/16 - Finals game 2 preview, Everything we learned in game 1, Are you a LeBron or a Curry?, LeBron is obsessed with Curry, LeBron vs. Curry approaching Magic vs. Bird level, Low blows and unsung heroes, NBA mean tweets compilation, Highlights, Recaps, Podcasts, and more",135,4mcdxj
300,he can't make that shot consistently anymore. imo he needs to get in the post more. he's big and strong and he supposedly has this great post game. stop hanging out 25 feet from the rim and get on the block.,86,moe1984,/r/nba/comments/4mb74x/lebron_doesnt_shoot_when_given_space_and_it_is/d3u2wy2/,d3u2wy2,1464956641.0,1464927841.0,LeBron doesn't shoot when given space and it is hurting his team,127,4mb74x
301,the bigger problem is the warriors blatantly cheating and shading off him when he doesn't have the ball. i've never seen a perimeter superstar player treated like this. hes killing the spacing.,58,revantitan25,/r/nba/comments/4mb74x/lebron_doesnt_shoot_when_given_space_and_it_is/d3u3h8l/,d3u3h8l,1464957753.0,1464928953.0,LeBron doesn't shoot when given space and it is hurting his team,127,4mb74x
302,">he can certainly make an open jumper

I really don't think it's a given that he can",161,Fsharp88,/r/nba/comments/4mb74x/lebron_doesnt_shoot_when_given_space_and_it_is/d3u2woo/,d3u2woo,1464956626.0,1464927826.0,LeBron doesn't shoot when given space and it is hurting his team,127,4mb74x
303,"You guys are aware Lebron missed like 4-5 layups right (and 3 tip-ins). 2 of the layups were point blank with nobody there. 

And he did make like 4 jumpers tonight. 

He needed to take more shots and be more aggressive. That will change of course.",48,t_mac1,/r/nba/comments/4mb74x/lebron_doesnt_shoot_when_given_space_and_it_is/d3u3fq8/,d3u3fq8,1464957665.0,1464928865.0,LeBron doesn't shoot when given space and it is hurting his team,127,4mb74x
304,He never hesitated with us. Lebron used to have a shit ton of games where he killed on the perimeter. Now he can only score in the paint,21,Nicklovesbud,/r/nba/comments/4mb74x/lebron_doesnt_shoot_when_given_space_and_it_is/d3u3ohj/,d3u3ohj,1464958167.0,1464929367.0,LeBron doesn't shoot when given space and it is hurting his team,127,4mb74x
305,You mean Draymond Green?,121,Hizenboig,/r/nba/comments/4mb0ig/curry_steals_the_ball_from_lebron_runs_down_the/d3u143l/,d3u143l,1464953496.0,1464924696.0,"Curry steals the ball from Lebron, runs down the court and drains a step back three pointer on Irving",401,4mb0ig
306,Draymond stole it.,54,,/r/nba/comments/4mb0ig/curry_steals_the_ball_from_lebron_runs_down_the/d3u15ka/,d3u15ka,1464953561.0,1464924761.0,"Curry steals the ball from Lebron, runs down the court and drains a step back three pointer on Irving",401,4mb0ig
307,"Dray poked in free from LeBron

He's been outstanding in this game",32,ConsumedAM,/r/nba/comments/4mb0ig/curry_steals_the_ball_from_lebron_runs_down_the/d3u15up/,d3u15up,1464953573.0,1464924773.0,"Curry steals the ball from Lebron, runs down the court and drains a step back three pointer on Irving",401,4mb0ig
308,I'm laughing so hard at Draymond clapping for the ball from half court during a Curry ISO. ,25,rjvir,/r/nba/comments/4mb0ig/curry_steals_the_ball_from_lebron_runs_down_the/d3u19tt/,d3u19tt,1464953747.0,1464924947.0,"Curry steals the ball from Lebron, runs down the court and drains a step back three pointer on Irving",401,4mb0ig
309,great crossover on the professional nut-tapper,164,Caleb-,/r/nba/comments/4mavo1/steph_curry_dekes_dellavadova_and_then_hits_the/d3tzptc/,d3tzptc,1464951368.0,1464922568.0,Steph Curry dekes Dellavadova and then hits the contested falling layup over Lebron,570,4mavo1
310,Smooth AF,47,trexpancakes,/r/nba/comments/4mavo1/steph_curry_dekes_dellavadova_and_then_hits_the/d3tzogh/,d3tzogh,1464951315.0,1464922515.0,Steph Curry dekes Dellavadova and then hits the contested falling layup over Lebron,570,4mavo1
311,One of two Curry highlights of the night!,23,CallMeDraken,/r/nba/comments/4mavo1/steph_curry_dekes_dellavadova_and_then_hits_the/d3u25ju/,d3u25ju,1464955223.0,1464926423.0,Steph Curry dekes Dellavadova and then hits the contested falling layup over Lebron,570,4mavo1
312,"File it under ""and-one's that should have been called"".",46,ghaliboy,/r/nba/comments/4mavo1/steph_curry_dekes_dellavadova_and_then_hits_the/d3u2au4/,d3u2au4,1464955493.0,1464926693.0,Steph Curry dekes Dellavadova and then hits the contested falling layup over Lebron,570,4mavo1
313,He was right too. That was a brutal ass flop. Funny thing is Kerr subbed him off cause he saw the cavs were gonna exploit Andy on the post if he was on the floor,927,pjs89,/r/nba/comments/4maqqr/mannixlebron_james_to_the_referee_after_that/d3tya4x/,d3tya4x,1464949144.0,1464920344.0,"[Mannix]LeBron james to the referee after that offensive foul on Love, taken by Varejao: ""That's a flop. I know him, and that's a flop.""",1891,4maqqr
314,"""I taught him everything he knows about flopping.""",758,NinjaPigeon_,/r/nba/comments/4maqqr/mannixlebron_james_to_the_referee_after_that/d3tzzfw/,d3tzzfw,1464951757.0,1464922957.0,"[Mannix]LeBron james to the referee after that offensive foul on Love, taken by Varejao: ""That's a flop. I know him, and that's a flop.""",1891,4maqqr
315,"""That's a flop. I know how to flop, and that's a flop."" - LeBron",152,,/r/nba/comments/4maqqr/mannixlebron_james_to_the_referee_after_that/d3u1dq3/,d3u1dq3,1464953909.0,1464925109.0,"[Mannix]LeBron james to the referee after that offensive foul on Love, taken by Varejao: ""That's a flop. I know him, and that's a flop.""",1891,4maqqr
316,Lol LeBron knows a flop,457,markyellowstone,/r/nba/comments/4maqqr/mannixlebron_james_to_the_referee_after_that/d3tye2q/,d3tye2q,1464949317.0,1464920517.0,"[Mannix]LeBron james to the referee after that offensive foul on Love, taken by Varejao: ""That's a flop. I know him, and that's a flop.""",1891,4maqqr
317,[Video to judge for yourself](https://streamable.com/y1qe),30,wafflehauss,/r/nba/comments/4maqqr/mannixlebron_james_to_the_referee_after_that/d3u7pnn/,d3u7pnn,1464968627.0,1464939827.0,"[Mannix]LeBron james to the referee after that offensive foul on Love, taken by Varejao: ""That's a flop. I know him, and that's a flop.""",1891,4maqqr
318,Snitch ,51,DailyShawarma,/r/nba/comments/4maqqr/mannixlebron_james_to_the_referee_after_that/d3tytt0/,d3tytt0,1464950022.0,1464921222.0,"[Mannix]LeBron james to the referee after that offensive foul on Love, taken by Varejao: ""That's a flop. I know him, and that's a flop.""",1891,4maqqr
319,"Yeah sure it was a flop but Love pushed off with his arm which is an offensive foul. If Andy doesn't sell it they don't get the offensive foul call and Love incorrectly gets  either a foul out of Andy, an and-1 or a layup. 

LeBron can cry all he wants about it but it's a fair play. 
",137,Reggie_MiIler,/r/nba/comments/4maqqr/mannixlebron_james_to_the_referee_after_that/d3u2hed/,d3u2hed,1464955829.0,1464927029.0,"[Mannix]LeBron james to the referee after that offensive foul on Love, taken by Varejao: ""That's a flop. I know him, and that's a flop.""",1891,4maqqr
320,He learned from one of the best,46,AlexCas18,/r/nba/comments/4maqqr/mannixlebron_james_to_the_referee_after_that/d3tzxps/,d3tzxps,1464951685.0,1464922885.0,"[Mannix]LeBron james to the referee after that offensive foul on Love, taken by Varejao: ""That's a flop. I know him, and that's a flop.""",1891,4maqqr
321,"If you're backpedaling and the defender sticks his arm in you and pushes, you're gonna fall down. Varejao just makes a show out of it but it's still an offensive foul. i feel like i'm taking crazy pills people. Have you ever played defense, any of you?",295,abcocktail,/r/nba/comments/4maqqr/mannixlebron_james_to_the_referee_after_that/d3u1l6r/,d3u1l6r,1464954253.0,1464925453.0,"[Mannix]LeBron james to the referee after that offensive foul on Love, taken by Varejao: ""That's a flop. I know him, and that's a flop.""",1891,4maqqr
322,"Trust me, I flop all the time!",39,phdre,/r/nba/comments/4maqqr/mannixlebron_james_to_the_referee_after_that/d3tyz2y/,d3tyz2y,1464950244.0,1464921444.0,"[Mannix]LeBron james to the referee after that offensive foul on Love, taken by Varejao: ""That's a flop. I know him, and that's a flop.""",1891,4maqqr
323,"Because it's exhausting and doesn't get his teammates in the flow of the game. Then if they crowd the paint (like last year's finals), he's either going to pass out of it or take an inefficient shot. If you never involved your teammates or they're playing like ass, you'll take a bad shot. Also, it's exhausting as fuck",295,TruthWillOutyo,/r/nba/comments/4map6g/this_may_be_a_dumb_question_but_why_doesnt_lebron/d3txv1d/,d3txv1d,1464948502.0,1464919702.0,"This may be a dumb question, but why doesn't LeBron just drive all the time?",109,4map6g
