,body,score,author,permalink,comment_id,created_loc,created_utc,post_title,post_score,post_id
716,Totally irrelevant to the post but OP's Hawk flair looks a pac man eating an ant.,29,tman916x,/r/nba/comments/zkof7/what_josh_smith_can_learn_from_lebron_james/c65g61q/,c65g61q,1347176682.0,1347147882.0,What Josh Smith can learn from Lebron James,80,zkof7
717,"No shit.

Hey guys ""DAE think Lebron is a great player?""",65,Houston832,/r/nba/comments/zk347/anyone_here_think_chris_bosh_talents_are/c65c1qy/,c65c1qy,1347157225.0,1347128425.0,Anyone here think Chris bosh talents are underutilized in Miami due to Lebron and wade.,48,zk347
718,I thought this was a widely known and accepted view,126,Skyline9,/r/nba/comments/zk347/anyone_here_think_chris_bosh_talents_are/c659wk9/,c659wk9,1347147081.0,1347118281.0,Anyone here think Chris bosh talents are underutilized in Miami due to Lebron and wade.,48,zk347
719,"Everyone knows Bosh is underutilized, but as Wade gets older and he starts to decline Bosh will have to pick up the slack. If Miami wants to win more rings in the future Bosh is going to be the key.",42,GrimeWizard,/r/nba/comments/zk347/anyone_here_think_chris_bosh_talents_are/c65a1er/,c65a1er,1347147811.0,1347119011.0,Anyone here think Chris bosh talents are underutilized in Miami due to Lebron and wade.,48,zk347
720,Yes. Everyone.,50,Notsdlog,/r/nba/comments/zk347/anyone_here_think_chris_bosh_talents_are/c659v47/,c659v47,1347146865.0,1347118065.0,Anyone here think Chris bosh talents are underutilized in Miami due to Lebron and wade.,48,zk347
721,Clearly has what it takes to lead a team to the 2nd round in the playoffs. If only he had 7 years to prove he was capable.,23,bkwrds,/r/nba/comments/zk347/anyone_here_think_chris_bosh_talents_are/c65ale8/,c65ale8,1347150630.0,1347121830.0,Anyone here think Chris bosh talents are underutilized in Miami due to Lebron and wade.,48,zk347
722,"They wouldn't be that bad of a starting 5
PG: Kemba Walker or Ramon Sessions
SG: Ben Gordon or Gerald Henderson
SF: Lebron James (back up is kidd-gilchrist)
PF: Tyrus Thomas
C: Bitchsmack Biyombo
[Not bad](http://i0.kym-cdn.com/photos/images/original/000/138/244/funny-barack-michelle-obama-face.jpg?1308706785)",34,toppswagg,/r/nba/comments/z580o/okay_guys_say_lebron_was_on_the_bobcats_do_you/c61jssh/,c61jssh,1346464703.0,1346435903.0,"Okay guys say LeBron was on the Bobcats, do you think he could take them to the ECF? Or maybe even the finals",46,z580o
723,"The talent & morale boost would likely make them a playoff team...but, with surrounding talent that doesn't even match Cleveland's, they'd get booted first or second round at best.",65,sirmcquade,/r/nba/comments/z580o/okay_guys_say_lebron_was_on_the_bobcats_do_you/c61jkbz/,c61jkbz,1346463858.0,1346435058.0,"Okay guys say LeBron was on the Bobcats, do you think he could take them to the ECF? Or maybe even the finals",46,z580o
724,"Ok sports fans, LeBron did not have the best supporting cast in Cleveland. Even I can admit that. But the Cavs were built to compliment LeBron. At its most basic, that meant people who could spread the floor. The only reliable to very good 3 point shooter on the Bobcats right now is Ben Gordon. As for the Cavs, they had (let's go with 2008-2010, the Cavs' two 60 win seasons) Mo Williams, Anthony Parker, Delonte West, Boobie Gibson, Antawn Jamison, and Wally Szczerbiak. On top of that the Cavs had Zydrunas Ilgauskus, who as I recall, played the pick and pop pretty well with Bron. Beyond people who could hit open jumpers, the Cavs were also a well-seasoned veteran team composed of good role-players, while the Bobcats are young as hell with only Sessions and Gordon as players who are good now (MKG will probably be awesome soon, while Biyombo and Walker have potential).

On top of that, you have to look at the coaches. I know Mike Brown is not popular around here, but he is one of the best defensive coaches in the league. His schemes with the Cavs were incredible. 2009-2010 they finished first in defensive efficiency, that's with only LeBron getting any all-nba defense considerations. In 2008-2010 they finished eighth, which is pretty good considering they had defensive sieves in Mo, Jamison, and Shaq. Now maybe Mike Dunlap will surpass Red Auerbach and Phil Jackson as the G.C.O.A.T, but it's not going to happen next season. He's a new NBA coach with a young team, never a pretty combinations. 

So I do agree with everyone saying LeBron could get them to the playoffs, but to people saying ""look what he did with the scrubs on the Cavs hurr-hurr"" you are simplifying things waaaay too much.",23,JohnnyZombie,/r/nba/comments/z580o/okay_guys_say_lebron_was_on_the_bobcats_do_you/c61llle/,c61llle,1346471102.0,1346442302.0,"Okay guys say LeBron was on the Bobcats, do you think he could take them to the ECF? Or maybe even the finals",46,z580o
725,[deleted],21,,/r/nba/comments/z580o/okay_guys_say_lebron_was_on_the_bobcats_do_you/c61jj9l/,c61jj9l,1346463749.0,1346434949.0,"Okay guys say LeBron was on the Bobcats, do you think he could take them to the ECF? Or maybe even the finals",46,z580o
726,Buckets?!,37,yourenottrying,/r/nba/comments/yzh1w/lebron_james_is_a_master_at_physics/c6078mw/,c6078mw,1346225424.0,1346196624.0,Lebron James is a master at physics,57,yzh1w
727,[deleted],24,,/r/nba/comments/yzh1w/lebron_james_is_a_master_at_physics/c606m6a/,c606m6a,1346222870.0,1346194070.0,Lebron James is a master at physics,57,yzh1w
728,"**Lebron's Law of Projectery:** 

[Draft in Arena(2.5) / 6] -^lil'bit (Windchill) = 40 ft. Behind-the-Backboard Shot

GENIUS!!!!",39,r9j0nr0nd0,/r/nba/comments/yzh1w/lebron_james_is_a_master_at_physics/c607oxw/,c607oxw,1346227289.0,1346198489.0,Lebron James is a master at physics,57,yzh1w
729,"TIL being called a ""dirty player"" is now a compliment. 

",54,fishgats,/r/nba/comments/yva7c/lebron_is_fucking_dirty_yall_maybe_i_was_a/c5z68l4/,c5z68l4,1346051986.0,1346023186.0,"Lebron is fucking dirty yall, maybe I was a hater...but wow he.is.dirty",46,yva7c
730,"""The extension, the spread eagle, the posterization of the imaginary defender."" - some dude on shrooms",25,TheLangolier,/r/nba/comments/yva7c/lebron_is_fucking_dirty_yall_maybe_i_was_a/c5z6w4z/,c5z6w4z,1346054692.0,1346025892.0,"Lebron is fucking dirty yall, maybe I was a hater...but wow he.is.dirty",46,yva7c
731,"I love how he actually answered the hairline question, and wasn't offended.",129,FriendEater,/r/nba/comments/yuqt7/lebron_james_answered_15_fan_questions_including/c5z09ic/,c5z09ic,1346026049.0,1345997249.0,"LeBron James answered 15 fan questions including his hairline, favorite movie, favorite superhero, and the potential for him appearing in Space Jam 2.",262,yuqt7
732,"Oh dear lord, Skip Bayless is going to go on an 40 minute tirade about that tweet on Monday. I was surprised to see that he answered it at all, even though his answer wasn't anything noteworthy. Thanks for posting all of this though, that was cool to read.",25,yurtyybomb,/r/nba/comments/yuqt7/lebron_james_answered_15_fan_questions_including/c5z0cmn/,c5z0cmn,1346026482.0,1345997682.0,"LeBron James answered 15 fan questions including his hairline, favorite movie, favorite superhero, and the potential for him appearing in Space Jam 2.",262,yuqt7
733,"I could imagine Lebron shouting in an opposing arena:

""Are you not entertained?!""",50,gandalf_grey_beer,/r/nba/comments/yuqt7/lebron_james_answered_15_fan_questions_including/c5z0cyl/,c5z0cyl,1346026525.0,1345997725.0,"LeBron James answered 15 fan questions including his hairline, favorite movie, favorite superhero, and the potential for him appearing in Space Jam 2.",262,yuqt7
734,NBA players work overtime to keep the memory of 'Martin' alive. ,27,xMdot,/r/nba/comments/yuqt7/lebron_james_answered_15_fan_questions_including/c5z0oug/,c5z0oug,1346028084.0,1345999284.0,"LeBron James answered 15 fan questions including his hairline, favorite movie, favorite superhero, and the potential for him appearing in Space Jam 2.",262,yuqt7
735,It makes it seem like he's a real person. Like with feelings and stuff. WHAT A LIE.,36,,/r/nba/comments/yuqt7/lebron_james_answered_15_fan_questions_including/c5z0h0p/,c5z0h0p,1346027063.0,1345998263.0,"LeBron James answered 15 fan questions including his hairline, favorite movie, favorite superhero, and the potential for him appearing in Space Jam 2.",262,yuqt7
736,"Ok, the hairline answer was clever as fuck",35,andrasi,/r/nba/comments/yuqt7/lebron_james_answered_15_fan_questions_including/c5z0cx3/,c5z0cx3,1346026519.0,1345997719.0,"LeBron James answered 15 fan questions including his hairline, favorite movie, favorite superhero, and the potential for him appearing in Space Jam 2.",262,yuqt7
737,"Love Starbury in there, just popping in to say hi",36,Roland19,/r/nba/comments/yr7wz/jordan_vs_lebron_in_sneaker_costs/c5y3pxd/,c5y3pxd,1345851424.0,1345822624.0,Jordan vs Lebron (in sneaker costs),30,yr7wz
738,"Does not take inflation and other economy factors into account, and neither the features that are built into the shoes and the materials used to make them. Also, comparing opposing items is painful with the way the bars are presented.

It looks nice, but the items mentioned above make it just *good* instead of *excellent*.",23,X-Craft,/r/nba/comments/yr7wz/jordan_vs_lebron_in_sneaker_costs/c5y43an/,c5y43an,1345852753.0,1345823953.0,Jordan vs Lebron (in sneaker costs),30,yr7wz
739,A strong contender for worst infographic ever - all those bar graphs could just as well not be there.,56,tetrakaidecahedron,/r/nba/comments/yr7wz/jordan_vs_lebron_in_sneaker_costs/c5y328y/,c5y328y,1345848963.0,1345820163.0,Jordan vs Lebron (in sneaker costs),30,yr7wz
740,[deleted],51,,/r/nba/comments/yoy72/ya_think_lebron/c5xjvle/,c5xjvle,1345760774.0,1345731974.0,"Ya think, Lebron?",181,yoy72
741,Those are sick tho... ,41,,/r/nba/comments/yoy72/ya_think_lebron/c5xkl4p/,c5xkl4p,1345763520.0,1345734720.0,"Ya think, Lebron?",181,yoy72
742,"They actually cost $180. There a special is a model that has Nike's ""+"" technology in it, which like a mini computer. Those will cost $315, but regular model will just be $180. ",48,lannix,/r/nba/comments/ykxlt/nikes_lebron_x_sneakers_to_cost_315/c5wi614/,c5wi614,1345589594.0,1345560794.0,Nike's LeBron X sneakers to cost $315,30,ykxlt
743,"Some people question LeBron's will to win, but by all appearances, he certainly loves winning. ",21,,/r/nba/comments/y4ps5/lebron_and_coach_k_after_the_win_a_moment_of_pure/c5sbgzi/,c5sbgzi,1344866297.0,1344837497.0,"LeBron and Coach K after the win. A moment of pure, unbridled joy.",111,y4ps5
744,[deleted],74,,/r/nba/comments/y3jk4/lebron_celebrating_victory_with_a_dance/c5s074a/,c5s074a,1344818756.0,1344789956.0,LeBron celebrating victory with a dance,287,y3jk4
745,Kevin Love standing there giving zero fucks,33,slater912,/r/nba/comments/y3jk4/lebron_celebrating_victory_with_a_dance/c5s1045/,c5s1045,1344822289.0,1344793489.0,LeBron celebrating victory with a dance,287,y3jk4
746,"Somewhere, Derrick Rose frowns disapprovingly...again. ",50,Diggity_Dave,/r/nba/comments/y3jk4/lebron_celebrating_victory_with_a_dance/c5s0qrt/,c5s0qrt,1344821164.0,1344792364.0,LeBron celebrating victory with a dance,287,y3jk4
747,Did he really dance that fast? &#3232;\_&#3232;,26,yall_crazy,/r/nba/comments/y3jk4/lebron_celebrating_victory_with_a_dance/c5s0777/,c5s0777,1344818766.0,1344789966.0,LeBron celebrating victory with a dance,287,y3jk4
748,"Maybe Magic Johnson has them both beat, depending on what you mean by ""complete.""  Certainly Magic has more triple doubles.  However, I must say that MJ and LeBron are better on defense than Magic.  MJ has that element of insane competitiveness, even for a pro athlete.  But MJ was viewed very differently when he had won no championships, or only one.  Let's see what LeBron does in the next seven years before we jump to any conclusions.",43,wjbc,/r/nba/comments/y2969/is_lebron_james_a_more_complete_player_than_mike/c5rnxw2/,c5rnxw2,1344747283.0,1344718483.0,Is Lebron James a more complete player than Mike?,61,y2969
749,[deleted],41,,/r/nba/comments/y2969/is_lebron_james_a_more_complete_player_than_mike/c5rpsit/,c5rpsit,1344755950.0,1344727150.0,Is Lebron James a more complete player than Mike?,61,y2969
750,And hes not even the point guard.. wouldja look at that,31,U_SO_FANNY,/r/nba/comments/y0oxb/lebron_james_now_holds_us_olympic_record_for/c5r9iuo/,c5r9iuo,1344665215.0,1344636415.0,LeBron James now holds US Olympic record for total assists,59,y0oxb
751,"Yo, this motherfucker's gonna make a serious bid for the GOAT once his career is up.",29,jaykoo21,/r/nba/comments/y0oxb/lebron_james_now_holds_us_olympic_record_for/c5rckii/,c5rckii,1344678859.0,1344650059.0,LeBron James now holds US Olympic record for total assists,59,y0oxb
752,"It's hilarious how every single media out there suddenly acknowledges his greatness. Although he gets better every year, he's playing on this level for years now. It's just a joke how he went from ''backing down'', ''not clutch'' or ''still ringless'' to ''most dominant force'', ''most versatile player'', ''biggest facilitator'', ''closer'', ''big time player'' and so on.   

He's all of this since years. Not just one season, or since he's in Miami. It's a shame how US medias can only jump from storyline to storyline and not be only a tiny little bit objective about what they're talking. I know that they seek for audience and that it's the easiest way to get even the dumbest consumer out there, but come on, that 180° is a joke. That ring doesn't make his play one inch better than it was before, but he suddendly wen't from bust to *the guy who could possibly push MJ off the trone, in 3-4 years or so*.

What's the next storyline everybody will have to jump on? Is Dwightmare already over? Hey, what about Melo? He's fat and still didn't get past the first round of the POs once right? What a bust.",57,FridayNightHoops,/r/nba/comments/xxcl5/some_great_quotes_here_cp3_on_lebron_hes_what_six/c5qepls/,c5qepls,1344520806.0,1344492006.0,"Some great quotes here: CP3 on Lebron: ""He's, what, six or seven inches taller than me and maybe 60 pounds [heavier] than me. And he can do everything I can do with the ball. Almost."" and Coach K on Lebron: ""He's the best basketball player in the world right now ...And he showed that tonight.""",50,xxcl5
753,"MVP, FMVP, member of Olympic record breaking team, first Olympics triple double by US player, what a year",23,yall_crazy,/r/nba/comments/xxcl5/some_great_quotes_here_cp3_on_lebron_hes_what_six/c5qezon/,c5qezon,1344522266.0,1344493466.0,"Some great quotes here: CP3 on Lebron: ""He's, what, six or seven inches taller than me and maybe 60 pounds [heavier] than me. And he can do everything I can do with the ball. Almost."" and Coach K on Lebron: ""He's the best basketball player in the world right now ...And he showed that tonight.""",50,xxcl5
754,"Your right that the ring doesn't make him better. I look at it like testing in school. The test itself doesn't make you smarter it gauges where you are. LeBron was getting A+ on every homework assignment but was struggling with the tests. He finally had a semester where he had good homework grades AND aced the finals (theres no possible way I couldn't have made that pun), now we can admire his smartness in full circle because there isn't much left to improve even though we always knew he was smart.",23,sayqueensbridge,/r/nba/comments/xxcl5/some_great_quotes_here_cp3_on_lebron_hes_what_six/c5qf9lq/,c5qf9lq,1344523881.0,1344495081.0,"Some great quotes here: CP3 on Lebron: ""He's, what, six or seven inches taller than me and maybe 60 pounds [heavier] than me. And he can do everything I can do with the ball. Almost."" and Coach K on Lebron: ""He's the best basketball player in the world right now ...And he showed that tonight.""",50,xxcl5
755,"I know what LBJ looks like, link to the boxscore would have been handy :)",220,imadepoopy,/r/nba/comments/xwqf0/the_first_triple_double_in_olympic_history/c5q8v6e/,c5q8v6e,1344497586.0,1344468786.0,"The first triple double in Olympic history.  Congratulations LeBron, keep it rolling to the gold.",632,xwqf0
756,And no turnovers. Which is fuckign unreal.,55,,/r/nba/comments/xwqf0/the_first_triple_double_in_olympic_history/c5qblmq/,c5qblmq,1344508237.0,1344479437.0,"The first triple double in Olympic history.  Congratulations LeBron, keep it rolling to the gold.",632,xwqf0
757,I have to say I am very proud of the Australian boombers takeing USA to three quarters. ,39,Shermanpk,/r/nba/comments/xwqf0/the_first_triple_double_in_olympic_history/c5q9x28/,c5q9x28,1344501733.0,1344472933.0,"The first triple double in Olympic history.  Congratulations LeBron, keep it rolling to the gold.",632,xwqf0
758,LeBron lost more than a dollar throwing all those dimes.,101,toppswagg,/r/nba/comments/xwqf0/the_first_triple_double_in_olympic_history/c5q8qb4/,c5q8qb4,1344497068.0,1344468268.0,"The first triple double in Olympic history.  Congratulations LeBron, keep it rolling to the gold.",632,xwqf0
759,"If he turns it on, it's over. The superstar of superstars.",60,ionescorhino,/r/nba/comments/xwqf0/the_first_triple_double_in_olympic_history/c5q93kp/,c5q93kp,1344498487.0,1344469687.0,"The first triple double in Olympic history.  Congratulations LeBron, keep it rolling to the gold.",632,xwqf0
760,"What a year he's having. Another MVP, an NBA Championship, and well on his way to another Olympic Gold. Not bad considering this time last year he was probably the most disliked player in the league.

He made a pretty stupid mistake with the Decision, but since then he's been nothing but professional. Now he's got his ring, all the pressure is off, and the entire country is cheering him on as he leads us to an Olympic Gold. This could be the year that everyone stops looking for reasons to hate him and starts including him in the discussion for the best ever.",96,f_yo_team_clown,/r/nba/comments/xwqf0/the_first_triple_double_in_olympic_history/c5qa6nr/,c5qa6nr,1344502797.0,1344473997.0,"The first triple double in Olympic history.  Congratulations LeBron, keep it rolling to the gold.",632,xwqf0
761,that was a Jason Kidd-esque triple double; 11 points 11 assists 14 rebounds,26,MiamiFootball,/r/nba/comments/xwqf0/the_first_triple_double_in_olympic_history/c5q9rfe/,c5q9rfe,1344501114.0,1344472314.0,"The first triple double in Olympic history.  Congratulations LeBron, keep it rolling to the gold.",632,xwqf0
762,There is no way Lebron would be able to handle Lebron. ,123,Ragingcroc,/r/nba/comments/xudu0/lebron_james_admits_current_usa_basketball_team/c5pp4lc/,c5pp4lc,1344408729.0,1344379929.0,LeBron James Admits Current USA Basketball Team Couldn't Beat 2012 Miami Heat,195,xudu0
763,Skip Bayless has found a new source.,107,mortymight,/r/nba/comments/xudu0/lebron_james_admits_current_usa_basketball_team/c5pnwb5/,c5pnwb5,1344404008.0,1344375208.0,LeBron James Admits Current USA Basketball Team Couldn't Beat 2012 Miami Heat,195,xudu0
764,Imagine a team only with LeBrons. Somebody tell me how to make this happen on 2k12.,28,FridayNightHoops,/r/nba/comments/xudu0/lebron_james_admits_current_usa_basketball_team/c5pqwdt/,c5pqwdt,1344415880.0,1344387080.0,LeBron James Admits Current USA Basketball Team Couldn't Beat 2012 Miami Heat,195,xudu0
765,"Is it bad it took me until ""Chalmers"" to realize the article was a joke?",36,dangots0ul,/r/nba/comments/xudu0/lebron_james_admits_current_usa_basketball_team/c5poqgn/,c5poqgn,1344407204.0,1344378404.0,LeBron James Admits Current USA Basketball Team Couldn't Beat 2012 Miami Heat,195,xudu0
766,So an Onion article is right for once? ,32,ayyyooomymayo,/r/nba/comments/xudu0/lebron_james_admits_current_usa_basketball_team/c5pnz68/,c5pnz68,1344404304.0,1344375504.0,LeBron James Admits Current USA Basketball Team Couldn't Beat 2012 Miami Heat,195,xudu0
767,Dwight demanding a trade to team USA.,233,noobeater,/r/nba/comments/xtsqg/anyone_know_what_lebron_and_durant_are_laughing/c5piyhs/,c5piyhs,1344386794.0,1344357994.0,Anyone know what Lebron and Durant are laughing about?,67,xtsqg
768,"Lebron: ""Why is Aaron Brooks on the women's gymnastics team?""
",44,Hijyre3291,/r/nba/comments/xtsqg/anyone_know_what_lebron_and_durant_are_laughing/c5pkgkd/,c5pkgkd,1344392072.0,1344363272.0,Anyone know what Lebron and Durant are laughing about?,67,xtsqg
769,I think this was when D-will got crossed over.,24,D_Dumps,/r/nba/comments/xtsqg/anyone_know_what_lebron_and_durant_are_laughing/c5pi5tf/,c5pi5tf,1344383745.0,1344354945.0,Anyone know what Lebron and Durant are laughing about?,67,xtsqg
770,this was probably when deron williams did the split like james harden,41,wlo18,/r/nba/comments/xtsqg/anyone_know_what_lebron_and_durant_are_laughing/c5pi432/,c5pi432,1344383577.0,1344354777.0,Anyone know what Lebron and Durant are laughing about?,67,xtsqg
771,"""wouldn't it be funny if you came to the heat?!.....no, but seriously""",73,kingbinji,/r/nba/comments/xtsqg/anyone_know_what_lebron_and_durant_are_laughing/c5pigt5/,c5pigt5,1344384944.0,1344356144.0,Anyone know what Lebron and Durant are laughing about?,67,xtsqg
772,James Harden's broken ankle.,28,yall_crazy,/r/nba/comments/xtsqg/anyone_know_what_lebron_and_durant_are_laughing/c5piesc/,c5piesc,1344384726.0,1344355926.0,Anyone know what Lebron and Durant are laughing about?,67,xtsqg
773,Carmelo's Defense,88,Dearerstill,/r/nba/comments/xtsqg/anyone_know_what_lebron_and_durant_are_laughing/c5pi9ci/,c5pi9ci,1344384125.0,1344355325.0,Anyone know what Lebron and Durant are laughing about?,67,xtsqg
774,"Tyson Chandler: ""I think the Knicks have a good chance this year"" ",44,XK310,/r/nba/comments/xtsqg/anyone_know_what_lebron_and_durant_are_laughing/c5pivr8/,c5pivr8,1344386514.0,1344357714.0,Anyone know what Lebron and Durant are laughing about?,67,xtsqg
775,[deleted],25,,/r/nba/comments/xsjha/lebron_doing_his_best_chris_bosh_impression/c5paloz/,c5paloz,1344338288.0,1344309488.0,Lebron doing his best Chris Bosh impression,333,xsjha
776,[gif 2](http://i.imgur.com/WUhLD.gif),26,_Circlejerk_,/r/nba/comments/xsjha/lebron_doing_his_best_chris_bosh_impression/c5p6vmf/,c5p6vmf,1344323820.0,1344295020.0,Lebron doing his best Chris Bosh impression,333,xsjha
777,Reminds me of [Aldon Smith.](http://nbcoutofbounds.files.wordpress.com/2011/12/aldonsmith.gif),144,el_chupa_cabra,/r/nba/comments/xsio9/lebron_runs_to_the_bench_after_his_4th_foul/c5p7lm6/,c5p7lm6,1344326685.0,1344297885.0,LeBron runs to the bench after his 4th foul,439,xsio9
778,I'm either on coke or that shit is sped up.,79,,/r/nba/comments/xsio9/lebron_runs_to_the_bench_after_his_4th_foul/c5p6rli/,c5p6rli,1344323384.0,1344294584.0,LeBron runs to the bench after his 4th foul,439,xsio9
779,"Good job, good effort.",60,,/r/nba/comments/xsio9/lebron_runs_to_the_bench_after_his_4th_foul/c5p79dr/,c5p79dr,1344325324.0,1344296524.0,LeBron runs to the bench after his 4th foul,439,xsio9
780,"Ginobili had that shove coming to him.

I bet Lebron was thinking, ""Hey, here's one you don't have to fake.""",59,,/r/nba/comments/xsio9/lebron_runs_to_the_bench_after_his_4th_foul/c5p6wje/,c5p6wje,1344323919.0,1344295119.0,LeBron runs to the bench after his 4th foul,439,xsio9
781,"I'm not the biggest Lebron fan, but this cracked me up. At least he knew haha. ",26,Retawtrams,/r/nba/comments/xsio9/lebron_runs_to_the_bench_after_his_4th_foul/c5p7u1k/,c5p7u1k,1344327609.0,1344298809.0,LeBron runs to the bench after his 4th foul,439,xsio9
782,http://www.youtube.com/watch?v=mnL4bvCaLtY&feature=youtube_gdata_player,26,takeyourdrugs,/r/nba/comments/xsio9/lebron_runs_to_the_bench_after_his_4th_foul/c5p73jg/,c5p73jg,1344324691.0,1344295891.0,LeBron runs to the bench after his 4th foul,439,xsio9
783,"Based on a [camera system installed in ten arenas](http://nba-point-forward.si.com/2012/03/08/who-is-really-the-fastest-point-guard/), ""Parker has reached a high speed of 20.9 miles per hour in one stretch of in-game sprinting, easily the highest speed any of these guys have registered.""
EDIT: At that rate, he would be a 10.70.",25,MidnightSpecialist,/r/nba/comments/xrfd0/after_bolts_100m_race_in_963_i_was_curious_to/c5ozhio/,c5ozhio,1344296181.0,1344267381.0,"After Bolt's 100m race in 9.63, i was curious to know how fast would NBA players make it. Lebron for example, any idea?",27,xrfd0
784,I'm not sure you understand the concept of humping.,161,,/r/nba/comments/xl7xd/kobe_humping_lebron/c5nbp27/,c5nbp27,1343977322.0,1343948522.0,Kobe humping LeBron,178,xl7xd
785,I wish USA Olympic Basketball played every summer. I love watching all these guys having fun together.,56,CatMinion,/r/nba/comments/xl7xd/kobe_humping_lebron/c5nbq7r/,c5nbq7r,1343977447.0,1343948647.0,Kobe humping LeBron,178,xl7xd
786,"Hey. Hey. Lebron. Hey Lebron. Hey Lebron.

WHAT????

Hi.",41,uber_troll,/r/nba/comments/xl7xd/kobe_humping_lebron/c5nccqt/,c5nccqt,1343979968.0,1343951168.0,Kobe humping LeBron,178,xl7xd
787,This is the highest quality .gif i've seen in my life.,57,neondeon21,/r/nba/comments/xh6rt/lebron_and_durant_share_a_love_stare/c5mbzqc/,c5mbzqc,1343812799.0,1343783999.0,LeBron and Durant share a love stare,482,xh6rt
788,someone farted. ,26,JLyons043,/r/nba/comments/xh6rt/lebron_and_durant_share_a_love_stare/c5mb2al/,c5mb2al,1343808840.0,1343780040.0,LeBron and Durant share a love stare,482,xh6rt
789,"Lebron: ""Wait a second whats a Tunisia?""

KD: ""God dammit Lebron.""
",79,funnibot,/r/nba/comments/xh6rt/lebron_and_durant_share_a_love_stare/c5mazld/,c5mazld,1343808516.0,1343779716.0,LeBron and Durant share a love stare,482,xh6rt
790,"It looks as if he's saying, ""Look, Mr. President. *She* came on to *me*.""",69,,/r/nba/comments/xfxpy/lebron_hugs_michelle_obama/c5m0xdr/,c5m0xdr,1343767122.0,1343738322.0,LeBron hugs Michelle Obama,143,xfxpy
791,Well done Draco. Well done.,31,,/r/nba/comments/xfxpy/lebron_hugs_michelle_obama/c5m23z3/,c5m23z3,1343773415.0,1343744615.0,LeBron hugs Michelle Obama,143,xfxpy
