,body,score,author,permalink,comment_id,created_loc,created_utc,post_title,post_score,post_id
451,"I honestly don't believe this bullshit about Lebron wanting to go the Lakers blah blah, but I don't think Gilbert is looking forward to giving Lebron over 40m/year until he's 38, so Gilbert might be low key pushing Lebron away since they got the ship.",27,DemonicDimples,/r/nba/comments/6o5g7x/nba_free_agency_dan_gilbert_clearing_path_out_of/dkesyd4/,dkesyd4,1500461148.0,1500432348.0,NBA free agency: Dan Gilbert clearing path out of Cleveland for LeBron James,54,6o5g7x
452,"-have the team give all out big contracts to your friends
-be capped out
-be mad 
",85,xJustinian,/r/nba/comments/6o5g7x/nba_free_agency_dan_gilbert_clearing_path_out_of/dkeqw83/,dkeqw83,1500458490.0,1500429690.0,NBA free agency: Dan Gilbert clearing path out of Cleveland for LeBron James,54,6o5g7x
453,Pierce is the biggest LeBron hater lol,69,DeKobe-DeBryant,/r/nba/comments/6o3wau/slam_paul_pierce_says_celtics_are_ready_to/dkedv9n/,dkedv9n,1500442390.0,1500413590.0,[SLAM] Paul Pierce Says Celtics Are Ready 'To Dethrone LeBron',47,6o3wau
454,Paul Pierce says a lot of stupid shit,190,,/r/nba/comments/6o3wau/slam_paul_pierce_says_celtics_are_ready_to/dkedn8p/,dkedn8p,1500442152.0,1500413352.0,[SLAM] Paul Pierce Says Celtics Are Ready 'To Dethrone LeBron',47,6o3wau
455,Said every team for the last 7 years,37,6eezus,/r/nba/comments/6o3wau/slam_paul_pierce_says_celtics_are_ready_to/dkedmzq/,dkedmzq,1500442144.0,1500413344.0,[SLAM] Paul Pierce Says Celtics Are Ready 'To Dethrone LeBron',47,6o3wau
456,Paul Pierce is probably the saltiest player of the last 10-15 years.,92,Redxstryker,/r/nba/comments/6o3wau/slam_paul_pierce_says_celtics_are_ready_to/dkedmvv/,dkedmvv,1500442141.0,1500413341.0,[SLAM] Paul Pierce Says Celtics Are Ready 'To Dethrone LeBron',47,6o3wau
457,I have a hard time taking Pierce seriously after he retired.,34,Somali_Kamikaze,/r/nba/comments/6o3wau/slam_paul_pierce_says_celtics_are_ready_to/dkedntb/,dkedntb,1500442169.0,1500413369.0,[SLAM] Paul Pierce Says Celtics Are Ready 'To Dethrone LeBron',47,6o3wau
458,"And just like they did, another team can take it to the next level and become the new dynasty 

Seriously, things change quickly  in this league",1609,htown_hold_it_down,/r/nba/comments/6o230o/bill_simmons_at_the_start_of_the_decade_everyone/dkdy8ke/,dkdy8ke,1500426004.0,1500397204.0,"Bill Simmons: At the start of the decade everyone thought OKC, Chicago, and whatever team Lebron is on is going to rule the decade. This Warriors dynasty came out of nowhere.",2518,6o230o
459,"Bulls potential dynasty got derailed by Rose's injury, can't fault someone thinking that the team with the youngest MVP in the league might be setup for greatness. 
OKC unfortunately never got over the hump after trading Harden.
Kawhi helped Spurs get another couple of cracks at it which hurt OKC.
Heat/CAVS aka Lebron have played in the last 7 finals.  By and large not a terrible prediction. I concede that GSW was the perfect storm. 


",551,kill3r7,/r/nba/comments/6o230o/bill_simmons_at_the_start_of_the_decade_everyone/dkdz4vk/,dkdz4vk,1500426903.0,1500398103.0,"Bill Simmons: At the start of the decade everyone thought OKC, Chicago, and whatever team Lebron is on is going to rule the decade. This Warriors dynasty came out of nowhere.",2518,6o230o
460,"The warriors had enormous luck to what their dynasty is.  To their full credit though they did an amazing job in assessing talent and drafting the players they did.  No to mention they capitalized on the luck they had and continued the momentum.

Some of the things though that will never happen again which made this dynasty ""Come out of nowhere""
1) Curry's injuries and him signing a very reasonable ~44M extension and then taking off as a MVP player.  Curry's leap was just phenomenal and I do believe a lot has to do with the development at GS.

2) Losing out on the Dwight Howard sweepstakes.  They went after him hard and lost out and ""settled"" for Iguodala instead.  Howard is the better player of course but Iggy is the much better fit for GSW.  At the time though the Iggy signing seemed to be a consolation prize.

3) David Lee's injury.  While I do believe Draymond would eventually be discovered it wasn't a given and Kerr had little choice early on but to start Green over Lee and the rest is history.  (again massive amount of credit to GSW player development with Green)

4)Klay and Dray having their max extension signed before the cap jump, this helps tremendously in today's NBA.  Klay is due 35M for the next two seasons and Draymond 52M over the next 3.  This is ridiculously good value for their talents right now.  (Consider that a guy like Kent Bazemore will make the same as Klay next two years and a guy like Ryan Anderson more than both Klay and Draymond next two years)

5)the cap hike instead of smoothing out the cap allowed them to sign Durant (along with Curry's small contract).  I dont expect this to EVER happen again even if the cap goes up with an even bigger TV contract I think the CBA will smooth out the cap.  Even for the players, last off season we saw a ton of big contracts given out and then this year the market dried up fast with owners being smarter.  That huge cap spike again allowed them to sign Durant at his market value without having to give up anything of their core outside of Barnes (who KD was replacing anyway)


Again while they had a ton of luck/unique opportunities the GSW front office needs to be given a ton of credit for jumping on those.  I remember when they gave Draymond the max there was a lot of talk of an over pay but he has improved since that signing and now is one of the best contracts in the NBA.  While Klay was more deserving of the max to be able to max him before the big cap jumps helped tremendously for them.  Of course now their 'luck' is running out having to pay Curry now his ""market value"", Iggy (getting paid more per year on new contract than old), and KD (despite the discount).  They have an amazing team and have done a job developing talent that is only rivaled by the Spurs IMO, they will have to pay now though for that team.  Discounts though like the on KD made will help them save money though, but outside of injuries to their main 4 I dont see how they will be stopped at least in the next two years (when Klay's contract expires)",256,the_yoyo,/r/nba/comments/6o230o/bill_simmons_at_the_start_of_the_decade_everyone/dkdzweg/,dkdzweg,1500427676.0,1500398876.0,"Bill Simmons: At the start of the decade everyone thought OKC, Chicago, and whatever team Lebron is on is going to rule the decade. This Warriors dynasty came out of nowhere.",2518,6o230o
461,Forgot one of the best parts: Steph winning 2 MVP's when he was on a 4 year/$44m contract ,26,YoungKeys,/r/nba/comments/6o230o/bill_simmons_at_the_start_of_the_decade_everyone/dkeb1qt/,dkeb1qt,1500439323.0,1500410523.0,"Bill Simmons: At the start of the decade everyone thought OKC, Chicago, and whatever team Lebron is on is going to rule the decade. This Warriors dynasty came out of nowhere.",2518,6o230o
462,"That's because Steph Curry, he of the dominating +/- and net rating (even when adjusted for teammates and opponents) came out of nowhere. No one imagined someone could have a level of offensive skill that far above everyone else. People worship height, and size, and vertical, but it turns out skill can more than make up for it.",24,formido,/r/nba/comments/6o230o/bill_simmons_at_the_start_of_the_decade_everyone/dke9h5d/,dke9h5d,1500437642.0,1500408842.0,"Bill Simmons: At the start of the decade everyone thought OKC, Chicago, and whatever team Lebron is on is going to rule the decade. This Warriors dynasty came out of nowhere.",2518,6o230o
463,The memory of the Bulls' possible dominance hurts as much as Rose's knees,74,cgk205,/r/nba/comments/6o230o/bill_simmons_at_the_start_of_the_decade_everyone/dkdzaqk/,dkdzaqk,1500427067.0,1500398267.0,"Bill Simmons: At the start of the decade everyone thought OKC, Chicago, and whatever team Lebron is on is going to rule the decade. This Warriors dynasty came out of nowhere.",2518,6o230o
464,"It took quite a bit of luck but it was an amazing job. 

I feel bad for the Cavs because Love was an excellent signing until the Warriors re-designed what you needed to be a championship team. ",84,,/r/nba/comments/6o230o/bill_simmons_at_the_start_of_the_decade_everyone/dkdykd4/,dkdykd4,1500426334.0,1500397534.0,"Bill Simmons: At the start of the decade everyone thought OKC, Chicago, and whatever team Lebron is on is going to rule the decade. This Warriors dynasty came out of nowhere.",2518,6o230o
465,"Wow, from country singer to sit com star to nba reporter, Reba sure can do it all",90,CaptainKirkHinrich,/r/nba/comments/6o1xhs/mcintyre_11_months_out_lakers_76ers_maybe_houston/dkdwvms/,dkdwvms,1500424625.0,1500395825.0,"[McIntyre] 11 months out: Lakers, 76ers & maybe Houston are the 3 landing spots for LeBron. Don't blame him. Blame the Warriors.",25,6o1xhs
466,So you're saying there's a chance. ,36,CWG4BF,/r/nba/comments/6o1xhs/mcintyre_11_months_out_lakers_76ers_maybe_houston/dkdwv5o/,dkdwv5o,1500424611.0,1500395811.0,"[McIntyre] 11 months out: Lakers, 76ers & maybe Houston are the 3 landing spots for LeBron. Don't blame him. Blame the Warriors.",25,6o1xhs
467,"> Houston

BANANA BEARD IS REAL!",23,nonetimeaccount,/r/nba/comments/6o1xhs/mcintyre_11_months_out_lakers_76ers_maybe_houston/dkdx1vz/,dkdx1vz,1500424799.0,1500395999.0,"[McIntyre] 11 months out: Lakers, 76ers & maybe Houston are the 3 landing spots for LeBron. Don't blame him. Blame the Warriors.",25,6o1xhs
468,"Blame the Warriors? For doing everything a team should be doing to win a championship? 

How about we hold the Cavs accountable?",41,hopsandhorns,/r/nba/comments/6o1xhs/mcintyre_11_months_out_lakers_76ers_maybe_houston/dkdyx6q/,dkdyx6q,1500426686.0,1500397886.0,"[McIntyre] 11 months out: Lakers, 76ers & maybe Houston are the 3 landing spots for LeBron. Don't blame him. Blame the Warriors.",25,6o1xhs
469,"Yes, blame us for everything!",49,SprayinChilean,/r/nba/comments/6o1xhs/mcintyre_11_months_out_lakers_76ers_maybe_houston/dkdwv7g/,dkdwv7g,1500424613.0,1500395813.0,"[McIntyre] 11 months out: Lakers, 76ers & maybe Houston are the 3 landing spots for LeBron. Don't blame him. Blame the Warriors.",25,6o1xhs
470,God forbid a team tries to win championships. Boo Warriors! You should be ashamed of yourselves!,23,MyLTPlayedinSD,/r/nba/comments/6o1xhs/mcintyre_11_months_out_lakers_76ers_maybe_houston/dkdwyja/,dkdwyja,1500424707.0,1500395907.0,"[McIntyre] 11 months out: Lakers, 76ers & maybe Houston are the 3 landing spots for LeBron. Don't blame him. Blame the Warriors.",25,6o1xhs
471,"Lebron has a durable and well-portioned body(not like poor Oden) and always had great running and landing mechanics, even back in high school. You never saw him stomp the floor like it owed him money, jarring his bones with every step. He runs and lands lightly, jumps effortlessly(using his core and barely bending knees).  

It's rare but you can notice it with some players. I can't tell if it's taught or they were born with it. Or both. The kind of unique movement that will keep your athleticism going much longer than the normal person. Vince Carter comes to mind. Older ones like Erving, Drexler and Hakeem. Even today, you could see the differences between them and other old big guys. They don't limp and still move pretty well(like Erving's recent dunk vid and Hakeem moving better than Dwight in training) Ewing moves like my grandpa which I think is partly because of his heavy running and not using his core enough to jump.

Derozan is a great example today - he just jumps easily and smoothly, using speed as an assist. I wince when I see Norman Powell slow down, bend legs a lot, then jump hard. It looks good and it works but it takes its toll over time. I kind of went off point, but you get the idea with Lebron. He is a unique one-in-a-million athlete with a body that can withstand and dominate any physical contact sport for many years.




",174,Akumetsu33,/r/nba/comments/6o0i50/with_all_talks_about_how_players_are_working_on/dkdqxsp/,dkdqxsp,1500418340.0,1500389540.0,"With all talks about how players are working on their landing mechanics (and even outrightly avoiding dunking) to avoid injuries and prolong their careers, it's amazing that LeBron had a career high on dunks on his 14th season at 32 years old",1065,6o0i50
472,Knee gone,467,Poughy,/r/nba/comments/6o0i50/with_all_talks_about_how_players_are_working_on/dkdl9y0/,dkdl9y0,1500410836.0,1500382036.0,"With all talks about how players are working on their landing mechanics (and even outrightly avoiding dunking) to avoid injuries and prolong their careers, it's amazing that LeBron had a career high on dunks on his 14th season at 32 years old",1065,6o0i50
473,The thing about Lebron is he lands very well and is very responsible when dunking and driving.  Most of his crazy athletic plays come when the playoffs start.  It also helps when he takes his midterm Lebreak to rest the joints.,401,,/r/nba/comments/6o0i50/with_all_talks_about_how_players_are_working_on/dkdnepk/,dkdnepk,1500413979.0,1500385179.0,"With all talks about how players are working on their landing mechanics (and even outrightly avoiding dunking) to avoid injuries and prolong their careers, it's amazing that LeBron had a career high on dunks on his 14th season at 32 years old",1065,6o0i50
474,I choose a book for reading,64,BigShotBosh,/r/nba/comments/6o0i50/with_all_talks_about_how_players_are_working_on/dkdl5vh/,dkdl5vh,1500410649.0,1500381849.0,"With all talks about how players are working on their landing mechanics (and even outrightly avoiding dunking) to avoid injuries and prolong their careers, it's amazing that LeBron had a career high on dunks on his 14th season at 32 years old",1065,6o0i50
475,Let's not compare human beings to soviet cyborgs such as LeBron James.,48,DangerzoneKenny,/r/nba/comments/6o0i50/with_all_talks_about_how_players_are_working_on/dkdr97u/,dkdr97u,1500418695.0,1500389895.0,"With all talks about how players are working on their landing mechanics (and even outrightly avoiding dunking) to avoid injuries and prolong their careers, it's amazing that LeBron had a career high on dunks on his 14th season at 32 years old",1065,6o0i50
476,Also that Vince Carter is entering his 21st NBA season at 40.,31,ragvamuffin,/r/nba/comments/6o0i50/with_all_talks_about_how_players_are_working_on/dkdtro3/,dkdtro3,1500421420.0,1500392620.0,"With all talks about how players are working on their landing mechanics (and even outrightly avoiding dunking) to avoid injuries and prolong their careers, it's amazing that LeBron had a career high on dunks on his 14th season at 32 years old",1065,6o0i50
477,I think shooters need to work on landing after a shot more than dunkers landing after a dunk. Like spread their legs out a bit to land about couple inches wider than normal landing spot. This can avoid a lot of Jalen Rose dirty moves. (Not using Zaza/Kawhi because Jalen Rose officially admitted he tried to hurt Kobe... ),41,asonofdevily,/r/nba/comments/6o0i50/with_all_talks_about_how_players_are_working_on/dkdly1a/,dkdly1a,1500411897.0,1500383097.0,"With all talks about how players are working on their landing mechanics (and even outrightly avoiding dunking) to avoid injuries and prolong their careers, it's amazing that LeBron had a career high on dunks on his 14th season at 32 years old",1065,6o0i50
478,"Elite athletes all use the Hyperarch Mechanism. That's why they dont get injured and turn their ankles. All the force goes to their glutes and their ankles stay locked in place.

Look at elite athletes' toes. They're curled back and mangled from being in the hyperarch. All fast runners/high jumpers have it/use the hyperarch, whether they're aware of it or not.

Skinny legs, tight calves, big butts. All things elite athletes have due to the hyperarch. They run on the balls of their feet and lift their knees using their glutes to run/jump insteaf of pulling their weight with their quads like most people.

EDIT.. More info:

gonna just type this out, I hope it doesn't sound too scrambled. 

When I put in that they lift their knees, I mean that they're not extending their leg out in front of them to pull themselves, using their quads. [This is how unathletic people run](https://www.youtube.com/watch?v=27T4TIra9pI), legs extending out in front of them pulling their weight with their quads. It takes them more steps to do so as well. Compare that to [Lebron running a fastbreak](https://www.youtube.com/watch?v=43u_SoEhOGQ) or [Usain Bolt running a 100m](https://www.youtube.com/watch?v=PH-3cHxXAK0). It takes them fewer steps because they are using their glutes to push themselves forwards while generating more power. At the same time their ankles are locked. Much like a dog or a horse. People wearing shoes, aka cushions under their feet, devolve the body's natural biomechanics. This is why I believe wearing multiple socks is VERY bad for developing athletes. Naturally, kids (or anyone in general) want to take their shoes off during foot races with their friends. It makes them faster as well as feel more comfortable. I can't remember the runner's name, but recently a woman sprinter beat a 100m wr after she switched to flat shoes right before the race. Flat shoes (no cushion) are going to feel more comfortable to these sprinters, helping their biomechanics.

To round it off, look at all the dominating athletes of our time. They all have the same traits. Huge butts, skinny legs, tight calves and messed up feet/toes (the messed up feet are from [pulling the toes towards the heel of the foot](https://i.ytimg.com/vi/sWhq-fklefM/maxresdefault.jpg). locking their ankles and getting into the hyperach, which is just a glute nerve connection). Zion Williamson, thicc. James Harden, thicc. Deandre jordan, super skinny legs.. thicc butt. [Jordan](http://images.sneakernews.com/wp-content/uploads/2010/11/air-jordan-retrospective-aj1-22.jpg), [Kobe](http://cdn1.thecomeback.com/crossoverchronicles/wp-content/uploads/sites/18/2013/12/KobeBryantLakers_TonyAllenGrizzlies121713.jpg), and [tmac](http://www.nba.com/media/playerfile/mcgrady_playfilegallery4.jpg) have some of the skinniest legs you'll see with thick buns.

Example of elite athletes' toes: [lebron](http://dranthonyweinert.com/wp-content/uploads/2013/09/lebronjames.jpg), [usain bolt](http://i.imgur.com/aURQcnm.jpg), [Michael Jordan](http://media.gettyimages.com/photos/basketball-us-olympic-trials-north-carolina-michael-jordan-gets-his-picture-id452024528) Jordan had CRAZY hyperarch. LOOK AT THOSE FEET.

Another thing these athletes have in common are tendons popping out. Their tendon that runs up the front of the shin and tendons on top of the feet will be visable when they're activating the hyperatch. Only ELITE athletes are in the hyperatch 24/7. [here's](http://lakers.newssurge.com/gallery/d/295522-1/Kobe+Bryant+gets+his+leg+looked+at+before+game+2+vs+OKC+during+the+2012+playoffs.JPG) an example of Kobe's feet tendons popping out. Notice the toes are curled back as well. [and here is blake's front tendon](http://i.dailymail.co.uk/i/pix/2011/07/17/article-2015748-0D0A027900000578-6_634x820.jpg)

And of course, the 6 pack comes along naturally for anyone that uses the hyperarch. It takes a lot of core strength to bounce (literally bounce), hyperarch users are all ""bouncy"". Remember anyone growing up who was naturally athletic? I guarantee they all had 6 packs.",88,Mr_Chill_friend,/r/nba/comments/6o0i50/with_all_talks_about_how_players_are_working_on/dkdnz5p/,dkdnz5p,1500414730.0,1500385930.0,"With all talks about how players are working on their landing mechanics (and even outrightly avoiding dunking) to avoid injuries and prolong their careers, it's amazing that LeBron had a career high on dunks on his 14th season at 32 years old",1065,6o0i50
479,"Dirk is close. 
1st in points, 2nd in rebs, 15th in stls, 7th in blocks. Missed out by being 30th in assists. 8th in 3 pts. ",592,treytakzona,/r/nba/comments/6o0baz/two_players_are_in_the_top25_active_leaders_of/dkdkkxi/,dkdkkxi,1500409682.0,1500380882.0,Two players are in the top-25 active leaders of all five major statistical categories: LeBron James and Vince Carter.,1582,6o0baz
480,"How could you forget Hakeem on your list of active players, op?",360,Brandon48236,/r/nba/comments/6o0baz/two_players_are_in_the_top25_active_leaders_of/dkdk53o/,dkdk53o,1500408897.0,1500380097.0,Two players are in the top-25 active leaders of all five major statistical categories: LeBron James and Vince Carter.,1582,6o0baz
481,Has anyone seen Hakeem?,133,Iamtheonedontweigha,/r/nba/comments/6o0baz/two_players_are_in_the_top25_active_leaders_of/dkdlz34/,dkdlz34,1500411943.0,1500383143.0,Two players are in the top-25 active leaders of all five major statistical categories: LeBron James and Vince Carter.,1582,6o0baz
482,"Guys i don't mean to cause any alarm but does anyone know where the fuck hakeem is?

I think a search party may be in order. ",153,charliedarwinsfather,/r/nba/comments/6o0baz/two_players_are_in_the_top25_active_leaders_of/dkdk51b/,dkdk51b,1500408894.0,1500380094.0,Two players are in the top-25 active leaders of all five major statistical categories: LeBron James and Vince Carter.,1582,6o0baz
483,"Is Wade close?

Edit: misses it on rebounds. He's 50th in rebounds. Around the top in everything else. ",25,imdinni,/r/nba/comments/6o0baz/two_players_are_in_the_top25_active_leaders_of/dkdu0me/,dkdu0me,1500421682.0,1500392882.0,Two players are in the top-25 active leaders of all five major statistical categories: LeBron James and Vince Carter.,1582,6o0baz
484,"This past season, one person was in the top 20 in all of those categories for the first time in NBA history -- Giannis Antetokounmpo.",67,humancartograph,/r/nba/comments/6o0baz/two_players_are_in_the_top25_active_leaders_of/dkdsr9n/,dkdsr9n,1500420342.0,1500391542.0,Two players are in the top-25 active leaders of all five major statistical categories: LeBron James and Vince Carter.,1582,6o0baz
485,"Hakeem, where is OP?",61,AccelerationGate,/r/nba/comments/6o0baz/two_players_are_in_the_top25_active_leaders_of/dkdt70y/,dkdt70y,1500420812.0,1500392012.0,Two players are in the top-25 active leaders of all five major statistical categories: LeBron James and Vince Carter.,1582,6o0baz
486,what in the hell is Vince doing at 22 in all time blocks?,341,Iamgonnarookyou,/r/nba/comments/6o0baz/two_players_are_in_the_top25_active_leaders_of/dkdjshe/,dkdjshe,1500408236.0,1500379436.0,Two players are in the top-25 active leaders of all five major statistical categories: LeBron James and Vince Carter.,1582,6o0baz
487,You played yourself with the Hakeem comment lmao.,50,69memelordharambe420,/r/nba/comments/6o0baz/two_players_are_in_the_top25_active_leaders_of/dkdk9rh/,dkdk9rh,1500409131.0,1500380331.0,Two players are in the top-25 active leaders of all five major statistical categories: LeBron James and Vince Carter.,1582,6o0baz
488,Well obviously vince is there but Lebron? That was a surprise,71,MagicWade,/r/nba/comments/6o0baz/two_players_are_in_the_top25_active_leaders_of/dkdqd8m/,dkdqd8m,1500417680.0,1500388880.0,Two players are in the top-25 active leaders of all five major statistical categories: LeBron James and Vince Carter.,1582,6o0baz
489,"Death, Taxes, LeBron Rumors ",78,plywood42,/r/nba/comments/6nvf9p/bleacher_report_lebron_james_rumors_star/dkchorf/,dkchorf,1500348751.0,1500319951.0,"[Bleacher Report] LeBron James Rumors: Star Reportedly Frustrated, Concerned About Cavs' Offseason",87,6nvf9p
490,wtf hes not content with calderon??? what a baby,94,ninjaman68,/r/nba/comments/6nvf9p/bleacher_report_lebron_james_rumors_star/dkchpfy/,dkchpfy,1500348770.0,1500319970.0,"[Bleacher Report] LeBron James Rumors: Star Reportedly Frustrated, Concerned About Cavs' Offseason",87,6nvf9p
491,I'm not sure I buy this. He must know the team is limited after trading away picks and paying everyone out ,21,,/r/nba/comments/6nvf9p/bleacher_report_lebron_james_rumors_star/dkchtsi/,dkchtsi,1500348892.0,1500320092.0,"[Bleacher Report] LeBron James Rumors: Star Reportedly Frustrated, Concerned About Cavs' Offseason",87,6nvf9p
492,Breaking News: LeBron in talks with Leslie Alexander to use his lifetime contract with Nike to buy Houston Rockets.,25,Viro_Lopes,/r/nba/comments/6nvf9p/bleacher_report_lebron_james_rumors_star/dkchomc/,dkchomc,1500348747.0,1500319947.0,"[Bleacher Report] LeBron James Rumors: Star Reportedly Frustrated, Concerned About Cavs' Offseason",87,6nvf9p
493,"He's dancing on insta more than before, if that's frustration I don't see it",34,jps78,/r/nba/comments/6nvf9p/bleacher_report_lebron_james_rumors_star/dkchnw5/,dkchnw5,1500348727.0,1500319927.0,"[Bleacher Report] LeBron James Rumors: Star Reportedly Frustrated, Concerned About Cavs' Offseason",87,6nvf9p
494,LeBron will buy the Rockets. He will pay himself.,607,IamOlderthanMe,/r/nba/comments/6nvdbd/lebron_james_is_probably_not_going_anywhere_his/dkch7he/,dkch7he,1500348263.0,1500319463.0,"LeBron James is probably not going anywhere. His max contract is estimated at 36,750,000 any team that offers him that would have to gut their team enough that they can't beat the warriors.",424,6nvdbd
495,Who said he'll have to take the max?,129,DeKobe-DeBryant,/r/nba/comments/6nvdbd/lebron_james_is_probably_not_going_anywhere_his/dkch687/,dkch687,1500348227.0,1500319427.0,"LeBron James is probably not going anywhere. His max contract is estimated at 36,750,000 any team that offers him that would have to gut their team enough that they can't beat the warriors.",424,6nvdbd
