,body,score,author,permalink,comment_id,created_loc,created_utc,post_title,post_score,post_id
268,"Both are athletic freaks nature who have dominated the league for most of their careers. 

Both seem to get flack for their finals records but they were against the other GOATs of the NBA.",118,riceballa,/r/nba/comments/3g9suf/mildly_interesting_both_wilt_chamberlain_and/ctw9374/,ctw9374,1439097016.0,1439068216.0,Mildly Interesting: Both Wilt Chamberlain and LeBron James have 4 MVPs and a 2-4 record in the Finals,788,3g9suf
269,I think LeBron will win and lose more than that ,155,TheKeyNextDoor,/r/nba/comments/3g9suf/mildly_interesting_both_wilt_chamberlain_and/ctw5ptb/,ctw5ptb,1439090374.0,1439061574.0,Mildly Interesting: Both Wilt Chamberlain and LeBron James have 4 MVPs and a 2-4 record in the Finals,788,3g9suf
270,Both Wilt and LeBron had to leave their original teams to win their first NBA championships. ,446,BearsNecessity,/r/nba/comments/3g9suf/mildly_interesting_both_wilt_chamberlain_and/ctw5tve/,ctw5tve,1439090596.0,1439061796.0,Mildly Interesting: Both Wilt Chamberlain and LeBron James have 4 MVPs and a 2-4 record in the Finals,788,3g9suf
271,And the bulk of their losses came from Tim Duncan and Bill Russell who are about as close of comparisons as you can get,249,,/r/nba/comments/3g9suf/mildly_interesting_both_wilt_chamberlain_and/ctw5oid/,ctw5oid,1439090306.0,1439061506.0,Mildly Interesting: Both Wilt Chamberlain and LeBron James have 4 MVPs and a 2-4 record in the Finals,788,3g9suf
272,Both of their penises have been seen by millions of people as well.,25,mphatso,/r/nba/comments/3g9suf/mildly_interesting_both_wilt_chamberlain_and/ctwn60d/,ctwn60d,1439128474.0,1439099674.0,Mildly Interesting: Both Wilt Chamberlain and LeBron James have 4 MVPs and a 2-4 record in the Finals,788,3g9suf
273,[deleted],62,,/r/nba/comments/3g9suf/mildly_interesting_both_wilt_chamberlain_and/ctw6v0t/,ctw6v0t,1439092653.0,1439063853.0,Mildly Interesting: Both Wilt Chamberlain and LeBron James have 4 MVPs and a 2-4 record in the Finals,788,3g9suf
274,[deleted],54,,/r/nba/comments/3g9suf/mildly_interesting_both_wilt_chamberlain_and/ctwapn1/,ctwapn1,1439101842.0,1439073042.0,Mildly Interesting: Both Wilt Chamberlain and LeBron James have 4 MVPs and a 2-4 record in the Finals,788,3g9suf
275,"larry bird was really fucking good, so this isn't exactly an absurd opinion.",217,ZombieLincoln666,/r/nba/comments/3g9byh/reggie_miller_picks_larry_bird_over_lebron_james/ctw2msh/,ctw2msh,1439084485.0,1439055685.0,Reggie Miller picks Larry Bird over LeBron James,104,3g9byh
276,Well Larry coached him to a finals appearance.  Can't say I'm surprised.,72,,/r/nba/comments/3g9byh/reggie_miller_picks_larry_bird_over_lebron_james/ctw1br2/,ctw1br2,1439081972.0,1439053172.0,Reggie Miller picks Larry Bird over LeBron James,104,3g9byh
277,[It's a compilation worth watching what others thought of Larry](https://www.youtube.com/watch?v=1Rg1sFMxnbM),39,,/r/nba/comments/3g9byh/reggie_miller_picks_larry_bird_over_lebron_james/ctw25aa/,ctw25aa,1439083567.0,1439054767.0,Reggie Miller picks Larry Bird over LeBron James,104,3g9byh
278,So? It's his opinion. You don't have to agree with him and he is a little biased but if he thinks this who cares. Feel free to pick LeBron if you so choose.,96,,/r/nba/comments/3g9byh/reggie_miller_picks_larry_bird_over_lebron_james/ctw1d5c/,ctw1d5c,1439082044.0,1439053244.0,Reggie Miller picks Larry Bird over LeBron James,104,3g9byh
279,I can't disagree. Bird was a phenomenal player and would dominate in today's game.,42,,/r/nba/comments/3g9byh/reggie_miller_picks_larry_bird_over_lebron_james/ctw2b6x/,ctw2b6x,1439083881.0,1439055081.0,Reggie Miller picks Larry Bird over LeBron James,104,3g9byh
280,Atta boy Reggie.,32,,/r/nba/comments/3g9byh/reggie_miller_picks_larry_bird_over_lebron_james/ctw1vls/,ctw1vls,1439083041.0,1439054241.0,Reggie Miller picks Larry Bird over LeBron James,104,3g9byh
281,"I'm fucking 24, and rewatched Bird games. He was insane. He would be so dominant in today's NBA. It is close between him and Lebron. Anyone who says Lebron and it is not close has not watched Bird.",26,cgar28,/r/nba/comments/3g9byh/reggie_miller_picks_larry_bird_over_lebron_james/ctw9iyq/,ctw9iyq,1439099424.0,1439070624.0,Reggie Miller picks Larry Bird over LeBron James,104,3g9byh
282,And Wade got revenge by kicking him ,77,,/r/nba/comments/3g8x8i/one_of_the_overlooked_moments_of_2014_ramon/ctvxzdy/,ctvxzdy,1439075144.0,1439046344.0,One of the overlooked moments of 2014: Ramon Sessions dunks on Lebron,356,3g8x8i
283,I didn't know he had that one in him. Everyone was hyped up after this.,84,BizGilwalker,/r/nba/comments/3g8x8i/one_of_the_overlooked_moments_of_2014_ramon/ctvxrf8/,ctvxrf8,1439074657.0,1439045857.0,One of the overlooked moments of 2014: Ramon Sessions dunks on Lebron,356,3g8x8i
284,[deleted],68,,/r/nba/comments/3g8x8i/one_of_the_overlooked_moments_of_2014_ramon/ctw1fny/,ctw1fny,1439082174.0,1439053374.0,One of the overlooked moments of 2014: Ramon Sessions dunks on Lebron,356,3g8x8i
285,"I usually balk at YouTube comments but this one was gold: 

> **What really happens:**

> Lebron Gets Dunked On 

> **What Diehard Lebron Fans Say Happened:**

> He dunked by him... 

> Where's Lebron...? 

> He was near the dunk.. 

> Lebron was right there and contested and the guy made the dunk but he didn't get dunked on... 

> Lebron wasn't really there... 

> It was CGI... 

> At least he contested... 

> Sessions doesn't have any rings... 

> That was a power layup... 

> It's not a poster because Lebron's BMI was in contradictory molecular disbalance to the infrequency wavelengths of the perputular modular calimysmic propensity levels that were present in region during the time of the game....",123,iPissVelvet,/r/nba/comments/3g8x8i/one_of_the_overlooked_moments_of_2014_ramon/ctw18k4/,ctw18k4,1439081809.0,1439053009.0,One of the overlooked moments of 2014: Ramon Sessions dunks on Lebron,356,3g8x8i
286,I bet LeBron tried to confiscate this video too.,50,FragileFrankieMerman,/r/nba/comments/3g8x8i/one_of_the_overlooked_moments_of_2014_ramon/ctvzoca/,ctvzoca,1439078738.0,1439049938.0,One of the overlooked moments of 2014: Ramon Sessions dunks on Lebron,356,3g8x8i
287,I love how he just immediately starts getting back on D instead of staring Bron down or something.  It's like he knows he got lucky and doesn't want to push it.,23,Surrella,/r/nba/comments/3g8x8i/one_of_the_overlooked_moments_of_2014_ramon/ctvztjt/,ctvztjt,1439079035.0,1439050235.0,One of the overlooked moments of 2014: Ramon Sessions dunks on Lebron,356,3g8x8i
288,"Sometimes I feel like he intentionally lets his man get by him so he can ""chase down"" the ball on the rim",83,2mchheightsinhouston,/r/nba/comments/3g4h5t/lebron_james_chasedown_compilation/ctuszk2/,ctuszk2,1438986664.0,1438957864.0,Lebron James chasedown compilation,273,3g4h5t
289,"What was it, the 2009-2010 season? He just decided he was going to start blocking every fast break layup attempted. He got so many that eventually there was speculation his opponents should just wait to set up the offense. Although if I'm not mistaken, Courtney Lee jammed one home when bron went for the block. I'm not 100% on that memory though, could've been someone else. And of course there was rondos slick layup fake and assist. 

But yeah. Both of those plays were notable because of just how effective James was at the chasedown. ",38,pqrk,/r/nba/comments/3g4h5t/lebron_james_chasedown_compilation/ctuudap/,ctuudap,1438988852.0,1438960052.0,Lebron James chasedown compilation,273,3g4h5t
290,"At the next players union meeting after showing this tape:

Silver: Raise your hand if you have ever felt personally victimized by LeBron James

Ray Allen looks around bows his head solemnly and raises his hand slowly.",22,IKetchBodies,/r/nba/comments/3g4h5t/lebron_james_chasedown_compilation/ctuuoc4/,ctuuoc4,1438989331.0,1438960531.0,Lebron James chasedown compilation,273,3g4h5t
291,"What's not shown is how many fastbreaks I've seen where the guy with the ball blows a layup because he could see Lebron out of the corner of his eye. I've seen a bunch of really really AWKWARD layups and fastbreaks where Lebron is on the prowl and the ballhander doesn't really quite know what to do. The ""Lebron Chasedown"" is one of the most unique signature plays I can think of.",21,theblackhole25,/r/nba/comments/3g4h5t/lebron_james_chasedown_compilation/ctv6xmr/,ctv6xmr,1439007420.0,1438978620.0,Lebron James chasedown compilation,273,3g4h5t
292,I think pornhub has ruined the word compilation for me,43,Sour-Diesel,/r/nba/comments/3g4h5t/lebron_james_chasedown_compilation/ctv159v/,ctv159v,1438998935.0,1438970135.0,Lebron James chasedown compilation,273,3g4h5t
293,"Boston was in this quite a lot, especially Rondo :)

Also the first few minutes were 80% LeBron taking a bad shot or having a bad turnover",28,JtkBasketball,/r/nba/comments/3g4h5t/lebron_james_chasedown_compilation/ctuus1q/,ctuus1q,1438989486.0,1438960686.0,Lebron James chasedown compilation,273,3g4h5t
294,Watching those God awful calls is painful..,44,cookienubz,/r/nba/comments/3g4h5t/lebron_james_chasedown_compilation/ctutnad/,ctutnad,1438987732.0,1438958932.0,Lebron James chasedown compilation,273,3g4h5t
295,"Excellent video, however, I find it strange that his most recent buzzer beater against the Bulls in 2015 is higher than his finals  sealing elbow J over Kawhi in 2013.

That said, and while I don't expect everyone to understand, or to agree with me; LeBron is my Michael Jordan.

He came into the league at a time when ISO ball and dominant scorers were what teams clamored for. Guys like AI, Kobe, VC, T-Mac, Antoine Walker, Mitch Richmond and so many others dominated by being mainly scorers. LeBron  turned basketball analytics on its head, and displayed a level of aptitude and ability that was rarely seen in a player. I mean now, we have hybrid players like PG13, Blake, KD, Lance, Beal who can do it all, and combo guards like Russ, Rose, Wall,  among others who value efficiency and all aroundedness above scoring.

He was and is a team first player, and relished on getting his guys going before wondering about himself. He's taken flak for not taking the last shot and instead making the correct basketball play, and in his interviews, he's always stuck with his decision to make said play. It's amazing Even when you look back at interviews of him in his teens, like seriously, 15 to 17 years old, he's displayed a level on humbleness that is so rare; especially someone who was professed as the next great thing *in high school*.

I've followed him through his whole career, and I am so beyond proud of how he's handled himself(decision withstanding) and what's he's accomplished. That his career is winding down makes me kinda sad because I've basically grown with LeBron.

I'm serious when I say the game will miss him when he's gone.

Edited for spelling.",85,jspeed04,/r/nba/comments/3g14df/lebron_james_top_100_plays_of_career/ctu34ht/,ctu34ht,1438926149.0,1438897349.0,LeBron James - Top 100 plays of career,108,3g14df
296,"lebron might be the ultimate ""do something with nothing"" player. like, dude dragged a team with larry hughes as the \#2 option to the finals. and just this playoffs he beat the hawks with jr smith/tristan thompson as the second best player. he seemingly walks into those 28/7/5 performances every night and his durability is out of this world.",56,trreeey,/r/nba/comments/3fxd5a/the_rnba_pantheon_of_greatness_does_lebron_james/ctstprs/,ctstprs,1438839379.0,1438810579.0,The r/NBA Pantheon of Greatness: Does LeBron James Belong? (11th Case),21,3fxd5a
297,he's one of my 11 locks for the top 12 ,23,goran_dragic,/r/nba/comments/3fxd5a/the_rnba_pantheon_of_greatness_does_lebron_james/ctsu0if/,ctsu0if,1438839801.0,1438811001.0,The r/NBA Pantheon of Greatness: Does LeBron James Belong? (11th Case),21,3fxd5a
298,"Lebron was a truly transcendent talent at an all-time level at every age in the league before his prime. I am extremely lucky to have witnessed his entire career from start to present, but I truly feel bad and ashamed for not appreciating how good he truly was and had been until maybe 2011. I was just a Kobe fanboy growing up in LA who thought LeBron sucked and was overrated because that's all everyone would say around here even though he would post better stats and a higher PER. I thought it was strange that everyone said he sucked or wasn't as good even though his stats were better year in and year out than Kobe's almost across the board entirely. Remember young guns, It's really important to do your own research! ",28,xalpha23,/r/nba/comments/3fuh87/lebron_april_2005_averages/cts7hrf/,cts7hrf,1438804931.0,1438776131.0,LeBron April 2005 averages:,25,3fuh87
299,"is ""per person w/info"" supposed to sound better than ""per source""?",34,,/r/nba/comments/3ftfv4/zillgitt_lebron_james_officially_informs_usa/ctrsvkm/,ctrsvkm,1438765741.0,1438736941.0,"[Zillgitt] LeBron James officially informs USA Basketball he will attend next week's mini-camp in Vegas, per person w/info. Yahoo reported last week.",105,3ftfv4
300,ahh yes...the birth place of lebron's greatest shot! https://www.youtube.com/watch?v=uoDKtzjLS9k,46,,/r/nba/comments/3ftfv4/zillgitt_lebron_james_officially_informs_usa/ctrs5jy/,ctrs5jy,1438764517.0,1438735717.0,"[Zillgitt] LeBron James officially informs USA Basketball he will attend next week's mini-camp in Vegas, per person w/info. Yahoo reported last week.",105,3ftfv4
301,The Rio Olympic games start a year from tomorrow. If the Cavs make it to the finals then Lebron and everyone else playing in them would only get about a months worth of rest before having to suit up for Team USA.,21,angeloko,/r/nba/comments/3ftfv4/zillgitt_lebron_james_officially_informs_usa/ctrsdya/,ctrsdya,1438764907.0,1438736107.0,"[Zillgitt] LeBron James officially informs USA Basketball he will attend next week's mini-camp in Vegas, per person w/info. Yahoo reported last week.",105,3ftfv4
302,[First time he ever murdered someone too.](https://www.youtube.com/watch?v=64gmdA5oDdo),50,,/r/nba/comments/3ftfv4/zillgitt_lebron_james_officially_informs_usa/ctrt2ab/,ctrt2ab,1438766063.0,1438737263.0,"[Zillgitt] LeBron James officially informs USA Basketball he will attend next week's mini-camp in Vegas, per person w/info. Yahoo reported last week.",105,3ftfv4
303,This is what happens when you grow up on the mean streets of Wurzberg. ,97,,/r/nba/comments/3fqg7n/dirk_might_just_be_the_nicest_guy_in_the_nba_hell/ctr02ck/,ctr02ck,1438719315.0,1438690515.0,Dirk might just be the nicest guy in the NBA. He'll even sign a LeBron jersey. (MTV/Punk'd),281,3fqg7n
304,"For some reason, the scene where Dirk asks Bow Wow for an autograph in Like Mike came to my head.",60,forNOreason100,/r/nba/comments/3fqg7n/dirk_might_just_be_the_nicest_guy_in_the_nba_hell/ctr2usa/,ctr2usa,1438725703.0,1438696903.0,Dirk might just be the nicest guy in the NBA. He'll even sign a LeBron jersey. (MTV/Punk'd),281,3fqg7n
305,I met him last year at Steve Nash's charity soccer tournament in NYC. He must've stopped to sign 200+ autographs and take over 100 pictures that day. The shuttle drivers taking the players away had to basically drag him away from the crowds when they were leaving. Dirk is definitely the friendliest NBA player I've met. You can tell he appreciates his fans.,90,sk1990,/r/nba/comments/3fqg7n/dirk_might_just_be_the_nicest_guy_in_the_nba_hell/ctr40ti/,ctr40ti,1438727812.0,1438699012.0,Dirk might just be the nicest guy in the NBA. He'll even sign a LeBron jersey. (MTV/Punk'd),281,3fqg7n
306,http://i.imgur.com/YSeh2xR.gif,68,urfaselol,/r/nba/comments/3fqg7n/dirk_might_just_be_the_nicest_guy_in_the_nba_hell/ctr4mr7/,ctr4mr7,1438728844.0,1438700044.0,Dirk might just be the nicest guy in the NBA. He'll even sign a LeBron jersey. (MTV/Punk'd),281,3fqg7n
307,"""...but will not participate in the workouts.""

Just got this notification a couple of hours ago.",21,,/r/nba/comments/3foagi/lebron_james_will_attend_team_usa_camp_per_nba/ctqldx4/,ctqldx4,1438679918.0,1438651118.0,LeBron James will attend Team USA Camp per NBA Gametime,88,3foagi
308,I think this guy has a chance to make it.,55,ShapeShiftnTrick,/r/nba/comments/3foagi/lebron_james_will_attend_team_usa_camp_per_nba/ctqh11a/,ctqh11a,1438672443.0,1438643643.0,LeBron James will attend Team USA Camp per NBA Gametime,88,3foagi
309,"I'm guessing that the organization made it clear that if you want on the Olympic team, you have to participate in all of the preparations.",25,,/r/nba/comments/3foagi/lebron_james_will_attend_team_usa_camp_per_nba/ctqg98b/,ctqg98b,1438671103.0,1438642303.0,LeBron James will attend Team USA Camp per NBA Gametime,88,3foagi
310,Sounds like you took the pledge,52,quentin-coldwater,/r/nba/comments/3foagi/lebron_james_will_attend_team_usa_camp_per_nba/ctqlfo7/,ctqlfo7,1438680007.0,1438651207.0,LeBron James will attend Team USA Camp per NBA Gametime,88,3foagi
311,Just to be very clear Lebron was toying with our team the entire time until it was game on mode. ,57,PKS_5,/r/nba/comments/3flvqv/wiggins_vs_lebron/ctpwqcd/,ctpwqcd,1438641141.0,1438612341.0,Wiggins VS LeBron,77,3flvqv
312,They were really going at each other until Lebron started to give a fuck in the 4th quarter and lock wiggins down,64,MrFundamentals101,/r/nba/comments/3flvqv/wiggins_vs_lebron/ctpsob2/,ctpsob2,1438631217.0,1438602417.0,Wiggins VS LeBron,77,3flvqv
313,"Still gives me goose bumps. Knowing that a 19 year old Wiggins played the best player in the world that tough gives me a ton of hope for the future of this franchise. Wish we could have pulled out the win but LeBron went all ""fuck you I'm Lebron"" mode on us in the last 5 minutes.",47,HammyFresh,/r/nba/comments/3flvqv/wiggins_vs_lebron/ctps8iw/,ctps8iw,1438629653.0,1438600853.0,Wiggins VS LeBron,77,3flvqv
314,"ah yes the patented ""Ayy I'm Lebron James"" shot",204,BlindManBaldwin,/r/nba/comments/3fixlm/lebron_hits_a_deeeeep_three_in_crunch_time_2012/ctp16z5/,ctp16z5,1438566561.0,1438537761.0,LeBron hits a deeeeep three in crunch time (2012 ECF Game 7),338,3fixlm
315,"The women screaming in the background... she fucking did that the entire game. 

The worst screech of any sports fan ever. Any highlight from this magnificent game is ruined by her shrill from hell. ",69,ShowMeTheMini,/r/nba/comments/3fixlm/lebron_hits_a_deeeeep_three_in_crunch_time_2012/ctp3jo8/,ctp3jo8,1438570916.0,1438542116.0,LeBron hits a deeeeep three in crunch time (2012 ECF Game 7),338,3fixlm
316,"2012 was when Lebron said ""fuck it, I'm Lebron James"" and stopped trying to defer to anyone or please the public. I loved every second of it.

The game 6 prior to this game is still one of my favourite games by one player ever.",45,IanicRR,/r/nba/comments/3fixlm/lebron_hits_a_deeeeep_three_in_crunch_time_2012/ctp3d9j/,ctp3d9j,1438570583.0,1438541783.0,LeBron hits a deeeeep three in crunch time (2012 ECF Game 7),338,3fixlm
317,the LeBronaron,28,danielcohen,/r/nba/comments/3fixlm/lebron_hits_a_deeeeep_three_in_crunch_time_2012/ctp0p73/,ctp0p73,1438565626.0,1438536826.0,LeBron hits a deeeeep three in crunch time (2012 ECF Game 7),338,3fixlm
318,"I have so many conflicted thoughts on this series. First, it's painful because I knew this was the Big Three's last serious run. What's more, the team was banged up as hell and missing several key role players due to injury. With that being said, this was my favorite Celtics team. It's also why I disagree with anyone who says only the champions had a successful year. To me, I'm more proud of this team than any other sports team I ever watched. I still smile like a weirdo when I think of [Pierce hitting that clutch three over LeBron](https://www.youtube.com/watch?v=K_uulujs-MM) in game five. I remember shouting, ""Paul Pierce brought his talent to South Beach!""

On the other side of the equation, this series made me a believer in LeBron, and subsequently, a huge fan of his. I followed him since his first game in the league, but grew to naturally dislike him as he posed a threat to the Celtics. I was so hyped for the Celtics to finish the series in game six at Boston, only for LeBron to enter a cheat code and put on a performance like I've never seen before. [He made like a dozen straight shots in the first half](https://www.youtube.com/watch?v=O-VzBeOrdAg), destroying the Big Three's final Finals run. I was heartbroken, but knew I witnessed greatness. I've cheered for Lebron ever since.",26,fatasslarry7,/r/nba/comments/3fixlm/lebron_hits_a_deeeeep_three_in_crunch_time_2012/ctp5244/,ctp5244,1438573592.0,1438544792.0,LeBron hits a deeeeep three in crunch time (2012 ECF Game 7),338,3fixlm
319,"This is what I found from looking up Kobes scouting report this should give you a good idea of what people thought 

http://upsidemotor.com/2015/03/18/kobe-bryant-lower-merion-high-school-los-angeles-lakers-scouting-report-nba-draft-hall-of-fame/

http://www.basketballforum.com/nba-forum/350562-kobe-bryant-scouting-report-circa-1996-a.html",69,NotHomeToday,/r/nba/comments/3fhe2a/michael_jordan_and_lebron_james_were_both/ctomnqz/,ctomnqz,1438522568.0,1438493768.0,"Michael Jordan and LeBron James were both unanimously a guaranteed 1-3 pick in their draft classes. Kobe Bryant was taken at 13, so what were his original scouting reports like? What did they think his ceiling was at the time?",169,3fhe2a
320,It was the start of the era where players came straight from HS. I think teams just didn't want to take chances.,200,,/r/nba/comments/3fhe2a/michael_jordan_and_lebron_james_were_both/cton28z/,cton28z,1438523598.0,1438494798.0,"Michael Jordan and LeBron James were both unanimously a guaranteed 1-3 pick in their draft classes. Kobe Bryant was taken at 13, so what were his original scouting reports like? What did they think his ceiling was at the time?",169,3fhe2a
321,"It was a really strong draft class to begin with.  Ray Allen, Iverson, Marbury, Nash, Kobe, etc.  Add to that the fact that he was high risk high reward at 17 and very outspoken about wanting to end up on a big market team like the Lakers or the Knicks and a lot of teams just looked elsewhere.

Jerry West called 17 year old Kobe ""better than anybody we have on the team right now"" after watching him demolish the legendary Laker defender Michael Cooper in a 1 on 1 game where Coop was on defense the entire time.  [source](http://bleacherreport.com/articles/2108226-kobe-bryants-predraft-workout-has-become-stuff-of-lakers-and-nba-legend) ",79,undid__iridium,/r/nba/comments/3fhe2a/michael_jordan_and_lebron_james_were_both/ctoqsnu/,ctoqsnu,1438537635.0,1438508835.0,"Michael Jordan and LeBron James were both unanimously a guaranteed 1-3 pick in their draft classes. Kobe Bryant was taken at 13, so what were his original scouting reports like? What did they think his ceiling was at the time?",169,3fhe2a
322,"Kobe was drafted in 1996.  At that point players coming straight from high school didn't have a great track record, Garnett had been taken the year before but he didn't have an awesome rookie year.  Also Kobe was really skinny in high school (he weighed 190 when he was drafted).  People were skeptical that he could perform at the next level.",37,ramskick,/r/nba/comments/3fhe2a/michael_jordan_and_lebron_james_were_both/ctoo7l6/,ctoo7l6,1438527075.0,1438498275.0,"Michael Jordan and LeBron James were both unanimously a guaranteed 1-3 pick in their draft classes. Kobe Bryant was taken at 13, so what were his original scouting reports like? What did they think his ceiling was at the time?",169,3fhe2a
323,"Remember those commercials with Bibby that aired before he'd even played a minute?
 
https://youtu.be/Rv3niQ-w3y0

Gutsy",314,,/r/nba/comments/3fh35z/lebron_james_first_game_as_a_pro_25_points_9/ctojjdv/,ctojjdv,1438515134.0,1438486334.0,"LeBron James first game as a pro: 25 points, 9 assists, 6 rebounds, 4 steals",662,3fh35z
324,I was lucky enough to go to this game. Favorite player ever since. ,144,,/r/nba/comments/3fh35z/lebron_james_first_game_as_a_pro_25_points_9/ctojp87/,ctojp87,1438515492.0,1438486692.0,"LeBron James first game as a pro: 25 points, 9 assists, 6 rebounds, 4 steals",662,3fh35z
325,Man crazy how good he was out of HS. Every other HS player who had been drafted before him was not even close to ready and here Lebron comes and drops 25. ,133,so-cal_kid,/r/nba/comments/3fh35z/lebron_james_first_game_as_a_pro_25_points_9/ctolows/,ctolows,1438520174.0,1438491374.0,"LeBron James first game as a pro: 25 points, 9 assists, 6 rebounds, 4 steals",662,3fh35z
326,"What was he, 19? Completely fucking ridiculous

edit: 18 what the fucking fuck",73,Dennis-Moore,/r/nba/comments/3fh35z/lebron_james_first_game_as_a_pro_25_points_9/ctonsqy/,ctonsqy,1438525743.0,1438496943.0,"LeBron James first game as a pro: 25 points, 9 assists, 6 rebounds, 4 steals",662,3fh35z
327,Left Handed scoop effortlessly floating to his left around the defender. He just floated back then. ,51,frisbeeboobdick,/r/nba/comments/3fh35z/lebron_james_first_game_as_a_pro_25_points_9/ctok9n5/,ctok9n5,1438516797.0,1438487997.0,"LeBron James first game as a pro: 25 points, 9 assists, 6 rebounds, 4 steals",662,3fh35z
328,"Damian Lillard had 23 and 11 in his first game, Lebron's game is better without a doubt (especially since he was 18 compared to Lillard being 21) but it is always awesome to see guys put up big numbers in their first game

MCW also had 22/12/7/9 in his first game which may be the best first game any rookie has ever had",65,benslowcalcalzonezon,/r/nba/comments/3fh35z/lebron_james_first_game_as_a_pro_25_points_9/ctopbs1/,ctopbs1,1438531064.0,1438502264.0,"LeBron James first game as a pro: 25 points, 9 assists, 6 rebounds, 4 steals",662,3fh35z
