,body,score,author,permalink,comment_id,created_loc,created_utc,post_title,post_score,post_id
436,"I think a lot of people--usually *not* people on this sub though--equate ""clutch"" only with ""buzzer-beater.""   
  
While Lebron has had his share of those over the years, he's more of a ""slow-burn clutch"" player, who makes a series of excellent plays over several minutes in key situations.
  
It can be hard to notice (he might be the all-time leader in ""quiet"" 30 point games and ""low-key"" 15 point quarters) and it's definitely easier to forget than a last second shot, so maybe that's where ill-informed arguments about Lebron not being ""clutch"" come from.",48,The-Seeker,/r/nba/comments/2y0tal/lebron_james_was_nearly_perfect_in_the_final_6/cp5d6w0/,cp5d6w0,1425607693.0,1425578893.0,LeBron James was nearly perfect in the final 6 minutes against the Raptors,526,2y0tal
437,"Honestly it's games like these that set apart SUPER-stars from stars. (Although Lebron is basically in a league of his own now in terms of stardom) 

They seem to have so much influence and they just use willpower or something to win, it's fucking ridiculous. (Kobe, Jordan, etc)",66,TOPLVL,/r/nba/comments/2y0tal/lebron_james_was_nearly_perfect_in_the_final_6/cp56dp5/,cp56dp5,1425596088.0,1425567288.0,LeBron James was nearly perfect in the final 6 minutes against the Raptors,526,2y0tal
438,Game was starting to slip away and he was not having it.,26,MozgodTheRussianBear,/r/nba/comments/2y0tal/lebron_james_was_nearly_perfect_in_the_final_6/cp55vgw/,cp55vgw,1425595017.0,1425566217.0,LeBron James was nearly perfect in the final 6 minutes against the Raptors,526,2y0tal
439,"Guys lets not push this narrative anymore. Lebron's the king, some missed free throws against Houston a couple days ago didn't change that.",127,PermYoWeaveTina,/r/nba/comments/2y0tal/lebron_james_was_nearly_perfect_in_the_final_6/cp57dnu/,cp57dnu,1425598045.0,1425569245.0,LeBron James was nearly perfect in the final 6 minutes against the Raptors,526,2y0tal
440,"His 3s were ridiculous, he absolutely refused to let his team lose. It's why he's the best in the league.",163,IanicRR,/r/nba/comments/2y0tal/lebron_james_was_nearly_perfect_in_the_final_6/cp55dpw/,cp55dpw,1425593906.0,1425565106.0,LeBron James was nearly perfect in the final 6 minutes against the Raptors,526,2y0tal
441,"Still, 8-13 FT on the game. What's going on with his recent FT%?",21,dontreachyoungblud,/r/nba/comments/2y0tal/lebron_james_was_nearly_perfect_in_the_final_6/cp5a521/,cp5a521,1425602726.0,1425573926.0,LeBron James was nearly perfect in the final 6 minutes against the Raptors,526,2y0tal
442,"Incredible. And not to take anything away from lebron, but God damn that's a thick ass head band in his picture. ",43,Cam8895,/r/nba/comments/2y0tal/lebron_james_was_nearly_perfect_in_the_final_6/cp55u32/,cp55u32,1425594934.0,1425566134.0,LeBron James was nearly perfect in the final 6 minutes against the Raptors,526,2y0tal
443,"""He missed a free throw...he was CLEARLY choking the game away. He just doesn't have that killer instinct.""",29,KnickedUp,/r/nba/comments/2y0tal/lebron_james_was_nearly_perfect_in_the_final_6/cp55bkd/,cp55bkd,1425593763.0,1425564963.0,LeBron James was nearly perfect in the final 6 minutes against the Raptors,526,2y0tal
444,also known as the Brian Windhorst job. ,74,hemingwayhero,/r/nba/comments/2xzrcm/kendrick_perkins_role_on_the_cavs_tell_lebron/cp4wjzz/,cp4wjzz,1425561739.0,1425532939.0,Kendrick Perkins' role on the Cavs: tell Lebron every day that he's the greatest,99,2xzrcm
445,"Imagining LeBron in the comfort room trying to piss, and Perkins with the eye contact softly whispering in his ears, ""LeBron, you are the greatest."" ""LeBron, you are the greatest."" ",49,LakersDynasty24,/r/nba/comments/2xzrcm/kendrick_perkins_role_on_the_cavs_tell_lebron/cp4wmfu/,cp4wmfu,1425561900.0,1425533100.0,Kendrick Perkins' role on the Cavs: tell Lebron every day that he's the greatest,99,2xzrcm
446,so he's a fluffer ,22,jimbo89012,/r/nba/comments/2xzrcm/kendrick_perkins_role_on_the_cavs_tell_lebron/cp4wiul/,cp4wiul,1425561661.0,1425532861.0,Kendrick Perkins' role on the Cavs: tell Lebron every day that he's the greatest,99,2xzrcm
447,[Better Angle](http://gfycat.com/BeneficialRemorsefulDwarfrabbit),45,H4pl0,/r/nba/comments/2xz76e/jonas_valanciunas_flagrant_foul_on_lebron/cp4r3pk/,cp4r3pk,1425551041.0,1425522241.0,Jonas Valanciunas flagrant foul on LeBron,196,2xz76e
448,"""I yust vanted to hug.""",41,TriteContrivity,/r/nba/comments/2xz76e/jonas_valanciunas_flagrant_foul_on_lebron/cp4r2sh/,cp4r2sh,1425550997.0,1425522197.0,Jonas Valanciunas flagrant foul on LeBron,196,2xz76e
449,That was a regular old hard wrap-up. James just slipped halfway through it. ,155,,/r/nba/comments/2xz76e/jonas_valanciunas_flagrant_foul_on_lebron/cp4r2xn/,cp4r2xn,1425551004.0,1425522204.0,Jonas Valanciunas flagrant foul on LeBron,196,2xz76e
450,"maybe im missing something here but can someone explain to me what part of this lebron ""sold""?

both angles to me look like JV wrapped him up and pulled him down. Not sure what part Lebron was supposed to have sold here...",85,brohymn,/r/nba/comments/2xz76e/jonas_valanciunas_flagrant_foul_on_lebron/cp4rckf/,cp4rckf,1425551499.0,1425522699.0,Jonas Valanciunas flagrant foul on LeBron,196,2xz76e
451,Not a good move but LeBron missed both free throws so as a diehard fan good job JV...,48,LegitSevenFooter,/r/nba/comments/2xz76e/jonas_valanciunas_flagrant_foul_on_lebron/cp4r24d/,cp4r24d,1425550965.0,1425522165.0,Jonas Valanciunas flagrant foul on LeBron,196,2xz76e
452,Pooooorly attempted wrap up. ,31,ProbablyMyLastLogin,/r/nba/comments/2xz76e/jonas_valanciunas_flagrant_foul_on_lebron/cp4qz72/,cp4qz72,1425550818.0,1425522018.0,Jonas Valanciunas flagrant foul on LeBron,196,2xz76e
453,"Did nothing wrong, tried to get Lebron before he went airborne. ",21,,/r/nba/comments/2xz76e/jonas_valanciunas_flagrant_foul_on_lebron/cp4r7kt/,cp4r7kt,1425551239.0,1425522439.0,Jonas Valanciunas flagrant foul on LeBron,196,2xz76e
454,"Westbrook had a PER of 34.6 in February, averaging 31.2 points, 9.1 rebounds and 10.2 assists per game.

James averaged 24.4 points, 6.7 rebounds and 7.3 assists per game for the month.",86,,/r/nba/comments/2xyu8x/russell_westbrook_and_lebron_james_win_players_of/cp4neug/,cp4neug,1425544316.0,1425515516.0,Russell Westbrook and LeBron James win Players of the Month for February,325,2xyu8x
455,Is Westbrook the first guy to win player and coach of the month in the same month?,32,themariokarters,/r/nba/comments/2xyu8x/russell_westbrook_and_lebron_james_win_players_of/cp4o31q/,cp4o31q,1425545537.0,1425516737.0,Russell Westbrook and LeBron James win Players of the Month for February,325,2xyu8x
456,Lebron James' iron genitals as honorable mention. ,35,fatty_fatshits,/r/nba/comments/2xyu8x/russell_westbrook_and_lebron_james_win_players_of/cp4nwg2/,cp4nwg2,1425545201.0,1425516401.0,Russell Westbrook and LeBron James win Players of the Month for February,325,2xyu8x
457,Any tweets by Dame feeling slighted?,28,_rerun984,/r/nba/comments/2xyu8x/russell_westbrook_and_lebron_james_win_players_of/cp4phzf/,cp4phzf,1425548092.0,1425519292.0,Russell Westbrook and LeBron James win Players of the Month for February,325,2xyu8x
458,Eric Gordon's 45% 3-point shooting season ,68,themariokarters,/r/nba/comments/2xwfdm/kobe_bryant_has_more_triple_doubles_this_season/cp41tot/,cp41tot,1425507396.0,1425478596.0,Kobe Bryant has more triple doubles this season than LeBron James. What's a crazy fact about this NBA season?,111,2xwfdm
459,Markel Brown who stands at 6'3 had 4 blocks in his first career start. Mason Plumlee who has started 41 games this season hasn't had more than 3 blocks in a game all season. ,83,DraperWhite,/r/nba/comments/2xwfdm/kobe_bryant_has_more_triple_doubles_this_season/cp400lu/,cp400lu,1425502413.0,1425473613.0,Kobe Bryant has more triple doubles this season than LeBron James. What's a crazy fact about this NBA season?,111,2xwfdm
460,"The Bulls most accurate 3-point shooter this season is...

Pau Gasol (7 for 16, .438)

[Source](http://www.basketball-reference.com/teams/CHI/2015.html)",41,Hyperboloidof2sheets,/r/nba/comments/2xwfdm/kobe_bryant_has_more_triple_doubles_this_season/cp4899n/,cp4899n,1425518909.0,1425490109.0,Kobe Bryant has more triple doubles this season than LeBron James. What's a crazy fact about this NBA season?,111,2xwfdm
461,Rodney Stuckey is leading the Pacers in 3pt FG% at .381 this year. ,38,Victory33,/r/nba/comments/2xwfdm/kobe_bryant_has_more_triple_doubles_this_season/cp415x6/,cp415x6,1425505786.0,1425476986.0,Kobe Bryant has more triple doubles this season than LeBron James. What's a crazy fact about this NBA season?,111,2xwfdm
462,Lance Stephenson's performance in Charlotte... it's almost mind bendingly bad.,29,KnickedUp,/r/nba/comments/2xwfdm/kobe_bryant_has_more_triple_doubles_this_season/cp4brw6/,cp4brw6,1425524407.0,1425495607.0,Kobe Bryant has more triple doubles this season than LeBron James. What's a crazy fact about this NBA season?,111,2xwfdm
463,"This would be the first season Tyreke Evans would have a positive +/- per 100 possessions while on the court, with +2.5 (previously -6.7, -5.3, -6.9, -5.5, -4.7). And only the second season that his team would have a better +/- per 100 with him on the court compared to off. His sophomore year, the Kings were 1.1 points per 100 better with him on the court rather than off; this year we are 5.1 points per 100 better with him on the court.",22,Good_NewsEveryone,/r/nba/comments/2xwfdm/kobe_bryant_has_more_triple_doubles_this_season/cp41svq/,cp41svq,1425507343.0,1425478543.0,Kobe Bryant has more triple doubles this season than LeBron James. What's a crazy fact about this NBA season?,111,2xwfdm
464,"It's not. NBA fans have no clue what a travel is. Watch the video again. At exactly :13 he touches the ball with both hands behind his back. His right foot is on the floor. Then he goes left foot -> right foot -> jump. What you and other people that are always wrong about travels are missing is that you think you start counting after his last dribble. That's incorrect. You start counting when the ball is picked up. Otherwise, you couldn't stutter step in between dribbles. Think if you were just dribbling normally but stuttering left/right/left/right really quickly. That's not a travel because you're still dribbling. So if you stutter step up until the point where you pick up the ball then you don't travel.",58,bigbeau,/r/nba/comments/2xv35h/lebron_goes_behindtheback_celtics_vs_cavaliers/cp3pygv/,cp3pygv,1425469872.0,1425441072.0,"LeBron Goes Behind-the-Back | Celtics vs Cavaliers | March 3, 2015",97,2xv35h
465,Pretty impressive when you consider Ray Allen has played 18 seasons.,309,sportsfan113,/r/nba/comments/2xutsm/with_his_25th_point_tonight_lebron_james_passed/cp3ljgn/,cp3ljgn,1425462331.0,1425433531.0,"With his 25th point tonight, LeBron James passed Ray Allen for 21st on all-time scoring list",1721,2xutsm
466,"If Ray Allen had joined the cavs, there's a chance he could have gotten the assist for that bucket. That would have been awesome",128,SeamusBayless,/r/nba/comments/2xutsm/with_his_25th_point_tonight_lebron_james_passed/cp3n8d2/,cp3n8d2,1425465236.0,1425436436.0,"With his 25th point tonight, LeBron James passed Ray Allen for 21st on all-time scoring list",1721,2xutsm
467,He's gonna pass about 10 more guys in the next year too.,295,ricky_roe,/r/nba/comments/2xutsm/with_his_25th_point_tonight_lebron_james_passed/cp3lbfi/,cp3lbfi,1425461948.0,1425433148.0,"With his 25th point tonight, LeBron James passed Ray Allen for 21st on all-time scoring list",1721,2xutsm
468,[deleted],157,,/r/nba/comments/2xutsm/with_his_25th_point_tonight_lebron_james_passed/cp3m9q5/,cp3m9q5,1425463597.0,1425434797.0,"With his 25th point tonight, LeBron James passed Ray Allen for 21st on all-time scoring list",1721,2xutsm
469,This just in: Ray Allen joins the Cavs to take shots away from Bron,152,Bringerofrain20,/r/nba/comments/2xutsm/with_his_25th_point_tonight_lebron_james_passed/cp3me12/,cp3me12,1425463798.0,1425434998.0,"With his 25th point tonight, LeBron James passed Ray Allen for 21st on all-time scoring list",1721,2xutsm
470,"Damn that's crazy, every time I watch him play he's pretty much everywhere and you barely notice (sometimes) that he's dropping a lot of points. Idk probably just me or something.",63,xKatana47,/r/nba/comments/2xutsm/with_his_25th_point_tonight_lebron_james_passed/cp3nmbs/,cp3nmbs,1425465892.0,1425437092.0,"With his 25th point tonight, LeBron James passed Ray Allen for 21st on all-time scoring list",1721,2xutsm
471,[Here's](https://www.youtube.com/watch?v=Arkq7ZPX-AQ) the layup which was his 25th point.,32,Tyrone_Lue,/r/nba/comments/2xutsm/with_his_25th_point_tonight_lebron_james_passed/cp3nt1g/,cp3nt1g,1425466200.0,1425437400.0,"With his 25th point tonight, LeBron James passed Ray Allen for 21st on all-time scoring list",1721,2xutsm
472,Lol people are down voting as if this isn't going to be on the /r/NBA front page. ,353,MeesterAndrew,/r/nba/comments/2xutsm/with_his_25th_point_tonight_lebron_james_passed/cp3lacf/,cp3lacf,1425461896.0,1425433096.0,"With his 25th point tonight, LeBron James passed Ray Allen for 21st on all-time scoring list",1721,2xutsm
473,"""Perk we need a handshake. We all have secret handshakes here.""

""Ok how about this. I hug you for a prolonged period of time and we whisper some kind words to each other.""

""Uh that works...I guess."" ",451,,/r/nba/comments/2xulqp/lebron_and_shumperts_secret_handshake_followed_by/cp3jc75/,cp3jc75,1425458456.0,1425429656.0,LeBron and Shumpert's secret handshake followed by a prolonged hug with Perkins,911,2xulqp
474,"How do these guys even decide what to do with their handshakes? Do they sit round after the game and talk about it ""Yeah, so we high five three times, then we move our hands up either side of our hair"" ",322,LuckyCharmer,/r/nba/comments/2xulqp/lebron_and_shumperts_secret_handshake_followed_by/cp3is0l/,cp3is0l,1425457332.0,1425428532.0,LeBron and Shumpert's secret handshake followed by a prolonged hug with Perkins,911,2xulqp
475,"that was a mafia hug. perk said 'you miss any more free throws, your legs gonna be broken son'",146,battierpeeler,/r/nba/comments/2xulqp/lebron_and_shumperts_secret_handshake_followed_by/cp3l5zp/,cp3l5zp,1425461682.0,1425432882.0,LeBron and Shumpert's secret handshake followed by a prolonged hug with Perkins,911,2xulqp
476,Shump's hair is reaching Marge Simpson territory. Love it. ,181,,/r/nba/comments/2xulqp/lebron_and_shumperts_secret_handshake_followed_by/cp3iyro/,cp3iyro,1425457751.0,1425428951.0,LeBron and Shumpert's secret handshake followed by a prolonged hug with Perkins,911,2xulqp
477,Shump's been one of my favorite players since he entered the league and and now he's on the Cavs who I'm kind of rooting for because of the Love <--> Wiggins trade.,47,Rswany,/r/nba/comments/2xulqp/lebron_and_shumperts_secret_handshake_followed_by/cp3iymc/,cp3iymc,1425457743.0,1425428943.0,LeBron and Shumpert's secret handshake followed by a prolonged hug with Perkins,911,2xulqp
478,"Slowly the 09 Cavs are returning, all we need now are the pregame shenanigans to come back 

Also, [extremely relevant](https://www.youtube.com/watch?v=dJ7-ZP1XGwo) ",39,2Chainz4Braceletz,/r/nba/comments/2xulqp/lebron_and_shumperts_secret_handshake_followed_by/cp3k8op/,cp3k8op,1425460050.0,1425431250.0,LeBron and Shumpert's secret handshake followed by a prolonged hug with Perkins,911,2xulqp
479,That used to be Durant's hug.... :(,126,cookies50796,/r/nba/comments/2xulqp/lebron_and_shumperts_secret_handshake_followed_by/cp3j57v/,cp3j57v,1425458111.0,1425429311.0,LeBron and Shumpert's secret handshake followed by a prolonged hug with Perkins,911,2xulqp
480,"I like to imagine perk just saying over and over 

""I'm Kendrick Perkins, I'm Kendrick Perkins, I'm Kendrick Perkins, I'm Kendrick Perkins""

And at the end bron is just like ""all right man""",33,popolopopo,/r/nba/comments/2xulqp/lebron_and_shumperts_secret_handshake_followed_by/cp3rbng/,cp3rbng,1425472374.0,1425443574.0,LeBron and Shumpert's secret handshake followed by a prolonged hug with Perkins,911,2xulqp
481,"lol fistbumps AC, best bit",50,I_LIKE_BASKETBALL,/r/nba/comments/2xulqp/lebron_and_shumperts_secret_handshake_followed_by/cp3ipeb/,cp3ipeb,1425457208.0,1425428408.0,LeBron and Shumpert's secret handshake followed by a prolonged hug with Perkins,911,2xulqp
482,Shumpert's hair isn't even it's final fro,21,writesaboutstats,/r/nba/comments/2xulqp/lebron_and_shumperts_secret_handshake_followed_by/cp3kns4/,cp3kns4,1425460792.0,1425431992.0,LeBron and Shumpert's secret handshake followed by a prolonged hug with Perkins,911,2xulqp
483,Ray has been been getting shit on so much the last few seasons for ring chasing and being a role player that y'all motherfuckers forgot about Ray ,70,WSUGrizzHawk,/r/nba/comments/2xtzkz/lebron_james_needs_25_points_to_pass_ray_allen/cp3f8ke/,cp3f8ke,1425451380.0,1425422580.0,LeBron James needs 25 points to pass Ray Allen for 21st on all-time scoring list,155,2xtzkz
484,I knew Ray Allen was one of the best shooters of all-time...but I didn't expect to see him 21st all-time in scoring,57,,/r/nba/comments/2xtzkz/lebron_james_needs_25_points_to_pass_ray_allen/cp3co8q/,cp3co8q,1425447341.0,1425418541.0,LeBron James needs 25 points to pass Ray Allen for 21st on all-time scoring list,155,2xtzkz
485,"Ray Allen is one of the best shooters ever to play, but Lebron James is just one of a kind.",23,emperornel,/r/nba/comments/2xtzkz/lebron_james_needs_25_points_to_pass_ray_allen/cp3d0ih/,cp3d0ih,1425447854.0,1425419054.0,LeBron James needs 25 points to pass Ray Allen for 21st on all-time scoring list,155,2xtzkz
486,Wow to think he actually scored 61 pts with less shots .. he tried too hard Sunday to prove a point .,21,DaBootyWarrior21,/r/nba/comments/2xrsgw/lebron_attempted_35_shots_against_houston_most_he/cp2vzdj/,cp2vzdj,1425419081.0,1425390281.0,LeBron attempted 35 shots against Houston. Most he has taken since 2006.,33,2xrsgw
487,He really seemed like he wanted to be the hero that game. Literally didn't pass unless the guy was wide open for an ally oop or something. He wanted to win and everyone to know it was because of him. Probably coulda done it too if it weren't for that meddling free throw line,25,no_one_knows42,/r/nba/comments/2xrsgw/lebron_attempted_35_shots_against_houston_most_he/cp2t6td/,cp2t6td,1425408191.0,1425379391.0,LeBron attempted 35 shots against Houston. Most he has taken since 2006.,33,2xrsgw
488,But how does Matt Barnes feel about it?,219,Bruederle,/r/nba/comments/2xq4s1/marc_stein_on_twitter_nba_just_announced_a/cp2cte7/,cp2cte7,1425368317.0,1425339517.0,"Marc Stein on Twitter: ""NBA just announced a one-game suspension for Houston's James Harden after his kick-out at LeBron James yesterday""",1743,2xq4s1
489,[BY THE WAY I GET FINNED 25k 4 KICKING A GATORADE CUP... LET ME KICK LEBON & THE @NBA WOULD TRY & PUT ME IN JAIL. #Bull$h!t - Matt Barnes](https://twitter.com/Matt_Barnes22/status/572172867288354817),1017,urfaselol,/r/nba/comments/2xq4s1/marc_stein_on_twitter_nba_just_announced_a/cp2cxnc/,cp2cxnc,1425368537.0,1425339737.0,"Marc Stein on Twitter: ""NBA just announced a one-game suspension for Houston's James Harden after his kick-out at LeBron James yesterday""",1743,2xq4s1
490,The regime of harden stops for one game,65,RondoGOAT,/r/nba/comments/2xq4s1/marc_stein_on_twitter_nba_just_announced_a/cp2cxhz/,cp2cxhz,1425368528.0,1425339728.0,"Marc Stein on Twitter: ""NBA just announced a one-game suspension for Houston's James Harden after his kick-out at LeBron James yesterday""",1743,2xq4s1
491,Oh yea. Great timing ,84,StoopidFlexin,/r/nba/comments/2xq4s1/marc_stein_on_twitter_nba_just_announced_a/cp2cy46/,cp2cy46,1425368561.0,1425339761.0,"Marc Stein on Twitter: ""NBA just announced a one-game suspension for Houston's James Harden after his kick-out at LeBron James yesterday""",1743,2xq4s1
492,Same suspension Wade got for kicking Sessions in the junk two years ago. Fair.,191,Zzzonked_Out,/r/nba/comments/2xq4s1/marc_stein_on_twitter_nba_just_announced_a/cp2d5yo/,cp2d5yo,1425368960.0,1425340160.0,"Marc Stein on Twitter: ""NBA just announced a one-game suspension for Houston's James Harden after his kick-out at LeBron James yesterday""",1743,2xq4s1
493,Anyone have video of it?,50,racismisgay,/r/nba/comments/2xq4s1/marc_stein_on_twitter_nba_just_announced_a/cp2e7vi/,cp2e7vi,1425370884.0,1425342084.0,"Marc Stein on Twitter: ""NBA just announced a one-game suspension for Houston's James Harden after his kick-out at LeBron James yesterday""",1743,2xq4s1
494,"[NBA ruling that foul should have been a flagrant-2 not insignificant. If ruled that way at the time, Harden would have been ejected in 3rd.](https://twitter.com/Jonathan_Feigen/status/572543405458251776)",41,thisiseku,/r/nba/comments/2xq4s1/marc_stein_on_twitter_nba_just_announced_a/cp2devc/,cp2devc,1425369410.0,1425340610.0,"Marc Stein on Twitter: ""NBA just announced a one-game suspension for Houston's James Harden after his kick-out at LeBron James yesterday""",1743,2xq4s1
495,Ain't that a kick in the nuts,394,GrapeSodaFiend,/r/nba/comments/2xq4s1/marc_stein_on_twitter_nba_just_announced_a/cp2cs15/,cp2cs15,1425368247.0,1425339447.0,"Marc Stein on Twitter: ""NBA just announced a one-game suspension for Houston's James Harden after his kick-out at LeBron James yesterday""",1743,2xq4s1
496,At least he'll be rested for Memphis,149,EhStonedTurtle,/r/nba/comments/2xq4s1/marc_stein_on_twitter_nba_just_announced_a/cp2cr2o/,cp2cr2o,1425368199.0,1425339399.0,"Marc Stein on Twitter: ""NBA just announced a one-game suspension for Houston's James Harden after his kick-out at LeBron James yesterday""",1743,2xq4s1
497,"""We won't eject you during the game against Lebron cause it's a Sunday game on ABC getting great ratings, but we'll suspend you against Atlanta on local cable when you're not playing up against another star.""",607,EternalOptimist829,/r/nba/comments/2xq4s1/marc_stein_on_twitter_nba_just_announced_a/cp2d5jr/,cp2d5jr,1425368938.0,1425340138.0,"Marc Stein on Twitter: ""NBA just announced a one-game suspension for Houston's James Harden after his kick-out at LeBron James yesterday""",1743,2xq4s1
498,Dude was just off on them all game. It happens.,91,sportsfan113,/r/nba/comments/2xmkay/lebron_james_came_into_today_10_of_11_in_fts_in/cp1fagg/,cp1fagg,1425292151.0,1425263351.0,"LeBron James came into today 10 of 11 in FTs in ""clutch"" situations this season.",91,2xmkay
499,I feel like he was playing too angrily or something. ,25,ZombieLincoln666,/r/nba/comments/2xmkay/lebron_james_came_into_today_10_of_11_in_fts_in/cp1fnts/,cp1fnts,1425292852.0,1425264052.0,"LeBron James came into today 10 of 11 in FTs in ""clutch"" situations this season.",91,2xmkay
500,"LeBron""DeAndre 'Michael' Jordan""James",28,dwade420,/r/nba/comments/2xmkay/lebron_james_came_into_today_10_of_11_in_fts_in/cp1fdvh/,cp1fdvh,1425292329.0,1425263529.0,"LeBron James came into today 10 of 11 in FTs in ""clutch"" situations this season.",91,2xmkay
501,Hes not wrong ,30,cookies50796,/r/nba/comments/2xmi0e/matt_barnes_on_hardens_kick_at_lebron/cp1ern5/,cp1ern5,1425291162.0,1425262362.0,Matt Barnes on Harden's kick at Lebron,56,2xmi0e
502,*and next time I'm gonna kick him in the nuts*,146,TEXANinvASIANx,/r/nba/comments/2xmcln/lebron_called_harden_one_of_the_most_difficult/cp1dk8p/,cp1dk8p,1425288868.0,1425260068.0,"LeBron called Harden ""one of the most difficult matchups in this league,"" but added, ""I'll take that matchup any day.""",323,2xmcln
503,"""I'm wearing two jockstraps next time, though.""",191,smilezandsouthstar,/r/nba/comments/2xmcln/lebron_called_harden_one_of_the_most_difficult/cp1djug/,cp1djug,1425288847.0,1425260047.0,"LeBron called Harden ""one of the most difficult matchups in this league,"" but added, ""I'll take that matchup any day.""",323,2xmcln
504,That's just called being a competitor. I'm sure most star players feel that way,106,itsbarron,/r/nba/comments/2xmcln/lebron_called_harden_one_of_the_most_difficult/cp1d5wi/,cp1d5wi,1425288116.0,1425259316.0,"LeBron called Harden ""one of the most difficult matchups in this league,"" but added, ""I'll take that matchup any day.""",323,2xmcln
505,two top players in the NBA going at it ,33,impertinently,/r/nba/comments/2xmcln/lebron_called_harden_one_of_the_most_difficult/cp1dxey/,cp1dxey,1425289568.0,1425260768.0,"LeBron called Harden ""one of the most difficult matchups in this league,"" but added, ""I'll take that matchup any day.""",323,2xmcln
506,"Finals here we come! :(


Edit: sad face format",31,Kalakashah,/r/nba/comments/2xmcln/lebron_called_harden_one_of_the_most_difficult/cp1do7i/,cp1do7i,1425289079.0,1425260279.0,"LeBron called Harden ""one of the most difficult matchups in this league,"" but added, ""I'll take that matchup any day.""",323,2xmcln
507,He has a beard down there too,22,greenbeanfiend,/r/nba/comments/2xmcln/lebron_called_harden_one_of_the_most_difficult/cp1tb6d/,cp1tb6d,1425335308.0,1425306508.0,"LeBron called Harden ""one of the most difficult matchups in this league,"" but added, ""I'll take that matchup any day.""",323,2xmcln
508,Dang I wish I could have watched this game.  All the videos make it look like it was an awesome game.,95,tornadodolphin,/r/nba/comments/2xm7p1/lebron_and_beverley_get_into_skirmish/cp1cgm6/,cp1cgm6,1425286749.0,1425257949.0,LeBron And Beverley Get Into Skirmish,424,2xm7p1
509,"Normally I think Beverley is at fault, but this time I think LeBron is the ass. ",151,mistermannequin,/r/nba/comments/2xm7p1/lebron_and_beverley_get_into_skirmish/cp1e77z/,cp1e77z,1425290083.0,1425261283.0,LeBron And Beverley Get Into Skirmish,424,2xm7p1
