,body,score,author,permalink,comment_id,created_loc,created_utc,post_title,post_score,post_id
202,"Casting judgment on whether the Lakers' ""nailed"" their recent high-lottery picks seems premature given that D'Lo is 20 and Ingram is *19* and won't turn 20 until, I think, September. And he's already improved significantly since the start of the season, averaging ~15pts on 54% over the past handful of games. And as far as Julius is concerned, I think if that draft were redone Julius probably move *up* a spot or two, so the Lakers did well with what they had. D'Lo's career could go either way and I have to say I'm not sure when was the last time I've seen not just a Laker but a player in general that I was as on the fence on as whether they have the potential to be damn-good, or are just another guy. Admittedly I'm in the camp that leans towards the latter but to act like the book has already been written on him at 20 is ridiculous. 

On the other hand, do you think in any universe Simmons' would call Jaylen Brown a missed pick at this point in his career? I like Simmons as a writer and reading his stuff is something of a guilty pleasure considering my own fandom but dammit if he doesn't come off as childish with how often he makes reference to the Pats that serve no purpose other than to boost his sport's ego, almost like he lives vicariously through his teams and their success, and with how often he takes swipes at the Lakers. Oh look, another Adam-is-going-to-rig-it-for-the-Lakers joke, four years running. Because you know, if you were going to rig if for the Lakers the ideal time wouldn't have been to do it when KAT or Simmons were on the board, of course. Jey-sus. ",29,aspiring1accountant,/r/nba/comments/5zzck8/bill_simmons_the_most_important_nba_lottery_since/df2pas0/,df2pas0,1489825372.0,1489796572.0,[Bill Simmons] The Most Important NBA Lottery Since the LeBron Sweepstakes,810,5zzck8
203,"He's got the stats, he's got the 3 point shot back, he's got the 1 seed, he doesn't have the turnovers, and even if he's ""not trying"" on defense he's still a plus on that end.

I would vote him for MVP.",56,zzMojaveExpress,/r/nba/comments/5zz2zi/lebron_james_now_leads_the_league_in_rpm_wins_he/df267qd/,df267qd,1489801727.0,1489772927.0,LeBron James now leads the league in RPM Wins. He last led in this stat in 2014.,32,5zz2zi
204,MVP,21,imtheasianlad,/r/nba/comments/5zz2zi/lebron_james_now_leads_the_league_in_rpm_wins_he/df2664f/,df2664f,1489801678.0,1489772878.0,LeBron James now leads the league in RPM Wins. He last led in this stat in 2014.,32,5zz2zi
205,"The year he won his 2nd MVP. After you get two, you can break your whole body and never play again and still make HOF. ",110,RudolphGobert,/r/nba/comments/5zyasd/in_your_opinion_what_year_did_lebron_james_become/df1zgj8/,df1zgj8,1489794223.0,1489765423.0,"In your opinion, what year did LeBron James become a lock for the Hall of Fame?",30,5zyasd
206,When he was born ,35,Deja-Vu-Virus,/r/nba/comments/5zyasd/in_your_opinion_what_year_did_lebron_james_become/df1zd5e/,df1zd5e,1489794120.0,1489765320.0,"In your opinion, what year did LeBron James become a lock for the Hall of Fame?",30,5zyasd
207,"When he joined the BIG BALLER BRAND. ™


🔛🔝🔜😆😆",76,MarvFuckingAlbert,/r/nba/comments/5zyasd/in_your_opinion_what_year_did_lebron_james_become/df1zckk/,df1zckk,1489794102.0,1489765302.0,"In your opinion, what year did LeBron James become a lock for the Hall of Fame?",30,5zyasd
208,When he won his first MVP. People overestimate how difficult the basketball HOF is. Nobody is left behind that. ,43,YesWeighNoWeigh,/r/nba/comments/5zyasd/in_your_opinion_what_year_did_lebron_james_become/df1zj8x/,df1zj8x,1489794308.0,1489765508.0,"In your opinion, what year did LeBron James become a lock for the Hall of Fame?",30,5zyasd
209,He hasn't beaten LaVar Ball yet so he isn't a lock yet,51,wikiman2001,/r/nba/comments/5zyasd/in_your_opinion_what_year_did_lebron_james_become/df1zhog/,df1zhog,1489794258.0,1489765458.0,"In your opinion, what year did LeBron James become a lock for the Hall of Fame?",30,5zyasd
210,can anyone make a streamable of JR saying he wouldn't hesitate on any shot even if his mom was defending him or something,638,lesdoggg,/r/nba/comments/5zxh3z/kyrie_you_got_this_lebron_yeah_proceeds_to_drop/df1wxif/,df1wxif,1489791245.0,1489762445.0,Kyrie: you got this? LeBron: yeah *proceeds to drop 17 in the 4th*,2466,5zxh3z
211,"Kyrie: You got this?

LeBron: Nah

Kyrie: Oh *re-enters game*",438,TuneHD,/r/nba/comments/5zxh3z/kyrie_you_got_this_lebron_yeah_proceeds_to_drop/df26r6h/,df26r6h,1489802304.0,1489773504.0,Kyrie: you got this? LeBron: yeah *proceeds to drop 17 in the 4th*,2466,5zxh3z
212,"""I didn't think anyone was capable of doing what LeBron has done, He is the most exciting, awesome player in the game today. I think it's just God disguised as LeBron James.""


-Larry Bird",919,xashburner24,/r/nba/comments/5zxh3z/kyrie_you_got_this_lebron_yeah_proceeds_to_drop/df1tf7g/,df1tf7g,1489786660.0,1489757860.0,Kyrie: you got this? LeBron: yeah *proceeds to drop 17 in the 4th*,2466,5zxh3z
213,"That trust though.

Man I love these guys.",464,No32,/r/nba/comments/5zxh3z/kyrie_you_got_this_lebron_yeah_proceeds_to_drop/df1sj56/,df1sj56,1489785334.0,1489756534.0,Kyrie: you got this? LeBron: yeah *proceeds to drop 17 in the 4th*,2466,5zxh3z
214,"This isn't even playoff LeBron. He can, at any point, just decide to win a basketball game. Fucking unreal. 

**Edit:** Why does he not do this all the time? Probably because doing so is exhausting, and LeBron feels comfortable enough performing in a restrained capacity to carry his team through the regular season until he feels the need to forcibly take over games in the playoffs. I mean, I'm no Cavs fan. I've watched enough Cavs regular season and post-season games where it has been LeBron's force of will that single handedly won the contest, to confidently say - in the face of all but the most stringent competition, (The Mavs, GSW, the Spurs), LeBron has the ability to decide the outcome of the game. 

**Edit 2 - The Reckoning:** All of that being said. I would still vote Russ for MVP this year. 

**Edit 3 - Revenge of the Spell-check:** Sneaky run-on sentence restructuring.",371,HugosBrotherEnrique,/r/nba/comments/5zxh3z/kyrie_you_got_this_lebron_yeah_proceeds_to_drop/df1x7rj/,df1x7rj,1489791602.0,1489762802.0,Kyrie: you got this? LeBron: yeah *proceeds to drop 17 in the 4th*,2466,5zxh3z
215,LeCloser,149,this_place_stinks,/r/nba/comments/5zxh3z/kyrie_you_got_this_lebron_yeah_proceeds_to_drop/df1ssap/,df1ssap,1489785722.0,1489756922.0,Kyrie: you got this? LeBron: yeah *proceeds to drop 17 in the 4th*,2466,5zxh3z
216,"Man does he really need to ask LeBron fuckin James ""you got this""??",70,Indiana_BROnes_,/r/nba/comments/5zxh3z/kyrie_you_got_this_lebron_yeah_proceeds_to_drop/df1wq3t/,df1wq3t,1489790996.0,1489762196.0,Kyrie: you got this? LeBron: yeah *proceeds to drop 17 in the 4th*,2466,5zxh3z
217,I still can't look at this dope without thinking about flat-earthers. Why Kyrie? Why?,36,GrandpaCrocket,/r/nba/comments/5zxh3z/kyrie_you_got_this_lebron_yeah_proceeds_to_drop/df29g07/,df29g07,1489805231.0,1489776431.0,Kyrie: you got this? LeBron: yeah *proceeds to drop 17 in the 4th*,2466,5zxh3z
218,But I just read a post yesterday that said LeBron is coasting?  I don't know how to handle this.,110,NetsBandwagonFan,/r/nba/comments/5zxh3z/kyrie_you_got_this_lebron_yeah_proceeds_to_drop/df1soyt/,df1soyt,1489785582.0,1489756782.0,Kyrie: you got this? LeBron: yeah *proceeds to drop 17 in the 4th*,2466,5zxh3z
219,NEWS FLASH: The best basketball player plays basketball well. ,34,carbongreen,/r/nba/comments/5zxh3z/kyrie_you_got_this_lebron_yeah_proceeds_to_drop/df28lng/,df28lng,1489804309.0,1489775509.0,Kyrie: you got this? LeBron: yeah *proceeds to drop 17 in the 4th*,2466,5zxh3z
220,His three point % is sucking the juice out his free throw %,40,riseUP777,/r/nba/comments/5zw28l/lebron_shot_better_from_the_field_than_he_did_at/df1ixdd/,df1ixdd,1489761011.0,1489732211.0,LeBron shot better from the field than he did at the free throw line against the Jazz,34,5zw28l
221,3 > 1,34,HoboWithAGlock,/r/nba/comments/5zw28l/lebron_shot_better_from_the_field_than_he_did_at/df1k8bq/,df1k8bq,1489764394.0,1489735594.0,LeBron shot better from the field than he did at the free throw line against the Jazz,34,5zw28l
222,LeBron on LeBron crime,172,DeKobe-DeBryant,/r/nba/comments/5zvg4i/lebron_swishes_rare_skyhook_over_gordon_hayward/df1dylx/,df1dylx,1489751615.0,1489722815.0,Lebron swishes rare sky-hook over Gordon Hayward,244,5zvg4i
223,What can this guy not do...,67,imsnice,/r/nba/comments/5zvg4i/lebron_swishes_rare_skyhook_over_gordon_hayward/df1dy8e/,df1dy8e,1489751600.0,1489722800.0,Lebron swishes rare sky-hook over Gordon Hayward,244,5zvg4i
224,Well there it is. Old man game bron has been ushered in,48,bowlofsoop,/r/nba/comments/5zvg4i/lebron_swishes_rare_skyhook_over_gordon_hayward/df1eatc/,df1eatc,1489752118.0,1489723318.0,Lebron swishes rare sky-hook over Gordon Hayward,244,5zvg4i
225,"Well defended, but that is just filthy.",37,nowhathappenedwas,/r/nba/comments/5zvg4i/lebron_swishes_rare_skyhook_over_gordon_hayward/df1ekh1/,df1ekh1,1489752529.0,1489723729.0,Lebron swishes rare sky-hook over Gordon Hayward,244,5zvg4i
226,"We are starting to see what Old Ass Man LeBron will look like. Hooks, 15 foot pick and pops (with him doing the popping), more uncontested three pointers. 

Basically, the lightning drives to the basket are there and will stay there for some time, as will the chasedown blocks and the stepback threes. But LeBron as an old man will be like how your dad can still kick your ass at 1 on 1. ",32,MacBethWay,/r/nba/comments/5zvg4i/lebron_swishes_rare_skyhook_over_gordon_hayward/df1hat5/,df1hat5,1489757353.0,1489728553.0,Lebron swishes rare sky-hook over Gordon Hayward,244,5zvg4i
227,LeKareem,77,mk1123,/r/nba/comments/5zvg4i/lebron_swishes_rare_skyhook_over_gordon_hayward/df1dys9/,df1dys9,1489751622.0,1489722822.0,Lebron swishes rare sky-hook over Gordon Hayward,244,5zvg4i
228,"Sounded like the he said ""Kareem Abdul JeBron""",30,Blestick,/r/nba/comments/5zvg4i/lebron_swishes_rare_skyhook_over_gordon_hayward/df1ebym/,df1ebym,1489752164.0,1489723364.0,Lebron swishes rare sky-hook over Gordon Hayward,244,5zvg4i
229,I think 5 of those 10 rebounds were in the 4th. Someone fact check me.,23,Virgin_Headquarters,/r/nba/comments/5zuxyh/lebron_james_vs_jazz_20170316_33_pts_10_reb_6_ast/df199na/,df199na,1489745075.0,1489716275.0,"LeBron James vs Jazz (2017.03.16) - 33 Pts, 10 Reb, 6 Ast. 17 of Cavs 24 Pts in the 4th!",139,5zuxyh
230,"He was simply amazing, i'm not a big Lebron fan but you've got to respect greatness.",53,NitroXYZ,/r/nba/comments/5zuxyh/lebron_james_vs_jazz_20170316_33_pts_10_reb_6_ast/df198mu/,df198mu,1489745038.0,1489716238.0,"LeBron James vs Jazz (2017.03.16) - 33 Pts, 10 Reb, 6 Ast. 17 of Cavs 24 Pts in the 4th!",139,5zuxyh
231,"And the most impressive part might be the Cavs defense in the 4th, was suffocating. ",100,DemonicDimples,/r/nba/comments/5zuq6i/jason_lloyd_with_irving_sitting_the_fourth_with/df17e7e/,df17e7e,1489742626.0,1489713826.0,"[Jason Lloyd] With Irving sitting the fourth with knee problem and Love reaching minutes limit, LeBron has scored 17pts, grabbed 5 rebs in fourth quarter",405,5zuq6i
232,It's literally just him playing and the pipe man this quarter.,217,calebkeith,/r/nba/comments/5zuq6i/jason_lloyd_with_irving_sitting_the_fourth_with/df178z9/,df178z9,1489742437.0,1489713637.0,"[Jason Lloyd] With Irving sitting the fourth with knee problem and Love reaching minutes limit, LeBron has scored 17pts, grabbed 5 rebs in fourth quarter",405,5zuq6i
233,Legetthefuckouttamywayandletmehandlemybusiness,64,Wu-Tang31,/r/nba/comments/5zuq6i/jason_lloyd_with_irving_sitting_the_fourth_with/df17di6/,df17di6,1489742600.0,1489713800.0,"[Jason Lloyd] With Irving sitting the fourth with knee problem and Love reaching minutes limit, LeBron has scored 17pts, grabbed 5 rebs in fourth quarter",405,5zuq6i
234,"Playoff Lebron showed up in that fourth. Was a treat to watch, god damn.",53,afkescape,/r/nba/comments/5zuq6i/jason_lloyd_with_irving_sitting_the_fourth_with/df17clh/,df17clh,1489742567.0,1489713767.0,"[Jason Lloyd] With Irving sitting the fourth with knee problem and Love reaching minutes limit, LeBron has scored 17pts, grabbed 5 rebs in fourth quarter",405,5zuq6i
235,LeMVP,35,BlindManBaldwin,/r/nba/comments/5zuq6i/jason_lloyd_with_irving_sitting_the_fourth_with/df17api/,df17api,1489742500.0,1489713700.0,"[Jason Lloyd] With Irving sitting the fourth with knee problem and Love reaching minutes limit, LeBron has scored 17pts, grabbed 5 rebs in fourth quarter",405,5zuq6i
236,"Hill is just like ""somebody plz halp"" ",44,datyellowguy,/r/nba/comments/5zuolv/lebron_with_the_emphatic_dunk/df16wqi/,df16wqi,1489741996.0,1489713196.0,LeBron with the emphatic dunk,109,5zuolv
237,Lmao that announcing THROWSSSS THE HAMMAAHHR DOWWHHHHNN,226,Eric_tion,/r/nba/comments/5zun8p/lebron_blows_by_george_hill_for_the_huge_dunk/df16je0/,df16je0,1489741513.0,1489712713.0,Lebron blows by George Hill for the huge dunk,591,5zun8p
238,"Hill is just like ""somebody plz halp"" ",141,datyellowguy,/r/nba/comments/5zun8p/lebron_blows_by_george_hill_for_the_huge_dunk/df16yfq/,df16yfq,1489742059.0,1489713259.0,Lebron blows by George Hill for the huge dunk,591,5zun8p
239,"Hill: ""Where's the help, guys!?""
The Rest: ""Fuck you, that's where.""",72,the_far_yard,/r/nba/comments/5zun8p/lebron_blows_by_george_hill_for_the_huge_dunk/df19yu7/,df19yu7,1489746021.0,1489717221.0,Lebron blows by George Hill for the huge dunk,591,5zun8p
240,"""Hmm, what should I do here?""


*Fuck it*",105,,/r/nba/comments/5zun8p/lebron_blows_by_george_hill_for_the_huge_dunk/df16i1m/,df16i1m,1489741467.0,1489712667.0,Lebron blows by George Hill for the huge dunk,591,5zun8p
241,Jazz D looks so confused with Frye at the 5 spacing the floor,30,,/r/nba/comments/5zun8p/lebron_blows_by_george_hill_for_the_huge_dunk/df17r00/,df17r00,1489743084.0,1489714284.0,Lebron blows by George Hill for the huge dunk,591,5zun8p
242,fk he is a large human,23,Deportivo76ers,/r/nba/comments/5zun8p/lebron_blows_by_george_hill_for_the_huge_dunk/df1dqep/,df1dqep,1489751275.0,1489722475.0,Lebron blows by George Hill for the huge dunk,591,5zun8p
243,AC drunk as usual,36,SausageOfShaq,/r/nba/comments/5zun8p/lebron_blows_by_george_hill_for_the_huge_dunk/df16p9i/,df16p9i,1489741728.0,1489712928.0,Lebron blows by George Hill for the huge dunk,591,5zun8p
244,So effortless,47,therightgayguy,/r/nba/comments/5zumqw/lebron_james_spin_move_and_dunk/df16yu9/,df16yu9,1489742073.0,1489713273.0,Lebron James spin move and dunk,264,5zumqw
245,Good grief. He makes the spectacular appear so casual. ,22,rake2204,/r/nba/comments/5zumqw/lebron_james_spin_move_and_dunk/df18m0b/,df18m0b,1489744215.0,1489715415.0,Lebron James spin move and dunk,264,5zumqw
246,Put him on a LeSpinCycle,26,jeric13xd,/r/nba/comments/5zumqw/lebron_james_spin_move_and_dunk/df16i0c/,df16i0c,1489741466.0,1489712666.0,Lebron James spin move and dunk,264,5zumqw
247,Thats pretty awesome. Where do y'all think he'll end up at the end of his career?,107,jameshardenistheman,/r/nba/comments/5zulbb/cavs_lebron_has_moved_into_13th_place_all_time_in/df1609o/,df1609o,1489740831.0,1489712031.0,"[Cavs] LeBron has moved into 13th place all time in field goals, passing Tim Duncan",412,5zulbb
248,That's insane considering Timmy played 20(?) seasons.,54,xBeleti,/r/nba/comments/5zulbb/cavs_lebron_has_moved_into_13th_place_all_time_in/df17uvc/,df17uvc,1489743223.0,1489714423.0,"[Cavs] LeBron has moved into 13th place all time in field goals, passing Tim Duncan",412,5zulbb
249,The *Andersons* got tickets to the game??,25,CreamyInfantShits,/r/nba/comments/5zulbb/cavs_lebron_has_moved_into_13th_place_all_time_in/df16013/,df16013,1489740823.0,1489712023.0,"[Cavs] LeBron has moved into 13th place all time in field goals, passing Tim Duncan",412,5zulbb
250,"Top 3. Hoping for #1, tho.",119,Virgin_Headquarters,/r/nba/comments/5zulbb/cavs_lebron_has_moved_into_13th_place_all_time_in/df161fz/,df161fz,1489740876.0,1489712076.0,"[Cavs] LeBron has moved into 13th place all time in field goals, passing Tim Duncan",412,5zulbb
251,Not as insane when you consider he was really only the main scorer of his team for 10 of those seasons.. Lebron been doing that since he came in.,42,BigWillie54,/r/nba/comments/5zulbb/cavs_lebron_has_moved_into_13th_place_all_time_in/df19qa3/,df19qa3,1489745701.0,1489716901.0,"[Cavs] LeBron has moved into 13th place all time in field goals, passing Tim Duncan",412,5zulbb
252,Who is the current top 5 and how far away is LBJ?,40,jameshardenistheman,/r/nba/comments/5zulbb/cavs_lebron_has_moved_into_13th_place_all_time_in/df162vl/,df162vl,1489740928.0,1489712128.0,"[Cavs] LeBron has moved into 13th place all time in field goals, passing Tim Duncan",412,5zulbb
253,RIP East it was fun while it lasted.,245,SegundaMortem,/r/nba/comments/5ztme8/hayden_grove_tonight_will_be_the_first_time_the/df0yhn8/,df0yhn8,1489731487.0,1489702687.0,"[Hayden Grove] Tonight will be the first time the Cavs trot out Kyrie, J.R, LeBron, Love and Thompson since December 23rd.",713,5ztme8
254,">trot out

LeHorse",446,theconfuserx2,/r/nba/comments/5ztme8/hayden_grove_tonight_will_be_the_first_time_the/df0xioc/,df0xioc,1489730365.0,1489701565.0,"[Hayden Grove] Tonight will be the first time the Cavs trot out Kyrie, J.R, LeBron, Love and Thompson since December 23rd.",713,5ztme8
255,I think it was just yesterday that people were calling someone crazy for thinking Love may start in the next week or so,91,peeinherbutt,/r/nba/comments/5ztme8/hayden_grove_tonight_will_be_the_first_time_the/df0xj7t/,df0xj7t,1489730382.0,1489701582.0,"[Hayden Grove] Tonight will be the first time the Cavs trot out Kyrie, J.R, LeBron, Love and Thompson since December 23rd.",713,5ztme8
256,^yay :(,48,fdahood,/r/nba/comments/5ztme8/hayden_grove_tonight_will_be_the_first_time_the/df0xhk7/,df0xhk7,1489730330.0,1489701530.0,"[Hayden Grove] Tonight will be the first time the Cavs trot out Kyrie, J.R, LeBron, Love and Thompson since December 23rd.",713,5ztme8
257,"DNPs don't affect MPG last I checked. Maybe they address it in the article, but I'm not in the mood to read ESPN right now ",34,Charlie_Steve,/r/nba/comments/5zs69b/habestroh_coaches_are_using_dnprest_did_not_play/df0mn5c/,df0mn5c,1489718696.0,1489689896.0,"[Habestroh] Coaches are using DNP-Rest (did not play, resting) at a record pace in 2016-17, nearly twice as often as in 2015-16. The outlier? LeBron James, who in his 14th season ranks among NBA leaders in minutes per game.",39,5zs69b
258,He's only 13th in total minutes played tho.,63,pen__pen,/r/nba/comments/5zs69b/habestroh_coaches_are_using_dnprest_did_not_play/df0ke8t/,df0ke8t,1489716307.0,1489687507.0,"[Habestroh] Coaches are using DNP-Rest (did not play, resting) at a record pace in 2016-17, nearly twice as often as in 2015-16. The outlier? LeBron James, who in his 14th season ranks among NBA leaders in minutes per game.",39,5zs69b
259,Is it just me who thinks that Isaiah over Wall is weird in the rankings?,167,,/r/nba/comments/5zs224/tim_botemps_surveyed_106_media_members_not_all/df0lxq3/,df0lxq3,1489717936.0,1489689136.0,"[Tim Botemps] Surveyed 106 media members (not all MVP voters) for the MVP: James Harden (910 points), Russell Westbrook (768), Kawhi Leonard (658), LeBron James (600)",702,5zs224
260,has there ever been an mvp the season before to not receive a single vote the following season? just curious bc it seems like that's what will happen with curry ,73,xj23z,/r/nba/comments/5zs224/tim_botemps_surveyed_106_media_members_not_all/df0jg1k/,df0jg1k,1489715321.0,1489686521.0,"[Tim Botemps] Surveyed 106 media members (not all MVP voters) for the MVP: James Harden (910 points), Russell Westbrook (768), Kawhi Leonard (658), LeBron James (600)",702,5zs224
261,Seems about right. ,255,,/r/nba/comments/5zs224/tim_botemps_surveyed_106_media_members_not_all/df0j3pn/,df0j3pn,1489714965.0,1489686165.0,"[Tim Botemps] Surveyed 106 media members (not all MVP voters) for the MVP: James Harden (910 points), Russell Westbrook (768), Kawhi Leonard (658), LeBron James (600)",702,5zs224
262,[deleted],370,,/r/nba/comments/5zs224/tim_botemps_surveyed_106_media_members_not_all/df0jbrb/,df0jbrb,1489715198.0,1489686398.0,"[Tim Botemps] Surveyed 106 media members (not all MVP voters) for the MVP: James Harden (910 points), Russell Westbrook (768), Kawhi Leonard (658), LeBron James (600)",702,5zs224
263,I'm salty. ,78,m__surly,/r/nba/comments/5zs224/tim_botemps_surveyed_106_media_members_not_all/df0jc0g/,df0jc0g,1489715205.0,1489686405.0,"[Tim Botemps] Surveyed 106 media members (not all MVP voters) for the MVP: James Harden (910 points), Russell Westbrook (768), Kawhi Leonard (658), LeBron James (600)",702,5zs224
264,"I find Westbrook the most endearing of the top 4 for some reason, and thus he is my personal pick. Seeding and logic be damned.",207,fdahood,/r/nba/comments/5zs224/tim_botemps_surveyed_106_media_members_not_all/df0j6mn/,df0j6mn,1489715052.0,1489686252.0,"[Tim Botemps] Surveyed 106 media members (not all MVP voters) for the MVP: James Harden (910 points), Russell Westbrook (768), Kawhi Leonard (658), LeBron James (600)",702,5zs224
265,Harden is winning it,57,,/r/nba/comments/5zs224/tim_botemps_surveyed_106_media_members_not_all/df0jaex/,df0jaex,1489715161.0,1489686361.0,"[Tim Botemps] Surveyed 106 media members (not all MVP voters) for the MVP: James Harden (910 points), Russell Westbrook (768), Kawhi Leonard (658), LeBron James (600)",702,5zs224
266,"This is probably how the voting will actually play out.

I'm still one of the people who thinks Kawhi/LeBron should be 2nd/3rd but oh well.",42,DeKobe-DeBryant,/r/nba/comments/5zs224/tim_botemps_surveyed_106_media_members_not_all/df0m8he/,df0m8he,1489718258.0,1489689458.0,"[Tim Botemps] Surveyed 106 media members (not all MVP voters) for the MVP: James Harden (910 points), Russell Westbrook (768), Kawhi Leonard (658), LeBron James (600)",702,5zs224
267,"LeBron led in points, rebounds, assists, blocks, and steals vs the all time best record team and from 1-3 down. No comparison.",76,Wesquire91,/r/nba/comments/5zmyoq/which_was_more_iconic_kobe_winning_his_5th_title/dezdh9t/,dezdh9t,1489649186.0,1489620386.0,Which was more iconic: Kobe winning his 5th title in 2010 OR LeBron winning one for Cleveland in 2016,27,5zmyoq
268,Cleveland's first vs Laker's... 16th? The fact I had to google the number is pretty indicative of which was bigger.,105,WD51,/r/nba/comments/5zmyoq/which_was_more_iconic_kobe_winning_his_5th_title/dezd175/,dezd175,1489648633.0,1489619833.0,Which was more iconic: Kobe winning his 5th title in 2010 OR LeBron winning one for Cleveland in 2016,27,5zmyoq
269,Lebron winning one for the land,46,CISScum2,/r/nba/comments/5zmyoq/which_was_more_iconic_kobe_winning_his_5th_title/dezczt3/,dezczt3,1489648585.0,1489619785.0,Which was more iconic: Kobe winning his 5th title in 2010 OR LeBron winning one for Cleveland in 2016,27,5zmyoq
270,"LeBron and it's not even close. Broke the curse, 3-1 down. 73-9 team with the first unanimous MVP ever, all that jazz.

For Kobe it was just a good win against the Celtics, second ring in a row. Not all that iconic really.",35,SidMoncrief,/r/nba/comments/5zmyoq/which_was_more_iconic_kobe_winning_his_5th_title/dezdeir/,dezdeir,1489649091.0,1489620291.0,Which was more iconic: Kobe winning his 5th title in 2010 OR LeBron winning one for Cleveland in 2016,27,5zmyoq
271,"Anytime you pass KAJ in a statistical achievement, it's saying something.

It's been an absolute honor and pleasure to get to see Lebron's entire career, he is definitively this generations GOAT.  ",398,WillyTanner,/r/nba/comments/5zkotz/lebron_has_778_consecutive_10_point_games_in_the/deytfk6/,deytfk6,1489627030.0,1489598230.0,Lebron has 778 consecutive 10 point games in the regular season. (10 games away from passing Kareem Abdul Jabar),457,5zkotz
272,"jinx post

inb4 8 points next game",70,DeKobe-DeBryant,/r/nba/comments/5zkotz/lebron_has_778_consecutive_10_point_games_in_the/deytmux/,deytmux,1489627250.0,1489598450.0,Lebron has 778 consecutive 10 point games in the regular season. (10 games away from passing Kareem Abdul Jabar),457,5zkotz
273,Great now for the first time in my life I'm worried Lebron wont score 10 points.,60,TheKingOfThings01,/r/nba/comments/5zkotz/lebron_has_778_consecutive_10_point_games_in_the/dez0a4u/,dez0a4u,1489634356.0,1489605556.0,Lebron has 778 consecutive 10 point games in the regular season. (10 games away from passing Kareem Abdul Jabar),457,5zkotz
274,The hype coming out of high school being fulfilled on top of this man's endurability is just insane to think about. ,45,,/r/nba/comments/5zkotz/lebron_has_778_consecutive_10_point_games_in_the/deytgoh/,deytgoh,1489627064.0,1489598264.0,Lebron has 778 consecutive 10 point games in the regular season. (10 games away from passing Kareem Abdul Jabar),457,5zkotz
275,"I'm more worried about dirks son. His wife has two brothers that play pro soccer. A black, ultra athletic dirk would break the Fucking league.",211,yungcrouch,/r/nba/comments/5zinj5/if_lebron_plays_until_hes_atleast_39_he_has_a/deyhuv9/,deyhuv9,1489613319.0,1489584519.0,"If Lebron plays until hes atleast 39, he has a good chance of playing with his son if LBJ Jr becomes a one and done.",338,5zinj5
276,LeBron after posterizing his son: I FUCKED YOUR MOM YESTERDAY,763,realudonishaslem,/r/nba/comments/5zinj5/if_lebron_plays_until_hes_atleast_39_he_has_a/deydmsp/,deydmsp,1489604887.0,1489576087.0,"If Lebron plays until hes atleast 39, he has a good chance of playing with his son if LBJ Jr becomes a one and done.",338,5zinj5
