,body,score,author,permalink,comment_id,created_loc,created_utc,post_title,post_score,post_id
722,Can't believe Bron is probably gonna retire within the next 10 years...one of the greatest to every play the game. We should all enjoy his career while he's still here; I think everyone is past the point of hating on him and we should all appreciate his greatness while it's still here. Damn I love basketball [8],32,InfernoBA,/r/nba/comments/5chxdc/lebron_james_youngest_player_in_nba_history_with/d9wzmvq/,d9wzmvq,1478967954.0,1478939154.0,"LeBron James: youngest player in NBA history with 27,000 career points (31 years, 317 days); Kobe Bryant held previous record at 32-160",932,5chxdc
723,The scary thing is that LeBron doesn't even prioritize scoring...just imagine if he had a pure scoring mentality. ,110,mr_antman85,/r/nba/comments/5chxdc/lebron_james_youngest_player_in_nba_history_with/d9wmpkj/,d9wmpkj,1478941848.0,1478913048.0,"LeBron James: youngest player in NBA history with 27,000 career points (31 years, 317 days); Kobe Bryant held previous record at 32-160",932,5chxdc
724,"I can't believe LeBron is 31, almost 32.",27,Wally450,/r/nba/comments/5chxdc/lebron_james_youngest_player_in_nba_history_with/d9wnjr8/,d9wnjr8,1478943175.0,1478914375.0,"LeBron James: youngest player in NBA history with 27,000 career points (31 years, 317 days); Kobe Bryant held previous record at 32-160",932,5chxdc
725,"LeBron is probably a better scorer than Kobe. 

Which is crazy when you consider the rest of LeBron's game. ",246,rjvir,/r/nba/comments/5chxdc/lebron_james_youngest_player_in_nba_history_with/d9wll4p/,d9wll4p,1478940097.0,1478911297.0,"LeBron James: youngest player in NBA history with 27,000 career points (31 years, 317 days); Kobe Bryant held previous record at 32-160",932,5chxdc
726,"I think that was a fine response from Lebron. Obviously he's personally disappointed. 

",328,jroades26,/r/nba/comments/5cfy0t/lebron_asked_if_he_will_visit_the_white_house_if/d9w4tvd/,d9w4tvd,1478917116.0,1478888316.0,LeBron asked if he will visit the White House if he wins another ring in the next 4 years,354,5cfy0t
727,"LeBron: I'll visit Trump, sure... not one time, not two times, not three times...",230,heat_forever,/r/nba/comments/5cfy0t/lebron_asked_if_he_will_visit_the_white_house_if/d9w6acx/,d9w6acx,1478918949.0,1478890149.0,LeBron asked if he will visit the White House if he wins another ring in the next 4 years,354,5cfy0t
728,"""Yeah I would love to..... have to cross that road.""",101,Donald_Keyman,/r/nba/comments/5cfy0t/lebron_asked_if_he_will_visit_the_white_house_if/d9w6tka/,d9w6tka,1478919630.0,1478890830.0,LeBron asked if he will visit the White House if he wins another ring in the next 4 years,354,5cfy0t
729,damn i didnt realize how deep lebrons voice is. he sounds like the bad guys in movies that disguise their voices lol,51,recamie,/r/nba/comments/5cfy0t/lebron_asked_if_he_will_visit_the_white_house_if/d9w9uld/,d9w9uld,1478923504.0,1478894704.0,LeBron asked if he will visit the White House if he wins another ring in the next 4 years,354,5cfy0t
730,Good response ,38,sportsfan161,/r/nba/comments/5cfy0t/lebron_asked_if_he_will_visit_the_white_house_if/d9w5w85/,d9w5w85,1478918453.0,1478889653.0,LeBron asked if he will visit the White House if he wins another ring in the next 4 years,354,5cfy0t
731,Still cant believe mike pence is the most powerful man in the world,34,wutdefukk,/r/nba/comments/5cfy0t/lebron_asked_if_he_will_visit_the_white_house_if/d9wd19b/,d9wd19b,1478927653.0,1478898853.0,LeBron asked if he will visit the White House if he wins another ring in the next 4 years,354,5cfy0t
732,Add this to the scouting report ... keep LeBron to 2 points. ,221,,/r/nba/comments/5c1lkn/espn_lebron_james_was_limited_to_2_points_in_the/d9sygj1/,d9sygj1,1478736235.0,1478707435.0,[ESPN] LeBron James was limited to 2 points in the 1st half in loss vs Atlanta. James' teams are 1-9 when he scores 2 or fewer in a 1st half,259,5c1lkn
733,That one win.... Albert Einstein.,71,whitlinger,/r/nba/comments/5c1lkn/espn_lebron_james_was_limited_to_2_points_in_the/d9sxdjr/,d9sxdjr,1478734855.0,1478706055.0,[ESPN] LeBron James was limited to 2 points in the 1st half in loss vs Atlanta. James' teams are 1-9 when he scores 2 or fewer in a 1st half,259,5c1lkn
734,key to victory: stop lebron james,30,goodname_,/r/nba/comments/5c1lkn/espn_lebron_james_was_limited_to_2_points_in_the/d9t0fj2/,d9t0fj2,1478738609.0,1478709809.0,[ESPN] LeBron James was limited to 2 points in the 1st half in loss vs Atlanta. James' teams are 1-9 when he scores 2 or fewer in a 1st half,259,5c1lkn
735,Honestly crazy that LeBron has 10 games with 2 points or less in the first half.,82,cantankerousbliss,/r/nba/comments/5c1lkn/espn_lebron_james_was_limited_to_2_points_in_the/d9sw7s1/,d9sw7s1,1478733314.0,1478704514.0,[ESPN] LeBron James was limited to 2 points in the 1st half in loss vs Atlanta. James' teams are 1-9 when he scores 2 or fewer in a 1st half,259,5c1lkn
736,lebron is exposed!!!!! no way the cavs can repeat now that this info is out,34,afarrisXD,/r/nba/comments/5c1lkn/espn_lebron_james_was_limited_to_2_points_in_the/d9sxys3/,d9sxys3,1478735617.0,1478706817.0,[ESPN] LeBron James was limited to 2 points in the 1st half in loss vs Atlanta. James' teams are 1-9 when he scores 2 or fewer in a 1st half,259,5c1lkn
737,"I knew Thompson was shooting poorly,
but after some good games, I'm surprised Booker hasn't knocked down more than that ",74,SherspockHolmes,/r/nba/comments/5brzx6/slater_stephen_curry_had_13_3s_tonight_players/d9qtp9o/,d9qtp9o,1478621245.0,1478592445.0,"[Slater] Stephen Curry had 13 3s tonight. Players with fewer than 13 3s this season: JJ Redick, Klay Thompson, Kyle Lowry, Devin Booker, LeBron James",197,5brzx6
738,"Jesus Christ, Klay is 9/46... ",40,Jotabonito,/r/nba/comments/5brzx6/slater_stephen_curry_had_13_3s_tonight_players/d9quhrp/,d9quhrp,1478623740.0,1478594940.0,"[Slater] Stephen Curry had 13 3s tonight. Players with fewer than 13 3s this season: JJ Redick, Klay Thompson, Kyle Lowry, Devin Booker, LeBron James",197,5brzx6
739,BUT NOT PORZINGOD! ðŸ™,77,CopenhagenCalling,/r/nba/comments/5brzx6/slater_stephen_curry_had_13_3s_tonight_players/d9qtl7e/,d9qtl7e,1478620904.0,1478592104.0,"[Slater] Stephen Curry had 13 3s tonight. Players with fewer than 13 3s this season: JJ Redick, Klay Thompson, Kyle Lowry, Devin Booker, LeBron James",197,5brzx6
740,Redick and Klay? Wow. What is up with Redick?,36,ultimaweapon51,/r/nba/comments/5brzx6/slater_stephen_curry_had_13_3s_tonight_players/d9qurkq/,d9qurkq,1478624645.0,1478595845.0,"[Slater] Stephen Curry had 13 3s tonight. Players with fewer than 13 3s this season: JJ Redick, Klay Thompson, Kyle Lowry, Devin Booker, LeBron James",197,5brzx6
741,At first I thought this was a stupid stat but this is actually pretty ridiculous,92,22every-day,/r/nba/comments/5brzx6/slater_stephen_curry_had_13_3s_tonight_players/d9qtj36/,d9qtj36,1478620727.0,1478591927.0,"[Slater] Stephen Curry had 13 3s tonight. Players with fewer than 13 3s this season: JJ Redick, Klay Thompson, Kyle Lowry, Devin Booker, LeBron James",197,5brzx6
742,"Don't forget Joel Embiid, but he's clearly better because of his %",23,mxnoob983,/r/nba/comments/5brzx6/slater_stephen_curry_had_13_3s_tonight_players/d9qtsxt/,d9qtsxt,1478621544.0,1478592744.0,"[Slater] Stephen Curry had 13 3s tonight. Players with fewer than 13 3s this season: JJ Redick, Klay Thompson, Kyle Lowry, Devin Booker, LeBron James",197,5brzx6
743,He averaged 20-5-5 his rookie year.,26,appioneer,/r/nba/comments/5brjdq/lebron_james_has_the_most_games_in_nba_history/d9qqjf6/,d9qqjf6,1478613452.0,1478584652.0,"Lebron James has the most games in NBA history with 20/5/5, 25/5/5, and 30/5/5.",86,5brjdq
744,Weird post but that's cool tho ,33,legendariusss,/r/nba/comments/5brjdq/lebron_james_has_the_most_games_in_nba_history/d9qq6o9/,d9qq6o9,1478612797.0,1478583997.0,"Lebron James has the most games in NBA history with 20/5/5, 25/5/5, and 30/5/5.",86,5brjdq
745,he's got a future in this league ,41,shanmustafa,/r/nba/comments/5brjdq/lebron_james_has_the_most_games_in_nba_history/d9qq8ez/,d9qq8ez,1478612885.0,1478584085.0,"Lebron James has the most games in NBA history with 20/5/5, 25/5/5, and 30/5/5.",86,5brjdq
746,"damn, surprised it took this long to do LeBron",60,GenieHunter,/r/nba/comments/5bqcrj/attention_to_detail_lebron_james/d9qhxg8/,d9qhxg8,1478600450.0,1478571650.0,Attention to Detail: LeBron James,316,5bqcrj
747,"That part where he parallels LeBron with Hakeem, Kobe and MJ was really cool. ",51,Catalyst985,/r/nba/comments/5bqcrj/attention_to_detail_lebron_james/d9qk8xj/,d9qk8xj,1478603602.0,1478574802.0,Attention to Detail: LeBron James,316,5bqcrj
748,Damn this is an amazing channel.,23,HumbleBrothers,/r/nba/comments/5bqcrj/attention_to_detail_lebron_james/d9qjgk3/,d9qjgk3,1478602544.0,1478573744.0,Attention to Detail: LeBron James,316,5bqcrj
749,"Man I am just so so lucky to watch this guy play. I've been watching LeBorn play for so long that all these subtle aspects discussed in the video are something that Ive taken for granted, having studied his game for so long. 

I just want this guy to succeed so bad. So glad he's on track to be one if the greatest ever to play. ",43,flashbunnny,/r/nba/comments/5bqcrj/attention_to_detail_lebron_james/d9qmdkf/,d9qmdkf,1478606528.0,1478577728.0,Attention to Detail: LeBron James,316,5bqcrj
750,"I'm an admittedly huge Lebron Stan and watching this made me oscillate back and forth between ""Jesus christ, this man is amazing"" and ""fuck this guy, no one should be this good at anything.""",21,sdtwo,/r/nba/comments/5bqcrj/attention_to_detail_lebron_james/d9qp6s6/,d9qp6s6,1478610966.0,1478582166.0,Attention to Detail: LeBron James,316,5bqcrj
751,"And only 8,113 to catch John Stockton for 1st. At his 9.9 APG career average he'd only have to play 10 more seasons without missing a game to catch him.",161,doctorjerome,/r/nba/comments/5blh9x/lebron_only_needs_440_more_points_to_become_8th/d9pnruc/,d9pnruc,1478562951.0,1478534151.0,Lebron only needs 440 more points to become 8th on the all-time scoring list! Chris Paul only needs 247 more assists to become 10th in all-time assists!,399,5blh9x
752,The Chris Paul one kind of surprised me but than I realized he's been in the league for 11 seasons. Jeez. Where does the time go.,114,croationsensation7,/r/nba/comments/5blh9x/lebron_only_needs_440_more_points_to_become_8th/d9piirq/,d9piirq,1478555308.0,1478526508.0,Lebron only needs 440 more points to become 8th on the all-time scoring list! Chris Paul only needs 247 more assists to become 10th in all-time assists!,399,5blh9x
753,"These were the guys that were the youngins when I just started really paying attention to the NBA, time flies , nice to see ",38,lukietrice,/r/nba/comments/5blh9x/lebron_only_needs_440_more_points_to_become_8th/d9pner8/,d9pner8,1478562481.0,1478533681.0,Lebron only needs 440 more points to become 8th on the all-time scoring list! Chris Paul only needs 247 more assists to become 10th in all-time assists!,399,5blh9x
754,"Alright let's play this game as I do enjoy it.

*If Lebron averages X amount of points he would have to play Y amount of years to catch Kareem as the All time points leader*

Kareem: **38,387**

Lebron: **26,970**

Difference: **11,417**

*If Lebron averages 20 ppg he would have to play another 7 seasons to catch Kareem*

*If Lebron averages 15 ppg he would have to play another 9.3 years*

*If Lebron averages 10 ppg he would have to play another 14 seasons*


(11,417 / 82 games per season / X points per game = Y number of seasons)

EDIT: Lebron James current career average is 27.2 ppg and he is averaging 22.8 ppg so far this season.",51,hankbaumbach,/r/nba/comments/5blh9x/lebron_only_needs_440_more_points_to_become_8th/d9pox74/,d9pox74,1478564400.0,1478535600.0,Lebron only needs 440 more points to become 8th on the all-time scoring list! Chris Paul only needs 247 more assists to become 10th in all-time assists!,399,5blh9x
755,LeAllTimeGreat,89,,/r/nba/comments/5blh9x/lebron_only_needs_440_more_points_to_become_8th/d9pg8ae/,d9pg8ae,1478550419.0,1478521619.0,Lebron only needs 440 more points to become 8th on the all-time scoring list! Chris Paul only needs 247 more assists to become 10th in all-time assists!,399,5blh9x
756,WITNESS,34,RsiiJordan,/r/nba/comments/5blh9x/lebron_only_needs_440_more_points_to_become_8th/d9ph3f5/,d9ph3f5,1478552474.0,1478523674.0,Lebron only needs 440 more points to become 8th on the all-time scoring list! Chris Paul only needs 247 more assists to become 10th in all-time assists!,399,5blh9x
757,"I know you guys hate politics, but if Lebron's influence wins her Ohio in Tuesdays election, it becomes practically impossible for Trump to win. This could be big.",37,StormWilliams,/r/nba/comments/5bjceo/lebron_james_brings_jr_smith_on_stage_introduces/d9oybos/,d9oybos,1478511021.0,1478482221.0,"LeBron James Brings JR Smith on Stage, Introduces Hillary Clinton at Ohio Rally",33,5bjceo
758,"If you asked me ""The Warriors can win more championships but Trump wins or they never win again and Hillary wins"" I'd basically stop watching basketball when the regular season ends because they ain't ever winning again. 

So people can complain about Lebron lord knows I do bit I give him props for throwing his weight behind her. Especially since people will shit on him for it. ESPECIALLY on Reddit. ",29,Parenegade,/r/nba/comments/5bjceo/lebron_james_brings_jr_smith_on_stage_introduces/d9oy77n/,d9oy77n,1478510843.0,1478482043.0,"LeBron James Brings JR Smith on Stage, Introduces Hillary Clinton at Ohio Rally",33,5bjceo
759,god I hate American politics,29,PairedFoot08,/r/nba/comments/5bjceo/lebron_james_brings_jr_smith_on_stage_introduces/d9oxiwa/,d9oxiwa,1478509874.0,1478481074.0,"LeBron James Brings JR Smith on Stage, Introduces Hillary Clinton at Ohio Rally",33,5bjceo
760,"To start he should probably stop fading away when he shoots, that makes the shot a million times harder ",444,Jay_x_Playboy,/r/nba/comments/5bj0ei/lebron_is_now_shooting_26_from_three_on_almost_5/d9ouxga/,d9ouxga,1478506198.0,1478477398.0,LeBron is now shooting 26% from three on almost 5 attempts per game. Will his three point shot ever come back?,320,5bj0ei
761,If Wade can start sniping from 3 out of nowhere I'd say there's at least a reasonable chance that this happens,165,,/r/nba/comments/5bj0ei/lebron_is_now_shooting_26_from_three_on_almost_5/d9ovdzt/,d9ovdzt,1478506832.0,1478478032.0,LeBron is now shooting 26% from three on almost 5 attempts per game. Will his three point shot ever come back?,320,5bj0ei
762,Through 6 games last season he was shooting 22% on 3s. It'll go up as the season goes on.,57,Xlow48,/r/nba/comments/5bj0ei/lebron_is_now_shooting_26_from_three_on_almost_5/d9ov15g/,d9ov15g,1478506340.0,1478477540.0,LeBron is now shooting 26% from three on almost 5 attempts per game. Will his three point shot ever come back?,320,5bj0ei
763,I think at this point we just have to accept he is a below average perimeter shooter who can be average to slightly above average when the playoff come around. ,73,theguru789,/r/nba/comments/5bj0ei/lebron_is_now_shooting_26_from_three_on_almost_5/d9ov1ax/,d9ov1ax,1478506345.0,1478477545.0,LeBron is now shooting 26% from three on almost 5 attempts per game. Will his three point shot ever come back?,320,5bj0ei
764,He never truly had a 3point shot. He minimized his attempts during the Heat stint to the league lowest. It was more about shot selection and coaching than anything. ,30,mypphotsauce,/r/nba/comments/5bj0ei/lebron_is_now_shooting_26_from_three_on_almost_5/d9ov46g/,d9ov46g,1478506454.0,1478477654.0,LeBron is now shooting 26% from three on almost 5 attempts per game. Will his three point shot ever come back?,320,5bj0ei
765,He has a lot of fuck you 3's late in the shot clock. When he sets and shoots he is much better. He has to jump with both feet and not off of one.,103,redman012,/r/nba/comments/5bj0ei/lebron_is_now_shooting_26_from_three_on_almost_5/d9ov13v/,d9ov13v,1478506338.0,1478477538.0,LeBron is now shooting 26% from three on almost 5 attempts per game. Will his three point shot ever come back?,320,5bj0ei
766,"He's only 3.8% worse than the Warriors as a team, not bad!

Anyway, I think he can find his shot again. His form doesn't really have issues, and he's been pretty decent in the past. If he focuses on it there's no reason why he can't at least be in the low/mid 30s.",114,zzMojaveExpress,/r/nba/comments/5bj0ei/lebron_is_now_shooting_26_from_three_on_almost_5/d9ouxjl/,d9ouxjl,1478506202.0,1478477402.0,LeBron is now shooting 26% from three on almost 5 attempts per game. Will his three point shot ever come back?,320,5bj0ei
767,It'll come back in the playoffs,67,JeramiGrant,/r/nba/comments/5bj0ei/lebron_is_now_shooting_26_from_three_on_almost_5/d9ouwci/,d9ouwci,1478506156.0,1478477356.0,LeBron is now shooting 26% from three on almost 5 attempts per game. Will his three point shot ever come back?,320,5bj0ei
768,"Man, magic changing his mvp pick everyday. What a shitposter",386,wikiman2001,/r/nba/comments/5bia56/magic_lebron_james_has_led_his_cavs_to_a_60_start/d9oouy1/,d9oouy1,1478498006.0,1478469206.0,"[Magic] LeBron James has led his Cavs to a 6-0 start if they finish the season with the best record in the league, he should be the NBA MVP.",641,5bia56
769,"MJ 6-0 in finals but Lebron got that 6-0 season record, DEBATE BACK OPEN",120,CIark,/r/nba/comments/5bia56/magic_lebron_james_has_led_his_cavs_to_a_60_start/d9ovisz/,d9ovisz,1478507019.0,1478478219.0,"[Magic] LeBron James has led his Cavs to a 6-0 start if they finish the season with the best record in the league, he should be the NBA MVP.",641,5bia56
770,it's literally November 6,436,spiritanimalofcousy,/r/nba/comments/5bia56/magic_lebron_james_has_led_his_cavs_to_a_60_start/d9ookgz/,d9ookgz,1478497640.0,1478468840.0,"[Magic] LeBron James has led his Cavs to a 6-0 start if they finish the season with the best record in the league, he should be the NBA MVP.",641,5bia56
771,"Magic has to be self-aware, right?",138,BlindManBaldwin,/r/nba/comments/5bia56/magic_lebron_james_has_led_his_cavs_to_a_60_start/d9opcs2/,d9opcs2,1478498647.0,1478469847.0,"[Magic] LeBron James has led his Cavs to a 6-0 start if they finish the season with the best record in the league, he should be the NBA MVP.",641,5bia56
772,"They gave Jordan the MVP when he was 35, because he was the best player on the #1 seeded team. This could be Lebrons chance",307,salmon10,/r/nba/comments/5bia56/magic_lebron_james_has_led_his_cavs_to_a_60_start/d9oos1a/,d9oos1a,1478497904.0,1478469104.0,"[Magic] LeBron James has led his Cavs to a 6-0 start if they finish the season with the best record in the league, he should be the NBA MVP.",641,5bia56
773,"Serious question, if the LeBron leads the Cavs have the best record in the league but Westbrook or Harden lead their teams to the 2nd, 3rd or 4th seed in the West while leading the league in points and assists, wouldn't you give it to them? That would be something that hasn't been done in over 2 decades. ",32,YoungDawz,/r/nba/comments/5bia56/magic_lebron_james_has_led_his_cavs_to_a_60_start/d9opn82/,d9opn82,1478499019.0,1478470219.0,"[Magic] LeBron James has led his Cavs to a 6-0 start if they finish the season with the best record in the league, he should be the NBA MVP.",641,5bia56
774,GOAT twitter troll,412,themariokarters,/r/nba/comments/5bia56/magic_lebron_james_has_led_his_cavs_to_a_60_start/d9oojf7/,d9oojf7,1478497602.0,1478468802.0,"[Magic] LeBron James has led his Cavs to a 6-0 start if they finish the season with the best record in the league, he should be the NBA MVP.",641,5bia56
775,Anyone have a guess on who Magic will pick for MVP after game 10?,52,untouchable765,/r/nba/comments/5bia56/magic_lebron_james_has_led_his_cavs_to_a_60_start/d9op6ye/,d9op6ye,1478498438.0,1478469638.0,"[Magic] LeBron James has led his Cavs to a 6-0 start if they finish the season with the best record in the league, he should be the NBA MVP.",641,5bia56
776,"No question.  If LeBron leads the Cavs to the best record, he will be the best player on the best team, in addition to the best player period.",25,siphillis,/r/nba/comments/5bia56/magic_lebron_james_has_led_his_cavs_to_a_60_start/d9ormwe/,d9ormwe,1478501670.0,1478472870.0,"[Magic] LeBron James has led his Cavs to a 6-0 start if they finish the season with the best record in the league, he should be the NBA MVP.",641,5bia56
777,"I thought it was more still giving respect to Hakeem, I remember he worked out with LeBron one summer, really helped him with his post moves. Either way, great post",67,EvanH98,/r/nba/comments/5bhtat/lebron_drops_subtle_hint_to_get_shaqs_ego_ready/d9okmqu/,d9okmqu,1478492941.0,1478464141.0,LeBron drops subtle hint to get Shaq's ego ready for when he passes him.,27,5bhtat
778,"Wow, what a clickbait and completely incorrect title lol. You must work at TMZ",32,secantstrut,/r/nba/comments/5bhtat/lebron_drops_subtle_hint_to_get_shaqs_ego_ready/d9omhyx/,d9omhyx,1478495169.0,1478466369.0,LeBron drops subtle hint to get Shaq's ego ready for when he passes him.,27,5bhtat
779,"Can we ban posts that reach so hard with titles like this?

This picture is dope, but you ruined it with your TMZ-esque title tbh",49,KevinWDurant,/r/nba/comments/5bhtat/lebron_drops_subtle_hint_to_get_shaqs_ego_ready/d9oluia/,d9oluia,1478494415.0,1478465615.0,LeBron drops subtle hint to get Shaq's ego ready for when he passes him.,27,5bhtat
780,What's the hint?  Is this just a fat joke because Shaq's sitting next to the cake?,21,jaynay1,/r/nba/comments/5bhtat/lebron_drops_subtle_hint_to_get_shaqs_ego_ready/d9okiz9/,d9okiz9,1478492814.0,1478464014.0,LeBron drops subtle hint to get Shaq's ego ready for when he passes him.,27,5bhtat
781,He's also the only non-guard in the top 30 in assists,218,-orangejoe,/r/nba/comments/5bg392/lebron_james_is_now_the_only_player_in_nba/d9octtz/,d9octtz,1478482805.0,1478454005.0,LeBron James is now the only player in NBA history in Top 10 in points and Top 20 in assists,2438,5bg392
782,"LeBron ""LeBron James"" James",1096,HOIST_IT,/r/nba/comments/5bg392/lebron_james_is_now_the_only_player_in_nba/d9oa2ge/,d9oa2ge,1478478845.0,1478450045.0,LeBron James is now the only player in NBA history in Top 10 in points and Top 20 in assists,2438,5bg392
783,He can do better than this.,68,tapk69,/r/nba/comments/5bg392/lebron_james_is_now_the_only_player_in_nba/d9o9k2p/,d9o9k2p,1478478095.0,1478449295.0,LeBron James is now the only player in NBA history in Top 10 in points and Top 20 in assists,2438,5bg392
784,"I always am in awe of this man. If he decides, he can easily average a triple-double. He always coasts in the regular season but when he sets foot into the playoffs, he is transformed. He has the sheer ability to do so too. He was on the cusp of averaging a triple-double in the Finals last year. I am glad that I get to see this man play. ",724,bleachsai,/r/nba/comments/5bg392/lebron_james_is_now_the_only_player_in_nba/d9o760y/,d9o760y,1478474465.0,1478445665.0,LeBron James is now the only player in NBA history in Top 10 in points and Top 20 in assists,2438,5bg392
785,"The LeBron James of basketball players, for sure...",113,fooferall,/r/nba/comments/5bg392/lebron_james_is_now_the_only_player_in_nba/d9oc1q2/,d9oc1q2,1478481681.0,1478452881.0,LeBron James is now the only player in NBA history in Top 10 in points and Top 20 in assists,2438,5bg392
786,"I hate it when people use the ""well he is 3/7 in the finals"" argument. What would you rather , that he didn't make the finals at all except the years he won so that he is a undefeated 3/3? Losing finals is the second best accomplishment in a season, more impressive than losing in earlier rounds in the playoffs. Let's celebrate his finals wins and not dwell on the losses. 3/7 is way more impressive than 2/2 or even 3/3.",280,Habib_Marwuana,/r/nba/comments/5bg392/lebron_james_is_now_the_only_player_in_nba/d9oczs2/,d9oczs2,1478483046.0,1478454246.0,LeBron James is now the only player in NBA history in Top 10 in points and Top 20 in assists,2438,5bg392
787,Find you a man that do both ,48,bensamples,/r/nba/comments/5bg392/lebron_james_is_now_the_only_player_in_nba/d9ocife/,d9ocife,1478482348.0,1478453548.0,LeBron James is now the only player in NBA history in Top 10 in points and Top 20 in assists,2438,5bg392
788,"When he's gone, people aren't going to understand just how great his court vision and ability to find the open man were. ",87,Not_A_Doctor__,/r/nba/comments/5bg392/lebron_james_is_now_the_only_player_in_nba/d9od3jr/,d9od3jr,1478483197.0,1478454397.0,LeBron James is now the only player in NBA history in Top 10 in points and Top 20 in assists,2438,5bg392
789,He's also top 25 in steals!,43,OwwHaveMercy,/r/nba/comments/5bg392/lebron_james_is_now_the_only_player_in_nba/d9odos7/,d9odos7,1478484045.0,1478455245.0,LeBron James is now the only player in NBA history in Top 10 in points and Top 20 in assists,2438,5bg392
790,It's a shame Prigioni didn't come over in his teens....,238,wedgies4all,/r/nba/comments/5bg392/lebron_james_is_now_the_only_player_in_nba/d9o93ue/,d9o93ue,1478477428.0,1478448628.0,LeBron James is now the only player in NBA history in Top 10 in points and Top 20 in assists,2438,5bg392
791,Expected a video of just Lebron nodding.,58,RoryBrennerz,/r/nba/comments/5bfpvd/lebron_james_professes_his_love_for_the_joel_the/d9o3ydw/,d9o3ydw,1478468665.0,1478439865.0,"LeBron James professes his love for the Joel ""The Process"" Embiid",188,5bfpvd
792,"Saved.
Archived.
Will use for future reference.",25,RightTwoCensor,/r/nba/comments/5bfpvd/lebron_james_professes_his_love_for_the_joel_the/d9o70gy/,d9o70gy,1478474220.0,1478445420.0,"LeBron James professes his love for the Joel ""The Process"" Embiid",188,5bfpvd
