,body,score,author,permalink,comment_id,created_loc,created_utc,post_title,post_score,post_id
459,Either Steve Kerr or Robert Horry appeared in every NBA Finals from 1994-2003.,24,MuffinChaser,/r/nba/comments/4lh20a/kobe_bryant_or_lebron_james_have_been_in_every/d3nawvi/,d3nawvi,1464496513.0,1464467713.0,Kobe Bryant or LeBron James have been in every NBA Finals since 2007.,211,4lh20a
460,"*in the year 2020*

Kobe Bryant or LeBron James have been in every NBA Finals since 2007",28,onirapac,/r/nba/comments/4lh20a/kobe_bryant_or_lebron_james_have_been_in_every/d3neum8/,d3neum8,1464503500.0,1464474700.0,Kobe Bryant or LeBron James have been in every NBA Finals since 2007.,211,4lh20a
461,"The pure obligation on his face when he said ""I had chocolate milk.""

It's like a kid being forced by his parents to apologize",695,ianbits,/r/nba/comments/4lgq4n/lebron_and_kyrie_calling_out_k_love_for/d3n64cz/,d3n64cz,1464488011.0,1464459211.0,LeBron and Kyrie calling out K Love for sponsoring chocolate milk,1142,4lgq4n
462,It was a 9 foot rim. Bro K Love is the GOAT deadpan NBA player,321,,/r/nba/comments/4lgq4n/lebron_and_kyrie_calling_out_k_love_for/d3n72ly/,d3n72ly,1464489730.0,1464460930.0,LeBron and Kyrie calling out K Love for sponsoring chocolate milk,1142,4lgq4n
463,> It was a nine foot rim,151,freerealestatedotbiz,/r/nba/comments/4lgq4n/lebron_and_kyrie_calling_out_k_love_for/d3n6g1m/,d3n6g1m,1464488606.0,1464459806.0,LeBron and Kyrie calling out K Love for sponsoring chocolate milk,1142,4lgq4n
464,You can see the jealousy and resentment in Lebron and Kyrie. Even though they've made it to the finals their chemistry looks shaky. More on Sportscenter at 10. ,560,so-cal_kid,/r/nba/comments/4lgq4n/lebron_and_kyrie_calling_out_k_love_for/d3n6frz/,d3n6frz,1464488592.0,1464459792.0,LeBron and Kyrie calling out K Love for sponsoring chocolate milk,1142,4lgq4n
465,"Tweet video Streamable mirror: https://streamable.com/xsqe

--------

Sending a PM for conversion is temporarily unavailable! It's been bugged and I'm just getting around to fixing it! Should be back up within a few days

Bugs/Feedback/Suggestions? Send me a PM. [FAQ](https://np.reddit.com/r/NBARedditBot/comments/407wku/frequently_asked_questions/)",110,TwitterVideoBot,/r/nba/comments/4lgq4n/lebron_and_kyrie_calling_out_k_love_for/d3n4wgc/,d3n4wgc,1464485833.0,1464457033.0,LeBron and Kyrie calling out K Love for sponsoring chocolate milk,1142,4lgq4n
466,"After every win, Lebron starts plugging all his sponsors too. 

""Lebron, what are you going now that you've brought a Championship to Cleveland after so long?""---Doris Burke

""Well, I'm going to drive my entire family down to Disneyland in my brand new, spacious, and affordable Kia!""-----Lebron",141,Sav10r,/r/nba/comments/4lgq4n/lebron_and_kyrie_calling_out_k_love_for/d3n7p26/,d3n7p26,1464490832.0,1464462032.0,LeBron and Kyrie calling out K Love for sponsoring chocolate milk,1142,4lgq4n
467,I love K Love the person ,85,Eagle0913,/r/nba/comments/4lgq4n/lebron_and_kyrie_calling_out_k_love_for/d3n6q3o/,d3n6q3o,1464489110.0,1464460310.0,LeBron and Kyrie calling out K Love for sponsoring chocolate milk,1142,4lgq4n
468,How the hell do you endorse the idea of chocolate milk. Who is paying for this shit? Is there like a chocolate milk of america foundation? Shouts to CMAF,77,rbmw263,/r/nba/comments/4lgq4n/lebron_and_kyrie_calling_out_k_love_for/d3naqp9/,d3naqp9,1464496212.0,1464467412.0,LeBron and Kyrie calling out K Love for sponsoring chocolate milk,1142,4lgq4n
469,"Yooooo, I have to say, I'm a 29 year old guy who freaking loves chocolate milk.  It's nature's energy drink!

The best brand I've ever had is [Rosenburger's](http://www.mcall.com/business/mc-rosenbergers-dairies-20141029-story.html).  They sell it in the local CVS two blocks from my apartment here in Philly.  So rich and creamy, it's so damn good!

Back when I was a kid, I used to use Hershey's syrup in whole milk, and I'd mix it up and then drink it with a spoon, like eating soup.  But from the glass.  I was weird.

Thankfully I just stopped doing the spoon thing at some point, and now even I make my own chocolate milk, I drink it like a normal, socialized adult human.

I like to order chocolate milk whenever I'm back home in New Jersey at one of our many famous diners.  I sometimes get weird stares, but I don't care, gimme dat chocolate milk.  Kids drink orange juice as well, but you don't give me no stares if I'd order and orange juice, now would you?

TL;DR - chocolate milk is awesome

Edit - [Obligatory chocolate milk photo](http://imgur.com/g1mhptF)",383,MRC1986,/r/nba/comments/4lgq4n/lebron_and_kyrie_calling_out_k_love_for/d3n8a2b/,d3n8a2b,1464491866.0,1464463066.0,LeBron and Kyrie calling out K Love for sponsoring chocolate milk,1142,4lgq4n
470,[deleted],49,,/r/nba/comments/4lgq4n/lebron_and_kyrie_calling_out_k_love_for/d3na0gq/,d3na0gq,1464494955.0,1464466155.0,LeBron and Kyrie calling out K Love for sponsoring chocolate milk,1142,4lgq4n
471,"If he wins a ring, 3, 7, 11, and 13 are all prime.  Lebron will re-enter his prime confirmed!! ",63,goldenpatterwarriors,/r/nba/comments/4lg5ue/lebron_has_been_in_the_league_for_13_seasons_made/d3n2zlj/,d3n2zlj,1464482408.0,1464453608.0,"Lebron has been in the league for 13 seasons, made 11 postseasons, and 7 Finals appearances.",109,4lg5ue
472,Crazy that Jordan was already considered the GOAT before his second 3Peat,68,MaliciousPancake,/r/nba/comments/4lg3ha/if_lebron_wins_a_ring_this_year_and_films_space/d3mzksj/,d3mzksj,1464476062.0,1464447262.0,"If LeBron wins a ring this year and films Space Jam 2 this summer, he will have 3 rings and 4 MVPs. When Jordan filmed Space Jam he had 3 rings and 3 MVPs.",108,4lg3ha
473,"When he retired the first time, he was pretty widely regarded as the GOAT",22,StoneColdSooner,/r/nba/comments/4lg3ha/if_lebron_wins_a_ring_this_year_and_films_space/d3mzs5e/,d3mzs5e,1464476464.0,1464447664.0,"If LeBron wins a ring this year and films Space Jam 2 this summer, he will have 3 rings and 4 MVPs. When Jordan filmed Space Jam he had 3 rings and 3 MVPs.",108,4lg3ha
474,Losing in the finals is better than not going there in the first place. ,54,Natheesh05,/r/nba/comments/4lg3ha/if_lebron_wins_a_ring_this_year_and_films_space/d3mzqjf/,d3mzqjf,1464476377.0,1464447577.0,"If LeBron wins a ring this year and films Space Jam 2 this summer, he will have 3 rings and 4 MVPs. When Jordan filmed Space Jam he had 3 rings and 3 MVPs.",108,4lg3ha
475,I mean it all depends if they show up or not. You would have thought he had enough help in the 2014 Finals but none of them showed up at all.,22,sportsfan113,/r/nba/comments/4lg3ha/if_lebron_wins_a_ring_this_year_and_films_space/d3n2kxj/,d3n2kxj,1464481677.0,1464452877.0,"If LeBron wins a ring this year and films Space Jam 2 this summer, he will have 3 rings and 4 MVPs. When Jordan filmed Space Jam he had 3 rings and 3 MVPs.",108,4lg3ha
476,Good thing his bones are made of adamantium,75,LaPenta5594,/r/nba/comments/4lfwul/lebron_near_freak_leg_injury_during_game_6/d3myc5t/,d3myc5t,1464473499.0,1464444699.0,LeBron Near Freak Leg Injury During Game 6,62,4lfwul
477,"i've seen him like that countless times and he's always fine, definitely inhuman",39,bumbleb333,/r/nba/comments/4lfwul/lebron_near_freak_leg_injury_during_game_6/d3my26m/,d3my26m,1464472872.0,1464444072.0,LeBron Near Freak Leg Injury During Game 6,62,4lfwul
478,[removed],32,,/r/nba/comments/4lfwul/lebron_near_freak_leg_injury_during_game_6/d3mygb8/,d3mygb8,1464473754.0,1464444954.0,LeBron Near Freak Leg Injury During Game 6,62,4lfwul
479,"I think it's crazy that Pippen and Jordan are both in the top 3 in playoff steals. C'mon now, there's only one ball.",378,prncpl_vgna_no_rlatn,/r/nba/comments/4lfuiq/to_save_us_from_the_onslaught_of_lebron_record/d3mxxrr/,d3mxxrr,1464472588.0,1464443788.0,"To save us from the onslaught of LeBron record breaker posts, here's where he is on the common counting stats as well as a few advanced metrics",737,4lfuiq
480,"With 5 more rebounds, LeBron will replace Larry Bird as the only player in the top 10 in all 3 categories of playoff points, rebounds, and assists.",143,Mikkel04,/r/nba/comments/4lfuiq/to_save_us_from_the_onslaught_of_lebron_record/d3n1yyy/,d3n1yyy,1464480580.0,1464451780.0,"To save us from the onslaught of LeBron record breaker posts, here's where he is on the common counting stats as well as a few advanced metrics",737,4lfuiq
481,Crazy how he's 31,113,h0ang,/r/nba/comments/4lfuiq/to_save_us_from_the_onslaught_of_lebron_record/d3myg4n/,d3myg4n,1464473743.0,1464444943.0,"To save us from the onslaught of LeBron record breaker posts, here's where he is on the common counting stats as well as a few advanced metrics",737,4lfuiq
482,"Serious question.  Has there ever been a player that has lived up to the amount of hype that he had coming into the league?  We are essentially the same age, and I vividly remember him coming out of high school at the same I was.  The hype was palpable, and he has basically surpassed every expectation.

Enjoy him while we still can folks.",44,rounced,/r/nba/comments/4lfuiq/to_save_us_from_the_onslaught_of_lebron_record/d3n6275/,d3n6275,1464487904.0,1464459104.0,"To save us from the onslaught of LeBron record breaker posts, here's where he is on the common counting stats as well as a few advanced metrics",737,4lfuiq
483,"> **PER**: Currently 3rd behind Mikan and MJ. Probably won't move.

Maybe they have better playoff stat tracking, but I wouldn't trust any PER numbers for Mikan's era. They're at the very least likely done by a different method. ",64,why_rob_y,/r/nba/comments/4lfuiq/to_save_us_from_the_onslaught_of_lebron_record/d3mzgbh/,d3mzgbh,1464475808.0,1464447008.0,"To save us from the onslaught of LeBron record breaker posts, here's where he is on the common counting stats as well as a few advanced metrics",737,4lfuiq
484,More blocks than KG. Damn. Garnett must really missed the playoffs a lot when he was with the Wolves.,28,bluedingoblood,/r/nba/comments/4lfuiq/to_save_us_from_the_onslaught_of_lebron_record/d3myftt/,d3myftt,1464473725.0,1464444925.0,"To save us from the onslaught of LeBron record breaker posts, here's where he is on the common counting stats as well as a few advanced metrics",737,4lfuiq
485,I honestly love the love for LeBron. He has been shitted on so often for dumb reasons and is finally getting himself respect ,164,awesom567,/r/nba/comments/4lfuiq/to_save_us_from_the_onslaught_of_lebron_record/d3n0go2/,d3n0go2,1464477778.0,1464448978.0,"To save us from the onslaught of LeBron record breaker posts, here's where he is on the common counting stats as well as a few advanced metrics",737,4lfuiq
486,"I for one don't want to be saved from Lebron record breaker posts, enjoy them every fucking time.",445,UnbiasedExpert,/r/nba/comments/4lfuiq/to_save_us_from_the_onslaught_of_lebron_record/d3mywvg/,d3mywvg,1464474716.0,1464445916.0,"To save us from the onslaught of LeBron record breaker posts, here's where he is on the common counting stats as well as a few advanced metrics",737,4lfuiq
487,"> Points: Currently 4th, won't move up this season.

My man Bron finna drop 70ppg in a 7 game series and move up on yo ass",60,JaySpike,/r/nba/comments/4lfuiq/to_save_us_from_the_onslaught_of_lebron_record/d3n3ls3/,d3n3ls3,1464483510.0,1464454710.0,"To save us from the onslaught of LeBron record breaker posts, here's where he is on the common counting stats as well as a few advanced metrics",737,4lfuiq
488,"This adds to him being alltime playoff VORP leader too.

http://www.basketball-reference.com/leaders/vorp_career_p.html",68,qule,/r/nba/comments/4lfn1n/lebron_is_now_the_alltime_leader_in_nba_playoff/d3mwydu/,d3mwydu,1464470186.0,1464441386.0,Lebron is now the All-Time leader in NBA Playoff Win Shares,306,4lfn1n
489,He's the most valuable player since 73-74 full stop (no stat for pre-73),35,CrustyM,/r/nba/comments/4lfn1n/lebron_is_now_the_alltime_leader_in_nba_playoff/d3mx9w8/,d3mx9w8,1464470992.0,1464442192.0,Lebron is now the All-Time leader in NBA Playoff Win Shares,306,4lfn1n
490,Probably because it'll be the last game.of this series.,22,catfish_dinner,/r/nba/comments/4lfe3t/spoiler_alert_nba_recap_52816_thunder_are_75/d3n0gco/,d3n0gco,1464477762.0,1464448962.0,"[Spoiler Alert] NBA Recap: 5/28/16 - Thunder are 75% favorites to win, Thunder facing their own kind of collapse, Steven Adams is a breakout star, Curry wouldnâ€™t last in â€™90s NBA, LeBron isn't like Mike, never will be like Mike, Highlights, Recaps, Podcasts, and more",74,4lfe3t
491,"I think everyone does, but hey anything can happen. ",29,bleev,/r/nba/comments/4lfe3t/spoiler_alert_nba_recap_52816_thunder_are_75/d3mxopz/,d3mxopz,1464471990.0,1464443190.0,"[Spoiler Alert] NBA Recap: 5/28/16 - Thunder are 75% favorites to win, Thunder facing their own kind of collapse, Steven Adams is a breakout star, Curry wouldnâ€™t last in â€™90s NBA, LeBron isn't like Mike, never will be like Mike, Highlights, Recaps, Podcasts, and more",74,4lfe3t
492,How do these writers know what the hell they are talking about?,331,Smoove-J,/r/nba/comments/4leonq/when_they_hugged_kyle_lowry_told_lebron_james/d3mpp9i/,d3mpp9i,1464444088.0,1464415288.0,"When they hugged, Kyle Lowry told LeBron James with great mutual respect: ""'(You're) a bad motherfucker. Go win it all.'""",690,4leonq
493,"Lowry loves calling people motherfuckers.

He called delly a ""pussy ass motherfucker"" 2 games ago",151,I-take-beast-shits,/r/nba/comments/4leonq/when_they_hugged_kyle_lowry_told_lebron_james/d3mvllj/,d3mvllj,1464466343.0,1464437543.0,"When they hugged, Kyle Lowry told LeBron James with great mutual respect: ""'(You're) a bad motherfucker. Go win it all.'""",690,4leonq
494,"[Cowley] Lowry calls LeBron a ""motherfucker"" and ""bad"" after a loss.",181,ThexJwubbz,/r/nba/comments/4leonq/when_they_hugged_kyle_lowry_told_lebron_james/d3mx1ly/,d3mx1ly,1464470418.0,1464441618.0,"When they hugged, Kyle Lowry told LeBron James with great mutual respect: ""'(You're) a bad motherfucker. Go win it all.'""",690,4leonq
495,Lowry has made me a fan of his after this series. ,28,BlindManBaldwin,/r/nba/comments/4leonq/when_they_hugged_kyle_lowry_told_lebron_james/d3mx3td/,d3mx3td,1464470568.0,1464441768.0,"When they hugged, Kyle Lowry told LeBron James with great mutual respect: ""'(You're) a bad motherfucker. Go win it all.'""",690,4leonq
496,"""You're one of the best motherfucker. Go win it all""",107,Derdota,/r/nba/comments/4leonq/when_they_hugged_kyle_lowry_told_lebron_james/d3mpxhh/,d3mpxhh,1464444755.0,1464415955.0,"When they hugged, Kyle Lowry told LeBron James with great mutual respect: ""'(You're) a bad motherfucker. Go win it all.'""",690,4leonq
497,Lowry excited this series with a ton of class ,51,Dustin65,/r/nba/comments/4leonq/when_they_hugged_kyle_lowry_told_lebron_james/d3mr7g9/,d3mr7g9,1464448945.0,1464420145.0,"When they hugged, Kyle Lowry told LeBron James with great mutual respect: ""'(You're) a bad motherfucker. Go win it all.'""",690,4leonq
498,"Serious question here, when did the phenomenon of calling someone a ""bad man"" or a ""bad motherfucker"" start to be a compliment ? Did it originate from a song or something ? Im quite curious",34,ultrarich,/r/nba/comments/4leonq/when_they_hugged_kyle_lowry_told_lebron_james/d3mttb2/,d3mttb2,1464459607.0,1464430807.0,"When they hugged, Kyle Lowry told LeBron James with great mutual respect: ""'(You're) a bad motherfucker. Go win it all.'""",690,4leonq
499,Everything I said these past 6 games about Lowry I take it back. Lowry is a pretty stand up dude. Specially after signing some gear for cavs fans in game 5.,144,fear865,/r/nba/comments/4leonq/when_they_hugged_kyle_lowry_told_lebron_james/d3mptpm/,d3mptpm,1464444453.0,1464415653.0,"When they hugged, Kyle Lowry told LeBron James with great mutual respect: ""'(You're) a bad motherfucker. Go win it all.'""",690,4leonq
500,I fucking love klow.,21,borsalino12,/r/nba/comments/4leonq/when_they_hugged_kyle_lowry_told_lebron_james/d3mqzv6/,d3mqzv6,1464448198.0,1464419398.0,"When they hugged, Kyle Lowry told LeBron James with great mutual respect: ""'(You're) a bad motherfucker. Go win it all.'""",690,4leonq
501,LeIncline,234,LaPenta5594,/r/nba/comments/4lempj/lebron_shot_622_in_the_ecf_2nd_most_efficient/d3mpbfl/,d3mpbfl,1464442996.0,1464414196.0,Lebron shot 62.2% in the ECF. 2nd most efficient series shooting-wise in his career,374,4lempj
502,Was that the bucks in six series? ,92,cowboysfan88,/r/nba/comments/4lempj/lebron_shot_622_in_the_ecf_2nd_most_efficient/d3mpbx4/,d3mpbx4,1464443035.0,1464414235.0,Lebron shot 62.2% in the ECF. 2nd most efficient series shooting-wise in his career,374,4lempj
503,"shit, i cant even get 70% of my urine in the toilet bowl most nights",88,FreeGums,/r/nba/comments/4lempj/lebron_shot_622_in_the_ecf_2nd_most_efficient/d3mpdmy/,d3mpdmy,1464443175.0,1464414375.0,Lebron shot 62.2% in the ECF. 2nd most efficient series shooting-wise in his career,374,4lempj
504,Demare LeStopper,29,beat_the_heat,/r/nba/comments/4lempj/lebron_shot_622_in_the_ecf_2nd_most_efficient/d3mpri6/,d3mpri6,1464444276.0,1464415476.0,Lebron shot 62.2% in the ECF. 2nd most efficient series shooting-wise in his career,374,4lempj
505,i needa incorporate that 456 thing in team cheers next time,45,uber_troll,/r/nba/comments/4leey7/lebron_james_delivers_short_locker_room_speech/d3mnpwo/,d3mnpwo,1464438841.0,1464410041.0,Lebron James Delivers Short Locker Room Speech,163,4leey7
506,"Great leader. He really knows how to get everyone invested in the team, rather than themselves. The ultimate player coach.",81,BearCanoe,/r/nba/comments/4leey7/lebron_james_delivers_short_locker_room_speech/d3mnfb0/,d3mnfb0,1464438169.0,1464409369.0,Lebron James Delivers Short Locker Room Speech,163,4leey7
507,"You can really see the respect the team has for him. Kyrie's straight cheesin' like a little brother. 
",90,LMA12,/r/nba/comments/4leey7/lebron_james_delivers_short_locker_room_speech/d3mnmw6/,d3mnmw6,1464438649.0,1464409849.0,Lebron James Delivers Short Locker Room Speech,163,4leey7
508,"it really boggles my mind when people say they ""hate Lebron""... maybe I'm just a massive homer, but I really think he's an incredible person",74,Lamentably,/r/nba/comments/4leey7/lebron_james_delivers_short_locker_room_speech/d3mnu8z/,d3mnu8z,1464439126.0,1464410326.0,Lebron James Delivers Short Locker Room Speech,163,4leey7
509,I was fighting in world war 2 the last time Lebron missed the finals.,193,Clevelandsucks1,/r/nba/comments/4le99t/kyrie_irving_was_wrapping_up_high_school_the_last/d3mn441/,d3mn441,1464437452.0,1464408652.0,"Kyrie Irving was wrapping up high school the last time LeBron wasn't in the Finals.""",758,4le99t
510,"I'm 29. The last time LeBron missed the Finals, I was 23.

Am I doing this right? ",135,Turbo__Sloth,/r/nba/comments/4le99t/kyrie_irving_was_wrapping_up_high_school_the_last/d3mn08p/,d3mn08p,1464437203.0,1464408403.0,"Kyrie Irving was wrapping up high school the last time LeBron wasn't in the Finals.""",758,4le99t
511,ITT: People saying what they were doing 6 years ago.,155,jcw4455,/r/nba/comments/4le99t/kyrie_irving_was_wrapping_up_high_school_the_last/d3mmjuf/,d3mmjuf,1464436202.0,1464407402.0,"Kyrie Irving was wrapping up high school the last time LeBron wasn't in the Finals.""",758,4le99t
512,This actually blew my mind more than any of the other stats posted tonight,216,lewlkewl,/r/nba/comments/4le99t/kyrie_irving_was_wrapping_up_high_school_the_last/d3mm14n/,d3mm14n,1464435094.0,1464406294.0,"Kyrie Irving was wrapping up high school the last time LeBron wasn't in the Finals.""",758,4le99t
513,"During the postgame coverage, there was a shot of LeBron addressing the Cavs in the locker room, where he told them how proud he was of them and how they have unfinished business, and Kyrie was just looking at him with big eyes and nodding vigorously and saying ""yes sir"" when he was done and smiling and it was very cute :)",31,adb1126,/r/nba/comments/4le99t/kyrie_irving_was_wrapping_up_high_school_the_last/d3mnlox/,d3mnlox,1464438572.0,1464409772.0,"Kyrie Irving was wrapping up high school the last time LeBron wasn't in the Finals.""",758,4le99t
514,Holy shit,27,KyleRaynerGotSweg,/r/nba/comments/4le99t/kyrie_irving_was_wrapping_up_high_school_the_last/d3mm1sr/,d3mm1sr,1464435132.0,1464406332.0,"Kyrie Irving was wrapping up high school the last time LeBron wasn't in the Finals.""",758,4le99t
515,"I'm 45 right now. The last time Lebron lost a conference finals, I was just starting 2nd grade.",29,iguot3388,/r/nba/comments/4le99t/kyrie_irving_was_wrapping_up_high_school_the_last/d3mpfvw/,d3mpfvw,1464443353.0,1464414553.0,"Kyrie Irving was wrapping up high school the last time LeBron wasn't in the Finals.""",758,4le99t
516,Ok this is the 3rd one that made me say What the Fuck.,23,EddieisKing,/r/nba/comments/4le99t/kyrie_irving_was_wrapping_up_high_school_the_last/d3mm1c4/,d3mm1c4,1464435105.0,1464406305.0,"Kyrie Irving was wrapping up high school the last time LeBron wasn't in the Finals.""",758,4le99t
517,"I'm in college now. When Lebron lost to Boston in 2010, I was 12 years old. It's crazy to think about.",57,StormWilliams,/r/nba/comments/4le99t/kyrie_irving_was_wrapping_up_high_school_the_last/d3mm2ep/,d3mm2ep,1464435166.0,1464406366.0,"Kyrie Irving was wrapping up high school the last time LeBron wasn't in the Finals.""",758,4le99t
518,David Blatt died for this,501,rightfulemperor,/r/nba/comments/4le96z/lebron_says_hell_no_coach_you_got_it_to_lue_as/d3mm1j0/,d3mm1j0,1464435117.0,1464406317.0,"LeBron says ""hell no coach, you got it"" to Lue as the Cavs are presented the Eastern Conference trophy",405,4le96z
519,"Lebron, shut the fuck up, I got this ",177,IdrankSUPERglue,/r/nba/comments/4le96z/lebron_says_hell_no_coach_you_got_it_to_lue_as/d3mm7n7/,d3mm7n7,1464435472.0,1464406672.0,"LeBron says ""hell no coach, you got it"" to Lue as the Cavs are presented the Eastern Conference trophy",405,4le96z
520,"Lebron the type of guy that when you are hanging out with a bunch of his friends that you dont know, he makes sure that you feel welcomed",220,KingofMangoes,/r/nba/comments/4le96z/lebron_says_hell_no_coach_you_got_it_to_lue_as/d3mok60/,d3mok60,1464440923.0,1464412123.0,"LeBron says ""hell no coach, you got it"" to Lue as the Cavs are presented the Eastern Conference trophy",405,4le96z
521,[deleted],134,,/r/nba/comments/4le96z/lebron_says_hell_no_coach_you_got_it_to_lue_as/d3mm6x6/,d3mm6x6,1464435430.0,1464406630.0,"LeBron says ""hell no coach, you got it"" to Lue as the Cavs are presented the Eastern Conference trophy",405,4le96z
522,"Tweet video Streamable mirror: https://streamable.com/fygn

--------

Sending a PM for conversion is temporarily unavailable! It's been bugged and I'm just getting around to fixing it! Should be back up within a few days

Bugs/Feedback/Suggestions? Send me a PM. [FAQ](https://np.reddit.com/r/NBARedditBot/comments/407wku/frequently_asked_questions/)",27,TwitterVideoBot,/r/nba/comments/4le96z/lebron_says_hell_no_coach_you_got_it_to_lue_as/d3mlzmv/,d3mlzmv,1464435009.0,1464406209.0,"LeBron says ""hell no coach, you got it"" to Lue as the Cavs are presented the Eastern Conference trophy",405,4le96z
523,Blatt still gets a ring if they win right?,25,Smellmyhand,/r/nba/comments/4le96z/lebron_says_hell_no_coach_you_got_it_to_lue_as/d3mptp0/,d3mptp0,1464444452.0,1464415652.0,"LeBron says ""hell no coach, you got it"" to Lue as the Cavs are presented the Eastern Conference trophy",405,4le96z
524,"Pretty sure an ECF trophy doesn't mean a god damn thing to Lebron, he has like ten of them by now.",67,Omar_Skittle,/r/nba/comments/4le96z/lebron_says_hell_no_coach_you_got_it_to_lue_as/d3momwa/,d3momwa,1464441117.0,1464412317.0,"LeBron says ""hell no coach, you got it"" to Lue as the Cavs are presented the Eastern Conference trophy",405,4le96z
525,LeBron talking in third person is bound to rub some people the wrong way,109,ztejas,/r/nba/comments/4le96z/lebron_says_hell_no_coach_you_got_it_to_lue_as/d3mr977/,d3mr977,1464449115.0,1464420315.0,"LeBron says ""hell no coach, you got it"" to Lue as the Cavs are presented the Eastern Conference trophy",405,4le96z
526,"I kinda doubted him but he does really seem to have the respect of the locker room. With Lebron on your team, you don't really need a great X's and O's coach, but you do need a coach who gets the stars to buy into what he says, and that appears to be what Lue has done. ",32,velocirappa,/r/nba/comments/4le96z/lebron_says_hell_no_coach_you_got_it_to_lue_as/d3mntns/,d3mntns,1464439087.0,1464410287.0,"LeBron says ""hell no coach, you got it"" to Lue as the Cavs are presented the Eastern Conference trophy",405,4le96z
527,"Posted this in another thread, but, when it comes to people questioning LeBron's personality:

It has nothing to do with basketball, but the dude married his high school sweetheart and is still with her today. He seems to be a good husband and father. That is insanely rare with people of his stature. He could easily divorce her and drown in fresh pussy. He's one of the most famous people in the world. His dedication to wife and family despite all of the obvious temptations tells me that his persona is not smoke and mirrors.",131,archaelleon,/r/nba/comments/4le8sz/lebron_james_full_post_game_interview/d3moc4u/,d3moc4u,1464440338.0,1464411538.0,Lebron James full post game interview,696,4le8sz
528,I just want him to win one for the land. ,271,BlindManBaldwin,/r/nba/comments/4le8sz/lebron_james_full_post_game_interview/d3mm7ow/,d3mm7ow,1464435475.0,1464406675.0,Lebron James full post game interview,696,4le8sz
529,This immediately became one of my favorite LeBron moments,169,Aquetas,/r/nba/comments/4le8sz/lebron_james_full_post_game_interview/d3mm613/,d3mm613,1464435377.0,1464406577.0,Lebron James full post game interview,696,4le8sz
