,body,score,author,permalink,comment_id,created_loc,created_utc,post_title,post_score,post_id
0,League= Fucked when Bron Bron draining 3s,28,PormanNowell,/r/nba/comments/5jot0a/lebron_drains_the_3_on_backtobacktoback/dbhu8nm/,dbhu8nm,1482413527.0,1482384727.0,Lebron drains the 3 on back-to-back-to-back possessions,170,5jot0a
1,Curry must've taught his father how to shoot from out there.,33,,/r/nba/comments/5jot0a/lebron_drains_the_3_on_backtobacktoback/dbhtxgg/,dbhtxgg,1482412968.0,1482384168.0,Lebron drains the 3 on back-to-back-to-back possessions,170,5jot0a
2,"Free throws dont scream fuck you as much as a deep three pointer, LeBron loves fuck you threes",1080,johncenatbh,/r/nba/comments/5jnz5u/lebron_james_is_shooting_a_high_3p_than_klay/dbhmnd5/,dbhmnd5,1482401259.0,1482372459.0,LeBron James is shooting a high 3P% than Klay Thompson this season.,1579,5jnz5u
3,Klay for Lebron who says no.,414,secantstrut,/r/nba/comments/5jnz5u/lebron_james_is_shooting_a_high_3p_than_klay/dbhms5i/,dbhms5i,1482401461.0,1482372661.0,LeBron James is shooting a high 3P% than Klay Thompson this season.,1579,5jnz5u
4,Yet Klay is higher than Lebron.,175,hamster4sale,/r/nba/comments/5jnz5u/lebron_james_is_shooting_a_high_3p_than_klay/dbhr6lp/,dbhr6lp,1482408234.0,1482379434.0,LeBron James is shooting a high 3P% than Klay Thompson this season.,1579,5jnz5u
5,I will staple my balls to my chest and do sit-ups if that lasts through the season. Count it.,181,Pan-The-Man,/r/nba/comments/5jnz5u/lebron_james_is_shooting_a_high_3p_than_klay/dbhugq4/,dbhugq4,1482413941.0,1482385141.0,LeBron James is shooting a high 3P% than Klay Thompson this season.,1579,5jnz5u
6,"Haha, I was waiting for a stat like this.

LeBron honestly needs to start only taking deep threes, I actually think he's way better at those because of how strong he is.",184,DeKobe-DeBryant,/r/nba/comments/5jnz5u/lebron_james_is_shooting_a_high_3p_than_klay/dbhpjan/,dbhpjan,1482405645.0,1482376845.0,LeBron James is shooting a high 3P% than Klay Thompson this season.,1579,5jnz5u
7,Flashbacks to Heat bron bron,136,TheShapeOfVoice,/r/nba/comments/5jnz5u/lebron_james_is_shooting_a_high_3p_than_klay/dbhmr7t/,dbhmr7t,1482401423.0,1482372623.0,LeBron James is shooting a high 3P% than Klay Thompson this season.,1579,5jnz5u
8,"Yo league legitimately fucked if Lebron decided to master the 3, I'll pack up and wait till he retires or something, he a scary man",225,realhighstorytimes,/r/nba/comments/5jnz5u/lebron_james_is_shooting_a_high_3p_than_klay/dbhoxpi/,dbhoxpi,1482404727.0,1482375927.0,LeBron James is shooting a high 3P% than Klay Thompson this season.,1579,5jnz5u
9,Not surprising as Klay had a huge shooting slump at the beginning of the season. He was at one point around 14-18% shooting 3s. That was around the time everyone outside the Warriors circle said Klay should be traded.,38,FGCHENG,/r/nba/comments/5jnz5u/lebron_james_is_shooting_a_high_3p_than_klay/dbhrkba/,dbhrkba,1482408856.0,1482380056.0,LeBron James is shooting a high 3P% than Klay Thompson this season.,1579,5jnz5u
10,He's cut his habit of chucking one immediately after he makes one ,146,Haysie,/r/nba/comments/5jnz5u/lebron_james_is_shooting_a_high_3p_than_klay/dbhmxwi/,dbhmxwi,1482401705.0,1482372905.0,LeBron James is shooting a high 3P% than Klay Thompson this season.,1579,5jnz5u
11,I think people are forgetting that he has that slump towards the beginning of the season. ,59,theanthonyd,/r/nba/comments/5jnz5u/lebron_james_is_shooting_a_high_3p_than_klay/dbhp2g9/,dbhp2g9,1482404924.0,1482376124.0,LeBron James is shooting a high 3P% than Klay Thompson this season.,1579,5jnz5u
12,"His kid would have to be a one and done, plus LeBron would have to still be playing when he's 40.

There is a chance, but probably not a big one. ",81,walterdog12,/r/nba/comments/5jn52h/how_long_will_lebron_james_realistically_play_in/dbhft82/,dbhft82,1482391278.0,1482362478.0,How long will LeBron James realistically play in the NBA?,111,5jn52h
13,"Well he's 32 and still putting up 25/8/9 

I think he'll be at this level for a couple more years and play at an above average level until like 38. ",139,,/r/nba/comments/5jn52h/how_long_will_lebron_james_realistically_play_in/dbhfqij/,dbhfqij,1482391176.0,1482362376.0,How long will LeBron James realistically play in the NBA?,111,5jn52h
14,"> ""It's kind of up to my kids, really,"" said the 31-year-old father, who is in his 13th season as a pro. ""I've missed so much of my kids' tournaments and things of that nature when I'm playing. So, it's kind of up to them. They'll let me know when they're tired of seeing me go away.""",119,WTFDOTA,/r/nba/comments/5jn52h/how_long_will_lebron_james_realistically_play_in/dbhfsbx/,dbhfsbx,1482391245.0,1482362445.0,How long will LeBron James realistically play in the NBA?,111,5jn52h
15,"As long as he wants to. Dude is a fucking robot. 

I think he'll play another 9 years and break all sorts of records in the process. Even at 40 I can foresee him putting up 17/6/6 or something like that. ",39,BizGilwalker,/r/nba/comments/5jn52h/how_long_will_lebron_james_realistically_play_in/dbhgcpg/,dbhgcpg,1482392019.0,1482363219.0,How long will LeBron James realistically play in the NBA?,111,5jn52h
16,"Barring injury (God please) I could see him playing till he's 39-40, which gives him a realistic chance to play with his son. ",39,,/r/nba/comments/5jn52h/how_long_will_lebron_james_realistically_play_in/dbhfrer/,dbhfrer,1482391212.0,1482362412.0,How long will LeBron James realistically play in the NBA?,111,5jn52h
17,In December 2016 OP confused the shit out of me,93,ElPlywood,/r/nba/comments/5jm06p/in_march_2014_lebron_scored_61_points_as_of_that/dbh6lnx/,dbh6lnx,1482379693.0,1482350893.0,"In March 2014, LeBron scored 61 points. As of that game, Wilt Chamberlain and every NBA player not named Wilt Chamberlain combined are tied for total 60 point games.",23,5jm06p
18,r/titlegore ,29,Incognitohero11,/r/nba/comments/5jm06p/in_march_2014_lebron_scored_61_points_as_of_that/dbh7c76/,dbh7c76,1482380566.0,1482351766.0,"In March 2014, LeBron scored 61 points. As of that game, Wilt Chamberlain and every NBA player not named Wilt Chamberlain combined are tied for total 60 point games.",23,5jm06p
19,"There have been 66 total 60 point games in NBA history, 32 of them belong to Wilt.",48,YouArentMe,/r/nba/comments/5jm06p/in_march_2014_lebron_scored_61_points_as_of_that/dbh6040/,dbh6040,1482378979.0,1482350179.0,"In March 2014, LeBron scored 61 points. As of that game, Wilt Chamberlain and every NBA player not named Wilt Chamberlain combined are tied for total 60 point games.",23,5jm06p
20,"See this would be a better title but goddamn Wilt is the goatest of goats. Could make anyone his bitch. 

Unpopular opinion, Wilt > Jordan. He was just in the wrong decade/generation.",30,N3rdMan,/r/nba/comments/5jm06p/in_march_2014_lebron_scored_61_points_as_of_that/dbh6ecd/,dbh6ecd,1482379447.0,1482350647.0,"In March 2014, LeBron scored 61 points. As of that game, Wilt Chamberlain and every NBA player not named Wilt Chamberlain combined are tied for total 60 point games.",23,5jm06p
21,Lmao. This kid is very likeable.,1344,,/r/nba/comments/5jkyef/brogdon_on_putting_lbj_on_a_poster_honestly_if_i/dbgwwia/,dbgwwia,1482368072.0,1482339272.0,"Brogdon on putting LBJ on a poster: ""Honestly, if I looked and saw it was LeBron, I might not even have gone up.""",4418,5jkyef
22,"I remember a similar quote when MJ came back out of retirement and wore #45 instead of #23. During the final moments of a game, he was on a fast break but an opposing player caught up to him from behind and stole the ball. 

When the guy was interviewed about it later he said ""number 45 is not number 23, I could have never done that to number 23.""",298,clive_bigsby,/r/nba/comments/5jkyef/brogdon_on_putting_lbj_on_a_poster_honestly_if_i/dbh4y1f/,dbh4y1f,1482377725.0,1482348925.0,"Brogdon on putting LBJ on a poster: ""Honestly, if I looked and saw it was LeBron, I might not even have gone up.""",4418,5jkyef
23,"""But I was completely ok dunking on that bitch Kyrie"" - Brogdon, probably",2799,YizWasHere,/r/nba/comments/5jkyef/brogdon_on_putting_lbj_on_a_poster_honestly_if_i/dbgx1vg/,dbgx1vg,1482368251.0,1482339451.0,"Brogdon on putting LBJ on a poster: ""Honestly, if I looked and saw it was LeBron, I might not even have gone up.""",4418,5jkyef
24,LeSpect,412,PM_me_Dope_things,/r/nba/comments/5jkyef/brogdon_on_putting_lbj_on_a_poster_honestly_if_i/dbgys5v/,dbgys5v,1482370362.0,1482341562.0,"Brogdon on putting LBJ on a poster: ""Honestly, if I looked and saw it was LeBron, I might not even have gone up.""",4418,5jkyef
25,"It may be true. I remember during last year finals Warriors were throwing garbage at the rim due to lebron. Even the final play of game 7, Klay didn't even take the shot from 3. This man has created a wave of fear which only a few wing players ,if any, can create.",534,VoldyDunks,/r/nba/comments/5jkyef/brogdon_on_putting_lbj_on_a_poster_honestly_if_i/dbgyqcy/,dbgyqcy,1482370304.0,1482341504.0,"Brogdon on putting LBJ on a poster: ""Honestly, if I looked and saw it was LeBron, I might not even have gone up.""",4418,5jkyef
26,And now he's overcome the mental hurdle. That should greatly boost his confidence and help him realize what he can do,68,Elian98,/r/nba/comments/5jkyef/brogdon_on_putting_lbj_on_a_poster_honestly_if_i/dbh0uv5/,dbh0uv5,1482372855.0,1482344055.0,"Brogdon on putting LBJ on a poster: ""Honestly, if I looked and saw it was LeBron, I might not even have gone up.""",4418,5jkyef
27,I thought LBJ was referring to President Johnson and I wondering for a second how anyone could mistaken LeBron for a tall old white man...,59,Thotsakan,/r/nba/comments/5jkyef/brogdon_on_putting_lbj_on_a_poster_honestly_if_i/dbh4r28/,dbh4r28,1482377494.0,1482348694.0,"Brogdon on putting LBJ on a poster: ""Honestly, if I looked and saw it was LeBron, I might not even have gone up.""",4418,5jkyef
28,Wahoowa baby,91,Lazrgator13,/r/nba/comments/5jkyef/brogdon_on_putting_lbj_on_a_poster_honestly_if_i/dbgxrw5/,dbgxrw5,1482369130.0,1482340330.0,"Brogdon on putting LBJ on a poster: ""Honestly, if I looked and saw it was LeBron, I might not even have gone up.""",4418,5jkyef
29,"[On a side note, I feel like he's pretty jacked for a guard.](http://i.cdn.turner.com/drp/nba/bucks/sites/default/files/styles/main_gallery_photo__480_tall/public/brogdon_4.jpg?itok=Kibh0Hxx)
",109,CharmsCandy,/r/nba/comments/5jkyef/brogdon_on_putting_lbj_on_a_poster_honestly_if_i/dbgz7mj/,dbgz7mj,1482370884.0,1482342084.0,"Brogdon on putting LBJ on a poster: ""Honestly, if I looked and saw it was LeBron, I might not even have gone up.""",4418,5jkyef
30,Read this in Obama's voice ,151,themariokarters,/r/nba/comments/5jkyef/brogdon_on_putting_lbj_on_a_poster_honestly_if_i/dbgx2vi/,dbgx2vi,1482368285.0,1482339485.0,"Brogdon on putting LBJ on a poster: ""Honestly, if I looked and saw it was LeBron, I might not even have gone up.""",4418,5jkyef
31,Pass that good shit,441,incredulousbear,/r/nba/comments/5ji71n/if_it_is_revealed_that_lebron_james_was_in_fact/dbgd4b6/,dbgd4b6,1482327208.0,1482298408.0,"If it is revealed that Lebron James was, in fact, created in a laboratory, what happens to his legacy?",271,5ji71n
32,Lmao everyone getting high tonight,201,N3rdMan,/r/nba/comments/5ji71n/if_it_is_revealed_that_lebron_james_was_in_fact/dbgd745/,dbgd745,1482327354.0,1482298554.0,"If it is revealed that Lebron James was, in fact, created in a laboratory, what happens to his legacy?",271,5ji71n
33,My first thought would be why the fuck did they make a basketball player with that technology?,186,JustiseWinfast,/r/nba/comments/5ji71n/if_it_is_revealed_that_lebron_james_was_in_fact/dbgdcsh/,dbgdcsh,1482327651.0,1482298851.0,"If it is revealed that Lebron James was, in fact, created in a laboratory, what happens to his legacy?",271,5ji71n
34,Post this again in 6 months,53,Bejewerly,/r/nba/comments/5ji71n/if_it_is_revealed_that_lebron_james_was_in_fact/dbgd6v7/,dbgd6v7,1482327341.0,1482298541.0,"If it is revealed that Lebron James was, in fact, created in a laboratory, what happens to his legacy?",271,5ji71n
35,"On a scale of one to Klay Thompson, how high are you right now?",94,Emighty,/r/nba/comments/5ji71n/if_it_is_revealed_that_lebron_james_was_in_fact/dbgd6y6/,dbgd6y6,1482327345.0,1482298545.0,"If it is revealed that Lebron James was, in fact, created in a laboratory, what happens to his legacy?",271,5ji71n
36,We invest in that lab and make a league filled with lebrons,36,wikiman2001,/r/nba/comments/5ji71n/if_it_is_revealed_that_lebron_james_was_in_fact/dbgd51v/,dbgd51v,1482327247.0,1482298447.0,"If it is revealed that Lebron James was, in fact, created in a laboratory, what happens to his legacy?",271,5ji71n
37,"if bron ðŸ˜ðŸ€ got created in a labðŸ’‰ðŸ¥ðŸ˜·ðŸ’€ idc ðŸ’¯ðŸ’¯ cuz he still bae ðŸ’ŸðŸ’Ÿ and still the goatðŸ˜‚ðŸ’¦ðŸ‘
",103,HolyHalla,/r/nba/comments/5ji71n/if_it_is_revealed_that_lebron_james_was_in_fact/dbgdgu7/,dbgdgu7,1482327863.0,1482299063.0,"If it is revealed that Lebron James was, in fact, created in a laboratory, what happens to his legacy?",271,5ji71n
38,They would have given him a better hairline if he was made in a lab.,29,sadleafsfan,/r/nba/comments/5ji71n/if_it_is_revealed_that_lebron_james_was_in_fact/dbgd71k/,dbgd71k,1482327351.0,1482298551.0,"If it is revealed that Lebron James was, in fact, created in a laboratory, what happens to his legacy?",271,5ji71n
39,The third LeFuckYouThree tonight,895,DudeJustLet,/r/nba/comments/5jht8j/lebron_hits_the_clutch_three_from_a_different/dbga7k1/,dbga7k1,1482320628.0,1482291828.0,LeBron hits the clutch three from a different time zone,2177,5jht8j
40,I think this is Lebron's natural range on his 3. Normal 3's seem too short for him and he looks like he has to aim it. When he shoots deep ones it just seems like a smoother shot and more natural. but yea that 3 was buck nasty,560,Bigbadbuck,/r/nba/comments/5jht8j/lebron_hits_the_clutch_three_from_a_different/dbgaalw/,dbgaalw,1482320749.0,1482291949.0,LeBron hits the clutch three from a different time zone,2177,5jht8j
41,That was clutch AF. Thought he was crazy to attempt since there was time in the clock but then he's LeBron James.,344,bleachsai,/r/nba/comments/5jht8j/lebron_hits_the_clutch_three_from_a_different/dbga8np/,dbga8np,1482320671.0,1482291871.0,LeBron hits the clutch three from a different time zone,2177,5jht8j
42,"Ah, one more classic ""Fuck you, I'm LeBron James"" three.",176,toivon,/r/nba/comments/5jht8j/lebron_hits_the_clutch_three_from_a_different/dbga8q8/,dbga8q8,1482320674.0,1482291874.0,LeBron hits the clutch three from a different time zone,2177,5jht8j
43,Bron was pissed from the tussle with Giannis before that and took it out on all of Milwaukee,323,insert_name_here_,/r/nba/comments/5jht8j/lebron_hits_the_clutch_three_from_a_different/dbga8eo/,dbga8eo,1482320661.0,1482291861.0,LeBron hits the clutch three from a different time zone,2177,5jht8j
44,Johnny Mac was pretty upset on Bucks TV that the Bucks were playing the drive on LeBron all game but isn't that what you have to do? Don't you want to play the averages and take your chances with his outside shooting versus his drive and kick to superior shooters?,54,allmymoneygoestokpop,/r/nba/comments/5jht8j/lebron_hits_the_clutch_three_from_a_different/dbgalvh/,dbgalvh,1482321208.0,1482292408.0,LeBron hits the clutch three from a different time zone,2177,5jht8j
45,You can describe this entire season for Lebron as going back and forth from LeCoast to LeFuckYouImTheBestPlayerInTheLeague ,179,,/r/nba/comments/5jht8j/lebron_hits_the_clutch_three_from_a_different/dbgaff3/,dbgaff3,1482320944.0,1482292144.0,LeBron hits the clutch three from a different time zone,2177,5jht8j
46,"the classic 'fuck you' three from lebron

call from the cavs announcers: https://streamable.com/er7eq",104,threeeebo,/r/nba/comments/5jht8j/lebron_hits_the_clutch_three_from_a_different/dbga820/,dbga820,1482320647.0,1482291847.0,LeBron hits the clutch three from a different time zone,2177,5jht8j
47,FROOOOOM DEEP IN THE BRADLEY CENTER ,72,CaramelMandingo,/r/nba/comments/5jht8j/lebron_hits_the_clutch_three_from_a_different/dbga99p/,dbga99p,1482320696.0,1482291896.0,LeBron hits the clutch three from a different time zone,2177,5jht8j
48,[removed],80,,/r/nba/comments/5jht8j/lebron_hits_the_clutch_three_from_a_different/dbgacn0/,dbgacn0,1482320832.0,1482292032.0,LeBron hits the clutch three from a different time zone,2177,5jht8j
49,"his three point percentage rises from 35% to 90% on those shots


and hey look, lebron is shooting 35% from three! ",54,bootum,/r/nba/comments/5jhnr8/lebron_effortlessly_lasers_in_a_long_stepback/dbg92c6/,dbg92c6,1482318987.0,1482290187.0,LeBron effortlessly lasers in a long stepback,157,5jhnr8
50,"Ah, a classic ""Fuck you, I'm LeBron James"" three.",92,toivon,/r/nba/comments/5jhnr8/lebron_effortlessly_lasers_in_a_long_stepback/dbg8wrv/,dbg8wrv,1482318764.0,1482289964.0,LeBron effortlessly lasers in a long stepback,157,5jhnr8
51,I'd be lying if I said I didn't yell at the TV about how stupid of a possession it was prior to that going in,33,insert_name_here_,/r/nba/comments/5jhnr8/lebron_effortlessly_lasers_in_a_long_stepback/dbg8w2g/,dbg8w2g,1482318735.0,1482289935.0,LeBron effortlessly lasers in a long stepback,157,5jhnr8
52,"Almost sounded like Fred McLeod said ""LeBron James... FUCKED IT.""",53,Akronite14,/r/nba/comments/5jhm1c/lebron_with_a_vicious_chasedown_block_on_jabari/dbgaoyi/,dbgaoyi,1482321334.0,1482292534.0,LeBron with a vicious chasedown block on Jabari Parker,518,5jhm1c
53,"""Whoops. Wrong lightskin."" - LeBron ",87,Slimshady305,/r/nba/comments/5jhm1c/lebron_with_a_vicious_chasedown_block_on_jabari/dbg8s3h/,dbg8s3h,1482318576.0,1482289776.0,LeBron with a vicious chasedown block on Jabari Parker,518,5jhm1c
54,He should trademark this,86,johncenatbh,/r/nba/comments/5jhm1c/lebron_with_a_vicious_chasedown_block_on_jabari/dbg8g45/,dbg8g45,1482318105.0,1482289305.0,LeBron with a vicious chasedown block on Jabari Parker,518,5jhm1c
55,http://imgur.com/1G6ZOiZ,99,jtbiggs,/r/nba/comments/5jhm1c/lebron_with_a_vicious_chasedown_block_on_jabari/dbg8jbo/,dbg8jbo,1482318232.0,1482289432.0,LeBron with a vicious chasedown block on Jabari Parker,518,5jhm1c
56,His signature move.,52,YizWasHere,/r/nba/comments/5jhm1c/lebron_with_a_vicious_chasedown_block_on_jabari/dbg8gmj/,dbg8gmj,1482318124.0,1482289324.0,LeBron with a vicious chasedown block on Jabari Parker,518,5jhm1c
57,The kid lived up to the hype. Respect ,335,zachwilson23,/r/nba/comments/5jh50f/nba_lebron_james_passes_moses_malone_for_8_spot/dbg7hyo/,dbg7hyo,1482316765.0,1482287965.0,[NBA] LeBron James passes Moses Malone for #8 spot on NBA's All-Time Scoring List,1035,5jh50f
58,"He now has more points than 

Jeff Malone

Moses Malone 

And

Matt Maloney

In a couple seasons he will have more points than all the Malones.",197,Dhylan18,/r/nba/comments/5jh50f/nba_lebron_james_passes_moses_malone_for_8_spot/dbg4eiw/,dbg4eiw,1482312534.0,1482283734.0,[NBA] LeBron James passes Moses Malone for #8 spot on NBA's All-Time Scoring List,1035,5jh50f
59,"He's not retiring until hes #1, idgaf. ",379,wotdaf0k,/r/nba/comments/5jh50f/nba_lebron_james_passes_moses_malone_for_8_spot/dbg4c0c/,dbg4c0c,1482312435.0,1482283635.0,[NBA] LeBron James passes Moses Malone for #8 spot on NBA's All-Time Scoring List,1035,5jh50f
60,"The insane thing is that scoring isn't even his best attribute as a player. He could end up #1 on the scoring list without it being the strongest part of his game.

That is unbelievable. ",160,UofMranger,/r/nba/comments/5jh50f/nba_lebron_james_passes_moses_malone_for_8_spot/dbg5zuf/,dbg5zuf,1482314709.0,1482285909.0,[NBA] LeBron James passes Moses Malone for #8 spot on NBA's All-Time Scoring List,1035,5jh50f
61,"If he can maintain 24 points per game, 70 games per year, he will break Kareems record in 7 seasons. ",84,maltrab,/r/nba/comments/5jh50f/nba_lebron_james_passes_moses_malone_for_8_spot/dbg7966/,dbg7966,1482316430.0,1482287630.0,[NBA] LeBron James passes Moses Malone for #8 spot on NBA's All-Time Scoring List,1035,5jh50f
62,LeBron James is my Favorite Team,221,rzoneking,/r/nba/comments/5jh50f/nba_lebron_james_passes_moses_malone_for_8_spot/dbg52j6/,dbg52j6,1482313442.0,1482284642.0,[NBA] LeBron James passes Moses Malone for #8 spot on NBA's All-Time Scoring List,1035,5jh50f
63,"Has anyone said ""This guy might end up being pretty good"" yet?",104,KnickedUp,/r/nba/comments/5jh50f/nba_lebron_james_passes_moses_malone_for_8_spot/dbg4em0/,dbg4em0,1482312538.0,1482283738.0,[NBA] LeBron James passes Moses Malone for #8 spot on NBA's All-Time Scoring List,1035,5jh50f
64,He's gonna be in the Top 5 before it's over with.,54,Dsarg_92,/r/nba/comments/5jh50f/nba_lebron_james_passes_moses_malone_for_8_spot/dbg4ft8/,dbg4ft8,1482312585.0,1482283785.0,[NBA] LeBron James passes Moses Malone for #8 spot on NBA's All-Time Scoring List,1035,5jh50f
65,Best player of all time. The only tickets I've bought for the jazz this year are to see him. I'm scared he'll be resting :/ but it's worth the chance to say I've seen him live!! ,40,kaptinkangaroo,/r/nba/comments/5jh50f/nba_lebron_james_passes_moses_malone_for_8_spot/dbg85ze/,dbg85ze,1482317716.0,1482288916.0,[NBA] LeBron James passes Moses Malone for #8 spot on NBA's All-Time Scoring List,1035,5jh50f
66,"Sure but fans have the right to complain about paying pricey tickets and to realize the players they wanted to see aren't. I am all for players but this one directly affects fans, not the owners.

Most of us don't care because few of us actually go to see these games most of the time, let alone make it a special occasion so we are happy our star players are resting. But this is all about the people cashing out to in person and make the sacrifice.",255,Bromine21,/r/nba/comments/5je9nx/lebron_james_and_other_nba_stars_should_be/dbfhed3/,dbfhed3,1482283842.0,1482255042.0,LeBron James and other NBA stars should be allowed to sit out games to rest,159,5je9nx
67,"My heart tells me they should have to play 

(First NBA game ever, Suns vs Lakers, Nash and Kobe sat out.. I died a little inside)

But my brain says that it's smart to rest players sporadically

  ",50,protos32,/r/nba/comments/5je9nx/lebron_james_and_other_nba_stars_should_be/dbffsgq/,dbffsgq,1482281961.0,1482253161.0,LeBron James and other NBA stars should be allowed to sit out games to rest,159,5je9nx
68,Of course they should. It's an 82 game season. Sometimes fans get unlucky. Whatever they think will help them come playoff time should be done.,85,,/r/nba/comments/5je9nx/lebron_james_and_other_nba_stars_should_be/dbfff6u/,dbfff6u,1482281529.0,1482252729.0,LeBron James and other NBA stars should be allowed to sit out games to rest,159,5je9nx
69,There ought to be a couple of good compromises to make this situation better. I actually kind of liked Chris Broussard's idea that maybe you only rest key guys for home games since the home fans get to see their stars for 41 games a year rather than an away game where away fans only see guys like LeBron once or twice a year.,25,wiggles97,/r/nba/comments/5je9nx/lebron_james_and_other_nba_stars_should_be/dbfg57i/,dbfg57i,1482282384.0,1482253584.0,LeBron James and other NBA stars should be allowed to sit out games to rest,159,5je9nx
70,"This is some quality content.

I think the problem with his free throw shooting is that he has a small hitch in his shot. 

In your last example you can see him extend/lock his legs as he's bring the ball back, meaning that his wrist has to provide both power *and* accuracy as opposed to his lower body providing the power and his wrist the accuracy.",179,Cyfa,/r/nba/comments/5j931k/lebron_james_free_throw_routine/dbeac2v/,dbeac2v,1482211935.0,1482183135.0,LeBron James Free Throw Routine,256,5j931k
71,He once used Ray Allen's routine for awhile. Idk why he didn't stick with it.,27,,/r/nba/comments/5j931k/lebron_james_free_throw_routine/dbeeuje/,dbeeuje,1482217244.0,1482188444.0,LeBron James Free Throw Routine,256,5j931k
72,LeCoast,156,FeKrdzo,/r/nba/comments/5j7kke/stein_most_minutes_per_game_in_december_zach/dbdxgp3/,dbdxgp3,1482196860.0,1482168060.0,"Stein: Most minutes per game in December: Zach LaVine (40.6 MPG), LeBron James (38.5 MPG), Anthony Davis (38.4) and Jimmy Butler (37.9).",118,5j7kke
73,Thibs gonna Thib,79,johncenatbh,/r/nba/comments/5j7kke/stein_most_minutes_per_game_in_december_zach/dbdxdh0/,dbdxdh0,1482196753.0,1482167953.0,"Stein: Most minutes per game in December: Zach LaVine (40.6 MPG), LeBron James (38.5 MPG), Anthony Davis (38.4) and Jimmy Butler (37.9).",118,5j7kke
74,"[Lebron's only 34th in total minutes played, though](http://stats.nba.com/players/traditional/#!?Season=2016-17&SeasonType=Regular%20Season&Month=3&sort=MIN&dir=-1&PerMode=Totals)",27,WARRlORSBLEWA3-1LEAD,/r/nba/comments/5j7kke/stein_most_minutes_per_game_in_december_zach/dbe1btq/,dbe1btq,1482201540.0,1482172740.0,"Stein: Most minutes per game in December: Zach LaVine (40.6 MPG), LeBron James (38.5 MPG), Anthony Davis (38.4) and Jimmy Butler (37.9).",118,5j7kke
75,4 stories high plinko board game show hosted by chris hardwick. no fucking thank you.,24,moe1984,/r/nba/comments/5j55e0/lebron_jamesproduced_the_wall_to_premiere_monday/dbdhbbd/,dbdhbbd,1482162691.0,1482133891.0,LeBron James-produced 'The Wall' to premiere Monday on NBC,25,5j55e0
76,"> 30 and 10

> 3~~0~~ and 1~~0~~

> 3 and 1",46,Primid47,/r/nba/comments/5j3682/stein_kevin_durant_is_up_to_79_30and10_games/dbd7yyl/,dbd7yyl,1482145308.0,1482116508.0,[Stein] Kevin Durant is up to 79 30-and-10 games since entering the league in 2007-08. LeBron James is next in line in the same span with 61.,55,5j3682
